activation,lemma,present_phones,past_phones
7.7724928855896,abbreviate,AH B R IY V IY EY T,AH B R IY V IY EY T IH D
7.416042327880859,undervalue,AH N D ER V AE L Y UW,AH N D ER V AE L Y UW D
4.996257781982422,agree,AH G R IY,AH G R IY D
4.856656074523926,aggrieve,AH G R IY V,AH G R IY V D
4.743187427520752,obscure,AH B S K Y UH R,AH B S K Y UH R D
3.295170545578003,unwelcome,AH N W EH L K AH M,AH N W EH L K AH M D
3.150526285171509,appreciate,AH P R IY SH IY EY T,AH P R IY SH IY EY T IH D
2.445462465286255,vary,V EH R IY,V EH R IY D
