activation,lemma,present_phones,past_phones
1.0635167360305786,overexcite,OW V ER EH K S AY T,OW V ER EH K S AY T IH D
1.0259203910827637,overestimate,OW V ER EH S T AH M EY T,OW V ER EH S T AH M EY T IH D
1.009950041770935,overproduce,OW V ER P R AH D UW S,OW V ER P R AH D UW S T
1.0008866786956787,overstate,OW V ER S T EY T,OW V ER S T EY T IH D
0.9727135896682739,overvalue,OW V ER V AE L Y UW,OW V ER V AE L Y UW D
0.9583860635757446,overspend,OW V ER S P EH N D,OW V ER S P EH N T
0.9335389137268066,overemphasize,OW V ER EH M F AH S AY Z,OW V ER EH M F AH S AY Z D
0.8925985097885132,overrule,OW V ER R UW L,OW V ER R UW L D
0.8802279233932495,overstock,OW V ER S T AA K,OW V ER S T AA K T
0.8792175650596619,overcast,OW V ER K AE S T,OW V ER K AE S T
0.8701648712158203,overburden,OW V ER B ER D AH N,OW V ER B ER D AH N D
0.8606579303741455,overpopulate,OW V ER P AA P Y AH L EY T,OW V ER P AA P Y AH L EY T IH D
0.8580135703086853,oversupply,OW V ER S AH P L AY,OW V ER S AH P L AY D
0.8563788533210754,overwhelm,OW V ER W EH L M,OW V ER W EH L M D
0.8466891050338745,overstay,OW V ER S T EY,OW V ER S T EY D
0.8364229202270508,overwrite,OW V ER R AY T,OW V ER R OW T
0.8347951173782349,overreach,OW V ER R IY CH,OW V ER R IY CH T
0.8252786993980408,oversimplify,OW V ER S IH M P L IH F AY,OW V ER S IH M P L IH F AY D
0.8133096098899841,overuse,OW V ER Y UW Z,OW V ER Y UW Z D
0.8131207227706909,overregulate,OW V ER R EH G Y AH L EY T,OW V ER R EH G Y AH L EY T IH D
0.8118014335632324,overmatch,OW V ER M AE CH,OW V ER M AE CH T
0.8066350817680359,overrate,OW V ER R EY T,OW V ER R EY T IH D
0.8060517311096191,overprice,OW V ER P R AY S,OW V ER P R AY S T
0.8011617660522461,override,OW V ER R AY D,OW V ER R OW D
0.800194501876831,oversell,OW V ER S EH L,OW V ER S OW L D
0.7982386350631714,overstep,OW V ER S T EH P,OW V ER S T EH P T
0.7904000282287598,overheat,OW V ER HH IY T,OW V ER HH IY T IH D
0.7827427387237549,overleverage,OW V ER L EH V R IH JH,OW V ER L EH V R IH JH D
0.7772599458694458,overthrow,OW V ER TH R OW,OW V ER TH R UW
0.7658655643463135,overshoot,OW V ER SH UW T,OW V ER SH AA T
0.7640462517738342,overdose,OW V ER D OW S,OW V ER D OW S T
0.7607156038284302,overwork,OW V ER W ER K,OW V ER W ER K T
0.7594650983810425,overload,OW V ER L OW D,OW V ER L OW D IH D
0.7591785788536072,oversize,OW V ER S AY Z,OW V ER S AY Z D
0.7493599653244019,overdraw,OW V ER D R AO,OW V ER D R UW
0.7479410171508789,overlap,OW V ER L AE P,OW V ER L AE P T
0.7468441724777222,oversubscribe,OW V ER S AH B S K R AY B,OW V ER S AH B S K R AY B D
0.7426959276199341,oversleep,OW V ER S L IY P,OW V ER S L EH P T
0.7357207536697388,overfeed,OW V ER F IY D,OW V ER F EH D
0.7335023880004883,oversee,OW V ER S IY,OW V ER S AO
0.7325716018676758,overhaul,OW V ER HH AO L,OW V ER HH AO L D
0.7254499793052673,overexpose,OW V ER IH K S P OW Z,OW V ER IH K S P OW Z D
0.7234536409378052,overlook,OW V ER L UH K,OW V ER L UH K T
0.7214096784591675,overtax,OW V ER T AE K S,OW V ER T AE K S T
0.7181764841079712,overdo,OW V ER D UW,OW V ER D IH D
0.7075033187866211,overeat,OW V ER IY T,OW V ER EY T
0.6898409128189087,overturn,OW V ER T ER N,OW V ER T ER N D
0.685571551322937,overhear,OW V ER HH IY R,OW V ER HH ER D
0.6838809251785278,overpay,OW V ER P EY,OW V ER P EY D
0.6778132319450378,overtake,OW V ER T EY K,OW V ER T UH K
0.6652401685714722,overrun,OW V ER R AH N,OW V ER R AE N
0.662142813205719,overflow,OW V ER F L OW,OW V ER F L OW D
0.6587404012680054,overcharge,OW V ER CH AA R JH,OW V ER CH AA R JH D
0.6582051515579224,overhang,OW V ER HH AE NG,OW V ER HH AH NG
0.6500622630119324,overlay,OW V ER L EY,OW V ER L EY D
0.62272047996521,overbuy,OW V ER B AY,OW V ER B AO T
0.6108272075653076,eviscerate,AH V IH S ER EY T,AH V IH S ER EY T IH D
0.571984052658081,overcome,OW V ER K AH M,OW V ER K EY M
0.4907780587673187,average,AE V ER IH JH,AE V R AH JH D
0.44465142488479614,evaporate,IH V AE P ER EY T,IH V AE P ER EY T AH D
0.34043970704078674,avenge,AH V EH N JH,AH V EH N JH D
0.27221354842185974,pinpoint,P IH N P OY N T,P IH N P OY N T IH D
0.2502800524234772,avail,AH V EY L,AH V EY L D
0.2318456619977951,rearrest,R IY ER EH S T,R IY ER EH S T IH D
0.18281786143779755,evolve,IH V AA L V,IH V AA L V D
0.18100082874298096,even,IY V IH N,IY V AH N D
0.17793211340904236,avoid,AH V OY D,AH V OY D IH D
0.17242421209812164,assert,AH S ER T,AH S ER T IH D
0.16681793332099915,ogle,OW G AH L,OW G AH L D
0.16080518066883087,flourish,F L ER IH SH,F L ER IH SH T
0.15951502323150635,evince,IH V IH N S,IH V IH N S T
0.15840549767017365,omit,OW M IH T,OW M IH T AH D
0.14592806994915009,assist,AH S IH S T,AH S IH S T IH D
0.135986790060997,authorize,AO TH ER AY Z,AO TH ER AY Z D
0.11857477575540543,breast,B R EH S T,B R EH S T AH D
0.09829894453287125,skirt,S K ER T,S K ER T IH D
0.096954844892025,wire,W AY ER,W AY ER D
0.08721595257520676,shower,SH AW ER,SH AW ER D
