activation,lemma,present_phones,past_phones
3.8277428150177,equalize,IY K W AH L AY Z,IY K W AH L AY Z D
3.6012566089630127,unmanage,AH N M AE N IH JH,AH N M AE N IH JH D
3.548584222793579,square,S K W EH R,S K W EH R D
3.4871535301208496,acquit,AH K W IH T,AH K W IH T IH D
3.218736171722412,acquire,AH K W AY ER,AH K W AY ER D
3.115812301635742,rework,R IY W ER K,R IY W ER K T
3.05795955657959,equate,IH K W EY T,IH K W EY T IH D
2.970442533493042,assuage,AH S W EY JH,AH S W EY JH D
2.951721668243408,squash,S K W AA SH,S K W AA SH T
2.8224377632141113,unwind,AH N W AY N D,AH N W AW N D
2.7695138454437256,accumulate,AH K Y UW M Y AH L EY T,AH K Y UW M Y AH L EY T IH D
2.5773417949676514,unwelcome,AH N W EH L K AH M,AH N W EH L K AH M D
2.574869394302368,squeak,S K W IY K,S K W IY K T
2.481156349182129,squeeze,S K W IY Z,S K W IY Z D
2.47941255569458,acknowledge,AE K N AA L IH JH,AE K N AA L IH JH D
2.476922035217285,squabble,S K W AA B AH L,S K W AA B AH L D
2.4039411544799805,encounter,IH N K AW N T ER,IH N K AW N T ER D
2.3776028156280518,internationalize,IH N T ER N AE SH AH N AH L AY Z,IH N T ER N AE SH AH N AH L AY Z D
2.236086368560791,astonish,AH S T AA N IH SH,AH S T AA N IH SH T
2.1832919120788574,reward,R IH W AO R D,R IH W AO R D IH D
2.1141347885131836,rewire,R IY W AY ER,R IY W AY ER D
2.084120988845825,squelch,S K W EH L CH,S K W EH L CH T
1.9631342887878418,repackage,R IY P AE K IH JH,R IY P AE K IH JH D
1.8810198307037354,affront,AH F R AH N T,AH F R AH N T IH D
1.6447157859802246,enlarge,EH N L AA R JH,EH N L AA R JH D
1.6439058780670166,bewitch,B IH W IH CH,B IH W IH CH T
1.6158854961395264,insinuate,IH N S IH N Y UW EY T,IH N S IH N Y UW EY T IH D
1.6130552291870117,utilize,Y UW T AH L AY Z,Y UW T AH L AY Z D
1.5557653903961182,upholster,AH P OW L S T ER,AH P OW L S T ER D
1.4294183254241943,reinvigorate,R IY IH N V IH G ER EY T,R IY IH N V IH G ER EY T IH D
1.3725762367248535,interlock,IH N T ER L AA K,IH N T ER L AA K T
1.3410987854003906,underman,AH N D ER M AE N,AH N D ER M AE N D
1.3178725242614746,guarantee,G EH R AH N T IY,G EH R AH N T IY D
1.287238359451294,intermarry,IH N T ER M AE R IY,IH N T ER M AE R IY D
1.278090238571167,scrounge,S K R AW N JH,S K R AW N JH D
1.259615182876587,appropriate,AH P R OW P R IY AH T,AH P R OW P R IY EY T IH D
1.2471668720245361,intermingle,IH N T ER M IH NG G AH L,IH N T ER M IH NG G AH L D
1.2456116676330566,intermix,IH N T ER M IH K S,IH N T ER M IH K S T
1.2137706279754639,estrange,EH S T R EY N JH,EH S T R EY N JH D
1.161653757095337,undersell,AH N D ER S EH L,AH N D ER S OW L D
1.1163995265960693,bounce,B AW N S,B AW N S T
1.1066079139709473,reexamine,R IY EH G Z AE M AH N,R IY IH G Z AE M AH N D
1.094611406326294,reauthorize,R IY AO TH ER AY Z,R IY AO TH ER AY Z D
1.085162878036499,incorporate,IH N K AO R P ER EY T,IH N K AO R P ER EY T IH D
1.074641466140747,reincarnate,R IY IH N K AA R N EY T,R IY IH N K AA R N EY T IH D
1.0620746612548828,introvert,IH N T R OW V ER T,IH N T R OW V ER T IH D
1.0378012657165527,accost,AH K AO S T,AH K AA S T IH D
0.9904382824897766,recharge,R IY CH AA R JH,R IY CH AA R JH D
0.986322820186615,acquiesce,AE K W IY EH S,AE K W IY EH S T
0.9856182932853699,overstock,OW V ER S T AA K,OW V ER S T AA K T
0.9825277924537659,sculpture,S K AH L P CH ER,S K AH L P CH ER D
0.9819691777229309,intoxicate,IH N T AA K S AH K EY T,IH N T AA K S AH K EY T IH D
0.9815872311592102,rearrange,R IY ER EY N JH,R IY ER EY N JH D
0.9815555214881897,refocus,R IY F OW K AH S,R IY F OW K AH S T
0.9601324200630188,unwrap,AH N R AE P,AH N R AE P T
0.9100369811058044,interrelate,IH N T ER R IH L EY T,IH N T ER R IH L EY T IH D
0.9018101096153259,departmentalize,D IH P AA R T M EH N T AH L AY Z,D IH P AA R T M EH N T AH L AY Z D
0.8976046442985535,downsize,D AW N S AY Z,D AW N S AY Z D
0.8934676051139832,aspire,AH S P AY R,AH S P AY R D
0.8757880330085754,ironize,AY ER N AY Z,AY ER N AY Z D
0.8473860621452332,eke,IY K,IY K T
0.8319792151451111,glaze,G L EY Z,G L EY Z D
0.8169929385185242,unhinge,AH N HH IH N JH,AH N HH IH N JH D
0.8152723908424377,recycle,R IY S AY K AH L,R IY S AY K AH L D
0.7953903079032898,gather,G AE DH ER,G AE DH ER D
0.7925061583518982,retort,R IY T AO R T,R IY T AO R T IH D
0.7878991961479187,renominate,R IY N AO M IH N EY T,R IY N AA M AH N EY T IH D
0.7847270369529724,entice,IH N T AY S,IH N T AY S T
0.7840108275413513,augment,AO G M EH N T,AA G M EH N T IH D
0.761169970035553,rehearse,R IY HH ER S,R IY HH ER S T
0.7449402213096619,accuse,AH K Y UW Z,AH K Y UW Z D
0.7012397646903992,account,AH K AW N T,AH K AW N T IH D
0.6870326399803162,underpin,AH N D ER P IH N,AH N D ER P IH N D
0.6846111416816711,outwit,AW T W IH T,AW T W IH T IH D
0.6728038191795349,applaud,AH P L AO D,AH P L AO D IH D
0.6652294993400574,report,R IY P AO R T,R IY P AO R T IH D
0.6473767161369324,admit,AH D M IH T,AH D M IH T IH D
0.6275942921638489,blindfold,B L AY N D F OW L D,B L AY N D F OW L D IH D
0.6121975779533386,inconvenience,IH N K AH N V IY N Y AH N S,IH N K AH N V IY N Y AH N S T
0.5898496508598328,intrigue,IH N T R IY G,IH N T R IY G D
0.5886027216911316,unzip,AH N Z IH P,AH N Z IH P T
0.5633993744850159,envisage,EH N V IH Z IH JH,EH N V IH Z IH JH D
0.5295478701591492,manicure,M AE N IH K Y ER,M AE N IH K Y ER D
0.522968590259552,admire,AE D M AY R,AH D M AY ER D
0.5208013653755188,retard,R IH T AA R D,R IH T AA R D IH D
0.5155553221702576,squirrel,S K W ER AH L,S K W ER AH L D
0.5053672194480896,interdict,IH N T ER D IH K T,IH N T ER D IH K T IH D
0.4633576273918152,resurface,R IY S ER F AH S,R IY S ER F AH S T
0.45722419023513794,glower,G L AW ER,G L AW ER D
0.43878477811813354,unwed,AH N W EH D,AH N W EH D
0.4325389266014099,cashier,K AE SH IH R,K AE SH IH R D
0.3912808299064636,adhere,AH D HH IH R,AE D HH IH R D
0.3699628710746765,garner,G AA R N ER,G AA R N ER D
0.32891881465911865,intrude,IH N T R UW D,IH N T R UW D AH D
0.2930043935775757,intern,IH N T ER N,IH N T ER N D
0.2390405535697937,intone,IH N T OW N,IH N T OW N D
0.20119708776474,ignore,IH G N AO R,IH G N AO R D
0.1984986662864685,get,G EH T,G AA T
0.09168654680252075,rout,R AW T,R UW T IH D
