activation,lemma,present_phones,past_phones
5.557450771331787,discourage,D IH S K ER IH JH,D IH S K ER AH JH D
3.954681396484375,disqualify,D IH S K W AA L AH F AY,D IH S K W AA L AH F AY D
3.7741928100585938,discount,D IH S K AW N T,D IH S K AW N T IH D
3.509398937225342,dismantle,D IH S M AE N T AH L,D IH S M AE N T AH L D
3.1931934356689453,discharge,D IH S CH AA R JH,D IH S CH AA R JH D
3.0949478149414062,congratulate,K AH N G R AE CH AH L EY T,K AH N G R AE CH AH L EY T IH D
2.8997316360473633,deactivate,D IY AE K T IH V EY T,D IY AE K T IH V EY T IH D
2.6590194702148438,determine,D AH T ER M AH N,D IH T ER M AH N D
2.6191935539245605,misquote,M IH S K W OW T,M IH S K W OW T IH D
2.4866347312927246,describe,D IH S K R AY B,D IH S K R AY B D
2.4363956451416016,misidentify,M IH S AY D EH N T AH F AY,M IH S AY D EH N T IH F AY D
2.393418312072754,disclose,D IH S K L OW Z,D IH S K L OW Z D
2.384003162384033,underestimate,AH N D ER EH S T AH M EY T,AH N D ER EH S T AH M EY T IH D
2.3718433380126953,disprove,D IH S P R UW V,D IH S P R UW V D
2.322185516357422,bifurcate,B IH F ER K EY T,B IH F ER K EY T IH D
2.3167200088500977,displease,D IH S P L IY Z,D IH S P L IY Z D
2.283186912536621,mismanage,M IH S M AE N IH JH,M IH S M AE N IH JH D
2.2527780532836914,acknowledge,AE K N AA L IH JH,AE K N AA L IH JH D
2.234104633331299,interlace,IH N T ER L EY S,IH N T ER L EY S T
2.1885337829589844,disgrace,D IH S G R EY S,D IH S G R EY S T
2.1336588859558105,mesmerize,M EH Z M ER AY Z,M EH Z M ER AY Z D
2.124938488006592,preoccupy,P R IY AA K Y AH P AY,P R IY AA K Y AH P AY D
2.1115760803222656,decertify,D IY S ER T AH F AY,D IY S ER T AH F AY D
2.0921201705932617,practice,P R AE K T AH S,P R AE K T AH S T
2.080915927886963,envisage,EH N V IH Z IH JH,EH N V IH Z IH JH D
2.076998233795166,practise,P R AE K T IH S,P R AE K T IH S T
2.0768303871154785,mischarge,M IH S CH AA R JH,M IH S CH AA R JH D
2.075552463531494,misstate,M IH S S T EY T,M IH S S T EY T IH D
2.0684733390808105,underutilize,AH N D ER Y UW T AH L AY Z,AH N D ER Y UW T AH L AY Z D
2.0595083236694336,misprint,M IH S P R IH N T,M IH S P R IH N T AH D
2.057936668395996,waterlog,W AO T ER L AA G,W AO T ER L AA G D
2.0367374420166016,confound,K AA N F AW N D,K AH N F AW N D IH D
2.032876491546631,intercept,IH N T ER S EH P T,IH N T ER S EH P T AH D
2.0260605812072754,detonate,D EH T AH N EY T,D EH T AH N EY T AH D
1.970559000968933,digitize,D IH JH AH T AY Z,D IH JH AH T AY Z D
1.9338051080703735,whisk,W IH S K,W IH S K T
1.9260393381118774,marginalize,M AA R JH AH N AH L AY Z,M AA R JH AH N AH L AY Z D
1.876524806022644,discriminate,D IH S K R IH M AH N EY T,D IH S K R IH M AH N EY T IH D
1.795960783958435,democratize,D IH M AA K R AH T AY Z,D IH M AA K R AH T AY Z D
1.747240424156189,befuddle,B IH F AH D AH L,B IH F AH D AH L D
1.727735161781311,mitigate,M IH T AH G EY T,M IH T AH G EY T IH D
1.7086173295974731,disembody,D IH S IH B AA D IY,D IH S IH B AA D IY D
1.7081681489944458,denominate,D IH N AA M AH N EY T,D IH N AA M AH N EY T IH D
1.698583722114563,winterize,W IH N T ER AY Z,W IH N T ER AY Z D
1.6823567152023315,mishandle,M IH S HH AE N D AH L,M IH S HH AE N D AH L D
1.6410843133926392,develop,D IH V EH L AH P,D IH V EH L AH P T
1.6278859376907349,interlink,IH N T ER L IH NG K,IH N T ER L IH NG K T
1.617005467414856,exchange,IH K S CH EY N JH,IH K S CH EY N JH D
1.6131552457809448,contrive,K AH N T R AY V,K AH N T R AY V D
1.6129494905471802,defer,D IH F ER,D IH F ER D
1.6099482774734497,fertilize,F ER T AH L AY Z,F ER T AH L AY Z D
1.5843995809555054,broker,B R OW K ER,B R OW K ER D
1.5535584688186646,mischaracterize,M IH S K AE R AH K T ER AY Z,M IH S K AE R AH K T ER AY Z D
1.5472275018692017,defy,D IH F AY,D IH F AY D
1.5007344484329224,deter,D IH T ER,D IH T ER D
1.5004652738571167,xerox,Z IH R AA K S,Z IH R AA K S T
1.4306288957595825,displace,D IH S P L EY S,D IH S P L EY S T
1.4230581521987915,monopolize,M AH N AA P AH L AY Z,M AH N AA P AH L AY Z D
1.4166477918624878,perplex,P ER P L EH K S,P ER P L EH K S T
1.4130052328109741,differentiate,D IH F ER EH N SH IY EY T,D IH F ER EH N SH IY EY T IH D
1.3958083391189575,demolish,D IH M AA L IH SH,D IH M AA L IH SH T
1.3752185106277466,harmonize,HH AA R M AH N AY Z,HH AA R M AH N AY Z D
1.3413063287734985,accede,AE K S IY D,AE K S IY D IH D
1.3367829322814941,deposit,D AH P AA Z IH T,D AH P AA Z IH T IH D
1.3308390378952026,motivate,M OW T AH V EY T,M OW T AH V EY T AH D
1.2970709800720215,quadruple,K W AA D R UW P AH L,K W AA D R UW P AH L D
1.2551157474517822,diversify,D AY V ER S AH F AY,D AY V ER S AH F AY D
1.2536680698394775,waver,W EY V ER,W EY V ER D
1.2202857732772827,manhandle,M AE N HH AE N D AH L,M AE N HH AE N D AH L D
1.1941734552383423,annualize,AE N Y UW W AH L AY Z,AE N Y UW W AH L AY Z D
1.1760321855545044,dehydrate,D IH HH AY D R EY T,D IH HH AY D R EY T AH D
1.1441948413848877,fictionalize,F IH K SH AH N AH L AY Z,F IH K SH AH N AH L AY Z D
1.107814908027649,nature,N EY CH ER,N EY CH ER D
1.0952203273773193,mow,M OW,M OW D
1.0908827781677246,downcast,D AW N K AE S T,D AW N K AE S T
1.0884617567062378,penalize,P EH N AH L AY Z,P IY N AH L AY Z D
1.0609225034713745,interrelate,IH N T ER R IH L EY T,IH N T ER R IH L EY T IH D
1.0403110980987549,meter,M IY T ER,M IY T ER D
1.02872633934021,disconnect,D IH S K AH N EH K T,D IH S K AH N EH K T IH D
1.0235782861709595,nauseate,N AO Z IY EY T,N AO Z IY EY T AH D
1.0209873914718628,wink,W IH NG K,W IH NG K T
1.0157498121261597,discontinue,D IH S K AH N T IH N Y UW,D IH S K AH N T IH N Y UW D
1.0126516819000244,distress,D IH S T R EH S,D IH S T R EH S T
0.998713493347168,prearrange,P R IY ER EY N JH,P R IY ER EY N JH D
0.967767596244812,disgorge,D IH S G AO R JH,D IH S G AO R JH D
0.9606575965881348,discard,D IH S K AA R D,D IH S K AA R D IH D
0.9581453800201416,anticipate,AE N T IH S AH P EY T,AE N T IH S AH P EY T IH D
0.9283738136291504,instruct,IH N S T R AH K T,IH N S T R AH K T AH D
0.9209302663803101,nurture,N ER CH ER,N ER CH ER D
0.8993899822235107,misprice,M IH S P R AY S,M IH S P R AY S T
0.8938184976577759,excoriate,EH K S K AO R IY EY T,EH K S K AO R IY EY T IH D
0.8862160444259644,interleave,IH N T ER L IY V,IH N T ER L IY V D
0.8857828378677368,meet,M IY T,M EH T
0.8857828378677368,mete,M IY T,M IY T IH D
0.8843525648117065,ensconce,IH N S K AA N S,IH N S K AA N S T
0.8651103973388672,de,D IY,D IH D
0.8289963006973267,persuade,P ER S W EY D,P ER S W EY D IH D
0.8254386186599731,photoshop,F OW T OW SH AA P,F OW T OW SH AA P T
0.8159242868423462,undervalue,AH N D ER V AE L Y UW,AH N D ER V AE L Y UW D
0.7958898544311523,dispute,D IH S P Y UW T,D IH S P Y UW T AH D
0.7300733327865601,convince,K AH N V IH N S,K AH N V IH N S T
0.7264982461929321,wager,W EY JH ER,W EY JH ER D
0.7074539661407471,knit,N IH T,N IH T
0.7058854103088379,dissatisfy,D IH S AE T AH S F AY,D IH S AE T AH S F AY D
0.7042418718338013,decelerate,D IH S EH L ER EY T,D IH S EH L ER EY T IH D
0.6934179067611694,manufacture,M AE N Y AH F AE K CH ER,M AE N Y AH F AE K CH ER D
0.6660757064819336,interfere,IH N T ER F IH R,IH N T ER F IH R D
0.6573890447616577,expunge,IH K S P AH N JH,IH K S P AH N JH D
0.6559292078018188,coauthor,K OW AA TH ER,K OW AA TH ER D
0.5586985349655151,entrance,EH N T R AH N S,IH N T R AE N S T
0.5410903692245483,mutter,M AH T ER,M AH T ER D
0.47842466831207275,pivot,P IH V AH T,P IH V AH T IH D
0.4607928991317749,decide,D IH S AY D,D IH S AY D IH D
0.4311870336532593,deny,D IH N AY,D IH N AY D
0.313268780708313,explore,IH K S P L AO R,IH K S P L AO R D
