activation,lemma,present_phones,past_phones
1.9456455707550049,tinkle,T IH NG K AH L,T IH NG K AH L D
1.8922944068908691,bridle,B R AY D AH L,B R AY D AH L D
1.8283817768096924,crackle,K R AE K AH L,K R AE K AH L D
1.7998590469360352,wrinkle,R IH NG K AH L,R IH NG K AH L D
1.749953269958496,triple,T R IH P AH L,T R IH P AH L D
1.6941494941711426,single,S IH NG G AH L,S IH NG G AH L D
1.687960147857666,signal,S IH G N AH L,S IH G N AH L D
1.6591331958770752,speckle,S P EH K AH L,S P EH K AH L D
1.6051511764526367,handle,HH AE N D AH L,HH AE N D AH L D
1.6012358665466309,kindle,K IH N D AH L,K IH N D AH L D
1.590196132659912,trickle,T R IH K AH L,T R IH K AH L D
1.5719037055969238,ventilate,V EH N T AH L EY T,V EH N T AH L EY T IH D
1.5140633583068848,wangle,W AE NG G AH L,W AE NG G AH L D
1.5029079914093018,grapple,G R AE P AH L,G R AE P AH L D
1.4640541076660156,cripple,K R IH P AH L,K R IH P AH L D
1.432142734527588,throttle,TH R AA T AH L,TH R AA T AH L D
1.4317727088928223,staple,S T EY P AH L,S T EY P AH L D
1.4240615367889404,freckle,F R EH K AH L,F R EH K AH L D
1.4224085807800293,overhaul,OW V ER HH AO L,OW V ER HH AO L D
1.4196724891662598,travel,T R AE V AH L,T R AE V AH L D
1.3955950736999512,tangle,T AE NG G AH L,T AE NG G AH L D
1.3936083316802979,stifle,S T AY F AH L,S T AY F AH L D
1.3892590999603271,mingle,M IH NG G AH L,M IH NG G AH L D
1.3831653594970703,jumble,JH AH M B AH L,JH AH M B AH L D
1.3697504997253418,frazzle,F R AE Z AH L,F R AE Z AH L D
1.3496184349060059,bristle,B R IH S AH L,B R IH S AH L D
1.3270630836486816,simulcast,S AY M Y AH L K AE S T,S AY M Y AH L K AE S T
1.3171610832214355,cancel,K AE N S AH L,K AE N S AH L D
1.309441328048706,frizzle,F R IH Z AH L,F R IH Z AH L D
1.3076999187469482,bungle,B AH NG G AH L,B AH NG G AH L D
1.296321153640747,rumple,R AH M P AH L,R AH M P AH L D
1.294196605682373,fondle,F AO N D AH L,F AO N D AH L D
1.2741155624389648,scuttle,S K AH T AH L,S K AH T AH L D
1.2607812881469727,swivel,S W IH V AH L,S W IH V AH L D
1.2604331970214844,dispel,D IH S P EH L,D IH S P EH L D
1.249556541442871,fangle,F AE NG G AH L,F AE NG G AH L D
1.242444634437561,simulate,S IH M Y AH L AH T,S IH M Y AH L EY T IH D
1.2422826290130615,sample,S AE M P AH L,S AE M P AH L D
1.2393572330474854,bludgeon,B L AH JH AH N,B L AH JH AH N D
1.2046589851379395,exhale,EH K S HH EY L,EH K S HH EY L D
1.1576004028320312,dimple,D IH M P AH L,D IH M P AH L D
1.1330792903900146,scuffle,S K AH F AH L,S K AH F AH L D
1.1213414669036865,demobilize,D IH M OW B AH L AY Z,D IH M OW B AH L AY Z D
1.0896117687225342,snuggle,S N AH G AH L,S N AH G AH L D
1.0868877172470093,tabulate,T AE B Y AH L EY T,T AE B Y AH L EY T IH D
1.0780175924301147,bundle,B AH N D AH L,B AH N D AH L D
1.0667673349380493,grizzle,G R IH Z AH L,G R IH Z AH L D
1.0526443719863892,rankle,R AE NG K AH L,R AE NG K AH L D
1.0276827812194824,deluge,D EH L Y UW JH,D EH L Y UW JH D
1.0266205072402954,misjudge,M IH S JH AH JH,M IH S JH AH JH D
1.020310401916504,crenelate,K R EH N AH L EY T,K R EH N AH L EY T AH D
1.013612151145935,mortgage,M AO R G AH JH,M AO R G IH JH D
0.9879575967788696,interpolate,IH T ER P AH L EY T,IH T ER P AH L EY T IH D
0.9538700580596924,mangle,M AE NG G AH L,M AE NG G AH L D
0.9455512762069702,subcontract,S AH B K AA N T R AE K T,S AH B K AA N T R AE K T IH D
0.9389524459838867,wrangle,R AE NG G AH L,R AE NG G AH L D
0.9363906383514404,crystallize,K R IH S T AH L AY Z,K R IH S T AH L AY Z D
0.9064600467681885,jangle,JH AE NG G AH L,JH AE NG G AH L D
0.9037220478057861,synchronize,S IH NG K R AH N AY Z,S IH NG K R AH N AY Z D
0.9020285606384277,spiral,S P AY R AH L,S P AY R AH L D
0.8981173038482666,circulate,S ER K Y AH L EY T,S ER K Y AH L EY T IH D
0.8958094120025635,jaundice,JH AO N D AH S,JH AO N D IH S T
0.8830877542495728,dangle,D AE NG G AH L,D AE NG G AH L D
0.8800780773162842,secure,S IH K Y UH R,S IH K Y UH R D
0.8799178600311279,diagnose,D AY AH G N OW S,D AY AH G N OW S T
0.8767659664154053,tumble,T AH M B AH L,T AH M B AH L D
0.8762280941009521,prattle,P R AE T AH L,P R AE T AH L D
0.8743205070495605,initial,IH N IH SH AH L,IH N IH SH AH L D
0.8667705059051514,rumble,R AH M B AH L,R AH M B AH L D
0.8588917255401611,expel,IH K S P EH L,IH K S P EH L D
0.8562483787536621,section,S EH K SH AH N,S EH K SH AH N D
0.8473538160324097,station,S T EY SH AH N,S T EY SH AH N D
0.8192368745803833,syncopate,S IH NG K AH P EY T,S IH NG K AH P EY T IH D
0.8188177347183228,humble,HH AH M B AH L,HH AH M B AH L D
0.8172274827957153,treble,T R EH B AH L,T R EH B AH L D
0.8170242309570312,mumble,M AH M B AH L,M AH M B AH L D
0.7879877090454102,propel,P R AH P EH L,P R AH P EH L D
0.7824429273605347,sentence,S EH N T AH N S,S EH N T AH N S T
0.7787903547286987,prejudge,P R IY JH AH JH,P R IY JH AH JH D
0.7772430181503296,bargain,B AA R G AH N,B AA R G AH N D
0.7640774250030518,postulate,P AA S CH AH L EY T,P AA S CH AH L EY T IH D
0.7627819776535034,mishandle,M IH S HH AE N D AH L,M IH S HH AE N D AH L D
0.762035608291626,specify,S P EH S AH F AY,S P EH S AH F AY D
0.7397221326828003,stucco,S T AH K OW,S T AH K OW D
0.7282288074493408,upstage,AH P S T EY JH,AH P S T EY JH D
0.7265173196792603,welcome,W EH L K AH M,W EH L K AH M D
0.7166037559509277,fumble,F AH M B AH L,F AH M B AH L D
0.704043984413147,distil,D IH S T IH L,D IH S T IH L D
0.6958205699920654,oversell,OW V ER S EH L,OW V ER S OW L D
0.6896954774856567,dovetail,D AH V T EY L,D AH V T EY L D
0.6896190643310547,vandalize,V AE N D AH L AY Z,V AE N D AH L AY Z D
0.6644315719604492,dribble,D R IH B AH L,D R IH B AH L D
0.6610714197158813,fulfil,F UH L F IH L,F UH L F IH L D
0.6543813943862915,mention,M EH N SH AH N,M EH N SH AH N D
0.6529611349105835,dispense,D IH S P EH N S,D IH S P EH N S T
0.6390901803970337,marvel,M AA R V AH L,M AA R V EH L D
0.6342203617095947,ramble,R AE M B AH L,R AE M B AH L D
0.6298989057540894,marshal,M AA R SH AH L,M AA R SH AH L D
0.6265724897384644,belittle,B IH L IH T AH L,B IH L IH T AH L D
0.626225471496582,squirrel,S K W ER AH L,S K W ER AH L D
0.6235949993133545,manhandle,M AE N HH AE N D AH L,M AE N HH AE N D AH L D
0.6218032836914062,hemorrhage,HH EH M ER IH JH,HH EH M ER IH JH D
0.6130393743515015,garden,G AA R D AH N,G AA R D AH N D
0.5907876491546631,deprive,D IH P R AY V,D IH P R AY V D
0.5905559062957764,flannel,F L AE N AH L,F L AE N AH L D
0.5847898721694946,trouble,T R AH B AH L,T R AH B AH L D
0.5419669151306152,cordon,K AO R D AH N,K AO R D AH N D
0.5323750972747803,distance,D IH S T AH N S,D IH S T AH N S T
0.5187387466430664,rampage,R AE M P EY JH,R AE M P EY JH D
0.5087771415710449,tantalize,T AE N T AH L AY Z,T AE N T AH L AY Z D
0.49916768074035645,salvage,S AE L V AH JH,S AE L V IH JH D
0.4961585998535156,overflow,OW V ER F L OW,OW V ER F L OW D
0.4945272207260132,reemerge,R IY IH M ER JH,R IY IH M ER JH D
0.49395954608917236,liberalize,L IH B ER AH L AY Z,L IH B ER AH L AY Z D
0.48512518405914307,bandage,B AE N D IH JH,B AE N D AH JH D
0.48500823974609375,enamel,IH N AE M AH L,IH N AE M AH L D
0.4784512519836426,stipulate,S T IH P Y AH L EY T,S T IH P Y AH L EY T IH D
0.47121167182922363,exclude,IH K S K L UW D,IH K S K L UW D AH D
0.45944011211395264,compensate,K AA M P AH N S EY T,K AA M P AH N S EY T AH D
0.44281649589538574,convolute,K AA N V AH L UW T,K AA N V AH L UW T AH D
0.44167160987854004,erect,IH R EH K T,IH R EH K T AH D
0.3980931043624878,excavate,EH K S K AH V EY T,EH K S K AH V EY T IH D
0.38702821731567383,gamble,G AE M B AH L,G AE M B AH L D
0.38222241401672363,caption,K AE P SH AH N,K AE P SH AH N D
0.3797416687011719,subjugate,S AH B JH AH G EY T,S AH B JH AH G EY T IH D
0.37883126735687256,presage,P R EH S IH JH,P R EH S IH JH D
0.37652456760406494,brush,B R AH SH,B R AH SH T
0.3717367649078369,graft,G R AE F T,G R AE F T IH D
0.3704644441604614,bolster,B OW L S T ER,B OW L S T ER D
0.36176013946533203,imagine,IH M AE JH AH N,IH M AE JH AH N D
0.35846471786499023,rebut,R IH B AH T,R IH B AH T IH D
0.3287017345428467,overcome,OW V ER K AH M,OW V ER K EY M
0.32545018196105957,usher,AH SH ER,AH SH ER D
0.3238178491592407,submerge,S AH B M ER JH,S AH B M ER JH D
0.32145190238952637,truck,T R AH K,T R AH K T
0.2698096036911011,bankrupt,B AE NG K R AH P T,B AE NG K R AH P T IH D
0.25780296325683594,sock,S AA K,S AA K T
0.25204038619995117,speak,S P IY K,S P OW K
0.24883079528808594,consult,K AH N S AH L T,K AH N S AH L T AH D
0.2445051670074463,tinker,T IH NG K ER,T IH NG K ER D
0.21912872791290283,berate,B IH R EY T,B IH R EY T IH D
0.21219784021377563,parcel,P AA R S AH L,P AA R S AH L D
0.2105991244316101,bobble,B AO B AH L,B AO B AH L D
0.20502007007598877,breast,B R EH S T,B R EH S T AH D
0.15800821781158447,rebuff,R IH B AH F,R IH B AH F T
0.15709275007247925,specialize,S P EH SH AH L AY Z,S P EH SH AH L AY Z D
0.15189242362976074,tender,T EH N D ER,T EH N D ER D
0.08672910928726196,sneak,S N IY K,S N IY K T
0.08293759822845459,overrun,OW V ER R AH N,OW V ER R AE N
0.08169877529144287,dock,D AA K,D AA K T
0.07005167007446289,tire,T AY ER,T AY ER D
