activation,lemma,present_phones,past_phones
2.2400426864624023,come,K AH M,K EY M
2.2400426864624023,cum,K AH M,K EY M
1.8257468938827515,cuff,K AH F,K AH F T
1.779415488243103,consolidate,K AH N S AA L IH D EY T,K AH N S AA L AH D EY T AH D
1.7302974462509155,tongue,T AH NG,T AH NG D
1.6964534521102905,gum,G AH M,G AH M D
1.6395078897476196,tough,T AH F,T AH F T
1.5537346601486206,bum,B AH M,B AH M D
1.492930293083191,cut,K AH T,K AH T
1.444703221321106,cuss,K AH S,K AH S T
1.4359956979751587,arraign,ER EY N,ER EY N D
1.4203368425369263,thumb,TH AH M,TH AH M D
1.4107340574264526,comb,K OW M,K OW M D
1.364662528038025,halve,HH AE V,HH AE V D
1.364662528038025,have,HH AE V,HH AE D
1.3634265661239624,luff,L AH F,L AH F T
1.354169249534607,bang,B AE NG,B AE NG D
1.3470076322555542,love,L AH V,L AH V D
1.336638331413269,sum,S AH M,S AH M D
1.3136943578720093,huff,HH AH F,HH AH F T
1.3089996576309204,shove,SH AH V,SH AH V D
1.3014460802078247,hang,HH AE NG,HH AH NG
1.298515796661377,gush,G AH SH,G AH SH T
1.2914557456970215,cake,K EY K,K EY K T
1.239237904548645,loom,L UW M,L UW M D
1.2299649715423584,rough,R AH F,R AH F T
1.2178770303726196,coiffe,K OY F,K OY F T
1.2148808240890503,cane,K EY N,K EY N D
1.2062156200408936,jam,JH AE M,JH AE M D
1.192436933517456,cough,K AA F,K AO F T
1.1853142976760864,hug,HH AH G,HH AH G D
1.1788431406021118,ram,R AE M,R AE M D
1.1775953769683838,half,HH AE F,HH AE V D
1.1760622262954712,buzz,B AH Z,B AH Z D
1.1595399379730225,goof,G UW F,G UW F T
1.1479939222335815,catch,K AE CH,K AA T
1.1436055898666382,tuck,T AH K,T AH K T
1.111537218093872,budge,B AH JH,B AH JH D
1.1110222339630127,shame,SH EY M,SH EY M D
1.1089658737182617,compound,K AA M P AW N D,K AH M P AW N D AH D
1.0817795991897583,maim,M EY M,M EY M D
1.076357364654541,cape,K EY P,K EY P T
1.069043517112732,buck,B AH K,B AH K T
1.068968653678894,solidify,S AH L IH D AH F AY,S AH L IH D AH F AY D
1.0515327453613281,dam,D AE M,D AE M D
1.0515327453613281,damn,D AE M,D AE M D
1.0411231517791748,laugh,L AE F,L AE F T
1.0324797630310059,tug,T AH G,T AH G D
1.031411051750183,gun,G AH N,G AH N D
1.0302772521972656,shuck,SH AH K,SH AH K T
1.0293153524398804,grandfather,G R AE N D F AA DH ER,G R AE N D F AA DH ER D
1.0238091945648193,mug,M AH G,M AH G D
1.0193872451782227,hull,HH AH L,HH AH L D
1.0056957006454468,hush,HH AH SH,HH AH SH T
1.0038331747055054,sac,S AE K,S AE K T
1.0038331747055054,sack,S AE K,S AE K T
1.000651240348816,pack,P AE K,P AE K T
0.9989162683486938,dun,D AH N,D AH N D
0.9985498189926147,compartmentalize,K AH M P AA R T M EH N T AH L AY Z,K AA M P AA R T M EH N T AH L AY Z D
0.9959689378738403,chafe,CH EY F,CH EY F T
0.988411545753479,gut,G AH T,G AH T IH D
0.9879919290542603,coach,K OW CH,K OW CH T
0.9869987964630127,tame,T EY M,T EY M D
0.9822322130203247,shun,SH AH N,SH AH N D
0.981347918510437,cave,K EY V,K EY V D
0.9676858186721802,cock,K AA K,K AA K T
0.9655965566635132,bombard,B AA M B AA R D,B AA M B AA R D IH D
0.965008020401001,rut,R AH T,R AH T IH D
0.964396595954895,code,K OW D,K OW D IH D
0.9608469009399414,coop,K UW P,K UW P T
0.9550931453704834,sacrifice,S AE K R AH F AY S,S AE K R AH F AY S T
0.9523707628250122,touch,T AH CH,T AH CH T
0.9397158622741699,cull,K AH L,K AH L D
0.9305932521820068,lose,L UW Z,L AO S T
0.9265342950820923,rub,R AH B,R AH B D
0.9143615961074829,mass,M AE S,M AE S T
0.9060428142547607,gas,G AE S,G AE S T
0.8979005813598633,hatch,HH AE CH,HH AE CH T
0.8967946767807007,cap,K AE P,K AE P T
0.895469069480896,shut,SH AH T,SH AH T
0.8943002223968506,coo,K UW,K UW D
0.894213080406189,rug,R AH G,R AH G AH D
0.8895652294158936,back,B AE K,B AE K T
0.8882150650024414,hack,HH AE K,HH AE K T
0.864879846572876,cause,K AA Z,K AA Z D
0.861200213432312,curb,K ER B,K ER B D
0.8527764081954956,sag,S AE G,S AE G D
0.8497562408447266,match,M AE CH,M AE CH T
0.8485276699066162,hamstring,HH AE M S T R IH NG,HH AE M S T R AH NG
0.8485161066055298,compel,K AH M P EH L,K AH M P EH L D
0.8424617052078247,cook,K UH K,K UH K T
0.8400076627731323,hydrolyze,HH AY D R AH L AY Z,HH AY D R AH L AY Z D
0.8393470048904419,judge,JH AH JH,JH AH JH D
0.8342125415802002,mull,M AH L,M AH L D
0.8325985670089722,subdivide,S AH B D AH V AY D,S AH B D IH V AY D IH D
0.8279917240142822,mash,M AE SH,M AE SH T
0.8241080045700073,bug,B AH G,B AH G D
0.8240560293197632,latch,L AE CH,L AE CH T
0.819003701210022,tack,T AE K,T AE K T
0.8188532590866089,sing,S IH NG,S AE NG
0.8134564161300659,rush,R AH SH,R AH SH T
0.8132808208465576,cache,K AE SH,K AE SH T
0.8132808208465576,cash,K AE SH,K AE SH T
0.8104004859924316,dub,D AH B,D AH B D
0.8097814321517944,gain,G EY N,G EY N D
0.795943021774292,thump,TH AH M P,TH AH M P T
0.7894779443740845,commingle,K AH M IH NG G AH L,K AA M IH NG G AH L D
0.7731965780258179,loose,L UW S,L UW S T
0.7662531137466431,chuck,CH AH K,CH AH K T
0.7611411809921265,camouflage,K AE M AH F L AA ZH,K AE M AH F L AA ZH D
0.757858157157898,jack,JH AE K,JH AE K T
0.7540744543075562,couch,K AW CH,K AW CH T
0.7459384202957153,pain,P EY N,P EY N D
0.7456637620925903,tan,T AE N,T AE N D
0.74445641040802,bus,B AH S,B AH S T
0.74445641040802,buss,B AH S,B AH S T
0.7418172359466553,hash,HH AE SH,HH AE SH T
0.7395632266998291,bath,B AE TH,B EY DH D
0.7229294776916504,putt,P AH T,P AH T IH D
0.7134690284729004,arouse,ER AW Z,ER AW Z D
0.7093297243118286,tune,T UW N,T UW N D
0.7089674472808838,home,HH OW M,HH OW M D
0.7046419382095337,pad,P AE D,P AE D IH D
0.7028070688247681,cage,K EY JH,K EY JH D
0.7016799449920654,pass,P AE S,P AE S T
0.6991015672683716,kick,K IH K,K IH K T
0.6970158815383911,ting,T IH NG,T IH NG D
0.6951205730438232,standardize,S T AE N D ER D AY Z,S T AE N D ER D AY Z D
0.6946476697921753,hitchhike,HH IH CH HH AY K,HH IH CH HH AY K T
0.691330075263977,kid,K IH D,K IH D IH D
0.6892740726470947,cop,K AA P,K AA P T
0.6881394386291504,patch,P AE CH,P AE CH T
0.6873005628585815,hood,HH UH D,HH UH D IH D
0.6777249574661255,duck,D AH K,D AH K T
0.6769129037857056,sock,S AA K,S AA K T
0.6763911247253418,commit,K AH M IH T,K AH M IH T IH D
0.6730453968048096,ring,R IH NG,R IH NG D
0.6730453968048096,wring,R IH NG,R AH NG
0.6728981733322144,chain,CH EY N,CH EY N D
0.6721056699752808,gag,G AE G,G AE G D
0.6649181842803955,bomb,B AA M,B AA M D
0.6648381948471069,make,M EY K,M EY D
0.6622072458267212,console,K AA N S OW L,K AH N S OW L D
0.6581662893295288,cope,K OW P,K OW P T
0.6573644876480103,junk,JH AH NG K,JH AH NG K T
0.6546200513839722,shave,SH EY V,SH EY V D
0.6527786254882812,hotwire,HH AA T W AY ER,HH AA T W AY ER D
0.6521352529525757,limb,L IH M,L IH M D
0.6463993787765503,look,L UH K,L UH K T
0.645097017288208,chug,CH AH G,CH AH G D
0.6417585611343384,lavish,L AE V IH SH,L AE V IH SH T
0.6407538652420044,gash,G AE SH,G AE SH T
0.6334816217422485,bash,B AE SH,B AE SH T
0.6316632032394409,ruse,R UW Z,R UW Z D
0.6299093961715698,jazz,JH AE Z,JH AE Z D
0.624381422996521,convene,K AH N V IY N,K AH N V IY N D
0.6167157888412476,sub,S AH B,S AH B D
0.616692304611206,boom,B UW M,B UW M D
0.6144412755966187,bat,B AE T,B AE T IH D
0.6138168573379517,fuck,F AH K,F AH K T
0.6126435995101929,push,P UH SH,P UH SH T
0.6112043857574463,shape,SH EY P,SH EY P T
0.6095877885818481,ban,B AE N,B AE N D
0.6083134412765503,jab,JH AE B,JH AE B D
0.6069430112838745,control,K AH N T R OW L,K AH N T R OW L D
0.6052144765853882,curve,K ER V,K ER V D
0.6037198305130005,hoot,HH UW T,HH UW T IH D
0.6016885042190552,loot,L UW T,L UW T AH D
0.5961614847183228,ping,P IH NG,P IH NG D
0.5948573350906372,rack,R AE K,R AE K T
0.5948573350906372,wrack,R AE K,R AE K T
0.5926889181137085,hook,HH UH K,HH UH K T
0.5922213792800903,lock,L AA K,L AA K T
0.5908194780349731,pale,P EY L,P EY L D
0.5907922983169556,shake,SH EY K,SH UH K
0.5870348215103149,hydrate,HH AY D R EY T,HH AY D R EY T AH D
0.5850417613983154,condone,K AH N D OW N,K AH N D OW N D
0.5782583951950073,gaze,G EY Z,G EY Z D
0.5769249200820923,prejudice,P R EH JH AH D IH S,P R EH JH AH D AH S T
0.5735124349594116,lag,L AE G,L AE G D
0.5715796947479248,hammer,HH AE M ER,HH AE M ER D
0.5710614919662476,lace,L EY S,L EY S T
0.567827582359314,vat,V AE T,V AE T IH D
0.5648905038833618,con,K AA N,K AA N D
0.5648905038833618,conn,K AA N,K AA N D
0.5644530057907104,substitute,S AH B S T AH T UW T,S AH B S T AH T UW T IH D
0.5638196468353271,bag,B AE G,B AE G D
0.5630205869674683,premier,P R EH M IH R,P R EH M IH R D
0.5630205869674683,premiere,P R EH M IH R,P R EH M IH R D
0.5628683567047119,reign,R EY N,R EY N D
0.5628683567047119,rein,R EY N,R EY N D
0.5616155862808228,suit,S UW T,S UW T IH D
0.5587018728256226,chew,CH UW,CH UW D
0.5579038858413696,compose,K AH M P OW Z,K AH M P OW Z D
0.557270884513855,take,T EY K,T UH K
0.556054949760437,gamble,G AE M B AH L,G AE M B AH L D
0.5549447536468506,compile,K AH M P AY L,K AH M P AY L D
0.5536400079727173,tone,T OW N,T OW N D
0.5525220632553101,arrange,ER EY N JH,ER EY N JH D
0.5513448715209961,arise,ER AY Z,ER OW Z
0.5500905513763428,bing,B IH NG,B IH N JH D
0.550086259841919,loop,L UW P,L UW P T
0.5500189065933228,mummify,M AH M AH F AY,M AH M IH F AY D
0.5498460531234741,fame,F EY M,F EY M D
0.5456832647323608,sandblast,S AE N D B L AE S T,S AE N D B L AE S T IH D
0.5424362421035767,tap,T AE P,T AE P T
0.5352708101272583,cry,K R AY,K R AY D
0.5344043970108032,homestead,HH OW M S T EH D,HH OW M S T EH D IH D
0.5331286191940308,commemorate,K AH M EH M ER EY T,K AH M EH M ER EY T IH D
0.5323964357376099,raise,R EY Z,R EY Z D
0.5323964357376099,raze,R EY Z,R EY Z D
0.5299714803695679,mate,M EY T,M EY T IH D
0.5295058488845825,conceive,K AH N S IY V,K AH N S IY V D
0.5279788970947266,thatch,TH AE CH,TH AE CH T
0.5268522500991821,lay,L EY,L EY D
0.5196136236190796,bake,B EY K,B EY K T
0.5186306238174438,symbolize,S IH M B AH L AY Z,S IH M B AH L AY Z D
0.5160859823226929,captivate,K AE P T IH V EY T,K AE P T IH V EY T IH D
0.5158065557479858,mail,M EY L,M EY L D
0.5152469873428345,pan,P AE N,P AE N D
0.5118978023529053,pat,P AE T,P AE T IH D
0.5110448598861694,choose,CH UW Z,CH OW Z
0.5100375413894653,shade,SH EY D,SH EY D IH D
0.5073739290237427,man,M AE N,M AE N D
0.5053058862686157,micromanage,M AY K R OW M AE N IH JH,M AY K R OW M AE N IH JH D
0.5038862228393555,move,M UW V,M UW V D
0.4985790252685547,chat,CH AE T,CH AE T AH D
0.4954441785812378,tag,T AE G,T AE G D
0.48417365550994873,buoy,B UW IY,B UW IY D
0.48367512226104736,join,JH OY N,JH OY N D
0.4828137159347534,soak,S OW K,S OW K T
0.4826315641403198,rot,R AA T,R AA T IH D
0.47992444038391113,rag,R AE G,R AE G AH D
0.47374141216278076,cue,K Y UW,K Y UW D
0.46809375286102295,sob,S AA B,S AA B D
0.467258095741272,sue,S UW,S UW D
0.467143177986145,handicap,HH AE N D IY K AE P,HH AE N D IY K AE P T
0.45588231086730957,castigate,K AE S T AH G EY T,K AE S T AH G EY T IH D
0.4539750814437866,lash,L AE SH,L AE SH T
0.4539254903793335,hump,HH AH M P,HH AH M P T
0.44714605808258057,riff,R IH F,R IH F T
0.44490277767181396,continue,K AH N T IH N Y UW,K AH N T IH N Y UW D
0.44477295875549316,grizzle,G R IH Z AH L,G R IH Z AH L D
0.4432104825973511,conclude,K AH N K L UW D,K AH N K L UW D AH D
0.44295012950897217,nab,N AE B,N AE B D
0.44253551959991455,lop,L AA P,L AA P T
0.4403252601623535,fake,F EY K,F EY K T
0.44014251232147217,pay,P EY,P EY D
0.4373680353164673,pock,P AA K,P AA K T
0.436578631401062,hone,HH OW N,HH OW N D
0.43645429611206055,rape,R EY P,R EY P T
0.43291985988616943,earn,ER N,ER N D
0.4311157464981079,soothe,S UW DH,S UW DH D
0.430156946182251,hote,HH OW T,HH AY T
0.42784929275512695,shoe,SH UW,SH AA D
0.42278504371643066,lob,L AA B,L AA B D
0.4227844476699829,trend,T R EH N D,T R EH N D IH D
0.4197678565979004,daze,D EY Z,D EY Z D
0.41973352432250977,pace,P EY S,P EY S T
0.4195150136947632,use,Y UW S,Y UW Z D
0.419211745262146,hate,HH EY T,HH EY T AH D
0.41845130920410156,coole,K UW L,K UW L D
0.4156690835952759,curry,K AH R IY,K ER IY D
0.41550910472869873,hem,HH EH M,HH EH M D
0.41546034812927246,loathe,L OW DH,L OW DH D
0.4154571294784546,rap,R AE P,R AE P T
0.4154571294784546,wrap,R AE P,R AE P T
0.41103649139404297,zoom,Z UW M,Z UW M D
0.41054248809814453,yoke,Y OW K,Y OW K T
0.401908278465271,keep,K IY P,K EH P T
0.4007788896560669,hose,HH OW Z,HH OW Z D
0.4001784324645996,passe,P AE S EY,P AE S T
0.3961876630783081,gate,G EY T,G EY T IH D
0.39605772495269775,tape,T EY P,T EY P T
0.39427292346954346,pave,P EY V,P EY V D
0.392747163772583,stay,S T EY,S T EY D
0.3906829357147217,poop,P UW P,P UW P T
0.3878614902496338,git,G IH T,G AA T AH N
0.3869011402130127,dome,D OW M,D OW M D
0.38479697704315186,patrol,P AH T R OW L,P AH T R OW L D
0.38296687602996826,pool,P UW L,P UW L D
0.382826566696167,stain,S T EY N,S T EY N D
0.378635048866272,lap,L AE P,L AE P T
0.3781139850616455,layer,L EY ER,L EY ER D
0.37605488300323486,slay,S L EY,S L UW
0.3760329484939575,thin,TH IH N,TH IH N D
0.3752695322036743,arm,AA R M,AA R M D
0.3744553327560425,poke,P OW K,P OW K T
0.3727461099624634,rake,R EY K,R EY K T
0.36997759342193604,lure,L UH R,L UH R D
0.36170685291290283,campaign,K AE M P EY N,K AE M P EY N D
0.3609657287597656,long,L AO NG,L AO NG D
0.36077964305877686,brow,B R AW,B R AW D
0.35525619983673096,load,L OW D,L OW D IH D
0.3521568775177002,fuss,F AH S,F AH S T
0.349015474319458,sap,S AE P,S AE P T
0.34700238704681396,create,K R IY EY T,K R IY EY T AH D
0.34205496311187744,duke,D UW K,D UW K T
0.34059274196624756,laminate,L AE M AH N AH T,L AE M AH N EY T AH D
0.3381596803665161,map,M AE P,M AE P T
0.3361544609069824,save,S EY V,S EY V D
0.3361039161682129,snee,S N IY,S N IY D
0.33597028255462646,jade,JH EY D,JH EY D AH D
0.3311871290206909,disembody,D IH S IH B AA D IY,D IH S IH B AA D IY D
0.33074986934661865,compute,K AH M P Y UW T,K AH M P Y UW T AH D
0.33017969131469727,bank,B AE NG K,B AE NG K T
0.3246268033981323,cure,K Y UH R,K Y UH R D
0.31939035654067993,tank,T AE NG K,T AE NG K T
0.3171030879020691,loan,L OW N,L OW N D
0.3161126375198364,shoot,SH UW T,SH AA T
0.31035053730010986,sate,S EY T,S EY T IH D
0.3061492443084717,mouth,M AW TH,M AW DH D
0.3044934868812561,ramble,R AE M B AH L,R AE M B AH L D
0.3042154312133789,trivialize,T R IH V IY AH L AY Z,T R IH V IY AH L AY Z D
0.3028576374053955,shop,SH AA P,SH AA P T
0.3009207248687744,sample,S AE M P AH L,S AE M P AH L D
0.2979465126991272,shock,SH AA K,SH AA K T
0.2959286570549011,hand,HH AE N D,HH AE N D AH D
0.2957648038864136,dunk,D AH NG K,D AH NG K T
0.29470229148864746,poach,P OW CH,P OW CH T
0.29410016536712646,put,P UH T,P UH T
0.2938627004623413,kiss,K IH S,K IH S T
0.2935304641723633,thank,TH AE NG K,TH AE NG K T
0.2871397137641907,pop,P AA P,P AA P T
0.2865285277366638,go,G OW,W EH N T
0.28597116470336914,fudge,F AH JH,F AH JH D
0.2765233516693115,pitch,P IH CH,P IH CH T
0.27509576082229614,base,B EY S,B EY S T
0.2737197279930115,yank,Y AE NG K,Y AE NG K T
0.27149057388305664,time,T AY M,T AY M D
0.270904541015625,lib,L IH B,L IH B D
0.26998549699783325,robe,R OW B,R OW B D
0.2689288854598999,page,P EY JH,P EY JH D
0.26700353622436523,veil,V EY L,V EY L D
0.2664836049079895,hole,HH OW L,HH OW L D
0.2658535838127136,goad,G OW D,G OW D IH D
0.2642454504966736,stand,S T AE N D,S T UH D
0.26400232315063477,coil,K OY L,K OY L D
0.26226627826690674,cow,K AW,K AW D
0.2612508535385132,clue,K L UW,K L UW D
0.2599697709083557,bowe,B OW,B AW D
0.25733065605163574,taxi,T AE K S IY,T AE K S IY D
0.25731968879699707,zag,Z AE G,Z AE G D
0.2563669681549072,boat,B OW T,B OW T IH D
0.2562720775604248,lunge,L AH N JH,L AH N JH D
0.2528042793273926,jump,JH AH M P,JH AH M P T
0.2522432208061218,toe,T OW,T OW D
0.2522432208061218,tow,T OW,T OW D
0.2516202926635742,botch,B AA CH,B AA CH T
0.24926745891571045,give,G IH V,G EY V
0.2459726333618164,tick,T IH K,T IH K T
0.2459646463394165,tote,T OW T,T OW T IH D
0.24583232402801514,collude,K AH L UW D,K AH L UW D IH D
0.24418044090270996,set,S EH T,S EH T
0.242378830909729,boo,B UW,B UW D
0.24173367023468018,toll,T OW L,T OW L D
0.24078840017318726,gin,JH IH N,JH IH N D
0.23977512121200562,root,R UW T,R UW T AH D
0.23977512121200562,route,R UW T,R UW T IH D
0.2366235852241516,dangle,D AE NG G AH L,D AE NG G AH L D
0.23479712009429932,joke,JH OW K,JH OW K T
0.23246538639068604,stray,S T R EY,S T R EY D
0.23222392797470093,ski,S K IY,S K IY D
0.23026204109191895,lick,L IH K,L IH K T
0.22916245460510254,peak,P IY K,P IY K T
0.22916245460510254,pique,P IY K,P IY K T
0.22657597064971924,curl,K ER L,K ER L D
0.22585415840148926,boot,B UW T,B UW T IH D
0.22412002086639404,moor,M UH R,M UH R D
0.22360944747924805,lump,L AH M P,L AH M P T
0.22277867794036865,crimp,K R IH M P,K R IH M P T
0.22215783596038818,caddie,K AE D IY,K AE D IY D
0.22215783596038818,caddy,K AE D IY,K AE D IY D
0.21969854831695557,faze,F EY Z,F EY Z D
0.21969854831695557,phase,F EY Z,F EY Z D
0.21927213668823242,wrong,R AO NG,R AO NG D
0.2177523970603943,rim,R IH M,R IH M D
0.216749370098114,moan,M OW N,M OW N D
0.21604883670806885,hike,HH AY K,HH AY K T
0.2153996229171753,choke,CH OW K,CH OW K T
0.21473491191864014,plough,P L AW,P L AW D
0.21473491191864014,plow,P L AW,P L AW D
0.20964181423187256,soil,S OY L,S OY L D
0.20803534984588623,profile,P R OW F AY L,P R OW F AY L D
0.20734167098999023,cube,K Y UW B,K Y UW B D
0.2063930630683899,tuft,T AH F T,T AH F T IH D
0.20247572660446167,let,L EH T,L EH T
0.20080453157424927,hide,HH AY D,HH IH D
0.19951534271240234,humble,HH AH M B AH L,HH AH M B AH L D
0.19929254055023193,vouch,V AW CH,V AW CH T
0.19897067546844482,top,T AA P,T AA P T
0.19877302646636963,pin,P IH N,P IH N D
0.1955541968345642,dupe,D UW P,D UW P T
0.1953892707824707,like,L AY K,L AY K T
0.19503438472747803,tumble,T AH M B AH L,T AH M B AH L D
0.18940353393554688,dribble,D R IH B AH L,D R IH B AH L D
0.18495047092437744,bate,B EY T,B EY T IH D
0.1836564540863037,team,T IY M,T IY M D
0.18189191818237305,date,D EY T,D EY T IH D
0.1807081699371338,sit,S IH T,S AE T
0.1801092028617859,pit,P IH T,P IH T IH D
0.1781613826751709,hit,HH IH T,HH IH T
0.1763979196548462,hitch,HH IH CH,HH IH CH T
0.17421895265579224,seek,S IY K,S AO T
0.17304831743240356,perch,P ER CH,P ER CH T
0.17221194505691528,rib,R IH B,R IH B D
0.1720653772354126,do,D UW,D IH D
0.17032957077026367,pot,P AA T,P AA T IH D
0.1701672077178955,curse,K ER S,K ER S T
0.16823124885559082,bone,B OW N,B OW N D
0.16780197620391846,poll,P OW L,P OW L D
0.16444528102874756,pick,P IH K,P IH K T
0.16156768798828125,search,S ER CH,S ER CH T
0.15691405534744263,soup,S UW P,S UW P T
0.15669739246368408,tangle,T AE NG G AH L,T AE NG G AH L D
0.15570998191833496,rate,R EY T,R EY T IH D
0.15507078170776367,doze,D OW Z,D OW Z D
0.15444910526275635,tramp,T R AE M P,T R AE M P T
0.15427744388580322,dope,D OW P,D OW P T
0.15404784679412842,dump,D AH M P,D AH M P T
0.15378814935684204,hunt,HH AH N T,HH AH N T AH D
0.15225303173065186,hop,HH AA P,HH AA P T
0.15132373571395874,tail,T EY L,T EY L D
0.15023958683013916,leak,L IY K,L IY K T
0.14784455299377441,travel,T R AE V AH L,T R AE V AH L D
0.14741814136505127,acidify,AH S IH D AH F AY,AH S IH D AH F AY D
0.14599525928497314,proofread,P R UW F R IY D,P R UW F R IY D
0.1418609619140625,rob,R AA B,R AA B D
0.13849079608917236,rope,R OW P,R OW P T
0.1375160813331604,grate,G R EY T,G R EY T IH D
0.13658267259597778,gauge,G EY JH,G EY JH D
0.13117367029190063,hope,HH OW P,HH OW P T
0.12724989652633667,wrangle,R AE NG G AH L,R AE NG G AH L D
0.1270657181739807,louse,L AW S,L AW Z D
0.12098872661590576,term,T ER M,T ER M D
0.12079334259033203,thread,TH R EH D,TH R EH D IH D
0.11688733100891113,state,S T EY T,S T EY T IH D
0.11362719535827637,blame,B L EY M,B L EY M D
0.11235612630844116,face,F EY S,F EY S T
0.11201274394989014,dash,D AE SH,D AE SH T
0.10979461669921875,pawn,P AO N,P AO N D
0.10636353492736816,fade,F EY D,F EY D AH D
0.10349071025848389,tread,T R EH D,T R AA D
0.102996826171875,hedge,HH EH JH,HH EH JH D
0.1001061201095581,raid,R EY D,R EY D IH D
0.08955037593841553,rumble,R AH M B AH L,R AH M B AH L D
0.08835875988006592,mob,M AA B,M AA B D
0.08683156967163086,house,HH AW S,HH AW Z D
0.08264023065567017,hackney,HH AE K N IY,HH AE K N IY D
0.07957786321640015,lurch,L ER CH,L ER CH T
0.0793033242225647,perk,P ER K,P ER K T
0.0740126371383667,cast,K AE S T,K AE S T
0.0709187388420105,mope,M OW P,M OW P T
0.07015430927276611,mast,M AE S T,M AE S T AH D
0.05907237529754639,coax,K OW K S,K OW K S T
0.05864262580871582,dot,D AA T,D AA T AH D
0.04692256450653076,dim,D IH M,D IH M D
0.045016586780548096,douse,D AW S,D AW S T
