activation,lemma,present_phones,past_phones
2.480663776397705,swindle,S W IH N D AH L,S W IH N D AH L D
2.112412452697754,quantify,K W AA N T IH F AY,K W AA N T IH F AY D
2.0711240768432617,scandalize,S K AE N D AH L AY Z,S K AE N D AH L AY Z D
2.0625367164611816,dwindle,D W IH N D AH L,D W IH N D AH L D
1.364858627319336,immortalize,IH M AO R T AH L AY Z,IH M AO R T AH L AY Z D
1.3640656471252441,quintuple,K W IH N T UW P AH L,K W IH N T Y UW P AH L D
0.45948368310928345,quiz,K W IH Z,K W IH Z D
