activation,lemma,present_phones,past_phones
6.6638007164001465,rearrest,R IY ER EH S T,R IY ER EH S T IH D
6.395646095275879,repost,R IY P OW S T,R IY P OW S T IH D
4.7452802658081055,videotape,V IH D IY OW T EY P,V IH D IY OW T EY P T
4.58706521987915,recast,R IY K AE S T,R IY K AE S T
4.394561290740967,retest,R IY T EH S T,R IY T EH S T IH D
4.262040615081787,deputize,D EH P Y AH T AY Z,D EH P Y AH T AY Z D
4.199399471282959,reject,R IH JH EH K T,R IH JH EH K T IH D
4.042586803436279,release,R IY L IY S,R IY L IY S T
3.903351068496704,reinstate,R IY IH N S T EY T,R IY IH N S T EY T IH D
3.828631639480591,deviate,D IY V IY EY T,D IY V IY EY T IH D
3.578160524368286,resurface,R IY S ER F AH S,R IY S ER F AH S T
3.4981577396392822,hypnotize,HH IH P N AH T AY Z,HH IH P N AH T AY Z D
3.4960691928863525,recheck,R IY CH EH K,R IY CH EH K T
3.3230140209198,reset,R IY S EH T,R IY S EH T
3.294811248779297,reinstitute,R IY IH N S T IH T UW T,R IY IH N S T IH T UW T IH D
3.139772653579712,devastate,D EH V AH S T EY T,D EH V AH S T EY T IH D
3.040522336959839,nauseate,N AO Z IY EY T,N AO Z IY EY T AH D
3.0074901580810547,object,AA B JH EH K T,AH B JH EH K T AH D
2.906236410140991,digest,D AY JH EH S T,D AY JH EH S T IH D
2.855968713760376,perfect,P ER F EH K T,P ER F EH K T IH D
2.8411505222320557,harmonize,HH AA R M AH N AY Z,HH AA R M AH N AY Z D
2.796839952468872,relent,R IH L EH N T,R IH L EH N T IH D
2.782356023788452,rehearse,R IY HH ER S,R IY HH ER S T
2.7421762943267822,hijack,HH AY JH AE K,HH AY JH AE K T
2.632092237472534,redecorate,R IY D EH K ER EY T,R IY D EH K ER EY T IH D
2.6156845092773438,resettle,R IY S EH T AH L,R IY S EH T AH L D
2.567755937576294,volunteer,V AA L AH N T IH R,V AA L AH N T IH R D
2.5425961017608643,defect,D IY F EH K T,D IH F EH K T IH D
2.3620083332061768,perpetuate,P ER P EH CH AH W EY T,P ER P EH CH AH W EY T IH D
2.3139641284942627,veto,V IY T OW,V IY T OW D
2.2913968563079834,violate,V AY AH L EY T,V AY AH L EY T IH D
2.279324769973755,antiquate,AE N T AH K W EY T,AE N T AH K W EY T IH D
2.258971691131592,understate,AH N D ER S T EY T,AH N D ER S T EY T IH D
2.2002174854278564,enlist,EH N L IH S T,EH N L IH S T IH D
2.1717004776000977,recess,R IH S EH S,R IH S EH S T
2.0978612899780273,approximate,AH P R AA K S AH M AH T,AH P R AA K S AH M EY T IH D
2.035081624984741,relocate,R IY L OW K EY T,R IY L OW K EY T IH D
1.9528753757476807,target,T AA R G AH T,T AA R G AH T IH D
1.95145845413208,undercount,AH N D ER K AW N T,AH N D ER K AW N T IH D
1.925783395767212,refocus,R IY F OW K AH S,R IY F OW K AH S T
1.8702867031097412,variegate,V EH R IH G EY T,V EH R IH G EY T IH D
1.8183789253234863,ferment,F ER M EH N T,F ER M EH N T AH D
1.790255069732666,mark,M AA R K,M AA R K T
1.790255069732666,marke,M AA R K,M AA R K T
1.721184492111206,rejoice,R IH JH OY S,R IH JH OY S T
1.7202212810516357,permeate,P ER M IY EY T,P ER M IY EY T IH D
1.7019057273864746,hydrolyze,HH AY D R AH L AY Z,HH AY D R AH L AY Z D
1.6733324527740479,desecrate,D EH Z AH K R EY T,D EH Z AH K R EY T IH D
1.6706483364105225,forest,F AO R AH S T,F AO R AH S T AH D
1.6675066947937012,hydrate,HH AY D R EY T,HH AY D R EY T AH D
1.6523058414459229,repute,R IY P Y UW T,R IH P Y UW T IH D
1.649853229522705,redistribute,R IY D IH S T R IH B Y UW T,R IY D IH S T R IH B Y UW T IH D
1.6484301090240479,photocopy,F OW T OW K AA P IY,F OW T OW K AA P IY D
1.6473982334136963,resell,R IY S EH L,R IY S OW L D
1.5995030403137207,deregulate,D IY R EH G Y AH L EY T,D IY R EH G Y AH L EY T IH D
1.5985100269317627,email,IY M EY L,IY M EY L D
1.578343152999878,mediate,M IY D IY EY T,M IY D IY EY T IH D
1.5344233512878418,redraft,R IY D R AE F T,R IY D R AE F T IH D
1.481332540512085,amputate,AE M P Y AH T EY T,AE M P Y AH T EY T IH D
1.4730064868927002,reanalyze,R IY AE N AH L AY Z,R IY AE N AH L AY Z D
1.4715535640716553,repurchase,R IY P ER CH AH S,R IY P ER CH AH S T
1.4708116054534912,streamline,S T R IY M L AY N,S T R IY M L AY N D
1.385542631149292,helmet,HH EH L M AH T,HH EH L M AH T IH D
1.3321690559387207,palpitate,P AE L P AH T EY T,P AE L P AH T EY T IH D
1.3228275775909424,recede,R IH S IY D,R AH S IY D IH D
1.3149573802947998,replay,R IY P L EY,R IY P L EY D
1.2807793617248535,unset,AH N S EH T,AH N S EH T
1.2792809009552002,resubmit,R IY S AH B M IH T,R IY S AH B M IH T IH D
1.2288439273834229,decease,D IH S IY S,D IH S IY S T
1.222304344177246,accessorize,AE K S EH S ER AY Z,AE K S EH S ER AY Z D
1.2003321647644043,bicycle,B AY S IH K AH L,B AY S IH K AH L D
1.1931400299072266,market,M AA R K AH T,M AA R K AH T AH D
1.1676113605499268,repel,R IH P EH L,R AH P EH L D
1.159005880355835,relend,R IY L EH N D,R IH L EH N T
1.1252598762512207,desegregate,D IH S EH G R AH G EY T,D IH S EH G R IH G EY T IH D
1.1192946434020996,reclaim,R IY K L EY M,R IY K L EY M D
1.1160950660705566,recap,R IY K AE P,R IY K AE P T
1.0913503170013428,serialize,S IH R IY AH L AY Z,S IH R IY AH L AY Z D
1.0797617435455322,reverse,R IH V ER S,R IH V ER S T
1.0359137058258057,collectivize,K AH L EH K T IH V AY Z,K AH L EH K T IH V AY Z D
1.0263755321502686,rally,R AE L IY,R AE L IY D
1.0077285766601562,relish,R EH L IH SH,R EH L IH SH T
0.9809232354164124,hospitalize,HH AO S P IH T AH L AY Z,HH AA S P IH T AH L AY Z D
0.9491588473320007,rim,R IH M,R IH M D
0.9466343522071838,hopscotch,HH AA P S K AA CH,HH AA P S K AA CH T
0.939391553401947,decorate,D EH K ER EY T,D EH K ER EY T IH D
0.9373812079429626,unbundle,AH N B AH N D AH L,AH N B AH N D AH L D
0.9271965622901917,unsell,AH N S EH L,AH N S OW L D
0.9084370732307434,federate,F EH D ER EY T,F EH D ER EY T IH D
0.8431900143623352,relegate,R EH L AH G EY T,R EH L AH G EY T IH D
0.7826178669929504,decelerate,D IH S EH L ER EY T,D IH S EH L ER EY T IH D
0.7527733445167542,upset,AH P S EH T,AH P S EH T
0.4848800301551819,rock,R AA K,R AA K T
