activation,lemma,present_phones,past_phones
4.270834445953369,splice,S P L AY S,S P L AY S T
4.201691150665283,speak,S P IY K,S P OW K
3.822744369506836,optimize,AA P T AH M AY Z,AA P T AH M AY Z D
3.732762336730957,undervalue,AH N D ER V AE L Y UW,AH N D ER V AE L Y UW D
3.623744010925293,oppose,AH P OW Z,AH P OW Z D
3.6030821800231934,splash,S P L AE SH,S P L AE SH T
3.5748119354248047,applaud,AH P L AO D,AH P L AO D IH D
3.4992642402648926,spring,S P R IH NG,S P R AE NG
3.4613547325134277,splurge,S P L ER JH,S P L ER JH D
3.448331832885742,approve,AH P R UW V,AH P R UW V D
3.4231984615325928,sprint,S P R IH N T,S P R IH N T IH D
3.404515504837036,sprain,S P R EY N,S P R EY N D
3.2534019947052,alternate,AO L T ER N AH T,AO L T ER N EY T IH D
3.2447357177734375,speculate,S P EH K Y AH L EY T,S P EH K Y AH L EY T IH D
3.12089467048645,sprout,S P R AW T,S P R AW T IH D
3.0269601345062256,appease,AH P IY Z,AH P IY Z D
2.9465532302856445,twirl,T W ER L,T W ER L D
2.9329051971435547,split,S P L IH T,S P L IH T
2.8459672927856445,uplift,AH P L IH F T,AH P L IH F T IH D
2.8382325172424316,spook,S P UW K,S P UW K T
2.705397129058838,apply,AH P L AY,AH P L AY D
2.5786304473876953,appraise,AH P R EY Z,AH P R EY Z D
2.5637006759643555,approach,AH P R OW CH,AH P R OW CH T
2.553994655609131,scrounge,S K R AW N JH,S K R AW N JH D
2.55051851272583,proscribe,P R OW S K R AY B,P R OW S K R AY B D
2.48270845413208,idle,AY D AH L,AY D AH L D
2.475719451904297,outshine,AW CH AY N,AW T SH OW N
2.4757022857666016,teeter,T IY T ER,T IY T ER D
2.421273708343506,spike,S P AY K,S P AY K T
2.404688835144043,uplink,AH P L IH NG K,UW P L IH NG K D
2.3989906311035156,apprise,AH P R AY Z,AH P R AY Z D
2.3885622024536133,sneak,S N IY K,S N IY K T
2.3768467903137207,intermingle,IH N T ER M IH NG G AH L,IH N T ER M IH NG G AH L D
2.374347686767578,splinter,S P L IH N T ER,S P L IH N T ER D
2.360311985015869,adore,AH D AO R,AH D AO R D
2.3331427574157715,spread,S P R EH D,S P R EH D
2.3224666118621826,precast,P R IY K AE S T,P R IY K AE S T
2.178420066833496,swerve,S W ER V,S W ER V D
2.0937745571136475,await,AH W EY T,AH W EY T IH D
2.066882371902466,renominate,R IY N AO M IH N EY T,R IY N AA M AH N EY T IH D
2.063948392868042,regiment,R EH JH AH M AH N T,R EH JH AH M EH N T IH D
2.0615792274475098,curry,K AH R IY,K ER IY D
2.0543925762176514,overestimate,OW V ER EH S T AH M EY T,OW V ER EH S T AH M EY T IH D
2.007927179336548,swirl,S W ER L,S W ER L D
1.9860880374908447,prescribe,P R AH S K R AY B,P R IY S K R AY B D
1.972740888595581,spew,S P Y UW,S P Y UW D
1.9632606506347656,awake,AH W EY K,AH W OW K
1.887908697128296,fetter,F EH T ER,F EH T ER D
1.876173496246338,twine,T W AY N,T W AY N D
1.8135709762573242,spell,S P EH L,S P EH L D
1.793818473815918,extract,EH K S T R AE K T,EH K S T R AE K T IH D
1.7792222499847412,forecast,F AO R K AE S T,F AO R K AE S T
1.7750849723815918,upholster,AH P OW L S T ER,AH P OW L S T ER D
1.7565608024597168,offer,AO F ER,AO F ER D
1.728654146194458,flower,F L AW ER,F L AW ER D
1.72597074508667,foreclose,F AO R K L OW Z,F AO R K L OW Z D
1.6899323463439941,stoke,S T OW K,S T OW K T
1.667496919631958,forgive,F ER G IH V,F ER G EY V
1.617530345916748,aggrieve,AH G R IY V,AH G R IY V D
1.5984232425689697,seesaw,S IY S AO,S IY S AO D
1.5768933296203613,miscast,M IH S K AE S T,M IH S K AE S T
1.5731091499328613,addle,AE D AH L,AE D AH L D
1.5541796684265137,unnerve,AH N ER V,AH N N ER V D
1.5038235187530518,disseminate,D IH S EH M AH N EY T,D IH S EH M AH N EY T AH D
1.4777202606201172,opine,OW P AY N,OW P AY N D
1.4703900814056396,update,AH P D EY T,AH P D EY T IH D
1.468832015991211,upgrade,AH P G R EY D,AH P G R EY D IH D
1.4669992923736572,preview,P R IY V Y UW,P R IY V Y UW D
1.4436230659484863,sneeze,S N IY Z,S N IY Z D
1.4312057495117188,append,AH P EH N D,AH P EH N D IH D
1.4281365871429443,etch,EH CH,EH CH T
1.4255249500274658,extricate,EH K S T R AH K EY T,EH K S T R AH K EY T IH D
1.3995072841644287,spruce,S P R UW S,S P R UW S T
1.3890504837036133,forestall,F AO R S T AO L,F AO R S T AA L D
1.3690531253814697,alter,AO L T ER,AO L T ER D
1.3640930652618408,feature,F IY CH ER,F IY CH ER D
1.346888542175293,engine,EH N JH AH N,EH N JH AH N D
1.3132798671722412,overhang,OW V ER HH AE NG,OW V ER HH AH NG
1.3125481605529785,tear,T EH R,T AO R
1.3121309280395508,avail,AH V EY L,AH V EY L D
1.3022665977478027,better,B EH T ER,B EH T ER D
1.3012382984161377,educate,EH JH AH K EY T,EH JH AH K EY T IH D
1.2946453094482422,oppress,AH P R EH S,AH P R EH S T
1.2942183017730713,behave,B IH HH EY V,B IH HH EY V D
1.277374029159546,strive,S T R AY V,S T R OW V
1.2676453590393066,exhume,EH K S HH Y UW M,EH K S HH Y UW M D
1.221764326095581,unwrap,AH N R AE P,AH N R AE P T
1.2020294666290283,spy,S P AY,S P AY D
1.197026252746582,tailor,T EY L ER,T EY L ER D
1.1771736145019531,tweak,T W IY K,T W IY K T
1.1758739948272705,amalgamate,AH M AE L G AH M EY T,AH M AE L G AH M EY T IH D
1.1756768226623535,amaze,AH M EY Z,AH M EY Z D
1.1491103172302246,abate,AH B EY T,AH B EY T IH D
1.1469135284423828,wound,W AW N D,W UW N D IH D
1.1415977478027344,unhinge,AH N HH IH N JH,AH N HH IH N JH D
1.1108362674713135,weld,W EH L D,W EH L D IH D
1.0960614681243896,boomerang,B UW M ER AE NG,B UW M ER AE NG D
1.0892906188964844,upload,AH P L OW D,AH P L OW D IH D
1.074171543121338,spout,S P AW T,S P AW T IH D
1.0494446754455566,stalk,S T AO K,S T AO K T
1.0446772575378418,speed,S P IY D,S P EH D
1.042802333831787,discuss,D IH S K AH S,D IH S K AH S T
1.040764331817627,persuade,P ER S W EY D,P ER S W EY D IH D
1.027296543121338,achieve,AH CH IY V,AH CH IY V D
1.0242087841033936,outlive,AW T L IH V,AW T L IH V D
1.0222976207733154,unsubscribe,AH N S AH B S K R AY B,AH N S AH B S K R AY B D
1.0184414386749268,assess,AH S EH S,AH S EH S T
0.9925147891044617,swarm,S W AO R M,S W AO R M D
0.9907380938529968,program,P R OW G R AE M,P R OW G R AE M D
0.9907380938529968,programme,P R OW G R AE M,P R OW G R AE M D
0.9745005965232849,snee,S N IY,S N IY D
0.9499146342277527,excise,EH K S AY S,EH K S AY Z D
0.9234444499015808,shellac,SH EH L AE K,SH EH L AE K D
0.9060155749320984,allege,AH L EH JH,AH L EH JH D
0.8839041590690613,spoil,S P OY L,S P OY L D
0.8723260760307312,adulterate,AH D AH L T ER EY T,AH D AH L T ER EY T IH D
0.8527930378913879,frown,F R AW N,F R AW N D
0.7702998518943787,allay,AH L EY,AH L EY D
0.749224841594696,second,S EH K AH N D,S EH K AH N D IH D
0.6763870120048523,outcast,AW T K AE S T,AW T K AE S T
0.6652962565422058,fork,F AO R K,F AO R K T
0.5363038182258606,brake,B R EY K,B R EY K T
0.5363038182258606,break,B R EY K,B R OW K
0.4061381220817566,letter,L EH T ER,L EH T ER D
