activation,lemma,present_phones,past_phones
5.141487121582031,bankrupt,B AE NG K R AH P T,B AE NG K R AH P T IH D
5.126397132873535,bank,B AE NG K,B AE NG K T
4.9417405128479,thank,TH AE NG K,TH AE NG K T
4.759074687957764,sink,S IH NG K,S AE NG K
4.426432132720947,bankroll,B AE NG K R OW L,B AE NG K R OW L D
4.3602986335754395,rankle,R AE NG K AH L,R AE NG K AH L D
4.311340808868408,tinkle,T IH NG K AH L,T IH NG K AH L D
4.063187122344971,yank,Y AE NG K,Y AE NG K T
3.816084384918213,dunk,D AH NG K,D AH NG K T
3.6349730491638184,practice,P R AE K T AH S,P R AE K T AH S T
3.6295948028564453,link,L IH NG K,L IH NG K T
3.5948805809020996,tank,T AE NG K,T AE NG K T
3.4726948738098145,function,F AH NG K SH AH N,F AH NG K SH AH N D
3.3209080696105957,synchronize,S IH NG K R AH N AY Z,S IH NG K R AH N AY Z D
3.1986961364746094,cascade,K AE S K EY D,K AE S K EY D IH D
3.1832122802734375,exclaim,IH K S K L EY M,IH K S K L EY M D
3.0662286281585693,wrinkle,R IH NG K AH L,R IH NG K AH L D
2.9773316383361816,inactivate,IH N AE K T IH V EY T,IH N AE K T IH V EY T IH D
2.8424339294433594,deactivate,D IY AE K T IH V EY T,D IY AE K T IH V EY T IH D
2.808685779571533,hang,HH AE NG,HH AH NG
2.7241859436035156,practise,P R AE K T IH S,P R AE K T IH S T
2.685706377029419,reorganize,R IY AO R G AH N AY Z,R IY AO R G AH N AY Z D
2.6005489826202393,bang,B AE NG,B AE NG D
2.5918917655944824,reactivate,R IY AE K T AH V EY T,R IY AE K T AH V EY T IH D
2.57211971282959,preclude,P R IH K L UW D,P R IH K L UW D IH D
2.5711026191711426,excoriate,EH K S K AO R IY EY T,EH K S K AO R IY EY T IH D
2.5010170936584473,sing,S IH NG,S AE NG
2.4856622219085693,erect,IH R EH K T,IH R EH K T AH D
2.457369327545166,vanquish,V AE NG K W IH SH,V AE NG K W IH SH T
2.4067575931549072,exclude,IH K S K L UW D,IH K S K L UW D AH D
2.3801522254943848,syncopate,S IH NG K AH P EY T,S IH NG K AH P EY T IH D
2.369899272918701,inscribe,IH N S K R AY B,IH N S K R AY B D
2.3684065341949463,dissatisfy,D IH S AE T AH S F AY,D IH S AE T AH S F AY D
2.3577520847320557,experience,IH K S P IH R IY AH N S,IH K S P IH R IY AH N S T
2.3535959720611572,crackle,K R AE K AH L,K R AE K AH L D
2.3236143589019775,congregate,K AA NG G R AH G EY T,K AA NG G R IH G EY T IH D
2.3190419673919678,attack,AH T AE K,AH T AE K T
2.2940080165863037,task,T AE S K,T AE S K T
2.258319616317749,ensconce,IH N S K AA N S,IH N S K AA N S T
2.2518362998962402,mask,M AE S K,M AE S K T
2.2241122722625732,sit,S IH T,S AE T
2.2175962924957275,constipate,K AA N S T AH P EY T,K AA N S T AH P EY T AH D
2.1797125339508057,hump,HH AH M P,HH AH M P T
2.17891526222229,box,B AA K S,B AA K S T
2.1134064197540283,champion,CH AE M P IY AH N,CH AE M P IY AH N D
2.1053242683410645,breastfeed,B R EH S T F IY D,B R EH S T F EH D
2.0685553550720215,renominate,R IY N AO M IH N EY T,R IY N AA M AH N EY T IH D
2.0496935844421387,outscore,AW T S K AO R,AW T S K AO R D
1.9793448448181152,democratize,D IH M AA K R AH T AY Z,D IH M AA K R AH T AY Z D
1.9544196128845215,discard,D IH S K AA R D,D IH S K AA R D IH D
1.890625,backfire,B AE K F AY R,B AE K F AY ER D
1.877711296081543,electrocute,IH L EH K T R AH K Y UW T,IH L EH K T R AH K Y UW T IH D
1.838667869567871,misbehave,M IH S B AH HH EY V,M IH S B AH HH EY V D
1.820988655090332,tax,T AE K S,T AE K S T
1.8157048225402832,prong,P R AO NG,P R AO NG D
1.7982163429260254,establish,IH S T AE B L IH SH,IH S T AE B L IH SH T
1.7758660316467285,bark,B AA R K,B AA R K T
1.771547794342041,creak,K R IY K,K R IY K T
1.7489700317382812,filibuster,F IH L AH B AH S T ER,F IH L AH B AH S T ER D
1.747490644454956,wrangle,R AE NG G AH L,R AE NG G AH L D
1.7056536674499512,substantiate,S AH B S T AE N CH IY EY T,S AH B S T AE N SH IY EY T IH D
1.6907367706298828,disassociate,D IH S AH S OW SH IY EY T,D IH S AH S OW SH IY EY T AH D
1.6857142448425293,punctuate,P AH NG K CH UW EY T,P AH NG K CH UW EY T IH D
1.6659393310546875,tinker,T IH NG K ER,T IH NG K ER D
1.6627013683319092,integrate,IH N T AH G R EY T,IH N T AH G R EY T AH D
1.5962231159210205,discount,D IH S K AW N T,D IH S K AW N T IH D
1.5823283195495605,describe,D IH S K R AY B,D IH S K R AY B D
1.5652613639831543,bungle,B AH NG G AH L,B AH NG G AH L D
1.5480895042419434,sock,S AA K,S AA K T
1.536529302597046,freak,F R IY K,F R IY K T
1.5245530605316162,harass,HH ER AE S,HH ER AE S T
1.5240602493286133,junk,JH AH NG K,JH AH NG K T
1.5183115005493164,demobilize,D IH M OW B AH L AY Z,D IH M OW B AH L AY Z D
1.503312110900879,crook,K R UH K,K R UH K AH D
1.4908103942871094,evoke,IH V OW K,IH V OW K T
1.4905266761779785,puncture,P AH NG K CH ER,P AH NG K CH ER D
1.4745523929595947,excuse,IH K S K Y UW S,IH K S K Y UW Z D
1.4710416793823242,trick,T R IH K,T R IH K T
1.4646978378295898,stack,S T AE K,S T AE K T
1.425450325012207,disadvantage,D IH S AH D V AE N T IH JH,D IH S AH D V AE N T IH JH D
1.4105064868927002,conclude,K AH N K L UW D,K AH N K L UW D AH D
1.4092943668365479,discourage,D IH S K ER IH JH,D IH S K ER AH JH D
1.3579635620117188,overhaul,OW V ER HH AO L,OW V ER HH AO L D
1.3313491344451904,snowball,S N OW B AO L,S N OW B AO L D
1.3278288841247559,vaccinate,V AE K S AH N EY T,V AE K S AH N EY T IH D
1.310190200805664,hunker,HH AH NG K ER,HH AH NG K ER D
1.272416114807129,trek,T R EH K,T R EH K T
1.2653751373291016,prick,P R IH K,P R IH K T
1.255971908569336,decertify,D IY S ER T AH F AY,D IY S ER T AH F AY D
1.2522056102752686,beset,B IH S EH T,B IH S EH T
1.2461199760437012,truck,T R AH K,T R AH K T
1.2438769340515137,fuck,F AH K,F AH K T
1.2415790557861328,misspeak,M IH S S P IY K,M IH S S P OW K
1.2070317268371582,intimate,IH N T AH M AH T,IH N T AH M EY T IH D
1.1968657970428467,shoe,SH UW,SH AA D
1.1856989860534668,affect,AH F EH K T,AH F EH K T IH D
1.1216340065002441,microwave,M AY K R AH W EY V,M AY K R OW W EY V D
1.1013834476470947,disclose,D IH S K L OW Z,D IH S K L OW Z D
1.0996336936950684,encroach,IH N K R OW CH,IH N K R OW CH T
1.098386287689209,expunge,IH K S P AH N JH,IH K S P AH N JH D
1.0981860160827637,rename,R IY N EY M,R IY N EY M D
1.0745408535003662,back,B AE K,B AE K T
1.0153474807739258,fay,F EY,F EY D
1.0010242462158203,max,M AE K S,M AE K S T
0.9852829575538635,tangle,T AE NG G AH L,T AE NG G AH L D
0.9668319821357727,assemble,AH S EH M B AH L,AH S EH M B AH L D
0.9378429055213928,sneak,S N IY K,S N IY K T
0.9197543263435364,dam,D AE M,D AE M D
0.9197543263435364,damn,D AE M,D AE M D
0.8836115002632141,misallocate,M IH S AE L AH K EY T,M IH S AE L AH K EY T IH D
0.8812304139137268,piggyback,P IH G IY B AE K,P IH G IY B AE K T
0.8222056031227112,trickle,T R IH K AH L,T R IH K AH L D
0.7978104948997498,enfeeble,EH N F IY B AH L,EH N F IY B AH L D
0.7968669533729553,shade,SH EY D,SH EY D IH D
0.7950978875160217,ax,AE K S,AE K S T
0.7950978875160217,axe,AE K S,AE K S T
0.7331642508506775,tweak,T W IY K,T W IY K T
0.7215366959571838,clam,K L AE M,K L AE M D
0.7043121457099915,cite,S AY T,S AY T AH D
0.7043121457099915,site,S AY T,S AY T IH D
0.7036259770393372,sabotage,S AE B AH T AA ZH,S AE B AH T AA ZH D
0.6770594716072083,vat,V AE T,V AE T IH D
0.6709796786308289,disable,D IH S EY B AH L,D IH S EY B AH L D
0.6264427304267883,duck,D AH K,D AH K T
0.5493553280830383,stoke,S T OW K,S T OW K T
