activation,lemma,present_phones,past_phones
3.0198068618774414,unshackle,AH N SH AE K AH L,AH N SH AE K AH L D
2.6305923461914062,discourage,D IH S K ER IH JH,D IH S K ER AH JH D
2.545316696166992,dishevel,D IH SH EH V AH L,D IH SH EH V AH L D
2.4919919967651367,misspend,M IH S S P EH N D,M IH S S P EH N T
2.482491970062256,excel,IH K S EH L,IH K S EH L D
2.2188644409179688,fissure,F IH SH ER,F IH SH ER D
2.070699691772461,outsell,AW T S EH L,AW T S OW L D
2.0663843154907227,dimension,D IH M EH N SH AH N,D AH M EH N CH AH N D
2.0384297370910645,unsell,AH N S EH L,AH N S OW L D
2.027042865753174,desegregate,D IH S EH G R AH G EY T,D IH S EH G R IH G EY T IH D
1.9928795099258423,simplify,S IH M P L AH F AY,S IH M P L AH F AY D
1.9625567197799683,decelerate,D IH S EH L ER EY T,D IH S EH L ER EY T IH D
1.9444142580032349,exploit,EH K S P L OY T,EH K S P L OY T AH D
1.9117871522903442,outscore,AW T S K AO R,AW T S K AO R D
1.8721727132797241,familiarize,F AH M IH L Y ER AY Z,F AH M IH L Y ER AY Z D
1.8708077669143677,nationalize,N AE SH AH N AH L AY Z,N AE SH AH N AH L AY Z D
1.8471049070358276,personalize,P ER S AH N AH L AY Z,P ER S AH N AH L AY Z D
1.7725740671157837,resell,R IY S EH L,R IY S OW L D
1.743310809135437,displease,D IH S P L IY Z,D IH S P L IY Z D
1.6888288259506226,demobilize,D IH M OW B AH L AY Z,D IH M OW B AH L AY Z D
1.637729525566101,arch,AA R CH,AA R CH T
1.636635184288025,deactivate,D IY AE K T IH V EY T,D IY AE K T IH V EY T IH D
1.628062129020691,synchronize,S IH NG K R AH N AY Z,S IH NG K R AH N AY Z D
1.617578387260437,dish,D IH SH,D IH SH T
1.6120811700820923,inspire,IH N S P AY R,IH N S P AY ER D
1.610211730003357,develop,D IH V EH L AH P,D IH V EH L AH P T
1.5466266870498657,sip,S IH P,S IH P T
1.5385640859603882,worship,W ER SH AH P,W ER SH AH P T
1.5304816961288452,fluctuate,F L AH K CH AH W EY T,F L AH K CH AH W EY T IH D
1.524074912071228,miscalculate,M IH S K AE L K Y AH L EY T,M IH S K AE L K Y AH L EY T IH D
1.5179511308670044,snee,S N IY,S N IY D
1.5047029256820679,disapprove,D IH S AH P R UW V,D IH S AH P R UW V D
1.4896668195724487,pick,P IH K,P IH K T
1.4894171953201294,enmesh,EH N M EH SH,EH N M EH SH T
1.484742522239685,wish,W IH SH,W IH SH T
1.4672693014144897,whistle,W IH S AH L,W IH S AH L D
1.4167176485061646,mesh,M EH SH,M EH SH T
1.3999301195144653,commercialize,K AH M ER SH AH L AY Z,K AH M ER SH AH L AY Z D
1.3751074075698853,demodulate,D IY M AA JH AH L EY T,D IY M AA JH AH L EY T AH D
1.3595322370529175,beset,B IH S EH T,B IH S EH T
1.347234845161438,access,AE K S EH S,AE K S EH S T
1.3326557874679565,remodel,R IY M AA D AH L,R IY M AA D AH L D
1.3262602090835571,belittle,B IH L IH T AH L,B IH L IH T AH L D
1.290948748588562,misallocate,M IH S AE L AH K EY T,M IH S AE L AH K EY T IH D
1.2705010175704956,fetter,F EH T ER,F EH T ER D
1.2494224309921265,gyp,JH IH P,JH IH P T
1.2476240396499634,safeguard,S EY F G AA R D,S EY F G AA R D IH D
1.2263048887252808,reactivate,R IY AE K T AH V EY T,R IY AE K T AH V EY T IH D
1.2107089757919312,disassemble,D IH S AH S EH M B AH L,D IH S AH S EH M B AH L D
1.2106975317001343,democratize,D IH M AA K R AH T AY Z,D IH M AA K R AH T AY Z D
1.2027171850204468,reset,R IY S EH T,R IY S EH T
1.2013386487960815,rationalize,R AE SH AH N AH L AY Z,R AE SH AH N AH L AY Z D
1.1983286142349243,squelch,S K W EH L CH,S K W EH L CH T
1.1757786273956299,whisper,W IH S P ER,W IH S P ER D
1.1727665662765503,diminish,D IH M IH N IH SH,D IH M IH N IH SH T
1.1510695219039917,wash,W AA SH,W AA SH T
1.1315282583236694,necessitate,N AH S EH S AH T EY T,N AH S EH S AH T EY T AH D
1.1023331880569458,arm,AA R M,AA R M D
1.0971498489379883,limp,L IH M P,L IH M P T
1.0851140022277832,demoralize,D IH M AO R AH L AY Z,D IH M AO R AH L AY Z D
1.0819090604782104,bombard,B AA M B AA R D,B AA M B AA R D IH D
1.0787080526351929,demote,D IH M OW T,D IH M OW T IH D
1.0613129138946533,unbalance,AH N B AE L AH N S,AH N B AE L AH N S T
1.0513070821762085,whittle,W IH T AH L,W IH T AH L D
1.0480176210403442,discipline,D IH S AH P L AH N,D IH S AH P L AH N D
1.037575364112854,disclose,D IH S K L OW Z,D IH S K L OW Z D
1.0292813777923584,germinate,JH ER M AH N EY T,JH ER M AH N EY T IH D
1.0066372156143188,option,AA P SH AH N,AA P SH AH N D
0.9948952198028564,outstretch,AW T S T R EH CH,AW T S T R EH CH T
0.9827330112457275,explode,IH K S P L OW D,IH K S P L OW D AH D
0.9651039838790894,outset,AW T S EH T,AW T S EH T
0.9581141471862793,commemorate,K AH M EH M ER EY T,K AH M EH M ER EY T IH D
0.9528590440750122,deteriorate,D IH T IH R IY ER EY T,D IH T IH R IY ER EY T IH D
0.9416251182556152,excerpt,EH K S ER P T,EH K S ER P T IH D
0.9338382482528687,accentuate,AE K S EH N CH UW EY T,AE K S EH N CH UW EY T IH D
0.9300829172134399,demolish,D IH M AA L IH SH,D IH M AA L IH SH T
0.9161200523376465,expire,IH K S P AY R,IH K S P AY R D
0.9127935171127319,disassociate,D IH S AH S OW SH IY EY T,D IH S AH S OW SH IY EY T AH D
0.909860372543335,degenerate,D IH JH EH N ER AH T,D IH JH EH N ER EY T IH D
0.9044950008392334,exasperate,IH G Z AE S P ER EY T,IH G Z AE S P ER EY T IH D
0.9017263650894165,repel,R IH P EH L,R AH P EH L D
0.8951691389083862,whisk,W IH S K,W IH S K T
0.892896294593811,inconvenience,IH N K AH N V IY N Y AH N S,IH N K AH N V IY N Y AH N S T
0.8859666585922241,widdle,W IH D AH L,W IH D AH L D
0.8792327642440796,fetch,F EH CH,F EH CH T
0.8591512441635132,ditch,D IH CH,D IH CH T
0.8454419374465942,foreclose,F AO R K L OW Z,F AO R K L OW Z D
0.8441002368927002,explore,IH K S P L AO R,IH K S P L AO R D
0.8266284465789795,weed,W IY D,W IY D IH D
0.8123294115066528,ensnare,IH N S N EH R,IH N S N EH R D
0.8077411651611328,resettle,R IY S EH T AH L,R IY S EH T AH L D
0.7957950830459595,nature,N EY CH ER,N EY CH ER D
0.7902127504348755,personify,P ER S AA N AH F AY,P ER S AA N AH F AY D
0.770487904548645,excoriate,EH K S K AO R IY EY T,EH K S K AO R IY EY T IH D
0.7541588544845581,factor,F AE K T ER,F AE K T ER D
0.7480552196502686,waver,W EY V ER,W EY V ER D
0.724422812461853,piss,P IH S,P IH S T
0.7239581346511841,encapsulate,EH N K AE P S AH L EY T,EH N K AE P S AH L EY T IH D
0.7224127054214478,monopolize,M AH N AA P AH L AY Z,M AH N AA P AH L AY Z D
0.7047940492630005,notch,N AA CH,N AA CH T
0.704200267791748,nestle,N EH S AH L,N EH S AH L D
0.6969178915023804,misunderstand,M IH S AH N D ER S T AE N D,M IH S AH N D ER S T UH D
0.6952818632125854,encounter,IH N K AW N T ER,IH N K AW N T ER D
0.6902960538864136,denominate,D IH N AA M AH N EY T,D IH N AA M AH N EY T IH D
0.6829103231430054,fluff,F L AH F,F L AH F T
0.6615952253341675,feature,F IY CH ER,F IY CH ER D
0.6552006006240845,weave,W IY V,W OW V
0.6438459157943726,fish,F IH SH,F IH SH T
0.6381798982620239,chip,CH IH P,CH IH P T
0.6359519958496094,deck,D EH K,D EH K T
0.6352124214172363,bobble,B AO B AH L,B AO B AH L D
0.6157653331756592,sprint,S P R IH N T,S P R IH N T IH D
0.6072349548339844,disabuse,D IH S AH B Y UW S,D IH S AH B Y UW Z D
0.5946875810623169,procrastinate,P R AH K R AE S T AH N EY T,P R AH K R AE S T AH N EY T IH D
0.5700670480728149,accelerate,AE K S EH L ER EY T,AE K S EH L ER EY T IH D
0.5652807950973511,seesaw,S IY S AO,S IY S AO D
0.5243872404098511,upset,AH P S EH T,AH P S EH T
0.5137906074523926,sizzle,S IH Z AH L,S IH Z AH L D
0.4913893938064575,nip,N IH P,N IH P T
0.4853311777114868,fester,F EH S T ER,F EH S T ER D
0.4500831365585327,wiggle,W IH G AH L,W IH G AH L D
0.44578826427459717,exhaust,IH G Z AO S T,IH G Z AO S T IH D
0.43093347549438477,disintegrate,D IH S IH N T AH G R EY T,D IH S IH N T AH G R EY T IH D
0.4001586437225342,leash,L IY SH,L IY SH T
0.32777512073516846,whip,W IH P,W IH P T
0.2948085069656372,sling,S L IH NG,S L AH NG
