activation,lemma,present_phones,past_phones
5.051470756530762,incinerate,IH N S IH N ER EY T,IH N S IH N ER EY T IH D
4.7205657958984375,regenerate,R IY JH EH N ER EY T,R IY JH EH N ER EY T IH D
4.298530578613281,vociferate,V AH S IH F ER EY T,V AH S IH F ER EY T IH D
4.292202949523926,exhilarate,IH G Z IH L ER EY T,IH G Z IH L ER EY T IH D
4.197820663452148,cogenerate,K OW JH EH N ER EY T,K OW JH EH N ER EY T IH D
4.00299072265625,exonerate,IH G Z AA N ER EY T,IH G Z AA N ER EY T IH D
3.834667921066284,obliterate,AH B L IH T ER EY T,AH B L IH T ER EY T IH D
3.654475450515747,deliberate,D IH L IH B ER AH T,D IH L IH B ER EY T IH D
3.414393186569214,invigorate,IH N V IH G ER IH T,IH N V IH G ER EY T IH D
3.213026762008667,legislate,L EH JH IH S L EY T,L EH JH AH S L EY T AH D
3.1606104373931885,decelerate,D IH S EH L ER EY T,D IH S EH L ER EY T IH D
3.065154790878296,collaborate,K AH L AE B ER EY T,K AH L AE B ER EY T IH D
2.8869378566741943,recuperate,R IH K UW P ER EY T,R IH K UW P ER EY T IH D
2.768923044204712,accelerate,AE K S EH L ER EY T,AE K S EH L ER EY T IH D
2.640859842300415,redecorate,R IY D EH K ER EY T,R IY D EH K ER EY T IH D
2.4368069171905518,commemorate,K AH M EH M ER EY T,K AH M EH M ER EY T IH D
2.2077372074127197,reciprocate,R IH S IH P R AH K EY T,R IH S IH P R AH K EY T IH D
2.118044137954712,delineate,D IH L IH N IY EY T,D IH L IH N IY EY T IH D
2.1001527309417725,calibrate,K AE L AH B R EY T,K AE L AH B R EY T AH D
2.075085401535034,enunciate,IH N AH N S IY EY T,IH N AH N S IY EY T IH D
2.052180528640747,degenerate,D IH JH EH N ER AH T,D IH JH EH N ER EY T IH D
1.9906108379364014,reinstate,R IY IH N S T EY T,R IY IH N S T EY T IH D
1.9130363464355469,regionalize,R IY JH AH N AH L AY Z,R IY JH AH N AH L AY Z D
1.8622374534606934,exaggerate,IH G Z AE JH ER EY T,IH G Z AE JH ER EY T AH D
1.7993910312652588,legitimize,L AH JH IH T AH M AY Z,L IH JH IH T AH M AY Z D
1.7825400829315186,reverberate,R IH V ER B ER AH T,R IH V ER B ER EY T IH D
1.7501447200775146,execute,EH K S AH K Y UW T,EH K S AH K Y UW T IH D
1.6377313137054443,retaliate,R IH T AE L IY EY T,R IH T AE L IY EY T IH D
1.6187193393707275,collateralize,K AH L AE T ER AH L AY Z,K AH L AE T ER AH L AY Z D
1.6015198230743408,reinstitute,R IY IH N S T IH T UW T,R IY IH N S T IH T UW T IH D
1.5456113815307617,renegotiate,R IY N IH G OW SH IY EY T,R IY N IH G OW SH IY EY T IH D
1.5383427143096924,bolster,B OW L S T ER,B OW L S T ER D
1.5168476104736328,filibuster,F IH L AH B AH S T ER,F IH L AH B AH S T ER D
1.5125977993011475,transect,T R AE N S EH K T,T R AE N S EH K T IH D
1.4598791599273682,exacerbate,IH G Z AE S ER B EY T,IH G Z AE S ER B EY T AH D
1.4295661449432373,mature,M AH CH UH R,M AH T Y UH R D
1.4240221977233887,outdistance,AW T D IH S T AH N S,AW T D IH S T AH N S T
1.3927147388458252,dissuade,D IH S W EY D,D IH S W EY D IH D
1.3774473667144775,demolish,D IH M AA L IH SH,D IH M AA L IH SH T
1.319277286529541,diminish,D IH M IH N IH SH,D IH M IH N IH SH T
1.2900086641311646,insinuate,IH N S IH N Y UW EY T,IH N S IH N Y UW EY T IH D
1.2444837093353271,resend,R IH Z EH N D,R IH Z EH N T
1.239182710647583,disengage,D IH S IH N G EY JH,D IH S IH N G EY JH D
1.2279653549194336,capitulate,K AH P IH CH UW L IH T,K AH P IH CH AH L EY T IH D
1.2206997871398926,revalue,R IY V AE L Y UW,R IY V AE L Y UW D
1.2184958457946777,deregulate,D IY R EH G Y AH L EY T,D IY R EH G Y AH L EY T IH D
1.2134629487991333,inlet,IH N L EH T,IH N L EH T
1.1695994138717651,negotiate,N AH G OW SH IY EY T,N AH G OW SH IY EY T AH D
1.1521456241607666,disassociate,D IH S AH S OW SH IY EY T,D IH S AH S OW SH IY EY T AH D
1.1509616374969482,familiarize,F AH M IH L Y ER AY Z,F AH M IH L Y ER AY Z D
1.132462501525879,misuse,M IH S Y UW Z,M IH S Y UW Z D
1.122152328491211,malnourish,M AE L N ER IH SH,M AE L N ER IH SH T
1.112743616104126,require,R IY K W AY ER,R IY K W AY ER D
1.1102702617645264,beseech,B IY S IY CH,B IY S IY CH T
1.0796842575073242,rationalize,R AE SH AH N AH L AY Z,R AE SH AH N AH L AY Z D
1.0795276165008545,inaugurate,IH N AO G Y ER IH T,IH N AO G ER EY T IH D
1.077315330505371,blister,B L IH S T ER,B L IH S T ER D
1.0751636028289795,abbreviate,AH B R IY V IY EY T,AH B R IY V IY EY T IH D
1.0664910078048706,refinish,R IY F IH N IH SH,R IY F IH N IH SH T
1.0469329357147217,exploit,EH K S P L OY T,EH K S P L OY T AH D
1.0325970649719238,infatuate,IH N F AE CH UW EY T,IH N F AE CH UW EY T IH D
0.9958248138427734,collapse,K AH L AE P S,K AH L AE P S T
0.9943642616271973,miscalculate,M IH S K AE L K Y AH L EY T,M IH S K AE L K Y AH L EY T IH D
0.9869840145111084,mischaracterize,M IH S K AE R AH K T ER AY Z,M IH S K AE R AH K T ER AY Z D
0.9398497343063354,desegregate,D IH S EH G R AH G EY T,D IH S EH G R IH G EY T IH D
0.9388059377670288,hedge,HH EH JH,HH EH JH D
0.9382957220077515,collectivize,K AH L EH K T IH V AY Z,K AH L EH K T IH V AY Z D
0.9336353540420532,resubmit,R IY S AH B M IH T,R IY S AH B M IH T IH D
0.9327635765075684,disinvite,D IH S IH N V AY T,D IH S IH N V AY T IH D
0.9027464389801025,integrate,IH N T AH G R EY T,IH N T AH G R EY T AH D
0.8854724168777466,remit,R IY M IH T,R IY M IH T IH D
0.8446832895278931,broadside,B R AO D S AY D,B R AO D S AY D IH D
0.7980988025665283,register,R EH JH IH S T ER,R EH JH IH S T ER D
0.7950723171234131,prepackage,P R IY P AE K AH JH,P R IY P AE K AH JH D
0.7776143550872803,rumple,R AH M P AH L,R AH M P AH L D
0.6156578063964844,attribute,AE T R AH B Y UW T,AH T R IH B Y AH T IH D
0.6101633310317993,syncopate,S IH NG K AH P EY T,S IH NG K AH P EY T IH D
0.592922568321228,facilitate,F AH S IH L AH T EY T,F AH S IH L AH T EY T IH D
0.5455322265625,denature,D IH N EY CH ER,D IH N EY CH ER D
0.5398861169815063,auction,AA K SH AH N,AO K SH AH N D
0.531369686126709,resell,R IY S EH L,R IY S OW L D
0.49517273902893066,cluster,K L AH S T ER,K L AH S T ER D
0.47189009189605713,disintegrate,D IH S IH N T AH G R EY T,D IH S IH N T AH G R EY T IH D
0.45093750953674316,stroll,S T R OW L,S T R OW L D
0.4344370365142822,massacre,M AE S AH K ER,M AE S AH K ER D
0.42995405197143555,catalog,K AE T AH L AO G,K AE T AH L AO G D
0.42995405197143555,catalogue,K AE T AH L AO G,K AE T AH L AO G D
0.3762354850769043,reach,R IY CH,R IY CH T
0.37106943130493164,reset,R IY S EH T,R IY S EH T
0.23100149631500244,inset,IH N S EH T,IH N S EH T
