activation,lemma,present_phones,past_phones
4.260861396789551,fold,F OW L D,F OW L D AH D
3.343508243560791,phone,F OW N,F OW N D
3.223194122314453,fund,F AH N D,F AH N D AH D
3.1806416511535645,flood,F L AH D,F L AH D AH D
3.085632801055908,fend,F EH N D,F EH N D IH D
3.0152876377105713,field,F IY L D,F IY L D IH D
2.9105968475341797,fine,F AY N,F AY N D
2.651801347732544,faint,F EY N T,F EY N T IH D
2.5571129322052,oversupply,OW V ER S AH P L AY,OW V ER S AH P L AY D
2.5151000022888184,bloody,B L AH D IY,B L AH D IY D
2.509244441986084,flourish,F L ER IH SH,F L ER IH SH T
2.470057964324951,firm,F ER M,F ER M D
2.466413974761963,shoulder,SH OW L D ER,SH OW L D ER D
2.409734010696411,flirt,F L ER T,F L ER T IH D
2.352956771850586,file,F AY L,F AY L D
2.34536075592041,fuss,F AH S,F AH S T
2.341372013092041,flinch,F L IH N CH,F L IH N CH T
2.3196699619293213,feast,F IY S T,F IY S T IH D
2.2934329509735107,fire,F AY ER,F AY ER D
2.215975046157837,flout,F L AW T,F L AW T IH D
2.212921380996704,founder,F AW N D ER,F AW N D ER D
2.1116700172424316,face,F EY S,F EY S T
2.046804666519165,foil,F OY L,F OY L D
2.032949924468994,foist,F OY S T,F OY S T IH D
1.9090862274169922,fan,F AE N,F AE N D
1.8660893440246582,fist,F IH S T,F IH S T IH D
1.8413541316986084,fritter,F R IH T ER,F R IH T ER D
1.833439826965332,eliminate,IH L IH M AH N EY T,IH L IH M AH N EY T IH D
1.8132598400115967,fool,F UW L,F UW L D
1.807607650756836,fuck,F AH K,F AH K T
1.7990338802337646,feel,F IY L,F EH L T
1.7931735515594482,weld,W EH L D,W EH L D IH D
1.7758593559265137,telecast,T EH L AH K AE S T,T EH L AH K AE S T
1.7660064697265625,flabbergast,F L AE B ER G AE S T,F L AE B ER G AE S T IH D
1.7521915435791016,bundle,B AH N D AH L,B AH N D AH L D
1.7315711975097656,function,F AH NG K SH AH N,F AH NG K SH AH N D
1.7209882736206055,furbish,F ER B IH SH,F ER B IH SH T
1.6958320140838623,finish,F IH N IH SH,F IH N IH SH T
1.693000078201294,steady,S T EH D IY,S T EH D IY D
1.6802852153778076,fence,F EH N S,F EH N S T
1.6598358154296875,shelter,SH EH L T ER,SH EH L T ER D
1.649104118347168,fast,F AE S T,F AE S T IH D
1.619582176208496,finesse,F IH N EH S,F IH N EH S T
1.6137983798980713,foul,F AW L,F AW L D
1.5864229202270508,bypass,B AY P AE S,B AY P AE S T
1.5760908126831055,shield,SH IY L D,SH IY L D IH D
1.5414643287658691,fame,F EY M,F EY M D
1.5371286869049072,study,S T AH D IY,S T AH D IY D
1.5258991718292236,fill,F IH L,F IH L D
1.4892477989196777,feud,F Y UW D,F Y UW D IH D
1.4672470092773438,faze,F EY Z,F EY Z D
1.4672470092773438,phase,F EY Z,F EY Z D
1.4512276649475098,fess,F EH S,F EH S T
1.4255218505859375,guard,G AA R D,G AA R D AH D
1.423203706741333,furnish,F ER N IH SH,F ER N IH SH T
1.4226865768432617,browbeat,B R AW B IY T,B R AW B IY T
1.4224944114685059,elucidate,IH L UW S AH D EY T,IH L UW S AH D EY T AH D
1.3801846504211426,ferret,F EH R AH T,F EH R AH T AH D
1.3749284744262695,fail,F EY L,F EY L D
1.3749284744262695,faile,F EY L,F EY L D
1.3711397647857666,fumble,F AH M B AH L,F AH M B AH L D
1.3478715419769287,hoard,HH AO R D,HH AO R D IH D
1.3368451595306396,glisten,G L IH S AH N,G L IH S AH N D
1.3273754119873047,suffice,S AH F AY S,S AH F AY S T
1.326350450515747,twist,T W IH S T,T W IH S T IH D
1.3182260990142822,fluff,F L AH F,F L AH F T
1.2960402965545654,filibuster,F IH L AH B AH S T ER,F IH L AH B AH S T ER D
1.2805607318878174,throat,TH R OW T,TH R OW T IH D
1.276010513305664,deprecate,D EH P R AH K EY T,D EH P R AH K EY T AH D
1.2664334774017334,highlight,HH AY L AY T,HH AY L AY T IH D
1.261763095855713,fondle,F AO N D AH L,F AO N D AH L D
1.2364795207977295,fillet,F AH L EY,F IH L AH T IH D
1.2139801979064941,snicker,S N IH K ER,S N IH K ER D
1.1999289989471436,evidence,EH V AH D AH N S,EH V IH D AH N S T
1.1997480392456055,purify,P Y UH R AH F AY,P Y UH R AH F AY D
1.19248366355896,flicker,F L IH K ER,F L IH K ER D
1.1916496753692627,overrun,OW V ER R AH N,OW V ER R AE N
1.1871328353881836,filter,F IH L T ER,F IH L T ER D
1.1855616569519043,fangle,F AE NG G AH L,F AE NG G AH L D
1.1831285953521729,beam,B IY M,B IY M D
1.1830165386199951,market,M AA R K AH T,M AA R K AH T AH D
1.1599652767181396,fake,F EY K,F EY K T
1.1543607711791992,fell,F EH L,F EH L D
1.151932954788208,thank,TH AE NG K,TH AE NG K T
1.1271326541900635,spatter,S P AE T ER,S P AE T ER D
1.1092021465301514,yell,Y EH L,Y EH L D
1.1025996208190918,ensure,EH N SH UH R,EH N SH UH R D
1.0799126625061035,hamper,HH AE M P ER,HH AE M P ER D
1.075310468673706,follow,F AA L OW,F AA L OW D
1.022068738937378,fee,F IY,F IY D
1.0149250030517578,demur,D IH M ER,D IH M ER D
1.0135257244110107,forbid,F ER B IH D,F ER B IH D
1.0067698955535889,fester,F EH S T ER,F EH S T ER D
1.0047798156738281,stud,S T AH D,S T AH D IH D
1.0046958923339844,instigate,IH N S T AH G EY T,IH N S T AH G EY T IH D
0.9860301613807678,fish,F IH SH,F IH SH T
0.976328432559967,beguile,B IH G AY L,B IH G AY L D
0.9711757302284241,flex,F L EH K S,F L EH K S T
0.963092029094696,parse,P AA R S,P AA R S T
0.9391956925392151,yield,Y IY L D,Y IY L D IH D
0.932364284992218,juggle,JH AH G AH L,JH AH G AH L D
0.9269781708717346,attribute,AE T R AH B Y UW T,AH T R IH B Y AH T IH D
0.9169033169746399,illustrate,IH L AH S T R EY T,IH L AH S T R EY T AH D
0.9102144837379456,wind,W AY N D,W IH N D IH D
0.9018339514732361,flush,F L AH SH,F L AH SH T
0.8885181546211243,fret,F R EH T,F R EH T IH D
0.8809826970100403,burble,B ER B AH L,B ER B AH L D
0.8800707459449768,hood,HH UH D,HH UH D IH D
0.8775015473365784,ward,W AO R D,W AO R D IH D
0.8751450181007385,fudge,F AH JH,F AH JH D
0.8396115899085999,flatter,F L AE T ER,F L AE T ER D
0.8177819848060608,dilute,D AY L UW T,D AY L UW T AH D
0.7930198311805725,sneer,S N IH R,S N IH R D
0.7880989909172058,foment,F OW M EH N T,F OW M EH N T IH D
0.7711732983589172,blotch,B L AA T CH,B L AA T CH T
0.770682156085968,admire,AE D M AY R,AH D M AY ER D
0.7645938992500305,flannel,F L AE N AH L,F L AE N AH L D
0.7627443671226501,saint,S EY N T,S EY N T IH D
0.7539547085762024,wheel,W IY L,W IY L D
0.7531861662864685,fissure,F IH SH ER,F IH SH ER D
0.7304404377937317,cell,S EH L,S EH L D
0.7304404377937317,sell,S EH L,S OW L D
0.7289121747016907,trend,T R EH N D,T R EH N D IH D
0.7263858914375305,pipe,P AY P,P AY P T
0.7014830708503723,burst,B ER S T,B ER S T
0.7007351517677307,overdo,OW V ER D UW,OW V ER D IH D
0.6952504515647888,humble,HH AH M B AH L,HH AH M B AH L D
0.6872820258140564,seal,S IY L,S IY L D
0.6658065915107727,tell,T EH L,T OW L D
0.6313496232032776,pile,P AY L,P AY L D
0.6121343970298767,hackney,HH AE K N IY,HH AE K N IY D
0.5877013802528381,poll,P OW L,P OW L D
0.5450816750526428,fare,F EH R,F EH R D
0.5309626460075378,celebrate,S EH L AH B R EY T,S EH L AH B R EY T IH D
0.5285391211509705,tee,T IY,T IY D
0.5276433825492859,paste,P EY S T,P EY S T IH D
0.526786744594574,fault,F AO L T,F AO L T IH D
0.4607852101325989,lie,L AY,L EY
0.46018344163894653,pilot,P AY L AH T,P AY L AH T IH D
0.4488152861595154,prattle,P R AE T AH L,P R AE T AH L D
0.43511074781417847,dun,D AH N,D AH N D
0.31455910205841064,poke,P OW K,P OW K T
