activation,lemma,present_phones,past_phones
2.6401777267456055,convoke,K AA N V OW K,K AA N V OW K T
2.613957643508911,modernize,M AA D ER N AY Z,M AA D ER N AY Z D
2.514784097671509,conscript,K AA N S K R IH P T,K AH N S K R IH P T IH D
2.4385643005371094,colonize,K AA L AH N AY Z,K AA L AH N AY Z D
2.2846076488494873,concentrate,K AA N S AH N T R EY T,K AA N S AH N T R EY T IH D
2.263690233230591,pontificate,P AA N T IH F AH K EY T,P AA N T IH F AH K EY T IH D
2.2550747394561768,convert,K AA N V ER T,K AH N V ER T IH D
2.231471300125122,convolute,K AA N V AH L UW T,K AA N V AH L UW T AH D
2.2232444286346436,jostle,JH AA S AH L,JH AA S AH L D
2.220567464828491,console,K AA N S OW L,K AH N S OW L D
2.2068257331848145,wad,W AA D,W AA D IH D
2.2062370777130127,hop,HH AA P,HH AA P T
2.2056519985198975,jot,JH AA T,JH AA T IH D
2.2041993141174316,mop,M AA P,M AA P T
2.204115629196167,con,K AA N,K AA N D
2.204115629196167,conn,K AA N,K AA N D
2.2040040493011475,rock,R AA K,R AA K T
2.201876401901245,mock,M AA K,M AA K T
2.197514533996582,jog,JH AA G,JH AA G D
2.1920006275177,comment,K AA M EH N T,K AA M EH N T AH D
2.1854679584503174,pot,P AA T,P AA T IH D
2.1843814849853516,don,D AA N,D AA N D
2.1792190074920654,dock,D AA K,D AA K T
2.1732776165008545,sock,S AA K,S AA K T
2.172283172607422,cock,K AA K,K AA K T
2.1715426445007324,notch,N AA CH,N AA CH T
2.170025110244751,rob,R AA B,R AA B D
2.167177677154541,cop,K AA P,K AA P T
2.1664178371429443,cause,K AA Z,K AA Z D
2.162731170654297,mob,M AA B,M AA B D
2.1626861095428467,pock,P AA K,P AA K T
2.1619246006011963,nod,N AA D,N AA D AH D
2.160919427871704,box,B AA K S,B AA K S T
2.1608707904815674,holler,HH AA L ER,HH AA L ER D
2.1584692001342773,posit,P AA Z AH T,P AA Z AH T IH D
2.1570098400115967,dot,D AA T,D AA T AH D
2.152705669403076,cockey,K AA K IY,K AA K AY D
2.1508915424346924,bond,B AA N D,B AA N D AH D
2.1493685245513916,cost,K AA S T,K AA S T
2.1406455039978027,collar,K AA L ER,K AA L ER D
2.13942551612854,pop,P AA P,P AA P T
2.1371877193450928,cough,K AA F,K AO F T
2.1367437839508057,boggle,B AA G AH L,B AA G AH L D
2.134965181350708,consecrate,K AA N S AH K R EY T,K AA N S AH K R EY T IH D
2.127626895904541,chop,CH AA P,CH AA P T
2.1216611862182617,knot,N AA T,N AA T IH D
2.121011257171631,volunteer,V AA L AH N T IH R,V AA L AH N T IH R D
2.1154205799102783,pollinate,P AA L AH N EY T,P AA L IH N EY T IH D
2.1070470809936523,bog,B AA G,B AA G D
2.1049749851226807,hobble,HH AA B AH L,HH AA B AH L D
2.1045005321502686,pocket,P AA K AH T,P AA K AH T IH D
2.1023411750793457,rot,R AA T,R AA T IH D
2.1020662784576416,copy,K AA P IY,K AA P IY D
2.1006014347076416,hollow,HH AA L OW,HH AA L OW D
2.0979554653167725,top,T AA P,T AA P T
2.096494674682617,sob,S AA B,S AA B D
2.094890594482422,shop,SH AA P,SH AA P T
2.094214916229248,gobble,G AA B AH L,G AA B AH L D
2.093956232070923,dogear,D AA G IY R,D AA G IY R D
2.0926382541656494,boss,B AA S,B AA S T
2.090393304824829,cobble,K AA B AH L,K AA B AH L D
2.090049982070923,lop,L AA P,L AA P T
2.086840867996216,lock,L AA K,L AA K T
2.0744025707244873,converse,K AA N V ER S,K AH N V ER S T
2.0676286220550537,waffle,W AA F AH L,W AA F AH L D
2.063138723373413,wash,W AA SH,W AA SH T
2.061485528945923,wallow,W AA L OW,W AA L OW D
2.060898542404175,shock,SH AA K,SH AA K T
2.0568859577178955,polish,P AA L IH SH,P AA L IH SH T
2.054926633834839,father,F AA DH ER,F AA DH ER D
2.053629159927368,lodge,L AA JH,L AA JH D
2.051746129989624,dodge,D AA JH,D AA JH D
2.048841714859009,solve,S AA L V,S AA L V D
2.047201633453369,rocket,R AA K AH T,R AA K AH T IH D
2.0399954319000244,mollify,M AA L AH F AY,M AA L AH F AY D
2.032273054122925,doctor,D AA K T ER,D AA K T ER D
2.0305051803588867,coddle,K AA D AH L,K AA D AH L D
2.023585557937622,botch,B AA CH,B AA CH T
2.0168275833129883,contract,K AA N T R AE K T,K AA N T R AE K T AH D
2.016476631164551,dominate,D AA M AH N EY T,D AA M AH N EY T AH D
2.0161776542663574,wobble,W AA B AH L,W AA B AH L D
2.009876012802124,bottle,B AA T AH L,B AA T AH L D
2.00456166267395,consummate,K AA N S AH M AH T,K AA N S AH M EY T AH D
1.9948476552963257,lob,L AA B,L AA B D
1.9944902658462524,conjure,K AA N JH ER,K AA N JH ER D
1.9810980558395386,contour,K AA N T UH R,K AA N T UH R D
1.9804729223251343,watch,W AA CH,W AA CH T
1.9737266302108765,wattle,W AA T AH L,W AA T AH L D
1.9729303121566772,tolerate,T AA L ER EY T,T AA L ER EY T IH D
1.9728525876998901,toggle,T AA G AH L,T AA G AH L D
1.9478033781051636,moderate,M AA D ER AH T,M AA D ER EY T IH D
1.9410136938095093,lobby,L AA B IY,L AA B IY D
1.9386042356491089,modify,M AA D AH F AY,M AA D AH F AY D
1.937926173210144,topple,T AA P AH L,T AA P AH L D
1.9377645254135132,compound,K AA M P AW N D,K AH M P AW N D AH D
1.9287971258163452,conjugate,K AA N JH AH G EY T,K AA N JH AH G EY T IH D
1.9186052083969116,ponder,P AA N D ER,P AA N D ER D
1.8909424543380737,bomb,B AA M,B AA M D
1.8876127004623413,convict,K AA N V IH K T,K AH N V IH K T AH D
1.8809810876846313,hotwire,HH AA T W AY ER,HH AA T W AY ER D
1.8612061738967896,confound,K AA N F AW N D,K AH N F AW N D IH D
1.8585065603256226,body,B AA D IY,B AA D IY D
1.8568059206008911,fossilize,F AA S AH L AY Z,F AA S AH L AY Z D
1.8491910696029663,longe,L AA N JH,L AO NG D
1.8419488668441772,constitute,K AA N S T AH T UW T,K AA N S T AH T UW T AH D
1.8354641199111938,waft,W AA F T,W AA F T IH D
1.8039417266845703,foster,F AA S T ER,F AA S T ER D
1.719523549079895,follow,F AA L OW,F AA L OW D
1.6780765056610107,constipate,K AA N S T AH P EY T,K AA N S T AH P EY T AH D
1.6761810779571533,costume,K AA S T UW M,K AO S T UW M D
1.6514679193496704,nominate,N AA M AH N AH T,N AA M AH N EY T AH D
1.630219578742981,monitor,M AA N AH T ER,M AA N AH T ER D
1.6266024112701416,combine,K AA M B AY N,K AH M B AY N D
1.535399079322815,compensate,K AA M P AH N S EY T,K AA M P AH N S EY T AH D
1.5291215181350708,hopscotch,HH AA P S K AA CH,HH AA P S K AA CH T
1.4937279224395752,complicate,K AA M P L AH K EY T,K AA M P L AH K EY T AH D
1.3710291385650635,confiscate,K AA N F AH S K EY T,K AA N F AH S K EY T AH D
1.3567091226577759,contemplate,K AA N T AH M P L EY T,K AA N T AH M P L EY T IH D
