activation,lemma,present_phones,past_phones
6.049275875091553,decontrol,D IY K AH N T R OW L,D IY K AH N T R OW L D
3.8440821170806885,decentralize,D IH S EH N T R AH L AY Z,D IH S EH N T R AH L AY Z D
2.767277717590332,orchestrate,AO R K IH S T R EY T,AO R K IH S T R EY T IH D
2.5992918014526367,decontaminate,D IY K AH N T AE M AH N EY T,D IY K AH N T AE M AH N EY T IH D
2.100576400756836,recalculate,R IY K AE L K Y AH L EY T,R IY K AE L K Y AH L EY T IH D
1.4554535150527954,reconfigure,R IY K AH N F IH G Y ER,R IY K AH N F IH G Y ER D
