activation,lemma,present_phones,past_phones
2.8663856983184814,editorialize,EH D AH T AO R IY AH L AY Z,EH D AH T AO R IY AH L AY Z D
2.6390531063079834,able,EY B AH L,EY B AH L D
2.49686598777771,grumble,G R AH M B AH L,G R AH M B AH L D
2.4323394298553467,allocate,AE L AH K EY T,AE L AH K EY T IH D
2.397369146347046,preserve,P R AH Z ER V,P R AH Z ER V D
2.389155626296997,trumpet,T R AH M P AH T,T R AH M P AH T IH D
2.354182481765747,unaffiliate,AH N AH F IH L IY EY T,AH N AH F IH L IY EY T IH D
2.3191416263580322,pioneer,P AY AH N IH R,P AY AH N IH R D
2.3106305599212646,open,OW P AH N,OW P AH N D
2.3054158687591553,trudge,T R AH JH,T R AH JH D
2.292062520980835,produce,P R AH D UW S,P R AH D UW S T
2.2904489040374756,prefer,P R AH F ER,P R AH F ER D
2.2676377296447754,provoke,P R AH V OW K,P R AH V OW K T
2.2652368545532227,crumble,K R AH M B AH L,K R AH M B AH L D
2.2417309284210205,pluck,P L AH K,P L AH K T
2.216352701187134,drub,D R AH B,D R AH B D
2.2091822624206543,crush,K R AH SH,K R AH SH T
2.2048826217651367,promote,P R AH M OW T,P R AH M OW T IH D
2.1920688152313232,profess,P R AH F EH S,P R AH F EH S T
2.187833547592163,ogle,OW G AH L,OW G AH L D
2.1874916553497314,grunt,G R AH N T,G R AH N T IH D
2.1814427375793457,stucco,S T AH K OW,S T AH K OW D
2.1745822429656982,stun,S T AH N,S T AH N D
2.1574814319610596,bluff,B L AH F,B L AH F T
2.153193950653076,accompany,AH K AH M P AH N IY,AH K AH M P AH N IY D
2.1447839736938477,propel,P R AH P EH L,P R AH P EH L D
2.143737554550171,plunk,P L AH NG K,P L AH NG K T
2.143216371536255,reassume,R IY AH S UW M,R IY AH S UW M D
2.1415858268737793,inundate,IH N AH N D EY T,IH N AH N D EY T IH D
2.1402885913848877,propose,P R AH P OW Z,P R AH P OW Z D
2.1326406002044678,truncate,T R AH NG K EY T,T R AH NG K EY T IH D
2.132228136062622,blunt,B L AH N T,B L AH N T AH D
2.12953519821167,stud,S T AH D,S T AH D IH D
2.1245837211608887,glut,G L AH T,G L AH T IH D
2.1225178241729736,plunge,P L AH N JH,P L AH N JH D
2.1163582801818848,provide,P R AH V AY D,P R AH V AY D IH D
2.1116533279418945,truck,T R AH K,T R AH K T
2.11023211479187,crunch,K R AH N CH,K R AH N CH T
2.1034908294677734,drum,D R AH M,D R AH M D
2.0979998111724854,plumb,P L AH M,P L AH M D
2.0939934253692627,duel,D UW AH L,D UW AH L D
2.090376615524292,glove,G L AH V,G L AH V D
2.0887296199798584,scuff,S K AH F,S K AH F T
2.085691213607788,slug,S L AH G,S L AH G D
2.0808656215667725,trump,T R AH M P,T R AH M P T
2.0806896686553955,blush,B L AH SH,B L AH SH T
2.061894178390503,stunt,S T AH N T,S T AH N T IH D
2.0614240169525146,stub,S T AH B,S T AH B D
2.053699254989624,plug,P L AH G,P L AH G D
2.049567937850952,blunder,B L AH N D ER,B L AH N D ER D
2.0485575199127197,bludgeon,B L AH JH AH N,B L AH JH AH N D
2.0475826263427734,addle,AE D AH L,AE D AH L D
2.0456228256225586,thrust,TH R AH S T,TH R AH S T
2.0454659461975098,abut,AH B AH T,AH B AH T IH D
2.0415735244750977,adjudge,AH JH AH JH,AH JH AH JH D
2.0362792015075684,elevate,EH L AH V EY T,EH L AH V EY T IH D
2.035191059112549,slump,S L AH M P,S L AH M P T
2.0296499729156494,club,K L AH B,K L AH B D
2.0235164165496826,irrigate,IH R AH G EY T,IH R AH G EY T IH D
2.018470287322998,plump,P L AH M P,P L AH M P T
2.01841402053833,accustom,AH K AH S T AH M,AH K AH S T AH M D
2.0145719051361084,snub,S N AH B,S N AH B D
2.013129472732544,fluff,F L AH F,F L AH F T
2.000333547592163,deify,D IY AH F AY,D IY AH F AY D
1.9920532703399658,voyage,V OY AH JH,V OY AH JH D
1.9886724948883057,trouble,T R AH B AH L,T R AH B AH L D
1.986267328262329,ossify,AA S AH F AY,AA S AH F AY D
1.983473539352417,study,S T AH D IY,S T AH D IY D
1.9820959568023682,flush,F L AH SH,F L AH SH T
1.9807300567626953,automate,AO T AH M EY T,AO T AH M EY T IH D
1.9795095920562744,urbanize,ER B AH N AY Z,ER B AH N AY Z D
1.9766900539398193,readmit,R IY AH D M IH T,R IY AH D M IH T IH D
1.9718396663665771,edit,EH D AH T,EH D AH T AH D
1.97090744972229,shrug,SH R AH G,SH R AH G D
1.965052843093872,plummet,P L AH M AH T,P L AH M AH T IH D
1.9643213748931885,stump,S T AH M P,S T AH M P T
1.9637720584869385,flood,F L AH D,F L AH D AH D
1.9636058807373047,scuffle,S K AH F AH L,S K AH F AH L D
1.9610435962677002,bloody,B L AH D IY,B L AH D IY D
1.9561142921447754,emanate,EH M AH N EY T,EH M AH N EY T IH D
1.9526817798614502,agitate,AE JH AH T EY T,AE JH AH T EY T IH D
1.941389799118042,oscillate,AA S AH L EY T,AA S AH L EY T AH D
1.9411697387695312,sculpture,S K AH L P CH ER,S K AH L P CH ER D
1.9377481937408447,adulterate,AH D AH L T ER EY T,AH D AH L T ER EY T IH D
1.9357619285583496,enunciate,IH N AH N S IY EY T,IH N AH N S IY EY T IH D
1.929504156112671,stumble,S T AH M B AH L,S T AH M B AH L D
1.9264686107635498,crumple,K R AH M P AH L,K R AH M P AH L D
1.9216206073760986,clutch,K L AH CH,K L AH CH T
1.9196288585662842,brush,B R AH SH,B R AH SH T
1.918010950088501,itemize,AY T AH M AY Z,AY T AH M AY Z D
1.9159915447235107,dial,D AY AH L,D AY AH L D
1.914391279220581,cluster,K L AH S T ER,K L AH S T ER D
1.913766622543335,lionize,L AY AH N AY Z,L AY AH N AY Z D
1.9111435413360596,smudge,S M AH JH,S M AH JH D
1.905578374862671,innovate,IH N AH V EY T,IH N AH V EY T IH D
1.9027526378631592,agonize,AE G AH N AY Z,AE G AH N AY Z D
1.8989324569702148,scuttle,S K AH T AH L,S K AH T AH L D
1.8987741470336914,drug,D R AH G,D R AH G D
1.8976147174835205,analyze,AE N AH L AY Z,AE N AH L AY Z D
1.8916711807250977,realise,R IY AH L AY Z,R IY AH L AY Z D
1.8916711807250977,realize,R IY AH L AY Z,R IY AH L AY Z D
1.8875372409820557,imitate,IH M AH T EY T,IH M AH T EY T IH D
1.8786084651947021,smother,S M AH DH ER,S M AH DH ER D
1.8742802143096924,critique,K R AH T IY K,K R IH T IY K T
1.8487813472747803,idle,AY D AH L,AY D AH L D
1.8374912738800049,reassemble,R IY AH S EH M B AH L,R IY AH S EH M B AH L D
1.837421178817749,immolate,IH M AH L EY T,IH M AH L EY T AH D
1.8331048488616943,reappraise,R IY AH P R EY Z,R IY AH P R EY Z D
1.827056646347046,annotate,AE N AH T EY T,AE N AH T EY T IH D
1.8235015869140625,reattach,R IY AH T AE CH,R IY AH T AE CH T
1.8142085075378418,reassure,R IY AH SH UH R,R IY AH SH UH R D
1.8103902339935303,bias,B AY AH S,B AY AH S T
1.8068809509277344,annul,AE N AH L,AE N AH L D
1.795902967453003,fluster,F L AH S T ER,F L AH S T ER D
1.786386251449585,immigrate,IH M AH G R EY T,IH M AH G R EY T IH D
1.7839555740356445,violate,V AY AH L EY T,V AY AH L EY T IH D
1.769040822982788,reassess,R IY AH S EH S,R IY AH S EH S T
1.7684712409973145,emulsify,IH M AH L S AH F AY,IH M AH L S AH F AY D
1.7564427852630615,sculpt,S K AH L P T,S K AH L P T IH D
1.7537436485290527,isolate,AY S AH L EY T,AY S AH L EY T AH D
1.7479336261749268,pronounce,P R AH N AW N S,P R AH N AW N S T
1.7116589546203613,animate,AE N AH M AH T,AE N AH M EY T IH D
1.68985915184021,sponge,S P AH N JH,S P AH N JH D
1.6389641761779785,emigrate,EH M AH G R EY T,EH M AH G R EY T IH D
1.6167199611663818,snuggle,S N AH G AH L,S N AH G AH L D
1.5904958248138428,coalesce,K OW AH L EH S,K OW AH L EH S T
1.4998857975006104,fluctuate,F L AH K CH AH W EY T,F L AH K CH AH W EY T IH D
1.4755172729492188,spelunk,S P AH L AH NG K,S P AH L AH NG K T
1.4603264331817627,illustrate,IH L AH S T R EY T,IH L AH S T R EY T AH D
1.320328712463379,frustrate,F R AH S T R EY T,F R AH S T R EY T AH D
1.305368423461914,autograph,AO T AH G R AE F,AO T AH G R AE F T
0.9937401413917542,reacquire,R IY AH K W AY R,R IY AH K W AY R D
0.3193039298057556,rule,R UW L,R UW L D
0.2652207016944885,proffer,P R AA F ER,P R AA F ER D
0.16515517234802246,forecast,F AO R K AE S T,F AO R K AE S T
0.05485135316848755,okay,OW K EY,OW K EY D
0.012052714824676514,scallop,S K AE L AH P,S K AA L AH P T
