activation,lemma,present_phones,past_phones
0.9844797253608704,cultivate,K AH L T AH V EY T,K AH L T AH V EY T IH D
0.9545470476150513,populate,P AA P Y AH L EY T,P AA P Y AH L EY T IH D
0.9474064707756042,conjugate,K AA N JH AH G EY T,K AA N JH AH G EY T IH D
0.9372930526733398,carbonate,K AA R B AH N EY T,K AA R B AH N EY T IH D
0.9106159210205078,captivate,K AE P T IH V EY T,K AE P T IH V EY T IH D
0.9098318219184875,castigate,K AE S T AH G EY T,K AE S T AH G EY T IH D
0.9047040343284607,appreciate,AH P R IY SH IY EY T,AH P R IY SH IY EY T IH D
0.903274416923523,palpitate,P AE L P AH T EY T,P AE L P AH T EY T IH D
0.8992540836334229,crenelate,K R EH N AH L EY T,K R EH N AH L EY T AH D
0.8804600238800049,excavate,EH K S K AH V EY T,EH K S K AH V EY T IH D
0.8790414929389954,amputate,AE M P Y AH T EY T,AE M P Y AH T EY T IH D
0.87895667552948,postulate,P AA S CH AH L EY T,P AA S CH AH L EY T IH D
0.8685349225997925,collaborate,K AH L AE B ER EY T,K AH L AE B ER EY T IH D
0.8610236048698425,adjudicate,AH JH UW D IH K EY T,AH JH UW D AH K EY T IH D
0.8573136925697327,propagate,P R AA P AH G EY T,P R AA P AH G EY T IH D
0.8460192680358887,proselytize,P R AA S AH L AH T AY Z,P R AA S AH L AH T AY Z D
0.8444870710372925,circulate,S ER K Y AH L EY T,S ER K Y AH L EY T IH D
0.8441833257675171,understate,AH N D ER S T EY T,AH N D ER S T EY T IH D
0.8375102877616882,vaccinate,V AE K S AH N EY T,V AE K S AH N EY T IH D
0.8374639749526978,flagellate,F L AE JH AH L EY T,F L AE JH AH L EY T AH D
0.8325656652450562,tabulate,T AE B Y AH L EY T,T AE B Y AH L EY T IH D
0.8324609994888306,procreate,P R OW K R IY EY T,P R OW K R IY EY T IH D
0.8241451978683472,permutate,P ER M Y UW T EY T,P ER M Y UW T EY T IH D
0.8228895664215088,ventilate,V EH N T AH L EY T,V EH N T AH L EY T IH D
0.8171349763870239,culminate,K AH L M IH N EY T,K AH L M AH N EY T IH D
0.8136930465698242,instigate,IH N S T AH G EY T,IH N S T AH G EY T IH D
0.8126790523529053,calibrate,K AE L AH B R EY T,K AE L AH B R EY T AH D
0.8123936653137207,predicate,P R EH D AH K EY T,P R EH D AH K EY T IH D
0.800204336643219,subjugate,S AH B JH AH G EY T,S AH B JH AH G EY T IH D
0.796576738357544,chlorinate,K L AO R AH N EY T,K L AO R AH N EY T AH D
0.7926943302154541,regulate,R EH G Y AH L EY T,R EH G Y AH L EY T IH D
0.7906591892242432,enunciate,IH N AH N S IY EY T,IH N AH N S IY EY T IH D
0.7865592837333679,masturbate,M AE S T ER B EY T,M AE S T ER B EY T IH D
0.7806017398834229,commemorate,K AH M EH M ER EY T,K AH M EH M ER EY T IH D
0.780250072479248,negotiate,N AH G OW SH IY EY T,N AH G OW SH IY EY T AH D
0.7801389098167419,gravitate,G R AE V IH T EY T,G R AE V AH T EY T IH D
0.7786974906921387,antiquate,AE N T AH K W EY T,AE N T AH K W EY T IH D
0.7777116298675537,extirpate,EH K S T ER P EY T,EH K S T ER P EY T AH D
0.7749496102333069,assassinate,AH S AE S AH N EY T,AH S AE S AH N EY T IH D
0.7700985670089722,syncopate,S IH NG K AH P EY T,S IH NG K AH P EY T IH D
0.7648565769195557,fabricate,F AE B R AH K EY T,F AE B R IH K EY T AH D
0.7642611265182495,accommodate,AH K AA M AH D EY T,AH K AA M AH D EY T IH D
0.7621479034423828,securitize,S IH K Y UH R AH T AY Z,S IH K Y UH R AH T AY Z D
0.7614854574203491,cogenerate,K OW JH EH N ER EY T,K OW JH EH N ER EY T IH D
0.7551742792129517,vindicate,V IH N D AH K EY T,V IH N D AH K EY T IH D
0.7539944648742676,reinstate,R IY IH N S T EY T,R IY IH N S T EY T IH D
0.7517632842063904,reallocate,R IY AE L AH K EY T,R IY AE L AH K EY T IH D
0.7470594048500061,modulate,M AO JH Y UW L EY T,M AO JH Y UW L EY T IH D
0.7447437644004822,inebriate,IH N EH B R IY EY T,IH N EH B R IY EY T AH D
0.7442231774330139,abbreviate,AH B R IY V IY EY T,AH B R IY V IY EY T IH D
0.7430495023727417,obliterate,AH B L IH T ER EY T,AH B L IH T ER EY T IH D
0.7414553761482239,ameliorate,AH M IY L Y ER EY T,AH M IY L Y ER EY T IH D
0.7397215366363525,mutilate,M Y UW T AH L EY T,M Y UW T AH L EY T AH D
0.7314462661743164,delineate,D IH L IH N IY EY T,D IH L IH N IY EY T IH D
0.7279102802276611,punctuate,P AH NG K CH UW EY T,P AH NG K CH UW EY T IH D
0.7273482084274292,graduate,G R AE JH AH W AH T,G R AE JH UW EY T IH D
0.7260359525680542,redecorate,R IY D EH K ER EY T,R IY D EH K ER EY T IH D
0.7253063917160034,elucidate,IH L UW S AH D EY T,IH L UW S AH D EY T AH D
0.720313310623169,replicate,R EH P L AH K EY T,R EH P L IH K EY T IH D
0.709809422492981,implicate,IH M P L IH K EY T,IH M P L IH K EY T IH D
0.7084810733795166,consummate,K AA N S AH M AH T,K AA N S AH M EY T AH D
0.7058649063110352,legislate,L EH JH IH S L EY T,L EH JH AH S L EY T AH D
0.7044199705123901,eradicate,IH R AE D AH K EY T,IH R AE D AH K EY T IH D
0.7030397653579712,liquidate,L IH K W IH D EY T,L IH K W IH D EY T IH D
0.7023975253105164,evacuate,IH V AE K Y AH EY T,IH V AE K Y AH W EY T IH D
0.6983627080917358,vociferate,V AH S IH F ER EY T,V AH S IH F ER EY T IH D
0.697862446308136,regenerate,R IY JH EH N ER EY T,R IY JH EH N ER EY T IH D
0.6970885992050171,adulterate,AH D AH L T ER EY T,AH D AH L T ER EY T IH D
0.6967074275016785,evaluate,IH V AE L Y UW EY T,IH V AE L Y UW EY T AH D
0.6956924200057983,devastate,D EH V AH S T EY T,D EH V AH S T EY T IH D
0.693984866142273,segregate,S EH G R AH G EY T,S EH G R AH G EY T IH D
0.6889105439186096,attenuate,AH T EH N Y UW EY T,AH T EH N Y UW EY T IH D
0.6872891187667847,infatuate,IH N F AE CH UW EY T,IH N F AE CH UW EY T IH D
0.6828008890151978,incinerate,IH N S IH N ER EY T,IH N S IH N ER EY T IH D
0.6824098229408264,retaliate,R IH T AE L IY EY T,R IH T AE L IY EY T IH D
0.6806139945983887,assimilate,AH S IH M AH L EY T,AH S IH M AH L EY T IH D
0.6790140867233276,frustrate,F R AH S T R EY T,F R AH S T R EY T AH D
0.6732099652290344,interpolate,IH T ER P AH L EY T,IH T ER P AH L EY T IH D
0.6712228655815125,deprecate,D EH P R AH K EY T,D EH P R AH K EY T AH D
0.6663552522659302,eliminate,IH L IH M AH N EY T,IH L IH M AH N EY T IH D
0.665887176990509,celebrate,S EH L AH B R EY T,S EH L AH B R EY T IH D
0.6628983020782471,exonerate,IH G Z AA N ER EY T,IH G Z AA N ER EY T IH D
0.656449019908905,lubricate,L UW B R IH K EY T,L UW B R AH K EY T IH D
0.6561896800994873,democratize,D IH M AA K R AH T AY Z,D IH M AA K R AH T AY Z D
0.6522356867790222,integrate,IH N T AH G R EY T,IH N T AH G R EY T AH D
0.6446828246116638,accelerate,AE K S EH L ER EY T,AE K S EH L ER EY T IH D
0.6425374150276184,simulate,S IH M Y AH L AH T,S IH M Y AH L EY T IH D
0.6406839489936829,penetrate,P EH N AH T R EY T,P EH N AH T R EY T IH D
0.6402772665023804,convolute,K AA N V AH L UW T,K AA N V AH L UW T AH D
0.6397369503974915,arbitrate,AA R B AH T R EY T,AA R B AH T R EY T IH D
0.6370631456375122,illustrate,IH L AH S T R EY T,IH L AH S T R EY T AH D
0.6362794637680054,perpetrate,P ER P AH T R EY T,P ER P AH T R EY T IH D
0.6334761381149292,angulate,AE NG G Y UW L EY T,AE NG G Y UW L EY T IH D
0.6123241782188416,desensitize,D IH S EH N S AH T AY Z,D IH S EH N S AH T AY Z D
0.6098009347915649,institute,IH N S T AH T UW T,IH N S T AH T UW T IH D
0.5829224586486816,designate,D EH Z AH G N EY T,D EH Z IH G N EY T IH D
0.5809603929519653,microwave,M AY K R AH W EY V,M AY K R OW W EY V D
0.5789530277252197,denigrate,D EH N AH G R EY T,D EH N IH G R EY T IH D
0.5756590962409973,translate,T R AE N Z L EY T,T R AE N Z L EY T IH D
0.5755350589752197,exaggerate,IH G Z AE JH ER EY T,IH G Z AE JH ER EY T AH D
0.5635784864425659,exhilarate,IH G Z IH L ER EY T,IH G Z IH L ER EY T IH D
0.5525413751602173,desecrate,D EH Z AH K R EY T,D EH Z AH K R EY T IH D
0.5514626502990723,decelerate,D IH S EH L ER EY T,D IH S EH L ER EY T IH D
0.5467082262039185,dislocate,D IH S L OW K EY T,D IH S L OW K EY T IH D
0.5344135761260986,execute,EH K S AH K Y UW T,EH K S AH K Y UW T IH D
0.5052047371864319,reverberate,R IH V ER B ER AH T,R IH V ER B ER EY T IH D
0.5013941526412964,persecute,P ER S AH K Y UW T,P ER S AH K Y UW T IH D
0.4998474419116974,misbehave,M IH S B AH HH EY V,M IH S B AH HH EY V D
0.4994015097618103,inculcate,IH NG K AH L K EY T,IH NG K AH L K EY T AH D
0.48890790343284607,recuperate,R IH K UW P ER EY T,R IH K UW P ER EY T IH D
0.4874419569969177,attribute,AE T R AH B Y UW T,AH T R IH B Y AH T IH D
0.4812179505825043,reinstitute,R IY IH N S T IH T UW T,R IY IH N S T IH T UW T IH D
0.48027148842811584,misconstrue,M IH S K AH N S T R UW,M IH S K AH N S T R UW D
0.4771302044391632,syndicate,S IH N D IH K AH T,S IH N D IH K EY T IH D
0.47540009021759033,deliberate,D IH L IH B ER AH T,D IH L IH B ER EY T IH D
0.47357985377311707,filibuster,F IH L AH B AH S T ER,F IH L AH B AH S T ER D
0.4538824260234833,collateralize,K AH L AE T ER AH L AY Z,K AH L AE T ER AH L AY Z D
0.44697582721710205,dehydrate,D IH HH AY D R EY T,D IH HH AY D R EY T AH D
0.4439348578453064,prognosticate,P R AA G N AA S T AH K EY T,P R AA G N AA S T AH K EY T IH D
0.43192899227142334,duplicate,D UW P L AH K AH T,D UW P L IH K EY T IH D
0.4296359419822693,extinguish,IH K S T IH NG G W IH SH,IH K S T IH NG G W IH SH T
0.42381468415260315,degenerate,D IH JH EH N ER AH T,D IH JH EH N ER EY T IH D
0.41606977581977844,preconceive,P R IY K AH N S IY V,P R IY K AH N S IY V D
0.4094834625720978,counterfeit,K AW N T ER F IH T,K AW N T ER F IH T IH D
0.40838512778282166,skyrocket,S K AY R AA K AH T,S K AY R AA K AH T IH D
0.38757553696632385,undercount,AH N D ER K AW N T,AH N D ER K AW N T IH D
0.3873136043548584,precipitate,P R IH S IH P IH T EY T,P R IH S IH P IH T EY T IH D
0.37334144115448,invigorate,IH N V IH G ER IH T,IH N V IH G ER EY T IH D
0.36084023118019104,manifest,M AE N AH F EH S T,M AE N AH F EH S T AH D
0.3570307791233063,blacklist,B L AE K L IH S T,B L AE K L IH S T IH D
0.3546166718006134,contract,K AA N T R AE K T,K AA N T R AE K T AH D
0.35335323214530945,counteract,K AW N T ER AE K T,K AW N T ER AE K T IH D
0.3490770161151886,instruct,IH N S T R AH K T,IH N S T R AH K T AH D
0.3473403751850128,commercialize,K AH M ER SH AH L AY Z,K AH M ER SH AH L AY Z D
0.3468658924102783,expedite,EH K S P IH D AY T,EH K S P IH D AY T IH D
0.3423575460910797,distinguish,D IH S T IH NG G W IH SH,D IH S T IH NG G W IH SH T
0.33718106150627136,resubmit,R IY S AH B M IH T,R IY S AH B M IH T IH D
0.3318025469779968,compensate,K AA M P AH N S EY T,K AA M P AH N S EY T AH D
0.30235156416893005,fragment,F R AE G M AH N T,F R AE G M AH N T IH D
0.2927202880382538,intercept,IH N T ER S EH P T,IH N T ER S EH P T AH D
0.2658003568649292,promulgate,P R OW M AH L G EY T,P R AA M AH L G EY T IH D
0.2645390033721924,extract,EH K S T R AE K T,EH K S T R AE K T IH D
0.22005082666873932,scramble,S K R AE M B AH L,S K R AE M B AH L D
0.19712428748607635,catalog,K AE T AH L AO G,K AE T AH L AO G D
0.19712428748607635,catalogue,K AE T AH L AO G,K AE T AH L AO G D
0.19250044226646423,revalue,R IY V AE L Y UW,R IY V AE L Y UW D
0.1242213100194931,colorize,K AH L ER AY Z,K AH L ER AY Z D
0.11437477171421051,preface,P R EH F AH S,P R EH F AH S T
0.11298432946205139,overuse,OW V ER Y UW Z,OW V ER Y UW Z D
0.1017170250415802,crackle,K R AE K AH L,K R AE K AH L D
0.09028129279613495,corbel,K AO R B AH L,K AO R B AH L D
0.08925250172615051,culture,K AH L CH ER,K AH L CH ER D
0.0891183465719223,freckle,F R EH K AH L,F R EH K AH L D
0.08784788846969604,clog,K L AA G,K L AO G D
0.08593907952308655,scuffle,S K AH F AH L,S K AH F AH L D
0.07831858843564987,garble,G AA R B AH L,G AA R B AH L D
0.07563003897666931,clock,K L AA K,K L AA K T
0.07157394289970398,clot,K L AA T,K L AA T AH D
0.0702575147151947,cart,K AA R T,K AA R T IH D
0.06854750216007233,crater,K R EY T ER,K R EY T ER D
0.0685381293296814,humble,HH AH M B AH L,HH AH M B AH L D
0.06115242466330528,caddie,K AE D IY,K AE D IY D
0.06115242466330528,caddy,K AE D IY,K AE D IY D
0.05913017690181732,cloak,K L OW K,K L OW K T
0.047795556485652924,cull,K AH L,K AH L D
