activation,lemma,present_phones,past_phones
1.8818484544754028,intermix,IH N T ER M IH K S,IH N T ER M IH K S T
1.820635437965393,unwelcome,AH N W EH L K AH M,AH N W EH L K AH M D
1.654183030128479,intertwine,IH N T ER T W AY N,IH N T ER T W AY N D
1.6193645000457764,intermarry,IH N T ER M AE R IY,IH N T ER M AE R IY D
1.5639777183532715,interdict,IH N T ER D IH K T,IH N T ER D IH K T IH D
1.5412157773971558,intersperse,IH N T ER S P ER S,IH N T ER S P ER S T
1.5069804191589355,undercook,AH N D ER K UH K,AH N D ER K UH K T
1.5015901327133179,intercept,IH N T ER S EH P T,IH N T ER S EH P T AH D
1.4864282608032227,interrelate,IH N T ER R IH L EY T,IH N T ER R IH L EY T IH D
1.3315212726593018,introvert,IH N T R OW V ER T,IH N T R OW V ER T IH D
1.2943089008331299,undercount,AH N D ER K AW N T,AH N D ER K AW N T IH D
1.2819522619247437,underprice,AH N D ER P R AY S,AH N D ER P R AY S T
1.2761118412017822,undersell,AH N D ER S EH L,AH N D ER S OW L D
1.2454744577407837,indoctrinate,IH N D AA K T R AH N EY T,IH N D AA K T R AH N EY T IH D
1.2437145709991455,interlock,IH N T ER L AA K,IH N T ER L AA K T
1.2358605861663818,undertake,AH N D ER T EY K,AH N D ER T UH K
1.2166028022766113,intercede,IH N T ER S IY D,IH N T ER S IY D IH D
1.2114660739898682,introduce,IH N T R AH D UW S,IH N T R AH D UW S T
1.2077159881591797,underinsure,AH N D ER IH N SH AO R,AH N D ER IH N SH AO R D
1.2076396942138672,underfinance,AH N D ER F IH N AE N S,AH N D ER F IH N AE N S T
1.1995432376861572,interact,IH N T ER AE K T,IH N T ER AE K T AH D
1.1990547180175781,undercapitalize,AH N D ER K AE P AH T AH L AY Z,AH N D ER K AE P AH T AH L AY Z D
1.1987874507904053,enrapture,EH N R AE P CH ER,EH N R AE P CH ER D
1.1958461999893188,interview,IH N T ER V Y UW,IH N T ER V Y UW D
1.1854710578918457,enfranchise,IH N F R AE N CH AY Z,EH N F R AE N CH AY Z D
1.1809966564178467,internalize,IH N T ER N AH L AY Z,IH N T ER N AH L AY Z D
1.1803609132766724,entrench,EH N T R EH N CH,EH N T R EH N CH T
1.179783582687378,interrupt,IH N T ER AH P T,IH N T ER AH P T IH D
1.1777222156524658,interrogate,IH N T EH R AH G EY T,IH N T EH R AH G EY T IH D
1.1706671714782715,understate,AH N D ER S T EY T,AH N D ER S T EY T IH D
1.1700644493103027,interfere,IH N T ER F IH R,IH N T ER F IH R D
1.1562585830688477,underbid,AH N D ER B IH D,AH N D ER B IH D
1.1510791778564453,underscore,AH N D ER S K AO R,AH N D ER S K AO R D
1.1508467197418213,underpin,AH N D ER P IH N,AH N D ER P IH N D
1.149084210395813,understand,AH N D ER S T AE N D,AH N D ER S T UH D
1.1381555795669556,incorporate,IH N K AO R P ER EY T,IH N K AO R P ER EY T IH D
1.1352626085281372,misbehave,M IH S B AH HH EY V,M IH S B AH HH EY V D
1.1347696781158447,undernourish,AH N D ER N ER IH SH,AH N D ER N ER IH SH T
1.130287528038025,underrate,AH N D ER R EY T,AH N D ER R EY T IH D
1.1239924430847168,underwrite,AH N D ER R AY T,AH N D ER R OW T
1.1238514184951782,entangle,EH N T AE NG G AH L,EH N T AE NG G AH L D
1.0917625427246094,intermingle,IH N T ER M IH NG G AH L,IH N T ER M IH NG G AH L D
1.0898076295852661,encompass,EH N K AH M P AH S,EH N K AH M P AH S T
1.0834720134735107,underman,AH N D ER M AE N,AH N D ER M AE N D
1.081369400024414,undermine,AH N D ER M AY N,AH N D ER M AY N D
1.0758992433547974,indemnify,IH N D EH M N AH F AY,IH N D EH M N AH F AY D
1.0671226978302002,undercut,AH N D ER K AH T,AH N D ER K AH T
1.0622729063034058,entrance,EH N T R AH N S,IH N T R AE N S T
1.0415387153625488,interleave,IH N T ER L IY V,IH N T ER L IY V D
1.0283622741699219,internationalize,IH N T ER N AE SH AH N AH L AY Z,IH N T ER N AE SH AH N AH L AY Z D
1.0202771425247192,undervalue,AH N D ER V AE L Y UW,AH N D ER V AE L Y UW D
1.0153446197509766,indenture,IH N D EH N CH ER,IH N D EH N CH ER D
1.0041706562042236,antiquate,AE N T AH K W EY T,AE N T AH K W EY T IH D
1.0000873804092407,instruct,IH N S T R AH K T,IH N S T R AH K T AH D
0.9940592646598816,intimidate,IH N T IH M IH D EY T,IH N T IH M IH D EY T IH D
0.9872389435768127,underuse,AH N D ER Y UW Z,AH N D ER Y UW Z D
0.9540629982948303,encircle,EH N S ER K AH L,IH N S ER K AH L D
0.9301517605781555,invigorate,IH N V IH G ER IH T,IH N V IH G ER EY T IH D
0.9204416871070862,investigate,IH N V EH S T AH G EY T,IH N V EH S T AH G EY T AH D
0.9164114594459534,underserve,AH N D ER S ER V,AH N D ER S ER V D
0.8976073861122131,uncomplicate,AH N K AA M P L AH K EY T,AH N K AA M P L AH K EY T IH D
0.8742190003395081,underutilize,AH N D ER Y UW T AH L AY Z,AH N D ER Y UW T AH L AY Z D
0.8686162829399109,increment,IH N K R AH M AH N T,IH N K R AH M EH N T IH D
0.8644660115242004,interlace,IH N T ER L EY S,IH N T ER L EY S T
0.8539450764656067,intervene,IH N T ER V IY N,IH N T ER V IY N D
0.8411142230033875,antagonize,AE N T AE G AH N AY Z,AE N T AE G AH N AY Z D
0.8390483260154724,entrap,IH N T R AE P,IH N T R AE P T
0.8309968113899231,underline,AH N D ER L AY N,AH N D ER L AY N D
0.8116519451141357,incarcerate,IH N K AA R S ER EY T,IH N K AA R S ER EY T IH D
0.8013613820075989,inscribe,IH N S K R AY B,IH N S K R AY B D
0.8006682395935059,outperform,AW T P ER F AO R M,AW T P ER F AO R M D
0.7906898260116577,entitle,EH N T AY T AH L,EH N T AY T AH L D
0.7849149703979492,engineer,EH N JH AH N IH R,EH N JH AH N IY R D
0.776969850063324,underwithhold,AH N D ER W IH TH HH OW L D,AH N D ER W IH TH HH EH L D
0.7661874294281006,encapsulate,EH N K AE P S AH L EY T,EH N K AE P S AH L EY T IH D
0.7438477873802185,anticipate,AE N T IH S AH P EY T,AE N T IH S AH P EY T IH D
0.7212798595428467,encroach,IH N K R OW CH,IH N K R OW CH T
0.7149644494056702,unshackle,AH N SH AE K AH L,AH N SH AE K AH L D
0.7107618451118469,invalidate,IH N V AE L IH D EY T,IH N V AE L AH D EY T AH D
0.7055043578147888,underpay,AH N D ER P EY,AH N D ER P EY D
0.7039476633071899,integrate,IH N T AH G R EY T,IH N T AH G R EY T AH D
0.6730011701583862,envisage,EH N V IH Z IH JH,EH N V IH Z IH JH D
0.6447761654853821,intensify,IH N T EH N S AH F AY,IH N T EH N S AH F AY D
0.6363583207130432,insinuate,IH N S IH N Y UW EY T,IH N S IH N Y UW EY T IH D
0.6340683102607727,unclassify,AH N K L AE S IH F AY,AH N K L AE S IH F AY D
0.6110954880714417,interlink,IH N T ER L IH NG K,IH N T ER L IH NG K T
0.6105260848999023,intimate,IH N T AH M AH T,IH N T AH M EY T IH D
0.6093348860740662,endorse,EH N D AO R S,EH N D AO R S T
0.599169909954071,inoculate,IH N AA K Y AH L EY T,IH N AA K Y AH L EY T IH D
0.5936294794082642,industrialize,IH N D AH S T R IY AH L AY Z,IH N D AH S T R IY AH L AY Z D
0.5912004113197327,encourage,EH N K ER IH JH,EH N K ER IH JH D
0.5839186906814575,institute,IH N S T AH T UW T,IH N S T AH T UW T IH D
0.5814844369888306,exploit,EH K S P L OY T,EH K S P L OY T AH D
0.5523107647895813,infatuate,IH N F AE CH UW EY T,IH N F AE CH UW EY T IH D
0.5477761626243591,anonymize,AH N AA N AH M AY Z,AH N AA N AH M AY Z D
0.546802282333374,earn,ER N,ER N D
0.5303474068641663,underestimate,AH N D ER EH S T AH M EY T,AH N D ER EH S T AH M EY T IH D
0.4978505074977875,enter,EH N T ER,EH N T ER D
0.48854461312294006,incapacitate,IH N K AH P AE S IH T EY T,IH N K AH P AE S IH T EY T IH D
0.4858334958553314,unsettle,AH N S EH T AH L,AH N S EH T AH L D
0.48300299048423767,endear,EH N D IY R,EH N D IY R D
0.46036478877067566,index,IH N D EH K S,IH N D EH K S T
0.4526000916957855,execute,EH K S AH K Y UW T,EH K S AH K Y UW T IH D
0.4484710991382599,extricate,EH K S T R AH K EY T,EH K S T R AH K EY T IH D
0.44542834162712097,innoculate,IH N AO K Y AH L EY T,IH N AO K Y AH L EY T AH D
0.4426768720149994,unmanage,AH N M AE N IH JH,AH N M AE N IH JH D
0.43514958024024963,instantiate,IH N S T AE N SH IY EY T,IH N S T AE N SH IY EY T AH D
0.4259319007396698,inebriate,IH N EH B R IY EY T,IH N EH B R IY EY T AH D
0.42562052607536316,enshrine,EH N SH R AY N,EH N SH R AY N D
0.4219982326030731,unsubscribe,AH N S AH B S K R AY B,AH N S AH B S K R AY B D
0.4129917621612549,enlarge,EH N L AA R JH,EH N L AA R JH D
0.41246774792671204,extract,EH K S T R AE K T,EH K S T R AE K T IH D
0.40696272253990173,undergo,AH N D ER G OW,AH N D ER W EH N T
0.4017455577850342,endure,EH N D Y UH R,EH N D Y UH R D
0.4008435904979706,enfeeble,EH N F IY B AH L,EH N F IY B AH L D
0.3989327847957611,er,ER,EH R D
0.39091673493385315,intrude,IH N T R UW D,IH N T R UW D AH D
0.3883722722530365,invest,IH N V EH S T,IH N V EH S T AH D
0.3883339464664459,instigate,IH N S T AH G EY T,IH N S T AH G EY T IH D
0.3677211105823517,inactivate,IH N AE K T IH V EY T,IH N AE K T IH V EY T IH D
0.35277822613716125,infiltrate,IH N F IH L T R EY T,IH N F IH L T R EY T IH D
0.3484717309474945,ensure,EH N SH UH R,EH N SH UH R D
0.3446268141269684,inter,IH N T ER,IH N T ER D
0.34401997923851013,ensconce,IH N S K AA N S,IH N S K AA N S T
0.3352636694908142,indicate,IH N D AH K EY T,IH N D AH K EY T AH D
0.33352839946746826,enunciate,IH N AH N S IY EY T,IH N AH N S IY EY T IH D
0.30313840508461,entail,EH N T EY L,IH N T EY L D
0.30286163091659546,individualize,IH N D IH V IH JH UW AH L AY Z,IH N D IH V IH JH UW AH L AY Z D
0.3014671504497528,unbalance,AH N B AE L AH N S,AH N B AE L AH N S T
0.2989204227924347,undulate,AH N JH AH L EY T,AH N JH AH L EY T AH D
0.2929230034351349,exempt,IH G Z EH M P T,IH G Z EH M P T IH D
0.2723792493343353,enlist,EH N L IH S T,EH N L IH S T IH D
0.2661200761795044,encase,EH N K EY S,EH N K EY S T
0.2544601261615753,injure,IH N JH ER,IH N JH ER D
0.23928919434547424,unwind,AH N W AY N D,AH N W AW N D
0.2294616997241974,entwine,EH N T W AY N,EH N T W AY N D
0.22611233592033386,incinerate,IH N S IH N ER EY T,IH N S IH N ER EY T IH D
0.22415190935134888,inventory,IH N V AH N T AO R IY,IH N V AH N T AO R IY D
0.22221970558166504,induce,IH N D UW S,IH N D UW S T
0.22181525826454163,infringe,IH N F R IH N JH,IH N F R IH N JH D
0.21662774682044983,intern,IH N T ER N,IH N T ER N D
0.18493768572807312,incur,IH N K ER,IH N K ER D
0.18039247393608093,insure,IH N SH UH R,IH N SH UH R D
0.17950919270515442,unwed,AH N W EH D,AH N W EH D
0.1652032434940338,enrich,EH N R IH CH,EH N R IH CH T
0.16270118951797485,entice,IH N T AY S,IH N T AY S T
0.15992426872253418,undo,AH N D UW,AH N D IH D
0.1593816876411438,invert,IH N V ER T,IH N V ER T IH D
0.1591639518737793,enumerate,IH N UW M ER EY T,IH N UW M ER EY T IH D
0.15140384435653687,intrigue,IH N T R IY G,IH N T R IY G D
0.1490570604801178,unemploy,AH N IH M P L OY,AH N EH M P L OY D
0.1452220380306244,undress,AH N D R EH S,AH N D R EH S T
0.1411798596382141,envy,EH N V IY,EH N V IY D
0.1363496482372284,enrage,EH N R EY JH,EH N R EY JH D
0.11633401364088058,involve,IH N V AA L V,IH N V AA L V D
0.10369638353586197,invoke,IH N V OW K,IH N V OW K T
0.1032414510846138,untie,AH N T AY,AH N T AY D
0.0870986357331276,end,EH N D,EH N D AH D
0.07065767794847488,enclose,IH N K L OW Z,EH N K L OW Z D
0.06805669516324997,estrange,EH S T R EY N JH,EH S T R EY N JH D
0.059221796691417694,unwrap,AH N R AE P,AH N R AE P T
0.05137213319540024,apprentice,AH P R EH N T AH S,AH P R EH N T AH S T
0.04507812112569809,dispossess,D IH S P AH Z EH S,D IH S P AH Z EH S T
0.039972685277462006,obscure,AH B S K Y UH R,AH B S K Y UH R D
0.03502967208623886,engross,IH N G R OW S,IH N G R OW S T
