activation,lemma,present_phones,past_phones
2.1408932209014893,quantify,K W AA N T IH F AY,K W AA N T IH F AY D
1.718353509902954,affine,AH F AY N,AH F AY N D
1.4304150342941284,graduate,G R AE JH AH W AH T,G R AE JH UW EY T IH D
1.355642557144165,electrify,IH L EH K T R AH F AY,IH L EH K T R AH F AY D
1.2691468000411987,prejudge,P R IY JH AH JH,P R IY JH AH JH D
1.2258245944976807,trudge,T R AH JH,T R AH JH D
1.2041290998458862,cremate,K R IY M EY T,K R IY M EY T IH D
1.2028567790985107,swing,S W IH NG,S W AH NG
1.1801738739013672,coincide,K OW IH N S AY D,K OW AH N S AY D AH D
1.1708452701568604,dream,D R IY M,D R IY M D
1.1627092361450195,climax,K L AY M AE K S,K L AY M AE K S T
1.1046836376190186,trundle,T R AH N D AH L,T R AH N D AH L D
1.071230173110962,gleam,G L IY M,G L IY M D
1.0497409105300903,clam,K L AE M,K L AE M D
1.046987771987915,claim,K L EY M,K L EY M D
1.0404949188232422,authenticate,AO TH EH N T AH K EY T,AO TH EH N T AH K EY T IH D
1.0223534107208252,quadruple,K W AA D R UW P AH L,K W AA D R UW P AH L D
1.00443696975708,electrocute,IH L EH K T R AH K Y UW T,IH L EH K T R AH K Y UW T IH D
0.998033881187439,glean,G L IY N,G L IY N D
0.9971218109130859,cram,K R AE M,K R AE M D
0.9958517551422119,misjudge,M IH S JH AH JH,M IH S JH AH JH D
0.9923380613327026,transfuse,T R AE N S F Y UW Z,T R AE N S F Y UW Z D
0.985122561454773,drum,D R AH M,D R AH M D
0.9823843240737915,careen,K ER IY N,K ER IY N D
0.9524369239807129,plague,P L EY G,P L EY G D
0.9306607246398926,bring,B R IH NG,B R AO T
0.9124196767807007,sling,S L IH NG,S L AH NG
0.9084973335266113,clean,K L IY N,K L IY N D
0.9038110971450806,bereave,B ER IY V,B ER IY V D
0.8827952146530151,grandfather,G R AE N D F AA DH ER,G R AE N D F AA DH ER D
0.8737149238586426,fling,F L IH NG,F L AH NG
0.8722680807113647,fume,F Y UW M,F Y UW M D
0.8631072044372559,twine,T W AY N,T W AY N D
0.8524285554885864,culminate,K AH L M IH N EY T,K AH L M AH N EY T IH D
0.8263614177703857,flame,F L EY M,F L EY M D
0.8242496252059937,plumb,P L AH M,P L AH M D
0.8159005641937256,drag,D R AE G,D R AE G D
0.8144121170043945,sting,S T IH NG,S T AH NG
0.8142733573913574,humiliate,HH Y UW M IH L IY EY T,HH Y UW M IH L IY EY T IH D
0.8090924024581909,premier,P R EH M IH R,P R EH M IH R D
0.8090924024581909,premiere,P R EH M IH R,P R EH M IH R D
0.8065402507781982,transcribe,T R AE N S K R AY B,T R AE N S K R AY B D
0.8054558038711548,bloom,B L UW M,B L UW M D
0.8009781837463379,crumple,K R AH M P AH L,K R AH M P AH L D
0.794073224067688,coif,K W AA F,K OY F T
0.794073224067688,quaff,K W AA F,K W AA F AH D
0.792055606842041,trim,T R IH M,T R IH M D
0.7906501293182373,reintroduce,R IY IH N T R AH D UW S,R IY IH N T R AH D UW S T
0.7878611087799072,prong,P R AO NG,P R AO NG D
0.7833478450775146,green,G R IY N,G R IY N D
0.7483148574829102,brave,B R EY V,B R EY V D
0.7393796443939209,try,T R AY,T R AY D
0.7363587617874146,humanize,HH Y UW M AH N AY Z,HH Y UW M AH N AY Z D
0.7278449535369873,blame,B L EY M,B L EY M D
0.7255311012268066,prime,P R AY M,P R AY M D
0.7194252014160156,plane,P L EY N,P L EY N D
0.7097642421722412,harangue,HH ER AE NG,HH ER AE NG D
0.7034850120544434,conjugate,K AA N JH AH G EY T,K AA N JH AH G EY T IH D
0.6899968385696411,clog,K L AA G,K L AO G D
0.6831437349319458,farm,F AA R M,F AA R M D
0.6765215396881104,misconstrue,M IH S K AH N S T R UW,M IH S K AH N S T R UW D
0.6731083393096924,brim,B R IH M,B R IH M D
0.6626949310302734,ashame,AH SH EY M,AH SH EY M D
0.6607495546340942,climb,K L AY M,K L AY M D
0.6527044773101807,darn,D AA R N,D AA R N D
0.6507680416107178,convince,K AH N V IH N S,K AH N V IH N S T
0.6432371139526367,outshine,AW CH AY N,AW T SH OW N
0.6431189775466919,throng,TH R AO NG,TH R AO NG D
0.6334042549133301,glare,G L EH R,G L EH R D
0.6325310468673706,cling,K L IH NG,K L AH NG
0.6318343877792358,grieve,G R IY V,G R IY V D
0.6282480955123901,barrage,B ER AA ZH,B ER AA ZH D
0.6248540878295898,shrug,SH R AH G,SH R AH G D
0.6247367858886719,dwell,D W EH L,D W EH L T
0.6087393760681152,bridge,B R IH JH,B R IH JH D
0.6067665815353394,frame,F R EY M,F R EY M D
0.6011273860931396,prune,P R UW N,P R UW N D
0.5972120761871338,excommunicate,EH K S K AH M Y UW N AH K EY T,EH K S K AH M Y UW N AH K EY T AH D
0.589606523513794,qualify,K W AA L AH F AY,K W AA L AH F AY D
0.5857394933700562,preen,P R IY N,P R IY N D
0.5824933052062988,plug,P L AH G,P L AH G D
0.5739829540252686,swim,S W IH M,S W AE M
0.5739825963973999,charm,CH AA R M,CH AA R M D
0.572058916091919,allege,AH L EH JH,AH L EH JH D
0.571086049079895,groom,G R UW M,G R UW M D
0.5682495832443237,stave,S T EY V,S T EY V D
0.5656551122665405,slam,S L AE M,S L AE M D
0.5645965337753296,twig,T W IH G,T W IH G D
0.5619875192642212,premeditate,P R IY M EH D AH T EY T,P R IY M EH D AH T EY T IH D
0.5618605613708496,gripe,G R AY P,G R AY P T
0.5583584308624268,drug,D R AH G,D R AH G D
0.5547534227371216,parole,P ER OW L,P ER OW L D
0.550328254699707,drawl,D R AO L,D R AO L D
0.536320686340332,brag,B R AE G,B R AE G D
0.5350866317749023,fledge,F L EH JH,F L EH JH D
0.5302226543426514,crane,K R EY N,K R EY N D
0.5258585214614868,pluck,P L AH K,P L AH K T
0.513398289680481,warm,W AO R M,W AO R M D
0.5118436813354492,flag,F L AE G,F L AE G D
0.5081642866134644,grin,G R IH N,G R IH N D
0.5038124322891235,clone,K L OW N,K L OW N D
0.49634161591529846,defer,D IH F ER,D IH F ER D
0.49566563963890076,shriek,SH R IY K,SH R IY K T
0.49453726410865784,blindfold,B L AY N D F OW L D,B L AY N D F OW L D IH D
0.4942893087863922,arrange,ER EY N JH,ER EY N JH D
0.492762953042984,brief,B R IY F,B R IY F T
0.48839274048805237,pledge,P L EH JH,P L EH JH D
0.48661115765571594,slim,S L IH M,S L IH M D
0.4831183850765228,corral,K ER AE L,K ER AE L D
0.4707660377025604,scam,S K AE M,S K AE M D
0.46809402108192444,progress,P R AA G R EH S,P R AH G R EH S T
0.466789573431015,bluff,B L AH F,B L AH F T
0.46054306626319885,blab,B L AE B,B L AE B D
0.44563910365104675,tinge,T IH N JH,T IH NG D
0.4441968500614166,creak,K R IY K,K R IY K T
0.44248834252357483,wager,W EY JH ER,W EY JH ER D
0.43988099694252014,cleave,K L IY V,K L EH F T
0.43432435393333435,alter,AO L T ER,AO L T ER D
0.42503467202186584,crown,K R AW N,K R AW N D
0.42252472043037415,gloss,G L AO S,G L AO S T
0.41380318999290466,crave,K R EY V,K R EY V D
0.4020039141178131,maroon,M ER UW N,M ER UW N D
0.40155115723609924,spike,S P AY K,S P AY K T
0.3976501524448395,drain,D R EY N,D R EY N D
0.3941468298435211,quell,K W EH L,K W EH L D
0.3846539556980133,clock,K L AA K,K L AA K T
0.3810369074344635,trample,T R AE M P AH L,T R AE M P AH L D
0.38096538186073303,slog,S L AA G,S L AA G D
0.3788265287876129,duel,D UW AH L,D UW AH L D
0.3750624358654022,groin,G R OY N,G R OY N D
0.3705073893070221,blend,B L EH N D,B L EH N D IH D
0.36807575821876526,tuft,T AH F T,T AH F T IH D
0.3677634298801422,tough,T AH F,T AH F T
0.3619637191295624,flock,F L AA K,F L AA K T
0.3602752983570099,preach,P R IY CH,P R IY CH T
0.35753121972084045,traumatize,T R AO M AH T AY Z,T R AO M AH T AY Z D
0.35720184445381165,binge,B IH N JH,B IH N JH D
0.35240933299064636,dial,D AY AH L,D AY AH L D
0.35083702206611633,drill,D R IH L,D R IH L D
0.34540942311286926,attune,AH T UW N,AH T UW N D
0.3439842760562897,bulge,B AH L JH,B AH L JH D
0.3436912000179291,crawl,K R AO L,K R AO L D
0.3381095230579376,fluff,F L AH F,F L AH F T
0.3292410671710968,skim,S K IH M,S K IH M D
0.3287995755672455,breathe,B R IY DH,B R IY DH D
0.3282853066921234,truck,T R AH K,T R AH K T
0.32744017243385315,shimmer,SH IH M ER,SH IH M ER D
0.3265041410923004,tweak,T W IY K,T W IY K T
0.32051578164100647,scheme,S K IY M,S K IY M D
0.32051125168800354,plan,P L AE N,P L AE N D
0.319459468126297,stage,S T EY JH,S T EY JH D
0.3193001449108124,brain,B R EY N,B R EY N D
0.31715157628059387,grain,G R EY N,G R EY N D
0.3168189823627472,plant,P L AE N T,P L AE N T IH D
0.30966708064079285,stem,S T EH M,S T EH M D
0.30780425667762756,thrill,TH R IH L,TH R IH L D
0.30632421374320984,barge,B AA R JH,B AA R JH D
0.30524149537086487,gnarl,N AA R L,N AA R L D
0.30169543623924255,proffer,P R AA F ER,P R AA F ER D
0.29507288336753845,growl,G R AW L,G R AW L D
0.2896946966648102,task,T AE S K,T AE S K T
0.28584644198417664,dwindle,D W IH N D AH L,D W IH N D AH L D
0.28575900197029114,defy,D IH F AY,D IH F AY D
0.283814936876297,gussy,G AH S IY,G AH S IY D
0.2803146541118622,swirl,S W ER L,S W ER L D
0.27568212151527405,grill,G R IH L,G R IH L D
0.26564261317253113,greet,G R IY T,G R IY T AH D
0.26420512795448303,star,S T AA R,S T AA R D
0.26001110672950745,swap,S W AA P,S W AA P T
0.2572808563709259,shave,SH EY V,SH EY V D
0.2570625841617584,flare,F L EH R,F L EH R D
0.25368747115135193,place,P L EY S,P L EY S T
0.2532751262187958,swathe,S W AA DH,S W AA DH D
0.251529723405838,prove,P R UW V,P R UW V D
0.24903956055641174,snag,S N AE G,S N AE G D
0.24844345450401306,charge,CH AA R JH,CH AA R JH D
0.24312785267829895,crucify,K R UW S AH F AY,K R UW S AH F AY D
0.23934516310691833,blemish,B L EH M IH SH,B L EH M IH SH T
0.23833021521568298,change,CH EY N JH,CH EY N JH D
0.23818495869636536,range,R EY N JH,R EY N JH D
0.23391661047935486,gulp,G AH L P,G AH L P T
0.23252204060554504,canoe,K AH N UW,K AH N UW D
0.226586252450943,groan,G R OW N,G R OW N D
0.22580721974372864,sleeve,S L IY V,S L IY V D
0.22500309348106384,toss,T AO S,T AO S T
0.22456946969032288,swoon,S W UW N,S W UW N D
0.22058215737342834,curse,K ER S,K ER S T
0.21902886033058167,shame,SH EY M,SH EY M D
0.21780595183372498,please,P L IY Z,P L IY Z D
0.21644791960716248,winge,W IH N JH,W IH NG D
0.21555402874946594,creep,K R IY P,K R EH P T
0.21452948451042175,scan,S K AE N,S K AE N D
0.21400800347328186,burst,B ER S T,B ER S T
0.21221593022346497,drone,D R OW N,D R OW N D
0.21029403805732727,train,T R EY N,T R EY N D
0.2066740095615387,travel,T R AE V AH L,T R AE V AH L D
0.20499828457832336,trick,T R IH K,T R IH K T
0.20216205716133118,grunt,G R AH N T,G R AH N T IH D
0.19238951802253723,drop,D R AA P,D R AA P T
0.1914149820804596,swipe,S W AY P,S W AY P T
0.19128134846687317,prop,P R AA P,P R AA P T
0.1892901360988617,club,K L AH B,K L AH B D
0.1871495544910431,stain,S T EY N,S T EY N D
0.18469634652137756,grease,G R IY S,G R IY S T
0.1831054985523224,plop,P L AA P,P L AA P T
0.17843618988990784,worry,W ER IY,W ER IY D
0.1776430904865265,prep,P R EH P,P R EH P T
0.17382052540779114,flesh,F L EH SH,F L EH SH T
0.16634967923164368,mask,M AE S K,M AE S K T
0.14100751280784607,scar,S K AA R,S K AA R D
0.1397639811038971,still,S T IH L,S T IH L D
0.13416430354118347,tee,T IY,T IY D
0.13279172778129578,glower,G L AW ER,G L AW ER D
0.12070468068122864,thrive,TH R AY V,TH R OW V
0.11153510212898254,gasp,G AE S P,G AE S P T
0.10705259442329407,press,P R EH S,P R EH S T
0.09306612610816956,price,P R AY S,P R AY S T
0.0918058454990387,attack,AH T AE K,AH T AE K T
0.07196226716041565,rough,R AH F,R AH F T
0.06720408797264099,attach,AH T AE CH,AH T AE CH T
0.06592884659767151,thump,TH AH M P,TH AH M P T
0.026278167963027954,breeze,B R IY Z,B R IY Z D
0.013358205556869507,stun,S T AH N,S T AH N D
