activation,lemma,present_phones,past_phones
4.944952011108398,sacrifice,S AE K R AH F AY S,S AE K R AH F AY S T
4.527202606201172,simulcast,S AY M Y AH L K AE S T,S AY M Y AH L K AE S T
4.152148246765137,influence,IH N F L UW AH N S,IH N F L UW AH N S T
3.861764430999756,improvise,IH M P R AH V AY Z,IH M P R AH V AY Z D
3.83370304107666,introvert,IH N T R OW V ER T,IH N T R OW V ER T IH D
3.546868324279785,initialize,IH N IH SH AH L AY Z,IH N IH SH AH L AY Z D
3.540637969970703,introduce,IH N T R AH D UW S,IH N T R AH D UW S T
3.525674819946289,crisscross,K R IH S K R AO S,K R IH S K R AO S T
2.9337735176086426,dispossess,D IH S P AH Z EH S,D IH S P AH Z EH S T
2.924990177154541,champion,CH AE M P IY AH N,CH AE M P IY AH N D
2.7559261322021484,intertwine,IH N T ER T W AY N,IH N T ER T W AY N D
2.638941764831543,unbalance,AH N B AE L AH N S,AH N B AE L AH N S T
2.4540767669677734,include,IH N K L UW D,IH N K L UW D AH D
2.332706928253174,issue,IH SH UW,IH SH UW D
2.292273759841919,sandblast,S AE N D B L AE S T,S AE N D B L AE S T IH D
2.2516162395477295,antiquate,AE N T AH K W EY T,AE N T AH K W EY T IH D
2.238403081893921,ennoble,IH N OW B AH L,IH N OW B AH L D
2.2315337657928467,humanize,HH Y UW M AH N AY Z,HH Y UW M AH N AY Z D
2.2098660469055176,vandalize,V AE N D AH L AY Z,V AE N D AH L AY Z D
2.180126905441284,retaliate,R IH T AE L IY EY T,R IH T AE L IY EY T IH D
2.171968936920166,irradiate,IH R EY D IY EY T,IH R EY D IY EY T IH D
2.1611547470092773,stratify,S T R AE T AH F AY,S T R AE T AH F AY D
2.116750717163086,sample,S AE M P AH L,S AE M P AH L D
2.009411573410034,intersperse,IH N T ER S P ER S,IH N T ER S P ER S T
2.008620262145996,vaccinate,V AE K S AH N EY T,V AE K S AH N EY T IH D
1.992598056793213,immobilize,IH M OW B AH L AY Z,IH M OW B AH L AY Z D
1.9773480892181396,brutalize,B R UW T AH L AY Z,B R UW T AH L AY Z D
1.9763693809509277,intermix,IH N T ER M IH K S,IH N T ER M IH K S T
1.9492390155792236,negotiate,N AH G OW SH IY EY T,N AH G OW SH IY EY T AH D
1.8911614418029785,inebriate,IH N EH B R IY EY T,IH N EH B R IY EY T AH D
1.8903968334197998,syncopate,S IH NG K AH P EY T,S IH NG K AH P EY T IH D
1.8405733108520508,damage,D AE M AH JH,D AE M AH JH D
1.833989143371582,argue,AA R G Y UW,AA R G Y UW D
1.7982120513916016,awe,AA,AO D
1.7962026596069336,spelunk,S P AH L AH NG K,S P AH L AH NG K T
1.776921272277832,handle,HH AE N D AH L,HH AE N D AH L D
1.7737541198730469,aluminize,AH L UW M AH N AY Z,AH L UW M AH N AY Z D
1.7612659931182861,infatuate,IH N F AE CH UW EY T,IH N F AE CH UW EY T IH D
1.7530624866485596,backhand,B AE K HH AE N D,B AE K HH AE N D IH D
1.7416400909423828,encompass,EH N K AH M P AH S,EH N K AH M P AH S T
1.7152793407440186,handcuff,HH AE N D K AH F,HH AE N D K AH F T
1.714449167251587,hijack,HH AY JH AE K,HH AY JH AE K T
1.7059056758880615,sterilize,S T EH R AH L AY Z,S T EH R AH L AY Z D
1.7022356986999512,disabuse,D IH S AH B Y UW S,D IH S AH B Y UW Z D
1.69069242477417,handicap,HH AE N D IY K AE P,HH AE N D IY K AE P T
1.675917625427246,disconnect,D IH S K AH N EH K T,D IH S K AH N EH K T IH D
1.6671059131622314,emulsify,IH M AH L S AH F AY,IH M AH L S AH F AY D
1.6501641273498535,initiate,IH N IH SH IY EY T,IH N IH SH IY EY T AH D
1.6415126323699951,simplify,S IH M P L AH F AY,S IH M P L AH F AY D
1.636441946029663,apprentice,AH P R EH N T AH S,AH P R EH N T AH S T
1.627387523651123,integrate,IH N T AH G R EY T,IH N T AH G R EY T AH D
1.623183250427246,illustrate,IH L AH S T R EY T,IH L AH S T R EY T AH D
1.573629379272461,handcraft,HH AE N D K R AE F T,HH AE N D K R AE F T IH D
1.5655555725097656,identify,AY D EH N T AH F AY,AY D EH N T AH F AY D
1.5402569770812988,throat,TH R OW T,TH R OW T IH D
1.5325777530670166,adjudicate,AH JH UW D IH K EY T,AH JH UW D AH K EY T IH D
1.531022071838379,emaciate,IH M EY SH IY EY T,IH M EY SH IY EY T IH D
1.4839668273925781,invalidate,IH N V AE L IH D EY T,IH N V AE L AH D EY T AH D
1.4147424697875977,simulate,S IH M Y AH L AH T,S IH M Y AH L EY T IH D
1.354828119277954,exaggerate,IH G Z AE JH ER EY T,IH G Z AE JH ER EY T AH D
1.323103666305542,erase,IH R EY S,IH R EY S T
1.2988080978393555,intrude,IH N T R UW D,IH N T R UW D AH D
1.275294542312622,brew,B R UW,B R UW D
1.2535321712493896,epitomize,IH P IH T AH M AY Z,IH P IH T AH M AY Z D
1.2463388442993164,staple,S T EY P AH L,S T EY P AH L D
1.224616289138794,halogenate,HH AE L AH JH AH N EY T,HH AE L AH JH AH N EY T IH D
1.2080440521240234,it,IH T,IH T
1.2044157981872559,feud,F Y UW D,F Y UW D IH D
1.1835687160491943,devaluate,D IH V AE L Y UW EY T,D IH V AE L Y UW EY T IH D
1.130650520324707,erode,IH R OW D,IH R OW D AH D
1.1012945175170898,attribute,AE T R AH B Y UW T,AH T R IH B Y AH T IH D
1.0843074321746826,grate,G R EY T,G R EY T IH D
1.0505445003509521,elongate,IH L AO NG G EY T,IH L AO NG G EY T AH D
0.97178715467453,reproduce,R IY P R AH D UW S,R IY P R AH D UW S T
0.9669548869132996,devalue,D IH V AE L Y UW,D IH V AE L Y UW D
0.9517164826393127,exasperate,IH G Z AE S P ER EY T,IH G Z AE S P ER EY T IH D
0.9470840096473694,hand,HH AE N D,HH AE N D AH D
0.8908469080924988,intone,IH N T OW N,IH N T OW N D
0.8755466341972351,zip,Z IH P,Z IH P T
0.8421338200569153,fantasize,F AE N T AH S AY Z,F AE N T IH S AY Z D
0.8105937838554382,edit,EH D AH T,EH D AH T AH D
0.717341959476471,dam,D AE M,D AE M D
0.717341959476471,damn,D AE M,D AE M D
0.7117182612419128,invite,IH N V AY T,IH N V AY T AH D
0.6909545063972473,zap,Z AE P,Z AE P T
0.6537856459617615,group,G R UW P,G R UW P T
