activation,lemma,present_phones,past_phones
1.0205200910568237,employ,EH M P L OY,EH M P L OY D
0.9904481172561646,deploy,D IH P L OY,D IH P L OY D
0.37353789806365967,depose,D IH P OW Z,D IH P OW Z D
0.13335329294204712,swarm,S W AO R M,S W AO R M D
0.09162849187850952,replay,R IY P L EY,R IY P L EY D
0.08347117900848389,reply,R IH P L AY,R IH P L AY D
0.058966219425201416,drawl,D R AO L,D R AO L D
0.04150402545928955,tiptoe,T IH P T OW,T IH P T OW D
0.039009273052215576,empty,EH M P T IY,EH M P T IY D
