activation,lemma,present_phones,past_phones
1.916290044784546,understand,AH N D ER S T AE N D,AH N D ER S T UH D
0.551902711391449,underscore,AH N D ER S K AO R,AH N D ER S K AO R D
0.4280319809913635,underserve,AH N D ER S ER V,AH N D ER S ER V D
0.4243197441101074,industrialize,IH N D AH S T R IY AH L AY Z,IH N D AH S T R IY AH L AY Z D
0.4022790193557739,underinsure,AH N D ER IH N SH AO R,AH N D ER IH N SH AO R D
0.3572503328323364,reprimand,R EH P R AH M AE N D,R EH P R AH M AE N D IH D
0.17542915046215057,disadvantage,D IH S AH D V AE N T IH JH,D IH S AH D V AE N T IH JH D
0.15766699612140656,polarize,P OW L ER AY Z,P OW L ER AY Z D
