activation,lemma,present_phones,past_phones
0.2544512450695038,cop,K AA P,K AA P T
0.25373223423957825,rush,R AH SH,R AH SH T
0.2536613345146179,nip,N IH P,N IH P T
0.253618061542511,offset,AO F S EH T,AO F S EH T
0.25198179483413696,cajole,K AH JH OW L,K AH JH OW L D
0.25177064538002014,emit,IH M IH T,IH M IH T AH D
0.2514795958995819,vouch,V AW CH,V AW CH T
0.2512563467025757,screw,S K R UW,S K R UW D
0.2510557174682617,skew,S K Y UW,S K Y UW D
0.2506476938724518,beam,B IY M,B IY M D
0.24929317831993103,sleeve,S L IY V,S L IY V D
0.24925416707992554,tier,T IY R,T IY R D
0.24881692230701447,budget,B AH JH IH T,B AH JH IH T AH D
0.24880564212799072,bereave,B ER IY V,B ER IY V D
0.24878747761249542,seize,S IY Z,S IY Z D
0.24877187609672546,come,K AH M,K EY M
0.24877187609672546,cum,K AH M,K EY M
0.24770119786262512,beset,B IH S EH T,B IH S EH T
0.24705055356025696,divulge,D IH V AH L JH,D IH V AH L JH D
0.24667219817638397,collide,K AH L AY D,K AH L AY D IH D
0.2462514340877533,tarnish,T AA R N IH SH,T AA R N IH SH T
0.2455301582813263,sulk,S AH L K,S AH L K T
0.24466682970523834,spot,S P AA T,S P AA T IH D
0.24419552087783813,ignore,IH G N AO R,IH G N AO R D
0.24396076798439026,zip,Z IH P,Z IH P T
0.2432161271572113,cube,K Y UW B,K Y UW B D
0.24224136769771576,cloak,K L OW K,K L OW K T
0.24212592840194702,kid,K IH D,K IH D IH D
0.2415040135383606,fissure,F IH SH ER,F IH SH ER D
0.24124544858932495,sting,S T IH NG,S T AH NG
0.24100086092948914,ratchet,R AE CH AH T,R AE CH AH T IH D
0.23984935879707336,boycott,B OY K AA T,B OY K AA T IH D
0.23956291377544403,crave,K R EY V,K R EY V D
0.23918665945529938,fudge,F AH JH,F AH JH D
0.23905271291732788,chase,CH EY S,CH EY S T
0.23796679079532623,snare,S N EH R,S N EH R D
0.23307278752326965,blink,B L IH NG K,B L IH NG K T
0.23251251876354218,ace,EY S,EY S T
0.2309560924768448,sum,S AH M,S AH M D
0.23059065639972687,glut,G L AH T,G L AH T IH D
0.23032823204994202,furrow,F ER OW,F ER OW D
0.2293098419904709,cliche,K L IY SH EY,K L IY SH EY D
0.2292385995388031,gloat,G L OW T,G L OW T IH D
0.2279699593782425,swish,S W IH SH,S W IH SH T
0.22720065712928772,er,ER,EH R D
0.22061946988105774,awe,AA,AO D
0.2194686233997345,able,EY B AH L,EY B AH L D
0.217756986618042,chime,CH AY M,CH AY M D
0.21477006375789642,sprout,S P R AW T,S P R AW T IH D
0.20756152272224426,eke,IY K,IY K T
0.20699970424175262,ease,IY Z,IY Z D
