activation,lemma,present_phones,past_phones
0.002721048891544342,dot,D AA T,D AA T AH D
0.002708934247493744,pellet,P EH L AH T,P EH L AH T IH D
0.002673722803592682,grill,G R IH L,G R IH L D
0.002622835338115692,writhe,R IH TH,R IH TH D
0.0025041326880455017,pillory,P IH L ER IY,P IH L ER IY D
0.002336554229259491,outgun,AW T G AH N,AW T G AH N D
0.0021711885929107666,sour,S AW ER,S AW ER D
0.002156481146812439,sate,S EY T,S EY T IH D
0.0021114498376846313,jam,JH AE M,JH AE M D
0.0021054521203041077,split,S P L IH T,S P L IH T
0.002071171998977661,chant,CH AE N T,CH AE N T IH D
0.001958779990673065,goad,G OW D,G OW D IH D
0.0018708780407905579,rape,R EY P,R EY P T
0.001848466694355011,shun,SH AH N,SH AH N D
0.0017784908413887024,scare,S K EH R,S K EH R D
0.0017536357045173645,coast,K OW S T,K OW S T IH D
0.0016949474811553955,rant,R AE N T,R AE N T IH D
0.0014944300055503845,suit,S UW T,S UW T IH D
0.0014775767922401428,don,D AA N,D AA N D
0.0013331770896911621,wet,W EH T,W EH T
0.0013331770896911621,whet,W EH T,W EH T IH D
0.0013033375144004822,robe,R OW B,R OW B D
0.0011748448014259338,hone,HH OW N,HH OW N D
0.0008952096104621887,term,T ER M,T ER M D
0.000701315701007843,hiss,HH IH S,HH IH S T
0.0005592182278633118,pare,P EH R,P EH R D
0.00045968592166900635,tee,T IY,T IY D
0.00020772218704223633,beg,B EH G,B EH G D
0.00011423975229263306,tier,T IY R,T IY R D
