activation,lemma,present_phones,past_phones
0.049074675887823105,relate,R IH L EY T,R IH L EY T IH D
0.0490252710878849,jot,JH AA T,JH AA T IH D
0.04899692162871361,agree,AH G R IY,AH G R IY D
0.048988226801157,hop,HH AA P,HH AA P T
0.04860607534646988,crown,K R AW N,K R AW N D
0.04850563779473305,park,P AA R K,P AA R K T
0.04845205321907997,affine,AH F AY N,AH F AY N D
0.04840074107050896,bake,B EY K,B EY K T
0.04819963127374649,crash,K R AE SH,K R AE SH T
0.04806399717926979,short,SH AO R T,SH AO R T IH D
0.04777956381440163,greet,G R IY T,G R IY T AH D
0.04746333137154579,browse,B R AW Z,B R AW Z D
0.04721251502633095,allay,AH L EY,AH L EY D
0.04705527052283287,shoot,SH UW T,SH AA T
0.04702604189515114,pluck,P L AH K,P L AH K T
0.04697160795331001,plop,P L AA P,P L AA P T
0.04690301790833473,clad,K L AE D,K L AE D
0.04664384573698044,halve,HH AE V,HH AE V D
0.04664384573698044,have,HH AE V,HH AE D
0.04645691066980362,loose,L UW S,L UW S T
0.04623790457844734,guard,G AA R D,G AA R D AH D
0.046126458793878555,knot,N AA T,N AA T IH D
0.04606539011001587,mail,M EY L,M EY L D
0.04600435495376587,book,B UH K,B UH K T
0.04597993567585945,fledge,F L EH JH,F L EH JH D
0.045816753059625626,blab,B L AE B,B L AE B D
0.045754317194223404,badger,B AE JH ER,B AE JH ER D
0.045743513852357864,birdie,B ER D IY,B ER D IY D
0.04570520296692848,buoy,B UW IY,B UW IY D
0.045704130083322525,elate,IH L EY T,IH L EY T AH D
0.04569967836141586,barrage,B ER AA ZH,B ER AA ZH D
0.045654553920030594,shake,SH EY K,SH UH K
0.04556781426072121,prod,P R AA D,P R AA D IH D
0.04555319622159004,whip,W IH P,W IH P T
0.04538222402334213,sip,S IH P,S IH P T
0.045165788382291794,gut,G AH T,G AH T IH D
0.0451509989798069,tip,T IH P,T IH P T
0.045082543045282364,space,S P EY S,S P EY S T
0.04502696916460991,watch,W AA CH,W AA CH T
0.044842157512903214,pawn,P AO N,P AO N D
0.04454517364501953,fit,F IH T,F IH T AH D
0.044466789811849594,glut,G L AH T,G L AH T IH D
0.044459450989961624,rob,R AA B,R AA B D
0.04442654922604561,tug,T AH G,T AH G D
0.044405702501535416,lodge,L AA JH,L AA JH D
0.044310312718153,duke,D UW K,D UW K T
0.0439923033118248,duel,D UW AH L,D UW AH L D
0.043858785182237625,drag,D R AE G,D R AE G D
0.04384404793381691,hurry,HH ER IY,HH ER IY D
0.04376194253563881,marry,M EH R IY,M EH R IY D
0.04342459514737129,lose,L UW Z,L AO S T
0.0433974452316761,annul,AE N AH L,AE N AH L D
0.043286584317684174,gum,G AH M,G AH M D
0.042936984449625015,harry,HH EH R IY,HH EH R IY D
0.042935628443956375,bruise,B R UW Z,B R UW Z D
0.04269733652472496,rule,R UW L,R UW L D
0.04263274744153023,gnaw,N AO,N AO D
0.0425296425819397,borrow,B AA R OW,B AA R OW D
0.04237060621380806,fish,F IH SH,F IH SH T
0.04235057905316353,burst,B ER S T,B ER S T
0.042158808559179306,corral,K ER AE L,K ER AE L D
0.042068127542734146,concur,K AH N K ER,K AH N K ER D
0.042055580765008926,whirl,W ER L,W ER L D
0.041808176785707474,throat,TH R OW T,TH R OW T IH D
0.041516516357660294,limit,L IH M AH T,L IH M AH T AH D
0.04132716730237007,arm,AA R M,AA R M D
0.04126036539673805,wish,W IH SH,W IH SH T
0.04114276543259621,board,B AO R D,B AO R D AH D
0.04112447053194046,rut,R AH T,R AH T IH D
0.04101843014359474,pause,P AO Z,P AO Z D
0.040928613394498825,goof,G UW F,G UW F T
0.040736470371484756,wall,W AO L,W AO L D
0.04059046879410744,luff,L AH F,L AH F T
0.04050040617585182,annoy,AH N OY,AH N OY D
0.04027586802840233,purse,P ER S,P ER S T
0.0401829369366169,tar,T AA R,T AA R D
0.04005645960569382,shame,SH EY M,SH EY M D
0.04004635289311409,hinder,HH IH N D ER,HH IH N D ER D
0.039862360805273056,ray,R EY,R EY D
0.0398288257420063,crunch,K R AH N CH,K R AH N CH T
0.03979891911149025,haunt,HH AO N T,HH AO N T IH D
0.03953802213072777,loot,L UW T,L UW T AH D
0.03927226737141609,toss,T AO S,T AO S T
0.039264049381017685,prick,P R IH K,P R IH K T
0.039184730499982834,gore,G AO R,G AO R D
0.0391734279692173,part,P AA R T,P AA R T IH D
0.038536619395017624,base,B EY S,B EY S T
0.03845667839050293,untie,AH N T AY,AH N T AY D
0.03819149360060692,huff,HH AH F,HH AH F T
0.038177598267793655,slice,S L AY S,S L AY S T
0.03816388174891472,rail,R EY L,R EY L D
0.038117390125989914,lure,L UH R,L UH R D
0.03799951821565628,bate,B EY T,B EY T IH D
0.03793223574757576,defame,D IH F EY M,D IH F EY M D
0.03792105242609978,sock,S AA K,S AA K T
0.03778059408068657,hook,HH UH K,HH UH K T
0.03768405690789223,court,K AO R T,K AO R T IH D
0.037389397621154785,snub,S N AH B,S N AH B D
0.037345658987760544,thumb,TH AH M,TH AH M D
0.03732617199420929,hurt,HH ER T,HH ER T
0.037296112626791,lace,L EY S,L EY S T
0.037070441991090775,egg,EH G,EH G D
0.037070441991090775,egge,EH G,EH G D
0.036970049142837524,dub,D AH B,D AH B D
0.03692740947008133,outlaw,AW T L AO,AW T L AO D
0.036863986402750015,hollow,HH AA L OW,HH AA L OW D
0.03682178631424904,nip,N IH P,N IH P T
0.03674205765128136,block,B L AA K,B L AA K T
0.036614373326301575,pop,P AA P,P AA P T
0.03638984635472298,berate,B IH R EY T,B IH R EY T IH D
0.03616349771618843,blade,B L EY D,B L EY D IH D
0.03615009784698486,bet,B EH T,B EH T
0.03614808991551399,deck,D EH K,D EH K T
0.03609843924641609,drive,D R AY V,D R OW V
0.035889241844415665,perk,P ER K,P ER K T
0.035851046442985535,waylay,W EY L EY,W EY L EY D
0.035764019936323166,gain,G EY N,G EY N D
0.035690728574991226,share,SH EH R,SH EH R D
0.035675060003995895,fence,F EH N S,F EH N S T
0.03558879718184471,loom,L UW M,L UW M D
0.0355432890355587,ruse,R UW Z,R UW Z D
0.03552713617682457,give,G IH V,G EY V
0.03552226349711418,ratchet,R AE CH AH T,R AE CH AH T IH D
0.03535396233201027,stage,S T EY JH,S T EY JH D
0.03520572558045387,change,CH EY N JH,CH EY N JH D
0.03516850620508194,stop,S T AA P,S T AA P T
0.03500858321785927,perch,P ER CH,P ER CH T
0.03496276214718819,char,CH AA R,CH AA R D
0.034795958548784256,bust,B AH S T,B AH S T IH D
0.03466637060046196,make,M EY K,M EY D
0.03456823527812958,pool,P UW L,P UW L D
0.034559670835733414,care,K EH R,K EH R D
0.034549739211797714,roar,R AO R,R AO R D
0.03453755006194115,corrode,K ER OW D,K ER OW D IH D
0.03453054651618004,show,SH OW,SH OW D
0.03451424837112427,immerse,IH M ER S,IH M ER S T
0.03441190719604492,stub,S T AH B,S T AH B D
0.034334227442741394,gush,G AH SH,G AH SH T
0.03400609269738197,ant,AE N T,AE N T IH D
0.033956971019506454,nurse,N ER S,N ER S T
0.03391693904995918,spice,S P AY S,S P AY S T
0.03389987349510193,lend,L EH N D,L EH N T
0.03387105092406273,dodge,D AA JH,D AA JH D
0.03385020047426224,let,L EH T,L EH T
0.03354731574654579,hunt,HH AH N T,HH AH N T AH D
0.03348236158490181,incur,IH N K ER,IH N K ER D
0.033475760370492935,mess,M EH S,M EH S T
0.03343547508120537,tuck,T AH K,T AH K T
0.03341801092028618,jerk,JH ER K,JH ER K T
0.033383000642061234,hush,HH AH SH,HH AH SH T
0.03328857198357582,pore,P AO R,P AO R D
0.03328857198357582,pour,P AO R,P AO R D
0.03327680006623268,patter,P AE T ER,P AE T ER D
0.03324766084551811,rough,R AH F,R AH F T
0.033207204192876816,trail,T R EY L,T R EY L D
0.03289633244276047,simmer,S IH M ER,S IH M ER D
0.03257109597325325,ensue,IH N S UW,IH N S UW D
0.032447028905153275,ax,AE K S,AE K S T
0.032447028905153275,axe,AE K S,AE K S T
0.03205354884266853,train,T R EY N,T R EY N D
0.03200823441147804,chug,CH AH G,CH AH G D
0.03165319189429283,idle,AY D AH L,AY D AH L D
0.031641025096178055,treasure,T R EH ZH ER,T R EH ZH ER D
0.03162306174635887,affront,AH F R AH N T,AH F R AH N T IH D
0.031485240906476974,cloak,K L OW K,K L OW K T
0.03142832592129707,recess,R IH S EH S,R IH S EH S T
0.031229231506586075,hoard,HH AO R D,HH AO R D IH D
0.031223632395267487,steep,S T IY P,S T IY P T
0.031211961060762405,recede,R IH S IY D,R AH S IY D IH D
0.03114940971136093,pale,P EY L,P EY L D
0.031043078750371933,date,D EY T,D EY T IH D
0.031034085899591446,rake,R EY K,R EY K T
0.030925307422876358,sleep,S L IY P,S L EH P T
0.030840681865811348,saw,S AO,S AO D
0.030798843130469322,rush,R AH SH,R AH SH T
0.030560512095689774,unwrap,AH N R AE P,AH N R AE P T
0.03054460510611534,chip,CH IH P,CH IH P T
0.0304131917655468,forget,F ER G EH T,F ER G AA T
0.030338220298290253,green,G R IY N,G R IY N D
0.030335526913404465,darn,D AA R N,D AA R N D
0.030160978436470032,daze,D EY Z,D EY Z D
0.02994050458073616,parade,P ER EY D,P ER EY D IH D
0.029906664043664932,peg,P EH G,P EH G D
0.02990179881453514,wash,W AA SH,W AA SH T
0.029889579862356186,crater,K R EY T ER,K R EY T ER D
0.02987690642476082,thrive,TH R AY V,TH R OW V
0.02987593784928322,pay,P EY,P EY D
0.029846254736185074,tool,T UW L,T UW L D
0.029813501983880997,parry,P EH R IY,P EH R IY D
0.02950635924935341,apply,AH P L AY,AH P L AY D
0.029335223138332367,shape,SH EY P,SH EY P T
0.029333140701055527,fleece,F L IY S,F L IY S T
0.02930033579468727,bowe,B OW,B AW D
0.029155727475881577,enmesh,EH N M EH SH,EH N M EH SH T
0.02896112948656082,reign,R EY N,R EY N D
0.02896112948656082,rein,R EY N,R EY N D
0.028787123039364815,gather,G AE DH ER,G AE DH ER D
0.02875012531876564,create,K R IY EY T,K R IY EY T AH D
0.028701838105916977,hoot,HH UW T,HH UW T IH D
0.02844155952334404,tail,T EY L,T EY L D
0.028390247374773026,broil,B R OY L,B R OY L D
0.028070371598005295,ally,AE L AY,AH L AY D
0.027974653989076614,term,T ER M,T ER M D
0.027920838445425034,boost,B UW S T,B UW S T IH D
0.027618013322353363,root,R UW T,R UW T AH D
0.027618013322353363,route,R UW T,R UW T IH D
0.027314890176057816,touch,T AH CH,T AH CH T
0.027232017368078232,sulk,S AH L K,S AH L K T
0.02720709517598152,edge,EH JH,EH JH D
0.02715166285634041,turn,T ER N,T ER N D
0.026987846940755844,treat,T R IY T,T R IY T IH D
0.026976052671670914,snack,S N AE K,S N AE K T
0.026962120085954666,fault,F AO L T,F AO L T IH D
0.026874635368585587,rub,R AH B,R AH B D
0.026865266263484955,gate,G EY T,G EY T IH D
0.026620451360940933,clot,K L AA T,K L AA T AH D
0.026618827134370804,raise,R EY Z,R EY Z D
0.026618827134370804,raze,R EY Z,R EY Z D
0.026554178446531296,bare,B EH R,B EH R D
0.02653096616268158,groan,G R OW N,G R OW N D
0.02649698033928871,flop,F L AA P,F L AA P T
0.026456231251358986,hate,HH EY T,HH EY T AH D
0.026286538690328598,get,G EH T,G AA T
0.02610800787806511,bedevil,B IH D EH V AH L,B IH D EH V AH L D
0.026098571717739105,commemorate,K AH M EH M ER EY T,K AH M EH M ER EY T IH D
0.02604570984840393,guess,G EH S,G EH S T
0.026015229523181915,race,R EY S,R EY S T
0.025820042937994003,freak,F R IY K,F R IY K T
0.025641445070505142,jacket,JH AE K AH T,JH AE K AH T IH D
0.025458749383687973,phrase,F R EY Z,F R EY Z D
0.025318454951047897,bowl,B OW L,B OW L D
0.02530210092663765,conserve,K AH N S ER V,K AH N S ER V D
0.0252891443669796,meld,M EH L D,M EH L D AH D
0.0251828171312809,gaze,G EY Z,G EY Z D
0.02510327473282814,verse,V ER S,V ER S T
0.024968285113573074,walk,W AO K,W AO K T
0.024869482964277267,chew,CH UW,CH UW D
0.024784859269857407,drone,D R OW N,D R OW N D
0.024745512753725052,cloud,K L AW D,K L AW D IH D
0.024733182042837143,wretch,R EH CH,R EH CH IH D
0.024662885814905167,coop,K UW P,K UW P T
0.024579357355833054,jell,JH EH L,JH EH L D
0.02454499527812004,work,W ER K,W ER K T
0.024304959923028946,moor,M UH R,M UH R D
0.0242018885910511,fall,F AO L,F EH L
0.02417098358273506,putt,P AH T,P AH T IH D
0.023914016783237457,clue,K L UW,K L UW D
0.023878611624240875,careen,K ER IY N,K ER IY N D
0.023656640201807022,maim,M EY M,M EY M D
0.02347547933459282,mate,M EY T,M EY T IH D
0.023270290344953537,trot,T R AA T,T R AA T IH D
0.023135464638471603,loop,L UW P,L UW P T
0.023113131523132324,wail,W EY L,W EY L D
0.02292691543698311,veil,V EY L,V EY L D
0.022894080728292465,hem,HH EH M,HH EH M D
0.022883880883455276,butter,B AH T ER,B AH T ER D
0.022876154631376266,shy,SH AY,SH AY D
0.02286805957555771,tattoo,T AE T UW,T AE T UW D
0.022773202508687973,melt,M EH L T,M EH L T AH D
0.022618919610977173,excerpt,EH K S ER P T,EH K S ER P T IH D
0.02259434387087822,tatter,T AE T ER,T AE T ER D
0.022575948387384415,waft,W AA F T,W AA F T IH D
0.022443078458309174,wreck,R EH K,R EH K T
0.022323060780763626,carve,K AA R V,K AA R V D
0.022237855941057205,stud,S T AH D,S T AH D IH D
0.02200895920395851,resend,R IH Z EH N D,R IH Z EH N T
0.021998204290866852,dare,D EH R,D EH R D
0.021662894636392593,mend,M EH N D,M EH N D IH D
0.021307487040758133,chuck,CH AH K,CH AH K T
0.02101999893784523,tune,T UW N,T UW N D
0.020913247019052505,ply,P L AY,P L AY D
0.02085885778069496,preen,P R IY N,P R IY N D
0.020805947482585907,groin,G R OY N,G R OY N D
0.020795375108718872,rate,R EY T,R EY T IH D
0.02075967565178871,gust,G AH S T,G AH S T IH D
0.020630696788430214,bleed,B L IY D,B L EH D
0.020526010543107986,tough,T AH F,T AH F T
0.020446080714464188,issue,IH SH UW,IH SH UW D
0.02018938958644867,fool,F UW L,F UW L D
0.02003886178135872,worry,W ER IY,W ER IY D
0.019983138889074326,woo,W UW,W UW D
0.019918221980333328,stoop,S T UW P,S T UW P T
0.01968473196029663,click,K L IH K,K L IH K T
0.019615136086940765,growl,G R AW L,G R AW L D
0.019543323665857315,sue,S UW,S UW D
0.019482702016830444,scoop,S K UW P,S K UW P T
0.019222665578126907,zap,Z AE P,Z AE P T
0.01919654756784439,achieve,AH CH IY V,AH CH IY V D
0.019156452268362045,trick,T R IH K,T R IH K T
0.019007094204425812,attire,AH T AY ER,AH T AY R D
0.018825765699148178,elude,IH L UW D,IH L UW D IH D
0.01839492842555046,shade,SH EY D,SH EY D IH D
0.018340911716222763,dream,D R IY M,D R IY M D
0.01827409118413925,inter,IH N T ER,IH N T ER D
0.01810881495475769,shove,SH AH V,SH AH V D
0.01799769327044487,pen,P EH N,P EH N D
0.017992932349443436,baste,B EY S T,B EY S T AH D
0.017966939136385918,coerce,K OW ER S,K OW ER S T
0.017724130302667618,allot,AH L AA T,AH L AA T IH D
0.017611075192689896,doe,D OW,D IH D
0.017510738223791122,accrue,AH K R UW,AH K R UW D
0.017382893711328506,port,P AO R T,P AO R T IH D
0.01734493300318718,buy,B AY,B AA T
0.017199072986841202,bone,B OW N,B OW N D
0.017121706157922745,chart,CH AA R T,CH AA R T AH D
0.016969677060842514,banish,B AE N IH SH,B AE N IH SH T
0.01694924384355545,say,S EY,S EH D
0.016949022188782692,fay,F EY,F EY D
0.016820359975099564,convert,K AA N V ER T,K AH N V ER T IH D
0.016779113560914993,dole,D OW L,D OW L D
0.016605254262685776,pain,P EY N,P EY N D
0.01658165082335472,sob,S AA B,S AA B D
0.016489971429109573,dupe,D UW P,D UW P T
0.015745464712381363,blue,B L UW,B L UW D
0.015624720603227615,prime,P R AY M,P R AY M D
0.015496574342250824,emerge,IH M ER JH,IH M ER JH D
0.015462372452020645,shine,SH AY N,SH OW N
0.015455450862646103,amaze,AH M EY Z,AH M EY Z D
0.015315193682909012,tell,T EH L,T OW L D
0.015267554670572281,top,T AA P,T AA P T
0.015086442232131958,claim,K L EY M,K L EY M D
0.01505214348435402,compete,K AH M P IY T,K AH M P IY T IH D
0.015027854591608047,hole,HH OW L,HH OW L D
0.015004370361566544,allude,AH L UW D,AH L UW D IH D
0.014738749712705612,take,T EY K,T UH K
0.014343637973070145,reject,R IH JH EH K T,R IH JH EH K T IH D
0.014150857925415039,mow,M OW,M OW D
0.014061402529478073,gutter,G AH T ER,G AH T ER D
0.01385708898305893,drill,D R IH L,D R IH L D
0.013856049627065659,mutter,M AH T ER,M AH T ER D
0.013556450605392456,answer,AE N S ER,AE N S ER D
0.013381358236074448,stitch,S T IH CH,S T IH CH T
0.013232976198196411,loan,L OW N,L OW N D
0.013167332857847214,merge,M ER JH,M ER JH D
0.01312253251671791,comb,K OW M,K OW M D
0.013092417269945145,blow,B L OW,B L UW
0.012877533212304115,wallow,W AA L OW,W AA L OW D
0.012793594971299171,grill,G R IH L,G R IH L D
0.012776914983987808,pace,P EY S,P EY S T
0.012518513947725296,pony,P OW N IY,P OW N IY D
0.012366537004709244,chop,CH AA P,CH AA P T
0.012250710278749466,avail,AH V EY L,AH V EY L D
0.01211763359606266,grin,G R IH N,G R IH N D
0.012074822559952736,coach,K OW CH,K OW CH T
0.012050073593854904,go,G OW,W EH N T
0.011926624923944473,permeate,P ER M IY EY T,P ER M IY EY T IH D
0.011875618249177933,roost,R UW S T,R UW S T IH D
0.01177072525024414,cater,K EY T ER,K EY T ER D
0.011565621942281723,taunt,T AO N T,T AO N T IH D
0.011436929926276207,clam,K L AE M,K L AE M D
0.011417295783758163,slip,S L IH P,S L IH P T
0.011225122958421707,commend,K AH M EH N D,K AH M EH N D IH D
0.01108575239777565,firm,F ER M,F ER M D
0.010984692722558975,glare,G L EH R,G L EH R D
0.01066083088517189,derive,D ER AY V,D ER AY V D
0.010648604482412338,zip,Z IH P,Z IH P T
0.0105331651866436,stretch,S T R EH CH,S T R EH CH T
0.0104854516685009,dent,D EH N T,D EH N T IH D
0.010408785194158554,eke,IY K,IY K T
0.01020493358373642,herd,HH ER D,HH ER D IH D
0.009986188262701035,thrash,TH R AE SH,TH R AE SH T
0.00991974025964737,wad,W AA D,W AA D IH D
0.00989103689789772,pelt,P EH L T,P EH L T IH D
0.009679675102233887,stack,S T AE K,S T AE K T
0.009515725076198578,wake,W EY K,W OW K
0.0094866082072258,wane,W EY N,W EY N D
0.00947769358754158,search,S ER CH,S ER CH T
0.009347692131996155,shed,SH EH D,SH EH D
0.00927332416176796,jet,JH EH T,JH EH T IH D
0.009198427200317383,mesh,M EH SH,M EH SH T
0.00901443138718605,furrow,F ER OW,F ER OW D
0.008783262223005295,hone,HH OW N,HH OW N D
0.008485261350870132,tame,T EY M,T EY M D
0.008145472034811974,freeze,F R IY Z,F R OW Z
0.007993590086698532,pet,P EH T,P EH T IH D
0.00791093148291111,roll,R OW L,R OW L D
0.007869917899370193,row,R OW,R OW D
0.007861677557229996,thrill,TH R IH L,TH R IH L D
0.00765967695042491,facet,F AE S AH T,F AE S AH T IH D
0.007633970584720373,audit,AO D IH T,AO D IH T IH D
0.0076247635297477245,tailor,T EY L ER,T EY L ER D
0.007476489525288343,contract,K AA N T R AE K T,K AA N T R AE K T AH D
0.007343315985053778,clash,K L AE SH,K L AE SH T
0.007233719807118177,pare,P EH R,P EH R D
0.007060482632368803,sneak,S N IY K,S N IY K T
0.006633784156292677,curve,K ER V,K ER V D
0.006617605220526457,levy,L EH V IY,L EH V IY D
0.006602886598557234,rocket,R AA K AH T,R AA K AH T IH D
0.006420846562832594,ice,AY S,AY S T
0.006314727943390608,brim,B R IH M,B R IH M D
0.006297591608017683,end,EH N D,EH N D AH D
0.005751192104071379,pocket,P AA K AH T,P AA K AH T IH D
0.005349676590412855,prune,P R UW N,P R UW N D
0.004916716832667589,groom,G R UW M,G R UW M D
0.004901498090475798,dine,D AY N,D AY N D
0.0048895287327468395,moan,M OW N,M OW N D
0.004806827288120985,snare,S N EH R,S N EH R D
0.004544516559690237,rape,R EY P,R EY P T
0.004475850146263838,mourn,M AO R N,M AO R N D
0.004458922427147627,rent,R EH N T,R EH N T IH D
0.004399250727146864,rile,R AY L,R AY L D
0.0037105954252183437,glue,G L UW,G L UW D
0.0035580950789153576,slay,S L EY,S L UW
0.003476001787930727,nod,N AA D,N AA D AH D
0.0032181027345359325,glow,G L OW,G L OW D
0.002877186518162489,stun,S T AH N,S T AH N D
0.0025220545940101147,wrest,R EH S T,R EH S T IH D
0.0022426671348512173,sky,S K AY,S K IY D
0.0018495279364287853,gnarl,N AA R L,N AA R L D
0.0016601118259131908,chain,CH EY N,CH EY N D
0.001503403764218092,letter,L EH T ER,L EH T ER D
0.0012796702794730663,surf,S ER F,S ER F T
0.0008966657915152609,vary,V EH R IY,V EH R IY D
0.0008282508351840079,smack,S M AE K,S M AE K T
0.0007438692846335471,purge,P ER JH,P ER JH D
0.00044513080501928926,draw,D R AO,D R UW
0.0004222686984576285,check,CH EH K,CH EH K T
0.0003318111994303763,tuft,T AH F T,T AH F T IH D
0.00018711718439590186,hose,HH OW Z,HH OW Z D
4.990729212295264e-05,push,P UH SH,P UH SH T
3.704013943206519e-05,lawyer,L AO Y ER,L AO Y ER D
1.742276072036475e-05,glove,G L AH V,G L AH V D
