activation,lemma,present_phones,past_phones
1.8298938274383545,retrofit,R EH T R OW F IH T,R EH T R OW F IH T IH D
0.9206255078315735,introvert,IH N T R OW V ER T,IH N T R OW V ER T IH D
0.6017400622367859,regiment,R EH JH AH M AH N T,R EH JH AH M EH N T IH D
0.42100220918655396,resubmit,R IY S AH B M IH T,R IY S AH B M IH T IH D
0.39516109228134155,reevaluate,R IY IH V AE L UW EY T,R IY IH V AE L Y UW EY T IH D
0.36192208528518677,regulate,R EH G Y AH L EY T,R EH G Y AH L EY T IH D
0.34398388862609863,retrench,R IY T R EH N CH,R IY T R EH N CH T
0.24858884513378143,redraft,R IY D R AE F T,R IY D R AE F T IH D
0.06964398920536041,glorify,G L AO R AH F AY,G L AO R AH F AY D
