activation,lemma,present_phones,past_phones
0.4010935425758362,outmode,AW T M OW D,AW T M OW D IH D
0.39409661293029785,divide,D IH V AY D,D IH V AY D IH D
0.3937816619873047,amend,AH M EH N D,AH M EH N D IH D
0.3911205232143402,delude,D IH L UW D,D IH L UW D IH D
0.38133931159973145,deride,D IH R AY D,D IH R AY D IH D
0.3773336410522461,unread,AH N R EH D,AH N R EH D
0.3744967579841614,impede,IH M P IY D,IH M P IY D IH D
0.3736048936843872,embed,IH M B EH D,EH M B EH D IH D
0.3736048936843872,imbed,IH M B EH D,IH M B EH D IH D
0.3711697459220886,denude,D IH N UW D,D IH N UW D IH D
0.36645859479904175,reread,R IY R IY D,R IY R IY D
0.36247554421424866,pervade,P ER V EY D,P ER V EY D IH D
0.3578975796699524,exude,IH G Z UW D,IH G Z UW D IH D
0.348907470703125,collide,K AH L AY D,K AH L AY D IH D
0.3483605980873108,stride,S T R AY D,S T R OW D
0.3481385409832001,recede,R IH S IY D,R AH S IY D IH D
0.3437882363796234,reload,R IY L OW D,R IY L OW D IH D
0.34009644389152527,collude,K AH L UW D,K AH L UW D IH D
0.33797383308410645,reside,R IH Z AY D,R IH Z AY D IH D
0.33398744463920593,upload,AH P L OW D,AH P L OW D IH D
0.3334871530532837,unwed,AH N W EH D,AH N W EH D
0.33343306183815,abrade,AE B R EY D,AE B R EY D IH D
0.333003968000412,spread,S P R EH D,S P R EH D
0.3326681852340698,scald,S K AO L D,S K AO L D IH D
0.33097395300865173,invade,IH N V EY D,IH N V EY D AH D
0.3306984603404999,award,AH W AO R D,AH W AO R D IH D
0.3298758864402771,decide,D IH S AY D,D IH S AY D IH D
0.32418227195739746,trend,T R EH N D,T R EH N D IH D
0.3240242004394531,append,AH P EH N D,AH P EH N D IH D
0.3171180486679077,blend,B L EH N D,B L EH N D IH D
0.315954327583313,accede,AE K S IY D,AE K S IY D IH D
0.3120502531528473,brand,B R AE N D,B R AE N D IH D
0.31196314096450806,outbid,AW T B IH D,AW T B IH D
0.3109346330165863,decode,D IH K OW D,D IH K OW D AH D
0.30974817276000977,secede,S IH S IY D,S IH S IY D IH D
0.30168765783309937,spend,S P EH N D,S P EH N T
0.2996424436569214,applaud,AH P L AO D,AH P L AO D IH D
0.2962716221809387,stand,S T AE N D,S T UH D
0.29614806175231934,surround,S ER AW N D,S ER AW N D IH D
0.2884518504142761,scold,S K OW L D,S K OW L D IH D
0.2853456735610962,encode,EH N K OW D,EH N K OW D IH D
0.28222185373306274,blind,B L AY N D,B L AY N D IH D
0.27759549021720886,rebid,R IY B IH D,R IY B IH D
0.2731400430202484,forbid,F ER B IH D,F ER B IH D
0.2610968053340912,blunder,B L AH N D ER,B L AH N D ER D
0.19563129544258118,ravage,R AE V IH JH,R AE V IH JH D
0.18466070294380188,savage,S AE V AH JH,S AE V IH JH D
0.17821210622787476,oblige,AH B L AY JH,AH B L AY JH D
0.17797455191612244,meander,M IY AE N D ER,M IY AE N D ER D
0.17574262619018555,diverge,D IH V ER JH,D AY V ER JH D
0.16997921466827393,befuddle,B IH F AH D AH L,B IH F AH D AH L D
0.16125431656837463,straddle,S T R AE D AH L,S T R AE D AH L D
0.1530720293521881,surge,S ER JH,S ER JH D
0.14287900924682617,average,AE V ER IH JH,AE V R AH JH D
0.1420266032218933,outvote,AW T V OW T,AW T V OW T IH D
0.1409779191017151,gauge,G EY JH,G EY JH D
0.14084303379058838,budget,B AH JH IH T,B AH JH IH T AH D
0.14035794138908386,wage,W EY JH,W EY JH D
0.13964727520942688,dodge,D AA JH,D AA JH D
0.13740825653076172,wedge,W EH JH,W EH JH D
0.13659226894378662,nudge,N AH JH,N AH JH D
0.13589590787887573,damage,D AE M AH JH,D AE M AH JH D
0.13426747918128967,cage,K EY JH,K EY JH D
0.13398733735084534,embody,IH M B AA D IY,IH M B AA D IY D
0.13326480984687805,purge,P ER JH,P ER JH D
0.12974804639816284,abridge,AH B R IH JH,AH B R IH JH D
0.12952610850334167,budge,B AH JH,B AH JH D
0.127969890832901,gouge,G AW JH,G AW JH D
0.127264142036438,rage,R EY JH,R EY JH D
0.12459550052881241,page,P EY JH,P EY JH D
0.12393876165151596,burgeon,B ER JH AH N,B ER JH AH N D
0.12392916530370712,judge,JH AH JH,JH AH JH D
0.12146603316068649,curry,K AH R IY,K ER IY D
0.12113850563764572,ridge,R IH JH,R IH JH D
0.11996360868215561,rummage,R AH M IH JH,R AH M IH JH D
0.11841432005167007,divvy,D IH V IY,D IH V IY D
0.11824849992990494,outrage,AW T R EY JH,AW T R EY JH D
0.11813931912183762,pillage,P IH L IH JH,P IH L IH JH D
0.11812498420476913,splurge,S P L ER JH,S P L ER JH D
0.1178671196103096,badger,B AE JH ER,B AE JH ER D
0.11776939779520035,fudge,F AH JH,F AH JH D
0.11661284416913986,perjure,P ER JH ER,P ER JH ER D
0.11528066545724869,cajole,K AH JH OW L,K AH JH OW L D
0.11428583413362503,carry,K AE R IY,K AE R IY D
0.11085405200719833,hedge,HH EH JH,HH EH JH D
0.11037810891866684,lodge,L AA JH,L AA JH D
0.10880739241838455,cringe,K R IH N JH,K R IH N JH D
0.10408774763345718,devote,D IH V OW T,D IH V OW T IH D
0.10388826578855515,upvote,AH P V OW T,AH P V OW T IH D
0.10342515259981155,besiege,B IH S IY JH,B IH S IY JH D
0.10209860652685165,merge,M ER JH,M ER JH D
0.10191545635461807,wager,W EY JH ER,W EY JH ER D
0.10026118904352188,enrage,EH N R EY JH,EH N R EY JH D
0.09898059815168381,sponge,S P AH N JH,S P AH N JH D
0.09609431773424149,parody,P EH R AH D IY,P EH R AH D IY D
0.09592612832784653,manage,M AE N AH JH,M AE N AH JH D
0.09492521733045578,envy,EH N V IY,EH N V IY D
0.09226075559854507,injure,IH N JH ER,IH N JH ER D
0.0887213721871376,delete,D IH L IY T,D IH L IY T AH D
0.0885421559214592,package,P AE K AH JH,P AE K IH JH D
0.08831121772527695,pervert,P ER V ER T,P ER V ER T IH D
0.08693429082632065,tattoo,T AE T UW,T AE T UW D
0.08630449324846268,major,M EY JH ER,M EY JH ER D
0.08478441089391708,even,IY V IH N,IY V AH N D
0.0827941820025444,serve,S ER V,S ER V D
0.08236513286828995,agree,AH G R IY,AH G R IY D
0.07818866521120071,rivet,R IH V AH T,R IH V AH T IH D
0.07681397348642349,allure,AH L UH R,AH L UH R D
0.07622488588094711,engage,EH N G EY JH,EH N G EY JH D
0.07541341334581375,invite,IH N V AY T,IH N V AY T AH D
0.07103221863508224,demote,D IH M OW T,D IH M OW T IH D
0.07024376839399338,smell,S M EH L,S M EH L D
0.06953074783086777,canoe,K AH N UW,K AH N UW D
0.06838763505220413,tank,T AE NG K,T AE NG K T
0.06827937811613083,survive,S ER V AY V,S ER V AY V D
0.06814549118280411,plunge,P L AH N JH,P L AH N JH D
0.06750313192605972,hijack,HH AY JH AE K,HH AY JH AE K T
0.06697758287191391,caddie,K AE D IY,K AE D IY D
0.06697758287191391,caddy,K AE D IY,K AE D IY D
0.0658644363284111,shaft,SH AE F T,SH AE F T IH D
0.06572691351175308,weary,W IH R IY,W IH R IY D
0.0650019571185112,pivot,P IH V AH T,P IH V AH T IH D
0.06453140825033188,devise,D IH V AY Z,D IH V AY Z D
0.06322117894887924,dally,D AE L IY,D AE L IY D
0.06297571212053299,ear,IY R,IH R D
0.06276609748601913,email,IY M EY L,IY M EY L D
0.06266506761312485,heave,HH IY V,HH IY V D
0.061426155269145966,survey,S ER V EY,S ER V EY D
0.06101711839437485,revert,R IH V ER T,R IH V ER T IH D
0.060880936682224274,cave,K EY V,K EY V D
0.060320593416690826,denote,D IH N OW T,D IH N OW T AH D
0.059644363820552826,curve,K ER V,K ER V D
0.059226714074611664,tuft,T AH F T,T AH F T IH D
0.05898597091436386,reveal,R IH V IY L,R IH V IY L D
0.05897656828165054,bang,B AE NG,B AE NG D
0.05896493047475815,yank,Y AE NG K,Y AE NG K T
0.058416612446308136,hinge,HH IH N JH,HH IH N JH D
0.05826511234045029,abort,AH B AO R T,AH B AO R T IH D
0.057986997067928314,thank,TH AE NG K,TH AE NG K T
0.0577392652630806,lavish,L AE V IH SH,L AE V IH SH T
0.05741562694311142,save,S EY V,S EY V D
0.05682282894849777,rally,R AE L IY,R AE L IY D
0.05678772181272507,rewrite,R IY R AY T,R IY R OW T
0.05641200393438339,shave,SH EY V,SH EY V D
0.0561286136507988,rely,R IH L AY,R IH L AY D
0.056088827550411224,dredge,D R EH JH,D R EH JH D
0.0558900460600853,halve,HH AE V,HH AE V D
0.0558900460600853,have,HH AE V,HH AE D
0.05566137284040451,barge,B AA R JH,B AA R JH D
0.055512093007564545,outfit,AW T F IH T,AW T F IH T IH D
0.0553738996386528,sing,S IH NG,S AE NG
0.05519285053014755,leave,L IY V,L EH F T
0.05484946817159653,abet,AH B EH T,AH B EH T IH D
0.054765962064266205,defy,D IH F AY,D IH F AY D
0.05426349490880966,winge,W IH N JH,W IH NG D
0.05365016311407089,wing,W IH NG,W IH NG D
0.05332603305578232,eat,IY T,EY T
0.052964143455028534,crawl,K R AO L,K R AO L D
0.05288512259721756,ring,R IH NG,R IH NG D
0.05288512259721756,wring,R IH NG,R AH NG
0.05278687924146652,peeve,P IY V,P IY V D
0.05274330824613571,hunker,HH AH NG K ER,HH AH NG K ER D
0.05274026840925217,unite,Y UW N AY T,Y UW N AY T IH D
0.05259820073843002,claw,K L AO,K L AO D
0.052483223378658295,accost,AH K AO S T,AH K AA S T IH D
0.052261777222156525,gloss,G L AO S,G L AO S T
0.05221966654062271,rave,R EY V,R EY V D
0.051841966807842255,dive,D AY V,D AY V D
0.05180562287569046,bank,B AE NG K,B AE NG K T
0.051695697009563446,weave,W IY V,W OW V
0.05143185704946518,desire,D IH Z AY ER,D IH Z AY ER D
0.051249437034130096,live,L AY V,L IH V D
0.05104585736989975,snort,S N AO R T,S N AO R T IH D
0.05103454738855362,bing,B IH NG,B IH N JH D
0.0505903884768486,livery,L IH V ER IY,L IH V R IY D
0.05035766214132309,waive,W EY V,W EY V D
0.05035766214132309,wave,W EY V,W EY V D
0.0495811328291893,hang,HH AE NG,HH AH NG
0.04948657006025314,wink,W IH NG K,W IH NG K T
0.04933273047208786,revise,R IH V AY Z,R IH V AY Z D
0.04864468425512314,eke,IY K,IY K T
0.04863571375608444,review,R IY V Y UW,R IY V Y UW D
0.048045091331005096,rebuff,R IH B AH F,R IH B AH F T
0.04748516529798508,deny,D IH N AY,D IH N AY D
0.04679582267999649,tinker,T IH NG K ER,T IH NG K ER D
0.04599771648645401,give,G IH V,G EY V
0.04577784985303879,cure,K Y UH R,K Y UH R D
0.045621223747730255,drawl,D R AO L,D R AO L D
0.04530181735754013,trudge,T R AH JH,T R AH JH D
0.04524271935224533,apply,AH P L AY,AH P L AY D
0.04517648369073868,tinge,T IH N JH,T IH NG D
0.04487796872854233,revive,R IH V AY V,R IH V AY V D
0.04481317847967148,ignite,IH G N AY T,IH G N AY T IH D
0.04466699808835983,inlet,IH N L EH T,IH N L EH T
0.04441770166158676,pave,P EY V,P EY V D
0.0443948432803154,muddy,M AH D IY,M AH D IY D
0.04434450715780258,love,L AH V,L AH V D
0.04425694793462753,throng,TH R AO NG,TH R AO NG D
0.04409614950418472,tongue,T AH NG,T AH NG D
0.04391228407621384,advise,AE D V AY Z,AE D V AY Z D
0.043287090957164764,revile,R IY V AY L,R IY V AY L D
0.04272208362817764,recite,R AH S AY T,R AH S AY T IH D
0.04263784736394882,exit,EH G Z IH T,EH G Z AH T IH D
0.04263273626565933,lunge,L AH N JH,L AH N JH D
0.04257332533597946,levy,L EH V IY,L EH V IY D
0.04223980754613876,draw,D R AO,D R UW
0.04220931977033615,binge,B IH N JH,B IH N JH D
0.042066194117069244,ting,T IH NG,T IH NG D
0.04187982529401779,rev,R EH V,R EH V D
0.04177393764257431,garb,G AA R B,G AA R B D
0.04151584953069687,defer,D IH F ER,D IH F ER D
0.04151410609483719,think,TH IH NG K,TH AO T
0.04140136390924454,unleash,AH N L IY SH,AH N L IY SH T
0.041252948343753815,pity,P IH T IY,P IH T IY D
0.04122977703809738,smudge,S M AH JH,S M AH JH D
0.040923111140728,reroute,R IY R UW T,R IY R UW T IH D
0.040488891303539276,snare,S N EH R,S N EH R D
0.04044673591852188,dunk,D AH NG K,D AH NG K T
0.04033007472753525,floor,F L AO R,F L AO R D
0.040259040892124176,ping,P IH NG,P IH NG D
0.03993750363588333,shove,SH AH V,SH AH V D
0.039865754544734955,quit,K W IH T,K W IH T
0.03965765982866287,ready,R EH D IY,R EH D IY D
0.03945399075746536,renew,R IH N UW,R IH N UW D
0.03936614841222763,thwart,TH W AO R T,TH W AO R T IH D
0.03895663470029831,permit,P ER M IH T,P ER M IH T IH D
0.038245148956775665,pledge,P L EH JH,P L EH JH D
0.03794308751821518,outset,AW T S EH T,AW T S EH T
0.037883780896663666,spatter,S P AE T ER,S P AE T ER D
0.03781972825527191,assess,AH S EH S,AH S EH S T
0.03778790682554245,shunt,SH AH N T,SH AH N T IH D
0.03754514455795288,shiver,SH IH V ER,SH IH V ER D
0.037423692643642426,link,L IH NG K,L IH NG K T
0.03723711520433426,charge,CH AA R JH,CH AA R JH D
0.037230975925922394,glide,G L AY D,G L AY D IH D
0.035728514194488525,gift,G IH F T,G IH F T AH D
0.03526647388935089,plead,P L IY D,P L IY D IH D
0.03526441007852554,savor,S EY V ER,S EY V ER D
0.035216934978961945,club,K L AH B,K L AH B D
0.035131894052028656,wrong,R AO NG,R AO NG D
0.03461713343858719,prong,P R AO NG,P R AO NG D
0.0343954935669899,borrow,B AA R OW,B AA R OW D
0.03435048460960388,assert,AH S ER T,AH S ER T IH D
0.0343286395072937,cross,K R AO S,K R AO S T
0.034089572727680206,darn,D AA R N,D AA R N D
0.03408631682395935,move,M UW V,M UW V D
0.03364770859479904,invert,IH N V ER T,IH N V ER T IH D
0.033614061772823334,scourge,S K ER JH,S K ER JH D
0.033202655613422394,long,L AO NG,L AO NG D
0.032701246440410614,untie,AH N T AY,AH N T AY D
0.03257375210523605,dwell,D W EH L,D W EH L T
0.032514266669750214,angle,AE NG G AH L,AE NG G AH L D
0.032388925552368164,spur,S P ER,S P ER D
0.03234877437353134,waver,W EY V ER,W EY V ER D
0.03218313306570053,clot,K L AA T,K L AA T AH D
0.032182417809963226,barb,B AA R B,B AA R B D
0.03215355426073074,raft,R AE F T,R AE F T IH D
0.032068751752376556,demur,D IH M ER,D IH M ER D
0.03136788308620453,bridge,B R IH JH,B R IH JH D
0.0312466099858284,sink,S IH NG K,S AE NG K
0.031220480799674988,sully,S AH L IY,S AH L IY D
0.0308757945895195,singe,S IH N JH,S IH N JH D
0.03011970967054367,dome,D OW M,D OW M D
0.03010106086730957,bleed,B L IY D,B L EH D
0.030067555606365204,treat,T R IY T,T R IY T IH D
0.029758207499980927,surmise,S ER M AY Z,S ER M AY Z D
0.029566161334514618,please,P L IY Z,P L IY Z D
0.029404819011688232,nurse,N ER S,N ER S T
0.029385559260845184,allege,AH L EH JH,AH L EH JH D
0.029265038669109344,dart,D AA R T,D AA R T IH D
0.029232509434223175,dare,D EH R,D EH R D
0.029211722314357758,dress,D R EH S,D R EH S T
0.0291668102145195,zag,Z AE G,Z AE G D
0.029143013060092926,spurt,S P ER T,S P ER T IH D
0.029117420315742493,zoom,Z UW M,Z UW M D
0.029095374047756195,sneer,S N IH R,S N IH R D
0.028842471539974213,remit,R IY M IH T,R IY M IH T IH D
0.028821811079978943,deem,D IY M,D IY M D
0.028563521802425385,stilt,S T IH L T,S T IH L T IH D
0.028340615332126617,blare,B L EH R,B L EH R D
0.02823176234960556,flaunt,F L AO N T,F L AO N T IH D
0.02808217704296112,busy,B IH Z IY,B IH Z IY D
0.028034642338752747,tally,T AE L IY,T AE L IY D
0.027925021946430206,glare,G L EH R,G L EH R D
0.027784563601017,retry,R IY T R AY,R IY T R AY D
0.027737237513065338,cart,K AA R T,K AA R T IH D
0.027556419372558594,out,AW T,AW T AH D
0.02732212096452713,conjure,K AA N JH ER,K AA N JH ER D
0.027262181043624878,spare,S P EH R,S P EH R D
0.027010492980480194,salary,S AE L ER IY,S AE L ER IY D
0.026968859136104584,card,K AA R D,K AA R D IH D
0.026877015829086304,bath,B AE TH,B EY DH D
0.026802130043506622,doe,D OW,D IH D
0.026758991181850433,amount,AH M AW N T,AH M AW N T IH D
0.02665475755929947,emerge,IH M ER JH,IH M ER JH D
0.02663203328847885,adore,AH D AO R,AH D AO R D
0.026418790221214294,oppose,AH P OW Z,AH P OW Z D
0.026405058801174164,addict,AH D IH K T,AH D IH K T IH D
0.026296235620975494,refit,R IY F IH T,R IY F IH T IH D
0.026276521384716034,ante,AE N T IY,AE N T IH D
0.026085548102855682,firm,F ER M,F ER M D
0.025943540036678314,smart,S M AA R T,S M AA R T IH D
0.02590104192495346,outman,AW T M AH N,AW T M AE N D
0.025395654141902924,dim,D IH M,D IH M D
0.025291666388511658,caress,K ER EH S,K ER EH S T
0.02512817084789276,spin,S P IH N,S P AH N
0.024961479008197784,daze,D EY Z,D EY Z D
0.024875737726688385,dam,D AE M,D AE M D
0.024875737726688385,damn,D AE M,D AE M D
0.024839140474796295,posit,P AA Z AH T,P AA Z AH T IH D
0.024826638400554657,commit,K AH M IH T,K AH M IH T IH D
0.024718381464481354,facet,F AE S AH T,F AE S AH T IH D
0.02470233291387558,clear,K L IH R,K L IH R D
0.024661406874656677,spell,S P EH L,S P EH L D
0.024536341428756714,winnow,W IH N OW,W IH N OW D
0.024488702416419983,do,D UW,D IH D
0.024417154490947723,outrun,AW T R AH N,AW T R AE N
0.024220339953899384,longe,L AA N JH,L AO NG D
0.024140380322933197,furrow,F ER OW,F ER OW D
0.02411087602376938,amass,AH M AE S,AH M AE S T
0.0239836648106575,serrate,S EH R EY T,S EH R EY T IH D
0.02376657724380493,waft,W AA F T,W AA F T IH D
0.023670174181461334,omit,OW M IH T,OW M IH T AH D
0.023590467870235443,crest,K R EH S T,K R EH S T IH D
0.0231526717543602,relate,R IH L EY T,R IH L EY T IH D
0.023045606911182404,use,Y UW S,Y UW Z D
0.0228562131524086,skid,S K IH D,S K IH D IH D
0.02284732460975647,greet,G R IY T,G R IY T AH D
0.022722557187080383,reset,R IY S EH T,R IY S EH T
0.02264968305826187,certify,S ER T AH F AY,S ER T AH F AY D
0.022612594068050385,admit,AH D M IH T,AH D M IH T IH D
0.02261079102754593,service,S ER V AH S,S ER V IH S T
0.021779172122478485,zone,Z OW N,Z OW N D
0.021741420030593872,egg,EH G,EH G D
0.021741420030593872,egge,EH G,EH G D
0.021640516817569733,dance,D AE N S,D AE N S T
0.021598607301712036,careen,K ER IY N,K ER IY N D
0.021294526755809784,doze,D OW Z,D OW Z D
0.021171413362026215,story,S T AO R IY,S T AO R IY D
0.021149076521396637,body,B AA D IY,B AA D IY D
0.021116681396961212,lose,L UW Z,L AO S T
0.021063901484012604,detach,D IH T AE CH,D IH T AE CH T
0.02098563313484192,gloat,G L OW T,G L OW T IH D
0.020971916615962982,accrue,AH K R UW,AH K R UW D
0.020926527678966522,gag,G AE G,G AE G D
0.02049935609102249,range,R EY N JH,R EY N JH D
0.020322568714618683,harry,HH EH R IY,HH EH R IY D
0.020322144031524658,chafe,CH EY F,CH EY F T
0.020141251385211945,blot,B L AA T,B L AA T AH D
0.01987762749195099,boom,B UW M,B UW M D
0.019871704280376434,emit,IH M IH T,IH M IH T AH D
0.01979544758796692,fire,F AY ER,F AY ER D
0.019784100353717804,smile,S M AY L,S M AY L D
0.01970066875219345,snicker,S N IH K ER,S N IH K ER D
0.019621163606643677,spurn,S P ER N,S P ER N D
0.019611313939094543,home,HH OW M,HH OW M D
0.019546784460544586,tatter,T AE T ER,T AE T ER D
0.019324176013469696,glean,G L IY N,G L IY N D
0.019266001880168915,veer,V IH R,V IH R D
0.019145093858242035,face,F EY S,F EY S T
0.019015364348888397,hire,HH AY ER,HH AY ER D
0.01897195726633072,refer,R AH F ER,R AH F ER D
0.01872437447309494,hem,HH EH M,HH EH M D
0.0183805450797081,donate,D OW N EY T,D OW N EY T IH D
0.01836652308702469,outdate,AW T D EY T,AW T D EY T IH D
0.018239907920360565,visit,V IH Z IH T,V IH Z IH T IH D
0.018109969794750214,surf,S ER F,S ER F T
0.018102236092090607,verse,V ER S,V ER S T
0.018011271953582764,harass,HH ER AE S,HH ER AE S T
0.017706729471683502,react,R IY AE K T,R IY AE K T IH D
0.01769646257162094,chance,CH AE N S,CH AE N S T
0.01731499284505844,gussy,G AH S IY,G AH S IY D
0.017296768724918365,sheath,SH IY TH,SH IY DH D
0.017164215445518494,faze,F EY Z,F EY Z D
0.017164215445518494,phase,F EY Z,F EY Z D
0.016881518065929413,beam,B IY M,B IY M D
0.016721852123737335,wag,W AE G,W AE G D
0.01670254021883011,care,K EH R,K EH R D
0.016667507588863373,loom,L UW M,L UW M D
0.016645081341266632,chauffeur,SH OW F ER,SH OW F ER D
0.01657702773809433,chime,CH AY M,CH AY M D
0.016565389931201935,hear,HH IY R,HH ER D
0.016552560031414032,dope,D OW P,D OW P T
0.016507819294929504,rhyme,R AY M,R AY M D
0.01635875552892685,aim,EY M,EY M D
0.016049467027187347,seize,S IY Z,S IY Z D
0.015915699303150177,drill,D R IH L,D R IH L D
0.015895090997219086,guard,G AA R D,G AA R D AH D
0.015868090093135834,dig,D IH G,D AH G
0.015808582305908203,flaw,F L AO,F L AO D
0.01576097309589386,dilate,D AY L EY T,D AY L EY T IH D
0.01573992520570755,chase,CH EY S,CH EY S T
0.01573111116886139,deal,D IY L,D EH L T
0.015641704201698303,total,T OW T AH L,T OW T AH L D
0.015142776072025299,bowse,B OW S,B AW Z D
0.015053100883960724,choose,CH UW Z,CH OW Z
0.014713764190673828,size,S AY Z,S AY Z D
0.014662332832813263,sear,S IH R,S IH R D
0.014649741351604462,slit,S L IH T,S L IH T
0.014399684965610504,undo,AH N D UW,AH N D IH D
0.014327935874462128,coerce,K OW ER S,K OW ER S T
0.014306508004665375,space,S P EY S,S P EY S T
0.01422969251871109,hollow,HH AA L OW,HH AA L OW D
0.014224015176296234,hold,HH OW L D,HH EH L D
0.014183707535266876,skirt,S K ER T,S K ER T IH D
0.014161773025989532,occur,AH K ER,AH K ER D
0.014135830104351044,comb,K OW M,K OW M D
0.014040693640708923,pant,P AE N T,P AE N T IH D
0.014002658426761627,soothe,S UW DH,S UW DH D
0.013937771320343018,up,AH P,AH P T
0.013904176652431488,birdie,B ER D IY,B ER D IY D
0.013852380216121674,quell,K W EH L,K W EH L D
0.013850606977939606,glut,G L AH T,G L AH T IH D
0.013791762292385101,grant,G R AE N T,G R AE N T AH D
0.013755746185779572,rotate,R OW T EY T,R OW T EY T IH D
0.013743378221988678,ram,R AE M,R AE M D
0.013732552528381348,chew,CH UW,CH UW D
0.013622187077999115,circuit,S ER K AH T,S ER K AH T IH D
0.013618849217891693,terrify,T EH R AH F AY,T EH R AH F AY D
0.013456396758556366,bloat,B L OW T,B L OW T IH D
0.013444781303405762,thrive,TH R AY V,TH R OW V
0.01336611807346344,tag,T AE G,T AE G D
0.013139240443706512,bathe,B EY DH,B EY DH D
0.013022035360336304,layer,L EY ER,L EY ER D
0.012949153780937195,row,R OW,R OW D
0.012921936810016632,beset,B IH S EH T,B IH S EH T
0.012887336313724518,de,D IY,D IH D
0.01272561401128769,dupe,D UW P,D UW P T
0.012670464813709259,rear,R IH R,R IH R D
0.012577496469020844,stall,S T AO L,S T AO L D
0.012562736868858337,sag,S AE G,S AE G D
0.012487098574638367,sting,S T IH NG,S T AH NG
0.012470655143260956,score,S K AO R,S K AO R D
0.01244644820690155,purse,P ER S,P ER S T
0.012391798198223114,hallow,HH AE L OW,HH AE L OW D
0.012036718428134918,duel,D UW AH L,D UW AH L D
0.011585645377635956,vet,V EH T,V EH T IH D
0.011512212455272675,spill,S P IH L,S P IH L D
0.011446483433246613,trot,T R AA T,T R AA T IH D
0.011439494788646698,thrust,TH R AH S T,TH R AH S T
0.011427588760852814,widow,W IH D OW,W IH D OW D
0.011325284838676453,stir,S T ER,S T ER D
0.011295519769191742,disease,D IH Z IY Z,D IH Z IY Z D
0.01128736138343811,ruse,R UW Z,R UW Z D
0.011193767189979553,goof,G UW F,G UW F T
0.011148132383823395,hunt,HH AH N T,HH AH N T AH D
0.011139623820781708,store,S T AO R,S T AO R D
0.011009752750396729,taxi,T AE K S IY,T AE K S IY D
0.010860227048397064,bed,B EH D,B EH D IH D
0.010833628475666046,band,B AE N D,B AE N D IH D
0.010707654058933258,soup,S UW P,S UW P T
0.010687761008739471,loose,L UW S,L UW S T
0.010587342083454132,cow,K AW,K AW D
0.010537467896938324,grin,G R IH N,G R IH N D
0.010424554347991943,yearn,Y ER N,Y ER N D
0.010389409959316254,pilot,P AY L AH T,P AY L AH T IH D
0.010214582085609436,bowe,B OW,B AW D
0.010184936225414276,chair,CH EH R,CH EH R D
0.010097317397594452,ax,AE K S,AE K S T
0.010097317397594452,axe,AE K S,AE K S T
0.009855754673480988,go,G OW,W EH N T
0.009767822921276093,yuppify,Y AH P IH F AY,Y AH P IH F AY D
0.009620681405067444,snee,S N IY,S N IY D
0.009333744645118713,ban,B AE N,B AE N D
0.009311884641647339,abide,AH B AY D,AH B OW D
0.00889604538679123,rim,R IH M,R IH M D
0.008888162672519684,immerse,IH M ER S,IH M ER S T
0.00861414521932602,dole,D OW L,D OW L D
0.008417315781116486,relish,R EH L IH SH,R EH L IH SH T
0.008309833705425262,outsell,AW T S EH L,AW T S OW L D
0.008271031081676483,deter,D IH T ER,D IH T ER D
0.008250579237937927,base,B EY S,B EY S T
0.00815030187368393,plot,P L AA T,P L AA T IH D
0.008115366101264954,hammer,HH AE M ER,HH AE M ER D
0.008107401430606842,quote,K W OW T,K W OW T IH D
0.008107207715511322,hose,HH OW Z,HH OW Z D
0.008057825267314911,blotch,B L AA T CH,B L AA T CH T
0.008051954209804535,abut,AH B AH T,AH B AH T IH D
0.00804031640291214,hote,HH OW T,HH AY T
0.008023135364055634,hurl,HH ER L,HH ER L D
0.007996417582035065,gaze,G EY Z,G EY Z D
0.007855497300624847,root,R UW T,R UW T AH D
0.007855497300624847,route,R UW T,R UW T IH D
0.0076659247279167175,taste,T EY S T,T EY S T IH D
0.007299177348613739,ant,AE N T,AE N T IH D
0.0072094351053237915,raise,R EY Z,R EY Z D
0.0072094351053237915,raze,R EY Z,R EY Z D
0.0070610567927360535,roast,R OW S T,R OW S T AH D
0.006939820945262909,stow,S T OW,S T OW D
0.0069343820214271545,doctor,D AA K T ER,D AA K T ER D
0.00675828754901886,date,D EY T,D EY T IH D
0.006752721965312958,pose,P OW Z,P OW Z D
0.006725884974002838,hoot,HH UW T,HH UW T IH D
0.006660088896751404,gun,G AH N,G AH N D
0.0064207762479782104,race,R EY S,R EY S T
0.006355293095111847,ogle,OW G AH L,OW G AH L D
0.0063473135232925415,wince,W IH N S,W IH N S T
0.006288222968578339,steer,S T IH R,S T IH R D
0.006262846291065216,hope,HH OW P,HH OW P T
0.0062316954135894775,toe,T OW,T OW D
0.0062316954135894775,tow,T OW,T OW D
0.006144814193248749,heal,HH IY L,HH IY L D
0.006144814193248749,heel,HH IY L,HH IY L D
0.00604691356420517,coo,K UW,K UW D
0.005951672792434692,spout,S P AW T,S P AW T IH D
0.005832761526107788,pony,P OW N IY,P OW N IY D
0.005778394639492035,hurt,HH ER T,HH ER T
0.005621731281280518,spar,S P AA R,S P AA R D
0.005575321614742279,sue,S UW,S UW D
0.005570106208324432,grab,G R AE B,G R AE B D
0.005398690700531006,cough,K AA F,K AO F T
0.005312152206897736,still,S T IH L,S T IH L D
0.005239836871623993,tint,T IH N T,T IH N T IH D
0.005172349512577057,hint,HH IH N T,HH IH N T AH D
0.005149178206920624,bat,B AE T,B AE T IH D
0.005135528743267059,roost,R UW S T,R UW S T IH D
0.005106925964355469,reel,R IY L,R IY L D
0.005077585577964783,taint,T EY N T,T EY N T IH D
0.00475146621465683,douse,D AW S,D AW S T
0.00458216667175293,skin,S K IH N,S K IH N D
0.004567623138427734,host,HH OW S T,HH OW S T IH D
0.004505448043346405,tan,T AE N,T AE N D
0.004395738244056702,breed,B R IY D,B R EH D
0.00436016172170639,curse,K ER S,K ER S T
0.004141382873058319,jimmy,JH IH M IY,JH IH M IY D
0.004118487238883972,heap,HH IY P,HH IY P T
0.004009470343589783,cast,K AE S T,K AE S T
0.0036692991852760315,twirl,T W ER L,T W ER L D
0.0035301968455314636,burn,B ER N,B ER N D
0.0035190582275390625,swirl,S W ER L,S W ER L D
0.0034986883401870728,wear,W EH R,W AO R
0.003385297954082489,guess,G EH S,G EH S T
0.0033184438943862915,gas,G AE S,G AE S T
0.003128640353679657,cloak,K L OW K,K L OW K T
0.003063678741455078,study,S T AH D IY,S T AH D IY D
0.002985946834087372,key,K IY,K IY D
0.002891235053539276,dun,D AH N,D AH N D
0.002884611487388611,bare,B EH R,B EH R D
0.0027804598212242126,slur,S L ER,S L ER D
