activation,lemma,present_phones,past_phones
0.41711166501045227,misspeak,M IH S S P IY K,M IH S S P OW K
0.19116005301475525,bang,B AE NG,B AE NG D
0.18921712040901184,earn,ER N,ER N D
0.1879391372203827,bank,B AE NG K,B AE NG K T
0.1855972409248352,bing,B IH NG,B IH N JH D
0.17986054718494415,hang,HH AE NG,HH AH NG
0.17387717962265015,ring,R IH NG,R IH NG D
0.17387717962265015,wring,R IH NG,R AH NG
0.16842599213123322,delineate,D IH L IH N IY EY T,D IH L IH N IY EY T IH D
0.1655297875404358,link,L IH NG K,L IH NG K T
0.16383206844329834,dress,D R EH S,D R EH S T
0.16221168637275696,dance,D AE N S,D AE N S T
0.16185405850410461,thank,TH AE NG K,TH AE NG K T
0.1598207652568817,tank,T AE NG K,T AE NG K T
0.15942977368831635,max,M AE K S,M AE K S T
0.15926706790924072,arraign,ER EY N,ER EY N D
0.1591796875,ting,T IH NG,T IH NG D
0.15755347907543182,ping,P IH NG,P IH NG D
0.15676435828208923,erase,IH R EY S,IH R EY S T
0.15485364198684692,urge,ER JH,ER JH D
0.15342439711093903,dally,D AE L IY,D AE L IY D
0.15263177454471588,mix,M IH K S,M IH K S T
0.15091492235660553,mince,M IH N S,M IH N S T
0.1497575342655182,brace,B R EY S,B R EY S T
0.14920659363269806,lynch,L IH N CH,L IH N CH T
0.14775431156158447,carry,K AE R IY,K AE R IY D
0.14716364443302155,lapse,L AE P S,L AE P S T
0.1470380425453186,think,TH IH NG K,TH AO T
0.14486049115657806,box,B AA K S,B AA K S T
0.14472568035125732,wing,W IH NG,W IH NG D
0.1447063535451889,grace,G R EY S,G R EY S T
0.14318203926086426,rasp,R AE S P,R AE S P T
0.14301784336566925,rally,R AE L IY,R AE L IY D
0.1419253945350647,dredge,D R EH JH,D R EH JH D
0.1411132663488388,sing,S IH NG,S AE NG
0.1405550241470337,gasp,G AE S P,G AE S P T
0.14046072959899902,long,L AO NG,L AO NG D
0.1386779546737671,caress,K ER EH S,K ER EH S T
0.1373896598815918,limp,L IH M P,L IH M P T
0.13738872110843658,binge,B IH N JH,B IH N JH D
0.13699260354042053,drape,D R EY P,D R EY P T
0.13592031598091125,crop,K R AA P,K R AA P T
0.13559377193450928,pinch,P IH N CH,P IH N CH T
0.13526654243469238,bag,B AE G,B AE G D
0.13513913750648499,press,P R EH S,P R EH S T
0.1338566243648529,lag,L AE G,L AE G D
0.13261500000953674,grass,G R AE S,G R AE S T
0.13124173879623413,clutch,K L AH CH,K L AH CH T
0.13115820288658142,sink,S IH NG K,S AE NG K
0.13088756799697876,busy,B IH Z IY,B IH Z IY D
0.13080263137817383,mulch,M AH L CH,M AH L CH T
0.1299327313899994,wink,W IH NG K,W IH NG K T
0.12980911135673523,dunk,D AH NG K,D AH NG K T
0.12941837310791016,tally,T AE L IY,T AE L IY D
0.12805041670799255,prep,P R EH P,P R EH P T
0.126797616481781,fax,F AE K S,F AE K S T
0.12580238282680511,bill,B IH L,B IH L D
0.12551575899124146,wrong,R AO NG,R AO NG D
0.12527918815612793,hinge,HH IH N JH,HH IH N JH D
0.12491729855537415,ban,B AE N,B AE N D
0.12466197460889816,creep,K R IY P,K R EH P T
0.12423735857009888,breach,B R IY CH,B R IY CH T
0.12296151369810104,nix,N IH K S,N IH K S T
0.12290152907371521,chance,CH AE N S,CH AE N S T
0.12276408076286316,bunch,B AH N CH,B AH N CH T
0.12275885045528412,gag,G AE G,G AE G D
0.12254313379526138,kill,K IH L,K IH L D
0.12247743457555771,caddie,K AE D IY,K AE D IY D
0.12247743457555771,caddy,K AE D IY,K AE D IY D
0.1224551796913147,dig,D IH G,D AH G
0.12234333902597427,yank,Y AE NG K,Y AE NG K T
0.12163229286670685,wax,W AE K S,W AE K S T
0.12076649069786072,bilk,B IH L K,B IH L K T
0.12036062777042389,cockey,K AA K IY,K AA K AY D
0.12020456790924072,munch,M AH N CH,M AH N CH T
0.11993835121393204,lunch,L AH N CH,L AH N CH T
0.1199285015463829,shred,SH R EH D,SH R EH D IH D
0.11914534866809845,longe,L AA N JH,L AO NG D
0.11877933144569397,catch,K AE CH,K AA T
0.11846183240413666,crouch,K R AW CH,K R AW CH T
0.11813823878765106,build,B IH L D,B IH L T
0.11805729568004608,junk,JH AH NG K,JH AH NG K T
0.11804614216089249,drop,D R AA P,D R AA P T
0.11784085631370544,price,P R AY S,P R AY S T
0.11765044182538986,pierce,P IH R S,P IH R S T
0.11738435178995132,rag,R AE G,R AE G AH D
0.11707106977701187,back,B AE K,B AE K T
0.11636735498905182,drub,D R AH B,D R AH B D
0.11619111895561218,tax,T AE K S,T AE K S T
0.11538047343492508,grease,G R IY S,G R IY S T
0.11447993665933609,class,K L AE S,K L AE S T
0.11442965269088745,bless,B L EH S,B L EH S T
0.11432571709156036,bulge,B AH L JH,B AH L JH D
0.11430872976779938,tongue,T AH NG,T AH NG D
0.11418874561786652,preach,P R IY CH,P R IY CH T
0.11412689089775085,trudge,T R AH JH,T R AH JH D
0.11273899674415588,rig,R IH G,R IH G D
0.11268942058086395,kick,K IH K,K IH K T
0.11235097050666809,broach,B R OW CH,B R OW CH T
0.11230634152889252,palpitate,P AE L P AH T EY T,P AE L P AH T EY T IH D
0.11226769536733627,arise,ER AY Z,ER OW Z
0.1122380793094635,gross,G R OW S,G R OW S T
0.11203651130199432,march,M AA R CH,M AA R CH T
0.11198144406080246,shear,SH IH R,SH IH R D
0.11184573173522949,mill,M IH L,M IH L D
0.11171908676624298,hunch,HH AH N CH,HH AH N CH T
0.11149212718009949,crab,K R AE B,K R AE B D
0.11122049391269684,band,B AE N D,B AE N D IH D
0.11106505244970322,filch,F IH L CH,F IH L CH T
0.11078092455863953,launch,L AO N CH,L AO N CH T
0.11060475558042526,jimmy,JH IH M IY,JH IH M IY D
0.11044462770223618,mass,M AE S,M AE S T
0.11040499806404114,beget,B IH G EH T,B IY G AO T
0.11039584875106812,wince,W IH N S,W IH N S T
0.10990853607654572,bog,B AA G,B AA G D
0.1097717210650444,capture,K AE P CH ER,K AE P CH ER D
0.10961560904979706,lick,L IH K,L IH K T
0.10949838161468506,cinch,S IH N CH,S IH N CH T
0.10915127396583557,hack,HH AE K,HH AE K T
0.10913930088281631,grouse,G R AW S,G R AW S T
0.10913056135177612,trace,T R EY S,T R EY S T
0.1089753806591034,barge,B AA R JH,B AA R JH D
0.10858634114265442,shit,SH IH T,SH IH T
0.10846787691116333,retaliate,R IH T AE L IY EY T,R IH T AE L IY EY T IH D
0.10843411087989807,man,M AE N,M AE N D
0.10842981934547424,gripe,G R AY P,G R AY P T
0.10819006711244583,kiss,K IH S,K IH S T
0.10814918577671051,culture,K AH L CH ER,K AH L CH ER D
0.10790129750967026,bat,B AE T,B AE T IH D
0.10738398134708405,bread,B R EH D,B R EH D IH D
0.10689727216959,mask,M AE S K,M AE S K T
0.1064152717590332,dam,D AE M,D AE M D
0.1064152717590332,damn,D AE M,D AE M D
0.10638654232025146,latch,L AE CH,L AE CH T
0.10556396842002869,clap,K L AE P,K L AE P T
0.10424265265464783,brake,B R EY K,B R EY K T
0.10424265265464783,break,B R EY K,B R OW K
0.10367636382579803,cast,K AE S T,K AE S T
0.10358112305402756,interleave,IH N T ER L IY V,IH N T ER L IY V D
0.10357555001974106,gas,G AE S,G AE S T
0.10321268439292908,assess,AH S EH S,AH S EH S T
0.10309310257434845,picture,P IH K CH ER,P IH K CH ER D
0.10282251238822937,match,M AE CH,M AE CH T
0.10255762189626694,bribe,B R AY B,B R AY B D
0.10239429771900177,ship,SH IH P,SH IH P T
0.1021478921175003,punch,P AH N CH,P AH N CH T
0.10198502987623215,passe,P AE S EY,P AE S T
0.10149446874856949,rack,R AE K,R AE K T
0.10149446874856949,wrack,R AE K,R AE K T
0.10134077817201614,hatch,HH AE CH,HH AE CH T
0.10115095227956772,trap,T R AE P,T R AE P T
0.10091018676757812,cache,K AE SH,K AE SH T
0.10091018676757812,cash,K AE SH,K AE SH T
0.10088726878166199,gulp,G AH L P,G AH L P T
0.10072098672389984,hamper,HH AE M P ER,HH AE M P ER D
0.10050445795059204,crest,K R EH S T,K R EH S T IH D
0.1004951000213623,droop,D R UW P,D R UW P T
0.09978939592838287,beset,B IH S EH T,B IH S EH T
0.09964723885059357,ache,EY K,EY K T
0.09964193403720856,attach,AH T AE CH,AH T AE CH T
0.09956371784210205,harp,HH AA R P,HH AA R P T
0.09917867183685303,parse,P AA R S,P AA R S T
0.0991421490907669,nag,N AE G,N AE G D
0.09841714799404144,group,G R UW P,G R UW P T
0.09830109775066376,prop,P R AA P,P R AA P T
0.09823494404554367,tinge,T IH N JH,T IH NG D
0.09790821373462677,pity,P IH T IY,P IH T IY D
0.09786731004714966,shock,SH AA K,SH AA K T
0.0978410467505455,grope,G R OW P,G R OW P T
0.09779588133096695,thin,TH IH N,TH IH N D
0.09766653180122375,laugh,L AE F,L AE F T
0.09743013978004456,ram,R AE M,R AE M D
0.09701104462146759,last,L AE S T,L AE S T AH D
0.0969231128692627,lap,L AE P,L AE P T
0.09690535068511963,pass,P AE S,P AE S T
0.09680354595184326,hiss,HH IH S,HH IH S T
0.09679291397333145,grasp,G R AE S P,G R AE S P T
0.0965641513466835,rely,R IH L AY,R IH L AY D
0.09649213403463364,pack,P AE K,P AE K T
0.09642833471298218,cry,K R AY,K R AY D
0.09632560610771179,misspend,M IH S S P EH N D,M IH S S P EH N T
0.09629582613706589,complete,K AH M P L IY T,K AH M P L IY T AH D
0.09585140645503998,miss,M IH S,M IH S T
0.09573888778686523,wag,W AE G,W AE G D
0.09571020305156708,jack,JH AE K,JH AE K T
0.09570753574371338,thread,TH R EH D,TH R EH D IH D
0.09544460475444794,lump,L AH M P,L AH M P T
0.09538021683692932,parch,P AA R CH,P AA R CH T
0.0953463464975357,mast,M AE S T,M AE S T AH D
0.09532004594802856,gild,G IH L D,G IH L D IH D
0.09503035247325897,curry,K AH R IY,K ER IY D
0.09482784569263458,bash,B AE SH,B AE SH T
0.09472834318876266,dim,D IH M,D IH M D
0.09458936750888824,tinker,T IH NG K ER,T IH NG K ER D
0.09443514794111252,cap,K AE P,K AE P T
0.09438639134168625,harass,HH ER AE S,HH ER AE S T
0.094310462474823,deny,D IH N AY,D IH N AY D
0.09416887164115906,displease,D IH S P L IY Z,D IH S P L IY Z D
0.09391595423221588,dump,D AH M P,D AH M P T
0.09388857334852219,remedy,R EH M AH D IY,R EH M AH D IY D
0.09344551712274551,thatch,TH AE CH,TH AE CH T
0.0927063375711441,hand,HH AE N D,HH AE N D AH D
0.09264488518238068,pan,P AE N,P AE N D
0.09242387861013412,oar,AO R,AO R D
0.09238580614328384,pulse,P AH L S,P AH L S T
0.09226174652576447,hitch,HH IH CH,HH IH CH T
0.09222503006458282,craze,K R EY Z,K R EY Z D
0.0921291708946228,allege,AH L EH JH,AH L EH JH D
0.09205314517021179,limb,L IH M,L IH M D
0.09200938791036606,breast,B R EH S T,B R EH S T AH D
0.09196281433105469,lunge,L AH N JH,L AH N JH D
0.09176039695739746,bridge,B R IH JH,B R IH JH D
0.09165292978286743,club,K L AH B,K L AH B D
0.09161166846752167,shriek,SH R IY K,SH R IY K T
0.09122774004936218,winge,W IH N JH,W IH NG D
0.09108833968639374,ooze,UW Z,UW Z D
0.09099946916103363,billow,B IH L OW,B IH L OW D
0.09089504182338715,con,K AA N,K AA N D
0.09089504182338715,conn,K AA N,K AA N D
0.0908181220293045,tag,T AE G,T AE G D
0.09081234037876129,inlay,IH N L EY,IH N L EY D
0.09076905250549316,dry,D R AY,D R AY D
0.09069138765335083,ditch,D IH CH,D IH CH T
0.09039029479026794,singe,S IH N JH,S IH N JH D
0.09016415476799011,rant,R AE N T,R AE N T IH D
0.09014881402254105,gallop,G AE L AH P,G AE L AH P T
0.08993303030729294,crook,K R UH K,K R UH K AH D
0.08970369398593903,lock,L AA K,L AA K T
0.08967267721891403,half,HH AE F,HH AE V D
0.08961597830057144,crane,K R EY N,K R EY N D
0.08952681720256805,pick,P IH K,P IH K T
0.08950000256299973,thrust,TH R AH S T,TH R AH S T
0.08938823640346527,rim,R IH M,R IH M D
0.08916499465703964,braid,B R EY D,B R EY D IH D
0.08901620656251907,etch,EH CH,EH CH T
0.08875099569559097,git,G IH T,G AA T AH N
0.0886920839548111,bully,B UH L IY,B UH L IY D
0.08865020424127579,lash,L AE SH,L AE SH T
0.08862101286649704,log,L AO G,L AO G D
0.08854125440120697,amass,AH M AE S,AH M AE S T
0.08853952586650848,sketch,S K EH CH,S K EH CH T
0.08844552934169769,bias,B AY AH S,B AY AH S T
0.08841602504253387,beard,B IH R D,B IH R D AH D
0.08834871649742126,adjudge,AH JH AH JH,AH JH AH JH D
0.087919220328331,shaft,SH AE F T,SH AE F T IH D
0.08783615380525589,bath,B AE TH,B EY DH D
0.08776278793811798,copy,K AA P IY,K AA P IY D
0.08770831674337387,clasp,K L AE S P,K L AE S P T
0.08758506178855896,bicker,B IH K ER,B IH K ER D
0.08734280616044998,drip,D R IH P,D R IH P T
0.08717282861471176,jazz,JH AE Z,JH AE Z D
0.08682168275117874,relent,R IH L EH N T,R IH L EH N T IH D
0.08661413192749023,hit,HH IH T,HH IH T
0.08652909100055695,cock,K AA K,K AA K T
0.08610188961029053,gash,G AE SH,G AE SH T
0.08588191866874695,mash,M AE SH,M AE SH T
0.08587977290153503,map,M AE P,M AE P T
0.08573701977729797,dash,D AE SH,D AE SH T
0.08565282821655273,hash,HH AE SH,HH AE SH T
0.08561589568853378,lobby,L AA B IY,L AA B IY D
0.08543989807367325,sag,S AE G,S AE G D
0.0853094831109047,hump,HH AH M P,HH AH M P T
0.08528855443000793,belch,B EH L CH,B EH L CH T
0.08517361432313919,hunker,HH AH NG K ER,HH AH NG K ER D
0.08508189022541046,truck,T R AH K,T R AH K T
0.08501136302947998,weary,W IH R IY,W IH R IY D
0.08496110886335373,offset,AO F S EH T,AO F S EH T
0.08464812487363815,gin,JH IH N,JH IH N D
0.08456310629844666,bond,B AA N D,B AA N D AH D
0.08454103767871857,parody,P EH R AH D IY,P EH R AH D IY D
0.08450145274400711,arouse,ER AW Z,ER AW Z D
0.08439943194389343,braise,B R EY Z,B R EY Z D
0.08439906686544418,glass,G L AE S,G L AE S T
0.08426196873188019,lip,L IH P,L IH P T
0.0842294991016388,pin,P IH N,P IH N D
0.08403142541646957,lib,L IH B,L IH B D
0.0839209109544754,mint,M IH N T,M IH N T IH D
0.08386341482400894,jam,JH AE M,JH AE M D
0.08372341841459274,tan,T AE N,T AE N D
0.0834113210439682,patch,P AE CH,P AE CH T
0.08340951055288315,shimmer,SH IH M ER,SH IH M ER D
0.08308222144842148,rear,R IH R,R IH R D
0.08287062495946884,barb,B AA R B,B AA R B D
0.08283743262290955,drab,D R AE B,D R AE B D
0.08261722326278687,creak,K R IY K,K R IY K T
0.08255895227193832,whack,W AE K,W AE K T
0.08168540894985199,boss,B AA S,B AA S T
0.08161546289920807,grab,G R AE B,G R AE B D
0.08161526918411255,grip,G R IH P,G R IH P T
0.08155228942632675,conjure,K AA N JH ER,K AA N JH ER D
0.08152297139167786,cause,K AA Z,K AA Z D
0.08135019987821579,troop,T R UW P,T R UW P T
0.08099916577339172,tack,T AE K,T AE K T
0.08082948625087738,tamper,T AE M P ER,T AE M P ER D
0.08079662173986435,piss,P IH S,P IH S T
0.08074994385242462,cull,K AH L,K AH L D
0.0807434618473053,dock,D AA K,D AA K T
0.08066059648990631,grade,G R EY D,G R EY D AH D
0.0806458592414856,jilt,JH IH L T,JH IH L T IH D
0.08053620904684067,riff,R IH F,R IH F T
0.08044213056564331,collar,K AA L ER,K AA L ER D
0.08016912639141083,close,K L OW S,K L OW Z D
0.08006595075130463,bug,B AH G,B AH G D
0.07992567121982574,trek,T R EH K,T R EH K T
0.07989783585071564,defy,D IH F AY,D IH F AY D
0.07972903549671173,jog,JH AA G,JH AA G D
0.0796729177236557,don,D AA N,D AA N D
0.07956443727016449,horse,HH AO R S,HH AO R S T
0.07918550819158554,tick,T IH K,T IH K T
0.07876773178577423,hint,HH IH N T,HH IH N T AH D
0.07858334481716156,pat,P AE T,P AE T IH D
0.0782662034034729,nick,N IH K,N IH K T
0.07801559567451477,inlet,IH N L EH T,IH N L EH T
0.07782590389251709,task,T AE S K,T AE S K T
0.0776415765285492,rib,R IH B,R IH B D
0.07759016752243042,list,L IH S T,L IH S T AH D
0.07748214155435562,dog,D AO G,D AO G D
0.077031709253788,tread,T R EH D,T R AA D
0.07699249684810638,bark,B AA R K,B AA R K T
0.07693006098270416,botch,B AA CH,B AA CH T
0.07689734548330307,kid,K IH D,K IH D IH D
0.07687675207853317,bomb,B AA M,B AA M D
0.07687466591596603,bely,B AH L AY,B IH L AY D
0.07686899602413177,crow,K R OW,K R OW D
0.07686291635036469,shop,SH AA P,SH AA P T
0.07629727572202682,bleach,B L IY CH,B L IY CH T
0.07622358202934265,raft,R AE F T,R AE F T IH D
0.0761275663971901,jeer,JH IH R,JH IH R D
0.07598543167114258,curl,K ER L,K ER L D
0.07598285377025604,unsettle,AH N S EH T AH L,AH N S EH T AH L D
0.07595402747392654,crowd,K R AW D,K R AW D AH D
0.07591120898723602,fill,F IH L,F IH L D
0.07573831081390381,shrug,SH R AH G,SH R AH G D
0.07572764158248901,pitch,P IH CH,P IH CH T
0.07571404427289963,dish,D IH SH,D IH SH T
0.07561904191970825,jab,JH AE B,JH AE B D
0.07553181052207947,rap,R AE P,R AE P T
0.07553181052207947,wrap,R AE P,R AE P T
0.07545527815818787,gussy,G AH S IY,G AH S IY D
0.07503216713666916,call,K AO L,K AO L D
0.07494184374809265,help,HH EH L P,HH EH L P T
0.07486894726753235,pant,P AE N T,P AE N T IH D
0.07472901046276093,peer,P IH R,P IH R D
0.07468801736831665,journey,JH ER N IY,JH ER N IY D
0.07468061149120331,ball,B AO L,B AO L D
0.07468061149120331,bawl,B AO L,B AO L D
0.07458969950675964,aim,EY M,EY M D
0.07450902462005615,sac,S AE K,S AE K T
0.07450902462005615,sack,S AE K,S AE K T
0.0744614526629448,pry,P R AY,P R AY D
0.07440445572137833,add,AE D,AE D AH D
0.07433956861495972,bar,B AA R,B AA R D
0.07394182682037354,thump,TH AH M P,TH AH M P T
0.07380448281764984,cough,K AA F,K AO F T
0.07345861196517944,demur,D IH M ER,D IH M ER D
0.07338256388902664,grate,G R EY T,G R EY T IH D
0.07325451076030731,vat,V AE T,V AE T IH D
0.07301834225654602,graze,G R EY Z,G R EY Z D
0.07293812930583954,mock,M AA K,M AA K T
0.07284143567085266,hammer,HH AE M ER,HH AE M ER D
0.07270945608615875,shuck,SH AH K,SH AH K T
0.07270690053701401,shun,SH AH N,SH AH N D
0.07270585745573044,dip,D IH P,D IH P T
0.07267206907272339,brain,B R EY N,B R EY N D
0.07262827455997467,pit,P IH T,P IH T IH D
0.07244091480970383,comment,K AA M EH N T,K AA M EH N T AH D
0.0723038837313652,bid,B IH D,B IH D
0.07198702543973923,brew,B R UW,B R UW D
0.07178835570812225,tilt,T IH L T,T IH L T IH D
0.071658656001091,brow,B R AW,B R AW D
0.07162883877754211,erode,IH R OW D,IH R OW D AH D
0.07149634510278702,boo,B UW,B UW D
0.07148922979831696,coax,K OW K S,K OW K S T
0.07104778289794922,fan,F AE N,F AE N D
0.07079144567251205,crush,K R AH SH,K R AH SH T
0.0707782581448555,breed,B R IY D,B R EH D
0.07076094299554825,card,K AA R D,K AA R D IH D
0.07063178718090057,snatch,S N AE CH,S N AE CH T
0.07036691904067993,pillar,P IH L ER,P IH L ER D
0.07022477686405182,step,S T EH P,S T EH P T
0.06983364373445511,dot,D AA T,D AA T AH D
0.06975190341472626,win,W IH N,W AH N
0.06969422101974487,brush,B R AH SH,B R AH SH T
0.06961238384246826,elope,IH L OW P,IH L OW P D
0.06942294538021088,edit,EH D AH T,EH D AH T AH D
0.0690406858921051,wick,W IH K,W IH K AH D
0.06880802661180496,recur,R IH K ER,R IY K ER D
0.06875178217887878,dement,D AH M EH N T,D IH M EH N T IH D
0.06872844696044922,grain,G R EY N,G R EY N D
0.06858330965042114,shoe,SH UW,SH AA D
0.0685613602399826,zag,Z AE G,Z AE G D
0.06838100403547287,snap,S N AE P,S N AE P T
0.06837481260299683,lift,L IH F T,L IH F T AH D
0.06830941140651703,divvy,D IH V IY,D IH V IY D
0.06821489334106445,pump,P AH M P,P AH M P T
0.06814950704574585,mark,M AA R K,M AA R K T
0.06814950704574585,marke,M AA R K,M AA R K T
0.06807851046323776,rip,R IH P,R IH P T
0.06800984591245651,sin,S IH N,S IH N D
0.06791706383228302,hallow,HH AE L OW,HH AE L OW D
0.06789880990982056,become,B IH K AH M,B IH K EY M
0.06784696877002716,shirk,SH ER K,SH ER K T
0.06769394874572754,shut,SH AH T,SH AH T
0.0675022155046463,hug,HH AH G,HH AH G D
0.06744220107793808,burn,B ER N,B ER N D
0.0673658475279808,chick,CH IH K,CH IH K T
0.06733749061822891,garb,G AA R B,G AA R B D
0.06714311987161636,coo,K UW,K UW D
0.06692813336849213,batter,B AE T ER,B AE T ER D
0.06680184602737427,place,P L EY S,P L EY S T
0.06676368415355682,curse,K ER S,K ER S T
0.06661415100097656,inset,IH N S EH T,IH N S EH T
0.06654427945613861,jump,JH AH M P,JH AH M P T
0.06639881432056427,rock,R AA K,R AA K T
0.06637772917747498,belate,B IH L EY T,B IH L EY T IH D
0.06636133044958115,cost,K AA S T,K AA S T
0.0657564178109169,balk,B AO K,B AO K T
0.06575480103492737,mug,M AH G,M AH G D
0.06549239158630371,mar,M AA R,M AA R D
0.06528659164905548,rug,R AH G,R AH G AH D
0.06507948040962219,charge,CH AA R JH,CH AA R JH D
0.06501612067222595,try,T R AY,T R AY D
0.06469039618968964,nab,N AE B,N AE B D
0.06452394276857376,learn,L ER N,L ER N D
0.06442417204380035,cuss,K AH S,K AH S T
0.06437014788389206,buck,B AH K,B AH K T
0.06414082646369934,delete,D IH L IY T,D IH L IY T AH D
0.06413725763559341,near,N IH R,N IH R D
0.06400872766971588,maul,M AO L,M AO L D
0.06391282379627228,cross,K R AO S,K R AO S T
0.06385684758424759,mirror,M IH R ER,M IH R ER D
0.06382313370704651,body,B AA D IY,B AA D IY D
0.0638158768415451,shore,SH AO R,SH AO R D
0.06377412378787994,hull,HH AH L,HH AH L D
0.06367142498493195,mull,M AH L,M AH L D
0.06364286690950394,pock,P AA K,P AA K T
0.0633845180273056,wrench,R EH N CH,R EH N CH T
0.0633474588394165,holler,HH AA L ER,HH AA L ER D
0.06328995525836945,disapprove,D IH S AH P R UW V,D IH S AH P R UW V D
0.06328946352005005,cart,K AA R T,K AA R T IH D
0.06323207169771194,haul,HH AO L,HH AO L D
0.06318414211273193,coole,K UW L,K UW L D
0.06305564939975739,drug,D R AH G,D R AH G D
0.06303407996892929,drain,D R EY N,D R EY N D
0.06300098448991776,defer,D IH F ER,D IH F ER D
0.06289179623126984,trip,T R IH P,T R IH P T
0.06287869811058044,procure,P R OW K Y UH R,P R OW K Y UH R D
0.06284955143928528,frenzy,F R EH N Z IY,F R EH N Z IY D
0.06255286931991577,drum,D R AH M,D R AH M D
0.062485288828611374,lop,L AA P,L AA P T
0.06228025630116463,out,AW T,AW T AH D
0.062254466116428375,lurk,L ER K,L ER K T
0.0620737262070179,cut,K AH T,K AH T
0.0619390495121479,bum,B AH M,B AH M D
0.06192750111222267,fast,F AE S T,F AE S T IH D
0.06192733719944954,shirt,SH ER T,SH ER T IH D
0.06183304637670517,breeze,B R IY Z,B R IY Z D
0.0616939477622509,knit,N IH T,N IH T
0.0614936463534832,mandate,M AE N D EY T,M AE N D EY T IH D
0.06145760789513588,bay,B EY,B EY D
0.06139545515179634,sand,S AE N D,S AE N D IH D
0.06127425655722618,veer,V IH R,V IH R D
0.06124808266758919,pride,P R AY D,P R AY D IH D
0.06120722368359566,bail,B EY L,B EY L D
0.06063433364033699,buzz,B AH Z,B AH Z D
0.06048233434557915,come,K AH M,K EY M
0.06048233434557915,cum,K AH M,K EY M
0.060437168926000595,thaw,TH AO,TH AO D
0.060004834085702896,ante,AE N T IY,AE N T IH D
0.059903163462877274,fixate,F IH K S EY T,F IH K S EY T IH D
0.05984526500105858,writhe,R IH TH,R IH TH D
0.05978574976325035,whiz,W IH Z,W IH Z D
0.059752464294433594,erect,IH R EH K T,IH R EH K T AH D
0.05969337001442909,orient,AO R IY EH N T,AO R IY EH N T AH D
0.05960652604699135,pledge,P L EH JH,P L EH JH D
0.05924123525619507,gift,G IH F T,G IH F T AH D
0.05911090597510338,bogey,B OW G IY,B OW G IY D
0.059092700481414795,damage,D AE M AH JH,D AE M AH JH D
0.059089649468660355,gyp,JH IH P,JH IH P T
0.059060174971818924,throw,TH R OW,TH R UW
0.058973245322704315,duck,D AH K,D AH K T
0.05889884755015373,renew,R IH N UW,R IH N UW D
0.05883142724633217,fret,F R EH T,F R EH T IH D
0.05874062702059746,bus,B AH S,B AH S T
0.05874062702059746,buss,B AH S,B AH S T
0.05862509086728096,sully,S AH L IY,S AH L IY D
0.05848906189203262,arrive,ER AY V,ER AY V D
0.058451954275369644,range,R EY N JH,R EY N JH D
0.0582866407930851,rot,R AA T,R AA T IH D
0.05820191279053688,lurch,L ER CH,L ER CH T
0.05786098167300224,grow,G R OW,G R UW
0.05786098167300224,growe,G R OW,G R UW
0.057764459401369095,atrophy,AE T R AH F IY,AE T R AH F IY D
0.057730257511138916,attack,AH T AE K,AH T AE K T
0.057638105005025864,ballyhoo,B AE L IY HH UW,B AE L IY HH UW D
0.057435180991888046,trade,T R EY D,T R EY D IH D
0.05731059983372688,leg,L EH G,L EH G AH D
0.05725735053420067,cruise,K R UW Z,K R UW Z D
0.057050518691539764,lob,L AA B,L AA B D
0.056912701576948166,do,D UW,D IH D
0.05688745155930519,vex,V EH K S,V EH K S T
0.056825801730155945,dun,D AH N,D AH N D
0.05671970173716545,clip,K L IH P,K L IH P T
0.05658561363816261,sex,S EH K S,S EH K S T
0.056578297168016434,it,IH T,IH T
0.05639567971229553,lament,L AH M EH N T,L AH M EH N T IH D
0.05633800849318504,hurl,HH ER L,HH ER L D
0.05630498006939888,inch,IH N CH,IH N CH T
0.056300316005945206,shunt,SH AH N T,SH AH N T IH D
0.05623926594853401,hawk,HH AO K,HH AO K T
0.05623823031783104,chant,CH AE N T,CH AE N T IH D
0.055821944028139114,ridge,R IH JH,R IH JH D
0.05573534592986107,chat,CH AE T,CH AE T AH D
0.055629339069128036,anchor,AE NG K ER,AE NG K ER D
0.05555504187941551,shell,SH EH L,SH EH L D
0.05510956421494484,fray,F R EY,F R EY D
0.054937656968832016,crave,K R EY V,K R EY V D
0.05488099530339241,beg,B EH G,B EH G D
0.05474073812365532,cuff,K AH F,K AH F T
0.05442572757601738,cram,K R AE M,K R AE M D
0.05416995659470558,tint,T IH N T,T IH N T IH D
0.054106567054986954,cheer,CH IH R,CH IH R D
0.05410028249025345,jar,JH AA R,JH AA R D
0.05407455191016197,deter,D IH T ER,D IH T ER D
0.0539376325905323,muddy,M AH D IY,M AH D IY D
0.053812138736248016,gun,G AH N,G AH N D
0.05357128754258156,pad,P AE D,P AE D IH D
0.05341366305947304,smudge,S M AH JH,S M AH JH D
0.05329759046435356,cop,K AA P,K AA P T
0.053255919367074966,notch,N AA CH,N AA CH T
0.053072523325681686,addle,AE D AH L,AE D AH L D
0.05305346101522446,sap,S AE P,S AE P T
0.052932027727365494,bore,B AO R,B AO R D
0.052923593670129776,ear,IY R,IH R D
0.0528692789375782,paw,P AO,P AO D
0.05286498740315437,fillet,F AH L EY,F IH L AH T IH D
0.05275237187743187,mob,M AA B,M AA B D
0.0527350939810276,arch,AA R CH,AA R CH T
0.052302755415439606,curb,K ER B,K ER B D
0.052245814353227615,halt,HH AO L T,HH AO L T AH D
0.0521705187857151,jelly,JH EH L IY,JH EH L IY D
0.05212682858109474,whisk,W IH S K,W IH S K T
0.05193566158413887,scotch,S K AA CH,S K AA CH T
0.05193088576197624,jaw,JH AO,JH AO D
0.05176404491066933,master,M AE S T ER,M AE S T ER D
0.051737841218709946,lay,L EY,L EY D
0.05155197158455849,merce,M ER S,M ER S T
0.051514673978090286,sit,S IH T,S AE T
0.05135801061987877,probe,P R OW B,P R OW B D
0.051264453679323196,boot,B UW T,B UW T IH D
0.0512612909078598,sear,S IH R,S IH R D
0.05113024637103081,slap,S L AE P,S L AE P T
0.051050007343292236,cake,K EY K,K EY K T
0.050872284919023514,cane,K EY N,K EY N D
0.05083293840289116,nap,N AE P,N AE P T
0.05059767886996269,brag,B R AE G,B R AE G D
0.05055375024676323,prize,P R AY Z,P R AY Z D
0.050398778170347214,up,AH P,AH P T
0.05039307102560997,brave,B R EY V,B R EY V D
0.05039215087890625,sense,S EH N S,S EH N S T
0.05019010230898857,praise,P R EY Z,P R EY Z D
0.05001426860690117,outset,AW T S EH T,AW T S EH T
0.0499795563519001,tap,T AE P,T AE P T
0.04995483532547951,dart,D AA R T,D AA R T IH D
0.04975200071930885,boom,B UW M,B UW M D
0.04964613914489746,pot,P AA T,P AA T IH D
0.04953049495816231,snipe,S N AY P,S N AY P T
0.04944832623004913,mop,M AA P,M AA P T
0.04943373426795006,bury,B EH R IY,B EH R IY D
0.04932732135057449,cook,K UH K,K UH K T
0.04915051907300949,clock,K L AA K,K L AA K T
