activation,lemma,present_phones,past_phones
1.4948667287826538,experience,IH K S P IH R IY AH N S,IH K S P IH R IY AH N S T
1.1253223419189453,mispronounce,M IH S P R AH N AW N S,M IH S P R AH N AW N S T
1.0097689628601074,better,B EH T ER,B EH T ER D
0.9460926055908203,butcher,B UH CH ER,B UH CH ER D
0.9207839965820312,belly,B EH L IY,B EH L IY D
0.9205883741378784,measure,M EH ZH ER,M EH ZH ER D
0.9173232316970825,outperform,AW T P ER F AO R M,AW T P ER F AO R M D
0.9158953428268433,bury,B EH R IY,B EH R IY D
0.888923168182373,marry,M EH R IY,M EH R IY D
0.888485312461853,batter,B AE T ER,B AE T ER D
0.7448662519454956,vary,V EH R IY,V EH R IY D
0.7042286396026611,saturate,S AE CH ER EY T,S AE CH ER EY T IH D
0.6563440561294556,harry,HH EH R IY,HH EH R IY D
0.6510055065155029,belch,B EH L CH,B EH L CH T
0.6353269815444946,bankroll,B AE NG K R OW L,B AE NG K R OW L D
0.6176764965057373,bully,B UH L IY,B UH L IY D
0.6142281293869019,help,HH EH L P,HH EH L P T
0.5881552696228027,bank,B AE NG K,B AE NG K T
0.5880459547042847,nauseate,N AO Z IY EY T,N AO Z IY EY T AH D
0.552383303642273,experiment,IH K S P EH R AH M AH N T,IH K S P EH R AH M AH N T AH D
0.5509887933731079,nurture,N ER CH ER,N ER CH ER D
0.5433061122894287,outlaw,AW T L AO,AW T L AO D
0.5352782011032104,yelp,Y EH L P,Y EH L P D
0.5339645147323608,parry,P EH R IY,P EH R IY D
0.5302724838256836,mask,M AE S K,M AE S K T
0.5229392051696777,busy,B IH Z IY,B IH Z IY D
0.5109522342681885,bet,B EH T,B EH T
0.5107499361038208,match,M AE CH,M AE CH T
0.47701945900917053,butter,B AH T ER,B AH T ER D
0.4654611051082611,suture,S UW CH ER,S UW CH ER D
0.44226309657096863,bellow,B EH L OW,B EH L OW D
0.43456342816352844,jelly,JH EH L IY,JH EH L IY D
0.415259450674057,helmet,HH EH L M AH T,HH EH L M AH T IH D
0.4132934510707855,mess,M EH S,M EH S T
0.40400585532188416,belt,B EH L T,B EH L T AH D
0.40148046612739563,bilk,B IH L K,B IH L K T
0.38942572474479675,mutter,M AH T ER,M AH T ER D
0.3871707618236542,mellow,M EH L OW,M EH L OW D
0.38567253947257996,meter,M IY T ER,M IY T ER D
0.38531073927879333,vet,V EH T,V EH T IH D
0.37833115458488464,ferry,F EH R IY,F EH R IY D
0.3772387206554413,bat,B AE T,B AE T IH D
0.36867961287498474,mirror,M IH R ER,M IH R ER D
0.3654322326183319,bath,B AE TH,B EY DH D
0.36392948031425476,patter,P AE T ER,P AE T ER D
0.3610048294067383,thank,TH AE NG K,TH AE NG K T
0.3584848940372467,carry,K AE R IY,K AE R IY D
0.35494711995124817,fetter,F EH T ER,F EH T ER D
0.3480648994445801,meld,M EH L D,M EH L D AH D
0.3477122485637665,sully,S AH L IY,S AH L IY D
0.34733566641807556,ball,B AO L,B AO L D
0.34733566641807556,bawl,B AO L,B AO L D
0.3461880385875702,maul,M AO L,M AO L D
0.31829094886779785,nature,N EY CH ER,N EY CH ER D
0.3176494836807251,merce,M ER S,M ER S T
0.31580913066864014,search,S ER CH,S ER CH T
0.3143269717693329,separate,S EH P ER EY T,S EH P ER EY T IH D
0.31304556131362915,mass,M AE S,M AE S T
0.3020480275154114,vat,V AE T,V AE T IH D
0.2991795837879181,bare,B EH R,B EH R D
0.2964150309562683,set,S EH T,S EH T
0.2949376404285431,wretch,R EH CH,R EH CH IH D
0.29229429364204407,delve,D EH L V,D EH L V D
0.28965824842453003,hammer,HH AE M ER,HH AE M ER D
0.2880426049232483,barrage,B ER AA ZH,B ER AA ZH D
0.28535521030426025,morph,M AO R F,M AO R F T
0.28450825810432434,stop,S T AA P,S T AA P T
0.2813397943973541,cater,K EY T ER,K EY T ER D
0.27939358353614807,tally,T AE L IY,T AE L IY D
0.278062105178833,rally,R AE L IY,R AE L IY D
0.27211323380470276,letter,L EH T ER,L EH T ER D
0.268183171749115,melt,M EH L T,M EH L T AH D
0.2676357626914978,moor,M UH R,M UH R D
0.26333877444267273,belittle,B IH L IH T AH L,B IH L IH T AH L D
0.25674232840538025,cell,S EH L,S EH L D
0.25674232840538025,sell,S EH L,S OW L D
0.2566000819206238,fetch,F EH CH,F EH CH T
0.2510206997394562,tatter,T AE T ER,T AE T ER D
0.23290583491325378,mulch,M AH L CH,M AH L CH T
0.23246416449546814,situate,S IH CH UW EY T,S IH CH UW EY T IH D
0.22714665532112122,serrate,S EH R EY T,S EH R EY T IH D
0.22697165608406067,solve,S AA L V,S AA L V D
0.22485008835792542,bang,B AE NG,B AE NG D
0.21955779194831848,sink,S IH NG K,S AE NG K
0.2187052071094513,mourn,M AO R N,M AO R N D
0.21581962704658508,mail,M EY L,M EY L D
0.21406230330467224,bicker,B IH K ER,B IH K ER D
0.21335908770561218,yank,Y AE NG K,Y AE NG K T
0.21260926127433777,buffer,B AH F ER,B AH F ER D
0.21130293607711792,vex,V EH K S,V EH K S T
0.20875531435012817,net,N EH T,N EH T IH D
0.20642346143722534,holler,HH AA L ER,HH AA L ER D
0.2063458263874054,output,AW T P UH T,AW T P UH T
0.20351281762123108,bark,B AA R K,B AA R K T
0.20294955372810364,beach,B IY CH,B IY CH T
0.20268166065216064,hatch,HH AE CH,HH AE CH T
0.2022915482521057,mouth,M AW TH,M AW DH D
0.2021886706352234,sex,S EH K S,S EH K S T
0.20117607712745667,cascade,K AE S K EY D,K AE S K EY D IH D
0.20116987824440002,vest,V EH S T,V EH S T IH D
0.1982032060623169,bore,B AO R,B AO R D
0.19651439785957336,neuter,N UW T ER,N UW T ER D
0.19634950160980225,stock,S T AA K,S T AA K T
0.1950804889202118,vouch,V AW CH,V AW CH T
0.19390767812728882,hurl,HH ER L,HH ER L D
0.18609952926635742,inter,IH N T ER,IH N T ER D
0.18556177616119385,haul,HH AO L,HH AO L D
0.18494075536727905,bulge,B AH L JH,B AH L JH D
0.18288519978523254,birdie,B ER D IY,B ER D IY D
0.17995333671569824,stave,S T EY V,S T EY V D
0.1773955523967743,burst,B ER S T,B ER S T
0.17726486921310425,catch,K AE CH,K AA T
0.17524486780166626,venerate,V EH N ER EY T,V EH N ER EY T IH D
0.17355066537857056,sulk,S AH L K,S AH L K T
0.1721733808517456,yell,Y EH L,Y EH L D
0.1704513132572174,curry,K AH R IY,K ER IY D
0.1682145595550537,salary,S AE L ER IY,S AE L ER IY D
0.16686972975730896,pity,P IH T IY,P IH T IY D
0.1666490137577057,believe,B IH L IY V,B IH L IY V D
0.16622242331504822,max,M AE K S,M AE K S T
0.16552439332008362,ballyhoo,B AE L IY HH UW,B AE L IY HH UW D
0.1653808057308197,narrow,N EH R OW,N EH R OW D
0.1646404266357422,bely,B AH L AY,B IH L AY D
0.1631990373134613,buzz,B AH Z,B AH Z D
0.16115251183509827,think,TH IH NG K,TH AO T
0.15840819478034973,mark,M AA R K,M AA R K T
0.15840819478034973,marke,M AA R K,M AA R K T
0.15607261657714844,stray,S T R EY,S T R EY D
0.15499457716941833,botch,B AA CH,B AA CH T
0.15402236580848694,maroon,M ER UW N,M ER UW N D
0.15273842215538025,dally,D AE L IY,D AE L IY D
0.15184828639030457,badger,B AE JH ER,B AE JH ER D
0.15071481466293335,pet,P EH T,P EH T IH D
0.1506212055683136,pillar,P IH L ER,P IH L ER D
0.14844512939453125,stoop,S T UW P,S T UW P T
0.1464778482913971,shelve,SH EH L V,SH EH L V D
0.14456966519355774,hurt,HH ER T,HH ER T
0.14172044396400452,mate,M EY T,M EY T IH D
0.14156928658485413,mull,M AH L,M AH L D
0.13926270604133606,verse,V ER S,V ER S T
0.13603952527046204,gasp,G AE S P,G AE S P T
0.13441714644432068,mast,M AE S T,M AE S T AH D
0.1291944682598114,straggle,S T R AE G AH L,S T R AE G AH L D
0.1287025511264801,stake,S T EY K,S T EY K T
0.12846821546554565,vault,V AO L T,V AO L T IH D
0.1281331479549408,brim,B R IH M,B R IH M D
0.12704044580459595,agree,AH G R IY,AH G R IY D
0.1255439817905426,mill,M IH L,M IH L D
0.12054786086082458,soar,S AO R,S AO R D
0.11829119920730591,tailor,T EY L ER,T EY L ER D
0.11681118607521057,collar,K AA L ER,K AA L ER D
0.11594143509864807,saw,S AO,S AO D
0.11441043019294739,mature,M AH CH UH R,M AH T Y UH R D
0.11423906683921814,generate,JH EH N ER EY T,JH EH N ER EY T AH D
0.10918143391609192,inch,IH N CH,IH N CH T
0.10898104310035706,map,M AE P,M AE P T
0.10772410035133362,perch,P ER CH,P ER CH T
0.10719086229801178,bail,B EY L,B EY L D
0.10679826140403748,hang,HH AE NG,HH AH NG
0.10669359564781189,out,AW T,AW T AH D
0.10581837594509125,balk,B AO K,B AO K T
0.10081103444099426,bate,B EY T,B EY T IH D
0.10017585754394531,skim,S K IH M,S K IH M D
0.09953881800174713,patch,P AE CH,P AE CH T
0.0955912321805954,curl,K ER L,K ER L D
0.09515506029129028,wet,W EH T,W EH T
0.09515506029129028,whet,W EH T,W EH T IH D
0.09411898255348206,miss,M IH S,M IH S T
0.08864244818687439,decorate,D EH K ER EY T,D EH K ER EY T IH D
0.08709573745727539,pause,P AO Z,P AO Z D
0.08527909219264984,sort,S AO R T,S AO R T IH D
0.08415502309799194,billow,B IH L OW,B IH L OW D
0.083899587392807,peter,P IY T ER,P IY T ER D
0.08210429549217224,infer,IH N F ER,IH N F ER D
0.08103057742118835,jazz,JH AE Z,JH AE Z D
0.07819686830043793,call,K AO L,K AO L D
0.07807822525501251,bill,B IH L,B IH L D
0.07684323191642761,curse,K ER S,K ER S T
0.07600829005241394,base,B EY S,B EY S T
0.07579249143600464,sneer,S N IH R,S N IH R D
0.0747615396976471,care,K EH R,K EH R D
0.06732749938964844,inlay,IH N L EY,IH N L EY D
0.06688420474529266,simmer,S IH M ER,S IH M ER D
0.05909481644630432,scoop,S K UW P,S K UW P T
0.05003158748149872,stitch,S T IH CH,S T IH CH T
0.049795836210250854,hem,HH EH M,HH EH M D
0.046095266938209534,snap,S N AE P,S N AE P T
0.04579445719718933,bus,B AH S,B AH S T
0.04579445719718933,buss,B AH S,B AH S T
0.043031200766563416,jell,JH EH L,JH EH L D
0.039444342255592346,scrape,S K R EY P,S K R EY P T
0.03667914867401123,tell,T EH L,T OW L D
0.03543102741241455,incur,IH N K ER,IH N K ER D
0.020237356424331665,snack,S N AE K,S N AE K T
0.012805148959159851,pelt,P EH L T,P EH L T IH D
0.0004323422908782959,sate,S EY T,S EY T IH D
