activation,lemma,present_phones,past_phones
1.9976252317428589,psyche,S AY K IY,S AY K T
1.8408175706863403,crush,K R AH SH,K R AH SH T
1.7180885076522827,radicalize,R AE D IH K AH L AY Z,R AE D IH K AH L AY Z D
1.5178133249282837,prove,P R UW V,P R UW V D
1.4808000326156616,plug,P L AH G,P L AH G D
1.384351134300232,plan,P L AE N,P L AE N D
1.3722630739212036,drab,D R AE B,D R AE B D
1.333107829093933,prep,P R EH P,P R EH P T
1.2832878828048706,plane,P L EY N,P L EY N D
1.26775062084198,trash,T R AE SH,T R AE SH T
1.2644768953323364,weary,W IH R IY,W IH R IY D
1.2583502531051636,crash,K R AE SH,K R AE SH T
1.24704110622406,open,OW P AH N,OW P AH N D
1.2309266328811646,bribe,B R AY B,B R AY B D
1.2222830057144165,farm,F AA R M,F AA R M D
1.2220152616500854,plague,P L EY G,P L EY G D
1.2191799879074097,prune,P R UW N,P R UW N D
1.214088797569275,dream,D R IY M,D R IY M D
1.2077070474624634,crane,K R EY N,K R EY N D
1.2003461122512817,probe,P R OW B,P R OW B D
1.1953554153442383,shrug,SH R AH G,SH R AH G D
1.1889127492904663,drum,D R AH M,D R AH M D
1.1832555532455444,grain,G R EY N,G R EY N D
1.174423098564148,misspend,M IH S S P EH N D,M IH S S P EH N T
1.1710777282714844,climax,K L AY M AE K S,K L AY M AE K S T
1.1650062799453735,warm,W AO R M,W AO R M D
1.1451958417892456,drub,D R AH B,D R AH B D
1.1344010829925537,crop,K R AA P,K R AA P T
1.121472716331482,skirt,S K ER T,S K ER T IH D
1.1117371320724487,shroud,SH R AW D,SH R AW D IH D
1.109764814376831,drape,D R EY P,D R EY P T
1.1095973253250122,grab,G R AE B,G R AE B D
1.1050070524215698,mismatch,M IH S M AE CH,M IH S M AE CH T
1.0947997570037842,entrap,IH N T R AE P,IH N T R AE P T
1.0821300745010376,crab,K R AE B,K R AE B D
1.0814214944839478,droop,D R UW P,D R UW P T
1.0738731622695923,presage,P R EH S IH JH,P R EH S IH JH D
1.0651227235794067,drop,D R AA P,D R AA P T
1.062491536140442,fester,F EH S T ER,F EH S T ER D
1.0434781312942505,snub,S N AH B,S N AH B D
1.0368841886520386,father,F AA DH ER,F AA DH ER D
1.035733938217163,preen,P R IY N,P R IY N D
1.0227625370025635,foist,F OY S T,F OY S T IH D
1.0163518190383911,mourn,M AO R N,M AO R N D
1.009856104850769,scout,S K AW T,S K AW T IH D
1.0070749521255493,annul,AE N AH L,AE N AH L D
1.0065836906433105,thrash,TH R AE SH,TH R AE SH T
0.9801417589187622,stain,S T EY N,S T EY N D
0.9794726371765137,perjure,P ER JH ER,P ER JH ER D
0.9784828424453735,foster,F AA S T ER,F AA S T ER D
0.9768879413604736,creep,K R IY P,K R EH P T
0.9568287134170532,prop,P R AA P,P R AA P T
0.9521385431289673,stub,S T AH B,S T AH B D
0.9484707117080688,brave,B R EY V,B R EY V D
0.9442633390426636,drag,D R AE G,D R AE G D
0.9352682828903198,trap,T R AE P,T R AE P T
0.9347721338272095,answer,AE N S ER,AE N S ER D
0.9290803670883179,plumb,P L AH M,P L AH M D
0.9239292144775391,prime,P R AY M,P R AY M D
0.9230877161026001,feather,F EH DH ER,F EH DH ER D
0.9214543104171753,state,S T EY T,S T EY T IH D
0.9148601293563843,frame,F R EY M,F R EY M D
0.9038577079772949,drip,D R IH P,D R IH P T
0.8975975513458252,flag,F L AE G,F L AE G D
0.8947477340698242,crave,K R EY V,K R EY V D
0.894692063331604,drain,D R EY N,D R EY N D
0.8908703327178955,praise,P R EY Z,P R EY Z D
0.8904827833175659,stave,S T EY V,S T EY V D
0.8833070993423462,phrase,F R EY Z,F R EY Z D
0.8774294853210449,prepackage,P R IY P AE K AH JH,P R IY P AE K AH JH D
0.8558746576309204,maroon,M ER UW N,M ER UW N D
0.8457975387573242,skate,S K EY T,S K EY T IH D
0.8431190252304077,brush,B R AH SH,B R AH SH T
0.8203167915344238,brag,B R AE G,B R AE G D
0.81934654712677,groan,G R OW N,G R OW N D
0.8009353876113892,cram,K R AE M,K R AE M D
0.7977374792098999,pillar,P IH L ER,P IH L ER D
0.7874300479888916,spout,S P AW T,S P AW T IH D
0.7854312658309937,dress,D R EH S,D R EH S T
0.7649718523025513,blur,B L ER,B L ER D
0.7485407590866089,drill,D R IH L,D R IH L D
0.7481503486633301,short,SH AO R T,SH AO R T IH D
0.744376540184021,tiptoe,T IH P T OW,T IH P T OW D
0.7433661222457886,snag,S N AE G,S N AE G D
0.7367725372314453,promulgate,P R OW M AH L G EY T,P R AA M AH L G EY T IH D
0.7266737222671509,stun,S T AH N,S T AH N D
0.6997514963150024,grin,G R IH N,G R IH N D
0.6990679502487183,train,T R EY N,T R EY N D
0.6931909322738647,craze,K R EY Z,K R EY Z D
0.691193699836731,spurt,S P ER T,S P ER T IH D
0.6860159635543823,prick,P R IH K,P R IH K T
0.6804354190826416,flower,F L AW ER,F L AW ER D
0.6741541624069214,frown,F R AW N,F R AW N D
0.6737844944000244,dial,D AY AH L,D AY AH L D
0.66413414478302,formulate,F AO R M Y AH L EY T,F AO R M Y AH L EY T AH D
0.6399205923080444,stone,S T OW N,S T OW N D
0.6386474370956421,press,P R EH S,P R EH S T
0.6310893297195435,addle,AE D AH L,AE D AH L D
0.6241079568862915,divvy,D IH V IY,D IH V IY D
0.6233738660812378,thrive,TH R AY V,TH R OW V
0.6195975542068481,club,K L AH B,K L AH B D
0.6160008907318115,brain,B R EY N,B R EY N D
0.604478120803833,unnerve,AH N ER V,AH N N ER V D
0.5839540958404541,swirl,S W ER L,S W ER L D
0.5808058977127075,premier,P R EH M IH R,P R EH M IH R D
0.5808058977127075,premiere,P R EH M IH R,P R EH M IH R D
0.5799113512039185,drug,D R AH G,D R AH G D
0.5738184452056885,flame,F L EY M,F L EY M D
0.5618813037872314,barb,B AA R B,B AA R B D
0.5475960969924927,assert,AH S ER T,AH S ER T IH D
0.5295798778533936,brief,B R IY F,B R IY F T
0.5290831327438354,thrill,TH R IH L,TH R IH L D
0.5195034742355347,gasp,G AE S P,G AE S P T
0.5150579214096069,overfeed,OW V ER F IY D,OW V ER F EH D
0.5146080255508423,recur,R IH K ER,R IY K ER D
0.5135530233383179,brim,B R IH M,B R IH M D
0.513375997543335,braise,B R EY Z,B R EY Z D
0.5119922161102295,darn,D AA R N,D AA R N D
0.5107284784317017,elope,IH L OW P,IH L OW P D
0.5034298896789551,blush,B L AH SH,B L AH SH T
0.4538700580596924,clip,K L IH P,K L IH P T
0.44468462467193604,price,P R AY S,P R AY S T
0.4276920557022095,blab,B L AE B,B L AE B D
0.4252277612686157,trip,T R IH P,T R IH P T
0.4130878448486328,drone,D R OW N,D R OW N D
0.4019964933395386,crown,K R AW N,K R AW N D
0.40181469917297363,braid,B R EY D,B R EY D IH D
0.3956791162490845,fray,F R EY,F R EY D
0.39224183559417725,quip,K W IH P,K W IH P T
0.3908323049545288,prong,P R AO NG,P R AO NG D
0.3891795873641968,gust,G AH S T,G AH S T IH D
0.3839867115020752,still,S T IH L,S T IH L D
0.3819977045059204,court,K AO R T,K AO R T IH D
0.37486088275909424,sneeze,S N IY Z,S N IY Z D
0.36014366149902344,troop,T R UW P,T R UW P T
0.328727126121521,shave,SH EY V,SH EY V D
0.31594109535217285,skim,S K IH M,S K IH M D
0.31524884700775146,drive,D R AY V,D R OW V
0.3111751079559326,wax,W AE K S,W AE K S T
0.3110828399658203,kick,K IH K,K IH K T
0.30577659606933594,lure,L UH R,L UH R D
0.3002413511276245,tarnish,T AA R N IH SH,T AA R N IH SH T
0.2936089038848877,like,L AY K,L AY K T
0.29345762729644775,grope,G R OW P,G R OW P T
0.2855260372161865,trim,T R IH M,T R IH M D
0.27727049589157104,immerse,IH M ER S,IH M ER S T
0.2608610987663269,perk,P ER K,P ER K T
0.25661081075668335,slug,S L AH G,S L AH G D
0.24979400634765625,ply,P L AY,P L AY D
0.23864710330963135,die,D AY,D AY D
0.23864710330963135,dye,D AY,D AY D
0.23265886306762695,dim,D IH M,D IH M D
0.15911632776260376,peak,P IY K,P IY K T
0.15911632776260376,pique,P IY K,P IY K T
0.1581352949142456,sob,S AA B,S AA B D
0.13046813011169434,pick,P IH K,P IH K T
0.12988901138305664,tick,T IH K,T IH K T
0.11838698387145996,collar,K AA L ER,K AA L ER D
0.10940682888031006,duck,D AH K,D AH K T
0.07157361507415771,okay,OW K EY,OW K EY D
0.03295755386352539,shred,SH R EH D,SH R EH D IH D
