activation,lemma,present_phones,past_phones
0.06306561827659607,accede,AE K S IY D,AE K S IY D IH D
0.06253162026405334,paddle,P AE D AH L,P AE D AH L D
0.06083881855010986,purchase,P ER CH AH S,P ER CH AH S T
0.05967181921005249,battle,B AE T AH L,B AE T AH L D
0.05893567204475403,mingle,M IH NG G AH L,M IH NG G AH L D
0.05761241912841797,deceive,D IH S IY V,D IH S IY V D
0.05487322807312012,incise,IH N S AY Z,IH N S AY Z D
0.05219152569770813,unplug,AH N P L AH G,AH N P L AH G D
0.051647037267684937,negate,N IH G EY T,N IY G EY T IH D
0.05107700824737549,vet,V EH T,V EH T IH D
0.050787150859832764,codify,K OW D AH F AY,K AA D AH F AY D
0.04894512891769409,vilify,V IH L IH F AY,V IH L AH F AY D
0.047903239727020264,yell,Y EH L,Y EH L D
0.04686969518661499,analyze,AE N AH L AY Z,AE N AH L AY Z D
0.04399105906486511,amble,AE M B AH L,AE M B AH L D
0.042955636978149414,dun,D AH N,D AH N D
0.04034614562988281,vote,V OW T,V OW T IH D
0.04009371995925903,peeve,P IY V,P IY V D
0.04003268480300903,claw,K L AO,K L AO D
0.039234280586242676,tickle,T IH K AH L,T IH K AH L D
0.03872758150100708,chair,CH EH R,CH EH R D
0.037029147148132324,dupe,D UW P,D UW P T
0.036390870809555054,dope,D OW P,D OW P T
0.03627607226371765,pen,P EH N,P EH N D
0.0332852303981781,chafe,CH EY F,CH EY F T
0.026925742626190186,douse,D AW S,D AW S T
0.01897573471069336,duel,D UW AH L,D UW AH L D
0.016993671655654907,decease,D IH S IY S,D IH S IY S T
0.012477278709411621,annul,AE N AH L,AE N AH L D
0.012392044067382812,dibble,D IH B AH L,D IH B AH L D
