activation,lemma,present_phones,past_phones
2.6350767612457275,synthesize,S IH N TH AH S AY Z,S IH N TH IH S AY Z D
2.4184377193450928,scale,S K EY L,S K EY L D
2.3906524181365967,spay,S P EY,S P EY D
2.3877127170562744,skate,S K EY T,S K EY T IH D
2.378776788711548,sin,S IH N,S IH N D
2.3771331310272217,sew,S OW,S OW D
2.3755605220794678,search,S ER CH,S ER CH T
2.3664042949676514,sue,S UW,S UW D
2.363095998764038,ski,S K IY,S K IY D
2.3629324436187744,set,S EH T,S EH T
2.3522353172302246,serve,S ER V,S ER V D
2.349653720855713,stow,S T OW,S T OW D
2.339754343032837,stay,S T EY,S T EY D
2.3392930030822754,screw,S K R UW,S K R UW D
2.3380777835845947,school,S K UW L,S K UW L D
2.3268797397613525,slow,S L OW,S L OW D
2.3263566493988037,skid,S K IH D,S K IH D IH D
2.3256218433380127,stew,S T UW,S T UW D
2.3239550590515137,sock,S AA K,S AA K T
2.323702335357666,snee,S N IY,S N IY D
2.31758189201355,single,S IH NG G AH L,S IH NG G AH L D
2.3159878253936768,scuff,S K AH F,S K AH F T
2.3148109912872314,survey,S ER V EY,S ER V EY D
2.3147971630096436,sink,S IH NG K,S AE NG K
2.314758062362671,scrub,S K R AH B,S K R AH B D
2.31070613861084,simmer,S IH M ER,S IH M ER D
2.309859275817871,scheme,S K IY M,S K IY M D
2.3078248500823975,steal,S T IY L,S T OW L
2.3000428676605225,sub,S AH B,S AH B D
2.2996628284454346,slay,S L EY,S L UW
2.2992172241210938,saint,S EY N T,S EY N T IH D
2.296066999435425,singe,S IH N JH,S IH N JH D
2.2940938472747803,say,S EY,S EH D
2.2940471172332764,snuggle,S N AH G AH L,S N AH G AH L D
2.2938461303710938,sum,S AH M,S AH M D
2.290477991104126,seesaw,S IY S AO,S IY S AO D
2.2878448963165283,sit,S IH T,S AE T
2.2858054637908936,sing,S IH NG,S AE NG
2.2850594520568848,soup,S UW P,S UW P T
2.281081438064575,streamline,S T R IY M L AY N,S T R IY M L AY N D
2.28027081489563,salute,S AH L UW T,S AH L UW T IH D
2.279740333557129,sob,S AA B,S AA B D
2.277907371520996,subdivide,S AH B D AH V AY D,S AH B D IH V AY D IH D
2.2778122425079346,see,S IY,S AO
2.27752423286438,slight,S L AY T,S L AY T IH D
2.2772281169891357,spur,S P ER,S P ER D
2.277050495147705,cease,S IY S,S IY S T
2.2768642902374268,square,S K W EH R,S K W EH R D
2.2759456634521484,savor,S EY V ER,S EY V ER D
2.2746622562408447,scout,S K AW T,S K AW T IH D
2.2745821475982666,service,S ER V AH S,S ER V IH S T
2.2740237712860107,stray,S T R EY,S T R EY D
2.2739181518554688,sucker,S AH K ER,S AH K ER D
2.272022008895874,scam,S K AE M,S K AE M D
2.271162986755371,stitch,S T IH CH,S T IH CH T
2.269089937210083,save,S EY V,S EY V D
2.2679641246795654,cell,S EH L,S EH L D
2.2679641246795654,sell,S EH L,S OW L D
2.2674758434295654,spot,S P AA T,S P AA T IH D
2.2670223712921143,spotlight,S P AA T L AY T,S P AA T L AY T IH D
2.2661454677581787,sulk,S AH L K,S AH L K T
2.265782117843628,cite,S AY T,S AY T AH D
2.265782117843628,site,S AY T,S AY T IH D
2.2643544673919678,scrap,S K R AE P,S K R AE P T
2.264204263687134,seek,S IY K,S AO T
2.2616467475891113,stack,S T AE K,S T AE K T
2.261125326156616,suture,S UW CH ER,S UW CH ER D
2.260263204574585,sigh,S AY,S AY D
2.259558916091919,stave,S T EY V,S T EY V D
2.2582995891571045,spring,S P R IH NG,S P R AE NG
2.258161783218384,sneak,S N IY K,S N IY K T
2.2580196857452393,sear,S IH R,S IH R D
2.257617235183716,seat,S IY T,S IY T IH D
2.2552409172058105,seize,S IY Z,S IY Z D
2.2537896633148193,slur,S L ER,S L ER D
2.2521069049835205,sex,S EH K S,S EH K S T
2.2517178058624268,spy,S P AY,S P AY D
2.2504489421844482,style,S T AY L,S T AY L D
2.24924635887146,stud,S T AH D,S T AH D IH D
2.248861074447632,suit,S UW T,S UW T IH D
2.2478997707366943,saw,S AO,S AO D
2.2468183040618896,sky,S K AY,S K IY D
2.24479603767395,snack,S N AE K,S N AE K T
2.244544744491577,cede,S IY D,S IY D AH D
2.2443339824676514,smack,S M AE K,S M AE K T
2.243626594543457,scoop,S K UW P,S K UW P T
2.241943597793579,slit,S L IH T,S L IH T
2.241267442703247,cinch,S IH N CH,S IH N CH T
2.240461587905884,sprain,S P R EY N,S P R EY N D
2.240293264389038,subside,S AH B S AY D,S AH B S AY D IH D
2.2399556636810303,stripe,S T R AY P,S T R AY P T
2.2392737865448,surface,S ER F AH S,S ER F IH S T
2.237367868423462,sate,S EY T,S EY T IH D
2.237041711807251,snag,S N AE G,S N AE G D
2.2366268634796143,side,S AY D,S AY D IH D
2.2361514568328857,slump,S L AH M P,S L AH M P T
2.235595464706421,sap,S AE P,S AE P T
2.2351646423339844,scurry,S K ER IY,S K ER IY D
2.2350499629974365,steamroller,S T IY M R OW L ER,S T IY M R OW L ER D
2.232203245162964,solve,S AA L V,S AA L V D
2.229174852371216,slick,S L IH K,S L IH K T
2.2286393642425537,splash,S P L AE SH,S P L AE SH T
2.2282464504241943,survive,S ER V AY V,S ER V AY V D
2.228189468383789,suppose,S AH P OW Z,S AH P OW Z D
2.2280828952789307,skirt,S K ER T,S K ER T IH D
2.227705955505371,slate,S L EY T,S L EY T IH D
2.2266790866851807,scapegoat,S K EY P G OW T,S K EY P G OW T IH D
2.226313829421997,stem,S T EH M,S T EH M D
2.225672960281372,skim,S K IH M,S K IH M D
2.2236130237579346,solidify,S AH L IH D AH F AY,S AH L IH D AH F AY D
2.2226555347442627,sip,S IH P,S IH P T
2.2216765880584717,seep,S IY P,S IY P T
2.220214366912842,scoff,S K AO F,S K AO F T
2.2191221714019775,sleeve,S L IY V,S L IY V D
2.217662811279297,spurt,S P ER T,S P ER T IH D
2.213667631149292,spice,S P AY S,S P AY S T
2.2112925052642822,snatch,S N AE CH,S N AE CH T
2.210291624069214,size,S AY Z,S AY Z D
2.210064172744751,stall,S T AO L,S T AO L D
2.2097878456115723,sort,S AO R T,S AO R T IH D
2.2097866535186768,sow,S AW,S AW D
2.209648847579956,segment,S EH G M AH N T,S EH G M EH N T IH D
2.2095043659210205,scallop,S K AE L AH P,S K AA L AH P T
2.2090752124786377,smile,S M AY L,S M AY L D
2.2088096141815186,sizzle,S IH Z AH L,S IH Z AH L D
2.208616018295288,stain,S T EY N,S T EY N D
2.208326578140259,circuit,S ER K AH T,S ER K AH T IH D
2.207036256790161,scotch,S K AA CH,S K AA CH T
2.2066643238067627,soar,S AO R,S AO R D
2.206481695175171,stalk,S T AO K,S T AO K T
2.205247163772583,stone,S T OW N,S T OW N D
2.2043299674987793,summarize,S AH M ER AY Z,S AH M ER AY Z D
2.2031753063201904,soil,S OY L,S OY L D
2.203122138977051,subsidize,S AH B S IH D AY Z,S AH B S IH D AY Z D
2.2024664878845215,stride,S T R AY D,S T R OW D
2.2018606662750244,string,S T R IH NG,S T R AH NG
2.2009894847869873,skin,S K IH N,S K IH N D
2.200460195541382,scream,S K R IY M,S K R IY M D
2.1994740962982178,stoop,S T UW P,S T UW P T
2.198639392852783,siphon,S AY F AH N,S AY F AH N D
2.198040246963501,snipe,S N AY P,S N AY P T
2.1972951889038086,speak,S P IY K,S P OW K
2.1965081691741943,smoke,S M OW K,S M OW K T
2.196294069290161,sketch,S K EH CH,S K EH CH T
2.196229934692383,stagger,S T AE G ER,S T AE G ER D
2.1951520442962646,spout,S P AW T,S P AW T IH D
2.194905996322632,screen,S K R IY N,S K R IY N D
2.1944773197174072,seal,S IY L,S IY L D
2.1938884258270264,state,S T EY T,S T EY T IH D
2.1924333572387695,spew,S P Y UW,S P Y UW D
2.192359685897827,sully,S AH L IY,S AH L IY D
2.1923553943634033,surmise,S ER M AY Z,S ER M AY Z D
2.1918294429779053,slice,S L AY S,S L AY S T
2.1907355785369873,summon,S AH M AH N,S AH M AH N D
2.1899750232696533,summons,S AH M AH N Z,S AH M AH N Z D
2.1899187564849854,spread,S P R EH D,S P R EH D
2.189605951309204,spurn,S P ER N,S P ER N D
2.188213586807251,stir,S T ER,S T ER D
2.186985731124878,subvert,S AH B V ER T,S AH B V ER T IH D
2.1865923404693604,speed,S P IY D,S P EH D
2.1858701705932617,spook,S P UW K,S P UW K T
2.184190034866333,spill,S P IH L,S P IH L D
2.1841399669647217,psyche,S AY K IY,S AY K T
2.1836636066436768,strive,S T R AY V,S T R OW V
2.1831531524658203,soak,S OW K,S OW K T
2.1829588413238525,still,S T IH L,S T IH L D
2.182623863220215,scalp,S K AE L P,S K AE L P T
2.1825027465820312,span,S P AE N,S P AE N D
2.180757761001587,space,S P EY S,S P EY S T
2.180593252182007,squeak,S K W IY K,S K W IY K T
2.1805641651153564,stock,S T AA K,S T AA K T
2.18046498298645,swerve,S W ER V,S W ER V D
2.1798911094665527,circle,S ER K AH L,S ER K AH L D
2.178981065750122,spell,S P EH L,S P EH L D
2.1788902282714844,snicker,S N IH K ER,S N IH K ER D
2.178245782852173,stage,S T EY JH,S T EY JH D
2.177743673324585,sour,S AW ER,S AW ER D
2.176612615585327,squash,S K W AA SH,S K W AA SH T
2.176532030105591,send,S EH N D,S EH N T
2.1761300563812256,scribble,S K R IH B AH L,S K R IH B AH L D
2.174638032913208,scorch,S K AO R CH,S K AO R CH T
2.173494577407837,stress,S T R EH S,S T R EH S T
2.1729366779327393,strip,S T R IH P,S T R IH P T
2.1716201305389404,suffice,S AH F AY S,S AH F AY S T
2.1714351177215576,sag,S AE G,S AE G D
2.1706979274749756,scrape,S K R EY P,S K R EY P T
2.1705384254455566,season,S IY Z AH N,S IY Z AH N D
2.169684886932373,sneer,S N IH R,S N IH R D
2.169191598892212,swipe,S W AY P,S W AY P T
2.1672699451446533,savage,S AE V AH JH,S AE V IH JH D
2.16654372215271,spruce,S P R UW S,S P R UW S T
2.1664695739746094,slide,S L AY D,S L IH D
2.1663601398468018,secede,S IH S IY D,S IH S IY D IH D
2.166290521621704,splice,S P L AY S,S P L AY S T
2.164870023727417,sting,S T IH NG,S T AH NG
2.1640989780426025,stagnate,S T AE G N EY T,S T AE G N EY T IH D
2.1633036136627197,sand,S AE N D,S AE N D IH D
2.1631619930267334,submit,S AH B M IH T,S AH B M IH T IH D
2.1630847454071045,sense,S EH N S,S EH N S T
2.1629905700683594,spatter,S P AE T ER,S P AE T ER D
2.1601057052612305,split,S P L IH T,S P L IH T
2.1600654125213623,surf,S ER F,S ER F T
2.1591603755950928,switch,S W IH CH,S W IH CH T
2.157585859298706,swoon,S W UW N,S W UW N D
2.1575114727020264,sleep,S L IY P,S L EH P T
2.156787633895874,stymie,S T AY M IY,S T AY M IY D
2.1547842025756836,slot,S L AA T,S L AA T IH D
2.1541898250579834,smudge,S M AH JH,S M AH JH D
2.154179573059082,stump,S T AH M P,S T AH M P T
2.153594970703125,situate,S IH CH UW EY T,S IH CH UW EY T IH D
2.153484582901001,swirl,S W ER L,S W ER L D
2.1529994010925293,swing,S W IH NG,S W AH NG
2.152174711227417,supply,S AH P L AY,S AH P L AY D
2.150942087173462,scuffle,S K AH F AH L,S K AH F AH L D
2.1492502689361572,stub,S T AH B,S T AH B D
2.1486942768096924,smell,S M EH L,S M EH L D
2.147850751876831,slack,S L AE K,S L AE K T
2.146113395690918,storm,S T AO R M,S T AO R M D
2.1457631587982178,snub,S N AH B,S N AH B D
2.145564317703247,swell,S W EH L,S W EH L D
2.1443140506744385,scan,S K AE N,S K AE N D
2.1429896354675293,steep,S T IY P,S T IY P T
2.1425862312316895,settle,S EH T AH L,S EH T AH L D
2.142483711242676,stake,S T EY K,S T EY K T
2.141786813735962,safeguard,S EY F G AA R D,S EY F G AA R D IH D
2.141716718673706,scuttle,S K AH T AH L,S K AH T AH L D
2.1408934593200684,sneeze,S N IY Z,S N IY Z D
2.1403110027313232,stoke,S T OW K,S T OW K T
2.13948130607605,censor,S EH N S ER,S EH N S ER D
2.13920521736145,spike,S P AY K,S P AY K T
2.1387810707092285,step,S T EH P,S T EH P T
2.1386420726776123,scare,S K EH R,S K EH R D
2.1380369663238525,sling,S L IH NG,S L AH NG
2.1377360820770264,snare,S N EH R,S N EH R D
2.1373116970062256,cycle,S AY K AH L,S AY K AH L D
2.1365363597869873,sublet,S AH B L EH T,S AH B L EH T
2.1349127292633057,slug,S L AH G,S L AH G D
2.134754180908203,screech,S K R IY CH,S K R IY CH T
2.134615182876587,swim,S W IH M,S W AE M
2.1346065998077393,stun,S T AH N,S T AH N D
2.134129524230957,scar,S K AA R,S K AA R D
2.1340761184692383,swamp,S W AA M P,S W AO M P T
2.1334822177886963,spark,S P AA R K,S P AA R K T
2.133209705352783,socialize,S OW SH AH L AY Z,S OW SH AH L AY Z D
2.1329219341278076,stream,S T R IY M,S T R IY M D
2.13150954246521,specify,S P EH S AH F AY,S P EH S AH F AY D
2.1306960582733154,spin,S P IH N,S P AH N
2.1298813819885254,sedate,S IH D EY T,S IH D EY T IH D
2.129552125930786,skew,S K Y UW,S K Y UW D
2.129492998123169,seclude,S AH K L UW D,S IH K L UW D IH D
2.129244804382324,station,S T EY SH AH N,S T EY SH AH N D
2.1292316913604736,starch,S T AA R CH,S T AA R CH T
2.129002094268799,surpass,S ER P AE S,S ER P AE S T
2.1269218921661377,stroll,S T R OW L,S T R OW L D
2.1261613368988037,stylize,S T AY L AY Z,S T AY L AY Z D
2.124596357345581,strike,S T R AY K,S T R AH K
2.124472141265869,snap,S N AE P,S N AE P T
2.1238820552825928,sponge,S P AH N JH,S P AH N JH D
2.1204845905303955,study,S T AH D IY,S T AH D IY D
2.117586374282837,strain,S T R EY N,S T R EY N D
2.1173367500305176,section,S EH K SH AH N,S EH K SH AH N D
2.1167287826538086,steer,S T IH R,S T IH R D
2.1163694858551025,score,S K AO R,S K AO R D
2.115947961807251,streak,S T R IY K,S T R IY K T
2.114149570465088,spearhead,S P IH R HH EH D,S P IH R HH EH D IH D
2.1139590740203857,serenade,S EH R AH N EY D,S EH R AH N EY D IH D
2.1133549213409424,saturate,S AE CH ER EY T,S AE CH ER EY T IH D
2.1133229732513428,slim,S L IH M,S L IH M D
2.113248825073242,separate,S EH P ER EY T,S EH P ER EY T IH D
2.111076593399048,subdue,S AH B D UW,S AH B D UW D
2.1101021766662598,soothe,S UW DH,S UW DH D
2.109534740447998,salivate,S AE L AH V EY T,S AE L AH V EY T IH D
2.109294891357422,stilt,S T IH L T,S T IH L T IH D
2.1080946922302246,scratch,S K R AE CH,S K R AE CH T
2.1076772212982178,swoop,S W UW P,S W UW P T
2.104788064956665,slip,S L IH P,S L IH P T
2.1041533946990967,strap,S T R AE P,S T R AE P T
2.104027509689331,sodomize,S AO D AH M AY Z,S AO D AH M AY Z D
2.103424310684204,spar,S P AA R,S P AA R D
2.1029934883117676,signal,S IH G N AH L,S IH G N AH L D
2.102670192718506,sanitize,S AE N IH T AY Z,S AE N IH T AY Z D
2.1014561653137207,start,S T AA R T,S T AA R T IH D
2.1012606620788574,suffuse,S AH F Y UW Z,S AH F Y UW Z D
2.100900888442993,submerse,S AH B M ER S,S AH B M ER S T
2.1008734703063965,sac,S AE K,S AE K T
2.1008734703063965,sack,S AE K,S AE K T
2.1005337238311768,smooth,S M UW DH,S M UW DH D
2.0992014408111572,spare,S P EH R,S P EH R D
2.098493814468384,swoosh,S W UW SH,S W UW SH T
2.097885847091675,straggle,S T R AE G AH L,S T R AE G AH L D
2.097468614578247,slam,S L AE M,S L AE M D
2.095768690109253,spank,S P AE NG K,S P AE NG K T
2.0949790477752686,censure,S EH N SH ER,S EH N SH ER D
2.0946357250213623,swathe,S W AA DH,S W AA DH D
2.0942468643188477,civilize,S IH V AH L AY Z,S IH V AH L AY Z D
2.0936968326568604,second,S EH K AH N D,S EH K AH N D IH D
2.0926222801208496,scold,S K OW L D,S K OW L D IH D
2.0919525623321533,stash,S T AE SH,S T AE SH T
2.090815305709839,swish,S W IH SH,S W IH SH T
2.0897018909454346,squeeze,S K W IY Z,S K W IY Z D
2.0866308212280273,suppress,S AH P R EH S,S AH P R EH S T
2.0865867137908936,stop,S T AA P,S T AA P T
2.086566925048828,swap,S W AA P,S W AA P T
2.085983991622925,spangle,S P AE NG G AH L,S P AE NG G AH L D
2.0846331119537354,scald,S K AO L D,S K AO L D IH D
2.0844757556915283,stanch,S T AE N CH,S T AE N CH T
2.08371901512146,splurge,S P L ER JH,S P L ER JH D
2.08271861076355,struggle,S T R AH G AH L,S T R AH G AH L D
2.0817883014678955,sweat,S W EH T,S W EH T IH D
2.0804522037506104,sound,S AW N D,S AW N D IH D
2.078688859939575,stretch,S T R EH CH,S T R EH CH T
2.0786426067352295,scourge,S K ER JH,S K ER JH D
2.0769622325897217,sculpt,S K AH L P T,S K AH L P T IH D
2.0757105350494385,seduce,S IH D UW S,S IH D UW S T
2.0738298892974854,slog,S L AA G,S L AA G D
2.0732150077819824,sidetrack,S AY D T R AE K,S AY D T R AE K T
2.0719401836395264,stroke,S T R OW K,S T R OW K T
2.0715863704681396,stare,S T EH R,S T EH R D
2.0710813999176025,simplify,S IH M P L AH F AY,S IH M P L AH F AY D
2.068776845932007,slash,S L AE SH,S L AE SH T
2.0683600902557373,star,S T AA R,S T AA R D
2.067837953567505,smart,S M AA R T,S M AA R T IH D
2.066143751144409,sequester,S IH K W EH S T ER,S IH K W EH S T ER D
2.064603567123413,stomp,S T AA M P,S T AA M P T
2.0605597496032715,sideline,S AY D L AY N,S AY D L AY N D
2.05975079536438,straddle,S T R AE D AH L,S T R AE D AH L D
2.0584614276885986,surprise,S ER P R AY Z,S ER P R AY Z D
2.0582563877105713,submerge,S AH B M ER JH,S AH B M ER JH D
2.0577239990234375,scrunch,S K R AH N CH,S K R AH N CH T
2.0541608333587646,stampede,S T AE M P IY D,S T AE M P IY D IH D
2.053614377975464,scrounge,S K R AW N JH,S K R AW N JH D
2.0534615516662598,stunt,S T AH N T,S T AH N T IH D
2.053069829940796,swat,S W AA T,S W AA T IH D
2.0516371726989746,smash,S M AE SH,S M AE SH T
2.0507071018218994,slap,S L AE P,S L AE P T
2.0498046875,slant,S L AE N T,S L AE N T IH D
2.0493228435516357,snort,S N AO R T,S N AO R T IH D
2.0482075214385986,starve,S T AA R V,S T AA R V D
2.0451154708862305,sprint,S P R IH N T,S P R IH N T IH D
2.04439640045166,saddle,S AE D AH L,S AE D AH L D
2.041124105453491,stink,S T IH NG K,S T AE NG K
2.038970947265625,stand,S T AE N D,S T UH D
2.0375969409942627,swatch,S W AA CH,S W AA CH T
2.036769151687622,stratify,S T R AE T AH F AY,S T R AE T AH F AY D
2.035897970199585,swink,S W IH NG K,S W AE NG K
2.035895824432373,snarl,S N AA R L,S N AA R AH L D
2.0350983142852783,serrate,S EH R EY T,S EH R EY T IH D
2.0341293811798096,signify,S IH G N AH F AY,S IH G N AH F AY D
2.028264284133911,startle,S T AA R T AH L,S T AA R T AH L D
2.026952028274536,swivel,S W IH V AH L,S W IH V AH L D
2.026287794113159,salvage,S AE L V AH JH,S AE L V IH JH D
2.0244216918945312,staple,S T EY P AH L,S T EY P AH L D
2.024407148361206,silence,S AY L AH N S,S AY L AH N S T
2.021944522857666,supersede,S UW P ER S IY D,S UW P ER S IY D IH D
2.0203304290771484,store,S T AO R,S T AO R D
2.0191218852996826,swear,S W EH R,S W AO R
2.0190558433532715,substantiate,S AH B S T AE N CH IY EY T,S AH B S T AE N SH IY EY T IH D
2.019002676010132,smother,S M AH DH ER,S M AH DH ER D
2.016721487045288,simulcast,S AY M Y AH L K AE S T,S AY M Y AH L K AE S T
2.0144128799438477,circulate,S ER K Y AH L EY T,S ER K Y AH L EY T IH D
2.0137763023376465,scamper,S K AE M P ER,S K AE M P ER D
2.01179575920105,squirrel,S K W ER AH L,S K W ER AH L D
2.0102062225341797,sidle,S AY D AH L,S AY D AH L D
2.0089800357818604,story,S T AO R IY,S T AO R IY D
2.008028745651245,sprout,S P R AW T,S P R AW T IH D
2.007920026779175,swelter,S W EH L T ER,S W EH L T ER D
2.007471799850464,salary,S AE L ER IY,S AE L ER IY D
2.0071051120758057,sustain,S AH S T EY N,S AH S T EY N D
2.0047762393951416,silhouette,S IH L AH W EH T,S IH L AH W EH T IH D
2.004711627960205,speckle,S P EH K AH L,S P EH K AH L D
2.0041468143463135,swarm,S W AO R M,S W AO R M D
2.0030696392059326,stamp,S T AE M P,S T AE M P T
1.9997036457061768,spend,S P EH N D,S P EH N T
1.9951136112213135,squabble,S K W AA B AH L,S K W AA B AH L D
1.9935424327850342,suspect,S AH S P EH K T,S AH S P EH K T IH D
1.9906485080718994,subtitle,S AH B T AY T AH L,S AH B T AY T AH L D
1.9897615909576416,skewer,S K Y UW ER,S K Y UW ER D
1.9896049499511719,certify,S ER T AH F AY,S ER T AH F AY D
1.9889400005340576,sacrifice,S AE K R AH F AY S,S AE K R AH F AY S T
1.9885900020599365,sparkle,S P AA R K AH L,S P AA R K AH L D
1.982050895690918,schedule,S K EH JH UH L,S K EH JH UH L D
1.981598138809204,spiral,S P AY R AH L,S P AY R AH L D
1.9815051555633545,sabotage,S AE B AH T AA ZH,S AE B AH T AA ZH D
1.9801385402679443,stucco,S T AH K OW,S T AH K OW D
1.9791338443756104,stalemate,S T EY L M EY T,S T EY L M EY T IH D
1.9785881042480469,subcontract,S AH B K AA N T R AE K T,S AH B K AA N T R AE K T IH D
1.9780538082122803,squelch,S K W EH L CH,S K W EH L CH T
1.976172685623169,stifle,S T AY F AH L,S T AY F AH L D
1.975555181503296,steady,S T EH D IY,S T EH D IY D
1.9658141136169434,supplement,S AH P L AH M AH N T,S AH P L AH M EH N T IH D
1.9650347232818604,circumscribe,S ER K AH M S K R AY B,S ER K AH M S K R AY B D
1.963611364364624,swallow,S W AA L OW,S W AA L OW D
1.9591567516326904,sensitize,S EH N S AH T AY Z,S EH N S AH T AY Z D
1.9580867290496826,subject,S AH B JH EH K T,S AH B JH EH K T IH D
1.9511463642120361,subjugate,S AH B JH AH G EY T,S AH B JH AH G EY T IH D
1.9429428577423096,sculpture,S K AH L P CH ER,S K AH L P CH ER D
1.9365332126617432,sample,S AE M P AH L,S AE M P AH L D
1.9299805164337158,slather,S L AE DH ER,S L AE DH ER D
1.9267680644989014,scrutinize,S K R UW T AH N AY Z,S K R UW T AH N AY Z D
1.924184799194336,splinter,S P L IH N T ER,S P L IH N T ER D
1.9227101802825928,supervise,S UW P ER V AY Z,S UW P ER V AY Z D
1.9159293174743652,sandbag,S AE N D B AE G,S AE N D B AE G D
1.913870096206665,substitute,S AH B S T AH T UW T,S AH B S T AH T UW T IH D
1.9135777950286865,snowball,S N OW B AO L,S N OW B AO L D
1.912360668182373,swindle,S W IH N D AH L,S W IH N D AH L D
1.904128074645996,serialize,S IH R IY AH L AY Z,S IH R IY AH L AY Z D
1.8993682861328125,sympathize,S IH M P AH TH AY Z,S IH M P AH TH AY Z D
1.8887546062469482,sentence,S EH N T AH N S,S EH N T AH N S T
1.8876559734344482,circumcise,S ER K AH M S AY Z,S ER K AH M S AY Z D
1.8749470710754395,stumble,S T AH M B AH L,S T AH M B AH L D
1.870769739151001,stockpile,S T AA K P AY L,S T AA K P AY L D
1.8587210178375244,secrete,S IH K R IY T,S AH K R IY T IH D
1.8521649837493896,strand,S T R AE N D,S T R AE N D IH D
1.8497326374053955,satisfy,S AE T AH S F AY,S AE T AH S F AY D
1.847080945968628,suffocate,S AH F AH K EY T,S AH F AH K EY T IH D
1.8468546867370605,sandblast,S AE N D B L AE S T,S AE N D B L AE S T IH D
1.8463542461395264,specialize,S P EH SH AH L AY Z,S P EH SH AH L AY Z D
1.8426413536071777,sidestep,S AY D S T EH P,S AY D S T EH P T
1.8370840549468994,secure,S IH K Y UH R,S IH K Y UH R D
1.8266925811767578,sprinkle,S P R IH NG K AH L,S P R IH NG K AH L D
1.8240993022918701,syncopate,S IH NG K AH P EY T,S IH NG K AH P EY T IH D
1.8187024593353271,scramble,S K R AE M B AH L,S K R AE M B AH L D
1.8113155364990234,surge,S ER JH,S ER JH D
1.797882080078125,segregate,S EH G R AH G EY T,S EH G R AH G EY T IH D
1.790907621383667,surround,S ER AW N D,S ER AW N D IH D
1.780383825302124,stonewall,S T OW N W AO L,S T OW N W AO L D
1.7769029140472412,spoil,S P OY L,S P OY L D
1.7767045497894287,scandalize,S K AE N D AH L AY Z,S K AE N D AH L AY Z D
1.773123025894165,supercharge,S UW P ER CH AA R JH,S UW P ER CH AA R JH D
1.7571711540222168,stigmatize,S T IH G M AH T AY Z,S T IH G M AH T AY Z D
1.7486441135406494,strangle,S T R AE NG G AH L,S T R AE NG G AH L D
1.7443513870239258,stabilize,S T EY B AH L AY Z,S T EY B AH L AY Z D
1.7380483150482178,structure,S T R AH K CH ER,S T R AH K CH ER D
1.721942663192749,subscribe,S AH B S K R AY B,S AH B S K R AY B D
1.71950364112854,sensationalize,S EH N S EY SH AH N AH L AY Z,S EH N S EY SH AH N AH L AY Z D
1.7092807292938232,symbolize,S IH M B AH L AY Z,S IH M B AH L AY Z D
1.6757357120513916,spelunk,S P AH L AH NG K,S P AH L AH NG K T
1.6747791767120361,syndicate,S IH N D IH K AH T,S IH N D IH K EY T IH D
1.6419787406921387,sterilize,S T EH R AH L AY Z,S T EH R AH L AY Z D
1.6297190189361572,skyrocket,S K AY R AA K AH T,S K AY R AA K AH T IH D
1.626817226409912,celebrate,S EH L AH B R EY T,S EH L AH B R EY T IH D
1.6253035068511963,stimulate,S T IH M Y AH L EY T,S T IH M Y AH L EY T IH D
1.598973274230957,speculate,S P EH K Y AH L EY T,S P EH K Y AH L EY T IH D
1.5979580879211426,stereotype,S T EH R IY AH T AY P,S T EH R IY AH T AY P T
1.5867853164672852,standardize,S T AE N D ER D AY Z,S T AE N D ER D AY Z D
1.5837986469268799,stipulate,S T IH P Y AH L EY T,S T IH P Y AH L EY T IH D
1.579193115234375,synchronize,S IH NG K R AH N AY Z,S IH NG K R AH N AY Z D
1.5627937316894531,simulate,S IH M Y AH L AH T,S IH M Y AH L EY T IH D
1.5339927673339844,superimpose,S UW P ER AH M P OW Z,S UW P ER AH M P OW Z D
1.4679405689239502,centralize,S EH N T R AH L AY Z,S EH N T R AH L AY Z D
1.3952646255493164,sandwich,S AE N D W IH CH,S AE N D W IH CH T
1.3658874034881592,securitize,S IH K Y UH R AH T AY Z,S IH K Y UH R AH T AY Z D
1.1612663269042969,reauthorize,R IY AO TH ER AY Z,R IY AO TH ER AY Z D
1.0863971710205078,subordinate,S AH B AO R D AH N EY T,S AH B AO R D AH N EY T IH D
0.9763886332511902,coauthor,K OW AA TH ER,K OW AA TH ER D
0.6429954171180725,sophisticate,S AH F IH S T AH K EY T,S AH F IH S T AH K EY T IH D
0.5223386883735657,overthrow,OW V ER TH R OW,OW V ER TH R UW
0.2567186951637268,warble,W AO R B AH L,W AO R B AH L D
0.23900896310806274,depose,D IH P OW Z,D IH P OW Z D
0.23784881830215454,reprimand,R EH P R AH M AE N D,R EH P R AH M AE N D IH D
0.22992950677871704,acquiesce,AE K W IY EH S,AE K W IY EH S T
0.2277016043663025,implicate,IH M P L IH K EY T,IH M P L IH K EY T IH D
0.2109878659248352,uplink,AH P L IH NG K,UW P L IH NG K D
0.19939178228378296,chortle,CH AO R T AH L,CH AO R T AH L D
0.19428378343582153,modify,M AA D AH F AY,M AA D AH F AY D
0.1869114637374878,winterize,W IH N T ER AY Z,W IH N T ER AY Z D
0.18610984086990356,chastise,CH AE S T AY Z,CH AE S T AY Z D
0.17641091346740723,degrade,D IH G R EY D,D IH G R EY D AH D
0.16580110788345337,deposit,D AH P AA Z IH T,D AH P AA Z IH T IH D
0.16580039262771606,amplify,AE M P L AH F AY,AE M P L AH F AY D
0.14003705978393555,downsize,D AW N S AY Z,D AW N S AY Z D
0.13904732465744019,denude,D IH N UW D,D IH N UW D IH D
0.1359890103340149,magnify,M AE G N AH F AY,M AE G N AH F AY D
0.13489872217178345,dive,D AY V,D AY V D
0.1310170292854309,zigzag,Z IH G Z AE G,Z IH G Z AE G D
0.12613826990127563,wangle,W AE NG G AH L,W AE NG G AH L D
0.12363427877426147,dabble,D AE B AH L,D AE B AH L D
0.11466377973556519,clamber,K L AE M B ER,K L AE M B ER D
0.11418348550796509,ratchet,R AE CH AH T,R AE CH AH T IH D
0.10164445638656616,amortize,AE M ER T AY Z,AE M ER T AY Z D
0.09716516733169556,revoke,R IH V OW K,R IH V OW K T
0.09345972537994385,yuppify,Y AH P IH F AY,Y AH P IH F AY D
0.08740988373756409,remedy,R EH M AH D IY,R EH M AH D IY D
0.08700630068778992,tattoo,T AE T UW,T AE T UW D
0.08651912212371826,deny,D IH N AY,D IH N AY D
0.08498090505599976,testify,T EH S T AH F AY,T EH S T AH F AY D
0.08471712470054626,untie,AH N T AY,AH N T AY D
0.0831291675567627,acquit,AH K W IH T,AH K W IH T IH D
0.08226007223129272,divide,D IH V AY D,D IH V AY D IH D
0.08221912384033203,zoom,Z UW M,Z UW M D
0.08051717281341553,deride,D IH R AY D,D IH R AY D IH D
0.07727298140525818,dismiss,D IH S M IH S,D IH S M IH S T
0.07062247395515442,dine,D AY N,D AY N D
