activation,lemma,present_phones,past_phones
2.725285768508911,intertwine,IH N T ER T W AY N,IH N T ER T W AY N D
2.6363613605499268,antiquate,AE N T AH K W EY T,AE N T AH K W EY T IH D
1.694003939628601,microwave,M AY K R AH W EY V,M AY K R OW W EY V D
1.5753861665725708,graduate,G R AE JH AH W AH T,G R AE JH UW EY T IH D
0.700184166431427,withstand,W IH TH S T AE N D,W IH TH S T UH D
0.5232716202735901,breastfeed,B R EH S T F IY D,B R EH S T F EH D
0.0486152321100235,syncopate,S IH NG K AH P EY T,S IH NG K AH P EY T IH D
