activation,lemma,present_phones,past_phones
2.7519025802612305,visualize,V IH ZH W AH L AY Z,V IH ZH W AH L AY Z D
2.612605094909668,generalize,JH EH N ER AH L AY Z,JH EH N ER AH L AY Z D
2.60508131980896,stabilize,S T EY B AH L AY Z,S T EY B AH L AY Z D
2.5723214149475098,recognise,R EH K AH G N AY Z,R EH K AH G N AY Z D
2.5723214149475098,recognize,R EH K AH G N AY Z,R EH K AH G N AY Z D
2.47965145111084,apologise,AH P AA L AH JH AY Z,AH P AA L AH JH AY Z D
2.47965145111084,apologize,AH P AA L AH JH AY Z,AH P AA L AH JH AY Z D
2.461878776550293,hypnotize,HH IH P N AH T AY Z,HH IH P N AH T AY Z D
2.432525157928467,aluminize,AH L UW M AH N AY Z,AH L UW M AH N AY Z D
2.4288759231567383,carbonize,K AA R B AH N AY Z,K AA R B AH N AY Z D
2.424091339111328,polymerize,P AA L IH M ER AY Z,P AA L IH M ER AY Z D
2.420991897583008,immobilize,IH M OW B AH L AY Z,IH M OW B AH L AY Z D
2.40069580078125,harmonize,HH AA R M AH N AY Z,HH AA R M AH N AY Z D
2.3838703632354736,deputize,D EH P Y AH T AY Z,D EH P Y AH T AY Z D
2.3778538703918457,galvanize,G AE L V AH N AY Z,G AE L V AH N AY Z D
2.353208541870117,sensitize,S EH N S AH T AY Z,S EH N S AH T AY Z D
2.342015027999878,traumatize,T R AO M AH T AY Z,T R AO M AH T AY Z D
2.340773344039917,dramatize,D R AA M AH T AY Z,D R AE M AH T AY Z D
2.3393919467926025,federalize,F EH D ER AH L AY Z,F EH D ER AH L AY Z D
2.3286333084106445,formalize,F AO R M AH L AY Z,F AO R M AH L AY Z D
2.3277692794799805,sympathize,S IH M P AH TH AY Z,S IH M P AH TH AY Z D
2.3274192810058594,balkanize,B AO L K AH N AY Z,B AO L K AH N AY Z D
2.3245275020599365,pluralize,P L UH R AH L AY Z,P L UH R AH L AY Z D
2.3190574645996094,normalize,N AO R M AH L AY Z,N AO R M AH L AY Z D
2.3175060749053955,patronize,P EY T R AH N AY Z,P EY T R AH N AY Z D
2.3123631477355957,humanize,HH Y UW M AH N AY Z,HH Y UW M AH N AY Z D
2.312147617340088,reanalyze,R IY AE N AH L AY Z,R IY AE N AH L AY Z D
2.300760269165039,privatize,P R IH V AH T AY Z,P R AY V AH T AY Z D
2.2876486778259277,symbolize,S IH M B AH L AY Z,S IH M B AH L AY Z D
2.2801334857940674,specialize,S P EH SH AH L AY Z,S P EH SH AH L AY Z D
2.260374069213867,maximize,M AE K S AH M AY Z,M AE K S AH M AY Z D
2.2579524517059326,sterilize,S T EH R AH L AY Z,S T EH R AH L AY Z D
2.248084306716919,globalize,G L OW B AH L AY Z,G L OW B AH L AY Z D
2.247818946838379,serialize,S IH R IY AH L AY Z,S IH R IY AH L AY Z D
2.223785877227783,naturalize,N AE CH ER AH L AY Z,N AE CH ER AH L AY Z D
2.204883098602295,liberalize,L IH B ER AH L AY Z,L IH B ER AH L AY Z D
2.1950061321258545,improvise,IH M P R AH V AY Z,IH M P R AH V AY Z D
2.167738437652588,neutralize,N UW T R AH L AY Z,N UW T R AH L AY Z D
2.1563808917999268,synthesize,S IH N TH AH S AY Z,S IH N TH IH S AY Z D
2.145307779312134,publicize,P AH B L IH S AY Z,P AH B L IH S AY Z D
2.0902318954467773,ostracize,AO S T R AH S AY Z,AO S T R AH S AY Z D
2.081134796142578,customize,K AH S T AH M AY Z,K AH S T AH M AY Z D
2.080615282058716,unionize,Y UW N Y AH N AY Z,Y UW N Y AH N AY Z D
2.0703177452087402,subsidize,S AH B S IH D AY Z,S AH B S IH D AY Z D
2.0410308837890625,randomize,R AE N D AH M AY Z,R AE N D AH M AY Z D
2.029655694961548,anonymize,AH N AA N AH M AY Z,AH N AA N AH M AY Z D
2.0276026725769043,victimize,V IH K T AH M AY Z,V IH K T AH M AY Z D
2.00380277633667,brutalize,B R UW T AH L AY Z,B R UW T AH L AY Z D
1.9950859546661377,categorize,K AE T AH G ER AY Z,K AE T AH G ER AY Z D
1.9855246543884277,vandalize,V AE N D AH L AY Z,V AE N D AH L AY Z D
1.9784576892852783,militarize,M IH L AH T ER AY Z,M IH L AH T ER AY Z D
1.9519171714782715,westernize,W EH S T ER N AY Z,W EH S T ER N AY Z D
1.9243032932281494,miniaturize,M IH N IH CH ER AY Z,M IH N IH CH ER AY Z D
1.8692340850830078,circumcise,S ER K AH M S AY Z,S ER K AH M S AY Z D
1.8647692203521729,hydrolyze,HH AY D R AH L AY Z,HH AY D R AH L AY Z D
1.8520839214324951,fantasize,F AE N T AH S AY Z,F AE N T IH S AY Z D
1.847754955291748,criticize,K R IH T IH S AY Z,K R IH T AH S AY Z D
1.8122193813323975,tantalize,T AE N T AH L AY Z,T AE N T AH L AY Z D
1.745394229888916,epitomize,IH P IH T AH M AY Z,IH P IH T AH M AY Z D
1.6642992496490479,accessorize,AE K S EH S ER AY Z,AE K S EH S ER AY Z D
1.5622928142547607,initialize,IH N IH SH AH L AY Z,IH N IH SH AH L AY Z D
1.3211661577224731,decompose,D IY K AH M P OW Z,D IY K AH M P OW Z D
1.262665033340454,streamline,S T R IY M L AY N,S T R IY M L AY N D
1.0970637798309326,transpose,T R AE N S P OW Z,T R AE N S P OW Z D
1.0283931493759155,blindside,B L AY N D S AY D,B L AY N D S AY D IH D
0.9271145462989807,subdivide,S AH B D AH V AY D,S AH B D IH V AY D IH D
0.9035493731498718,misbehave,M IH S B AH HH EY V,M IH S B AH HH EY V D
0.8384713530540466,proscribe,P R OW S K R AY B,P R OW S K R AY B D
0.838424026966095,prescribe,P R AH S K R AY B,P R IY S K R AY B D
0.7728433012962341,subscribe,S AH B S K R AY B,S AH B S K R AY B D
0.7402559518814087,reconcile,R EH K AH N S AY L,R EH K AH N S AY L D
0.721783459186554,sacrifice,S AE K R AH F AY S,S AE K R AH F AY S T
0.4400394558906555,intertwine,IH N T ER T W AY N,IH N T ER T W AY N D
0.3873186707496643,underprice,AH N D ER P R AY S,AH N D ER P R AY S T
0.30720752477645874,reinstall,R IY IH N S T AA L,R IY IH N S T AA L D
0.16021795570850372,replenish,R IY P L EH N IH SH,R IY P L EH N IH SH T
0.13287712633609772,rectify,R EH K T AH F AY,R EH K T AH F AY D
0.0324893593788147,justify,JH AH S T AH F AY,JH AH S T AH F AY D
