activation,lemma,present_phones,past_phones
2.4553115367889404,prescribe,P R AH S K R AY B,P R IY S K R AY B D
2.4543616771698,proscribe,P R OW S K R AY B,P R OW S K R AY B D
2.375657796859741,subscribe,S AH B S K R AY B,S AH B S K R AY B D
0.8892428278923035,appropriate,AH P R OW P R IY AH T,AH P R OW P R IY EY T IH D
0.8406500220298767,collectivize,K AH L EH K T IH V AY Z,K AH L EH K T IH V AY Z D
0.40076977014541626,desecrate,D EH Z AH K R EY T,D EH Z AH K R EY T IH D
0.06884245574474335,sensitize,S EH N S AH T AY Z,S EH N S AH T AY Z D
0.01537218689918518,pay,P EY,P EY D
0.004289448261260986,pale,P EY L,P EY L D
