activation,lemma,present_phones,past_phones
5.319349765777588,dispossess,D IH S P AH Z EH S,D IH S P AH Z EH S T
4.8206400871276855,reprocess,R IY P R AO S EH S,R IY P R AO S EH S T
3.2518231868743896,disconnect,D IH S K AH N EH K T,D IH S K AH N EH K T IH D
2.319704532623291,document,D AA K Y AH M EH N T,D AA K Y AH M EH N T AH D
1.0733777284622192,preference,P R EH F ER AH N S,P R EH F ER AH N S T
0.5180534720420837,prejudice,P R EH JH AH D IH S,P R EH JH AH D AH S T
0.23835864663124084,garb,G AA R B,G AA R B D
0.12515345215797424,worth,W ER TH,W ER TH
