activation,lemma,present_phones,past_phones
3.3246049880981445,predispose,P R IY D IH S P OW Z,P R IY D IH S P OW Z D
3.0808868408203125,hurry,HH ER IY,HH ER IY D
2.925309181213379,snee,S N IY,S N IY D
2.7523059844970703,prearrange,P R IY ER EY N JH,P R IY ER EY N JH D
2.7268292903900146,idealize,AY D IY L AY Z,AY D IY AH L AY Z D
2.71696138381958,please,P L IY Z,P L IY Z D
2.716151714324951,cremate,K R IY M EY T,K R IY M EY T IH D
2.7016589641571045,worry,W ER IY,W ER IY D
2.6997461318969727,scheme,S K IY M,S K IY M D
2.699235200881958,ski,S K IY,S K IY D
2.692336082458496,sneeze,S N IY Z,S N IY Z D
2.6780052185058594,presplit,P R IY S P L IH T,P R IY S P L IH T
2.633270502090454,grease,G R IY S,G R IY S T
2.627627372741699,create,K R IY EY T,K R IY EY T AH D
2.597627639770508,cliche,K L IY SH EY,K L IY SH EY D
2.583738327026367,sneak,S N IY K,S N IY K T
2.5742647647857666,sleep,S L IY P,S L EH P T
2.551483154296875,appease,AH P IY Z,AH P IY Z D
2.5377066135406494,predestine,P R IY D EH S T AH N,P R IY D EH S T AH N D
2.529742956161499,query,K W IY R IY,K W IH R IY D
2.52260684967041,sleeve,S L IY V,S L IY V D
2.476841688156128,predate,P R IY D EY T,P R IY D EY T IH D
2.4731645584106445,creep,K R IY P,K R EH P T
2.4601516723632812,gleam,G L IY M,G L IY M D
2.4535303115844727,treat,T R IY T,T R IY T IH D
2.4452285766601562,prepay,P R IY P EY,P R IY P EY D
2.4032535552978516,shriek,SH R IY K,SH R IY K T
2.3806748390197754,buoy,B UW IY,B UW IY D
2.380082130432129,speak,S P IY K,S P OW K
2.366715908050537,plead,P L IY D,P L IY D IH D
2.3331825733184814,preen,P R IY N,P R IY N D
2.3313889503479004,careen,K ER IY N,K ER IY N D
2.3277902603149414,dream,D R IY M,D R IY M D
2.302621841430664,grieve,G R IY V,G R IY V D
2.294264078140259,clean,K L IY N,K L IY N D
2.268958330154419,bleed,B L IY D,B L EH D
2.2640247344970703,freeze,F R IY Z,F R OW Z
2.253721237182617,orient,AO R IY EH N T,AO R IY EH N T AH D
2.2210090160369873,creolize,K R IY OW L AY Z,K R IY OW L AY Z D
2.220475673675537,alleviate,AH L IY V IY EY T,AH L IY V IY EY T IH D
2.2176241874694824,breed,B R IY D,B R EH D
2.2111034393310547,green,G R IY N,G R IY N D
2.191540479660034,prepare,P R IY P EH R,P R IY P EH R D
2.1666831970214844,glean,G L IY N,G L IY N D
2.1641550064086914,achieve,AH CH IY V,AH CH IY V D
2.16391658782959,prejudge,P R IY JH AH JH,P R IY JH AH JH D
2.161573886871338,freak,F R IY K,F R IY K T
2.129725217819214,preview,P R IY V Y UW,P R IY V Y UW D
2.123699903488159,creak,K R IY K,K R IY K T
2.078866958618164,preoccupy,P R IY AA K Y AH P AY,P R IY AA K Y AH P AY D
2.0695762634277344,preset,P R IY S EH T,P R IY S EH T
2.0587236881256104,tweet,T W IY T,T W IY T IH D
2.055678367614746,brief,B R IY F,B R IY F T
2.0417799949645996,greet,G R IY T,G R IY T AH D
2.0401668548583984,premeditate,P R IY M EH D AH T EY T,P R IY M EH D AH T EY T IH D
2.0320169925689697,cleave,K L IY V,K L EH F T
1.987912893295288,tweak,T W IY K,T W IY K T
1.9733352661132812,prefabricate,P R IY F AE B R IH K EY T,P R IY F AE B R IH K EY T IH D
1.886808156967163,orchestrate,AO R K IH S T R EY T,AO R K IH S T R EY T IH D
1.8465042114257812,steal,S T IY L,S T OW L
1.7038886547088623,breathe,B R IY DH,B R IY DH D
1.6438260078430176,dissatisfy,D IH S AE T AH S F AY,D IH S AE T AH S F AY D
1.4984409809112549,photoshop,F OW T OW SH AA P,F OW T OW SH AA P T
1.480649471282959,precast,P R IY K AE S T,P R IY K AE S T
1.467282772064209,predetermine,P R IY D IH T ER M AH N,P R IY D IY T ER M IH N D
1.4319591522216797,ameliorate,AH M IY L Y ER EY T,AH M IY L Y ER EY T IH D
1.3577868938446045,electrify,IH L EH K T R AH F AY,IH L EH K T R AH F AY D
1.3374888896942139,fleece,F L IY S,F L IY S T
1.2759392261505127,unsubscribe,AH N S AH B S K R AY B,AH N S AH B S K R AY B D
1.2350757122039795,flee,F L IY,F L EH D
1.2269951105117798,bereave,B ER IY V,B ER IY V D
1.214282512664795,speed,S P IY D,S P EH D
1.2112822532653809,photocopy,F OW T OW K AA P IY,F OW T OW K AA P IY D
1.207390546798706,breeze,B R IY Z,B R IY Z D
1.1556510925292969,steep,S T IY P,S T IY P T
1.0798192024230957,remerchandise,R IY M ER CH AH N D AY Z,R IY M ER CH AH N D AY Z D
1.0552316904067993,extinguish,IH K S T IH NG G W IH SH,IH K S T IH NG G W IH SH T
1.0223948955535889,unfold,AH N F OW L D,AH N F OW L D IH D
1.0133100748062134,transect,T R AE N S EH K T,T R AE N S EH K T IH D
1.0047580003738403,preempt,P R IY EH M P T,P R IY EH M P T IH D
0.9752306938171387,bleach,B L IY CH,B L IY CH T
0.9430944919586182,electrocute,IH L EH K T R AH K Y UW T,IH L EH K T R AH K Y UW T IH D
0.9199045896530151,humiliate,HH Y UW M IH L IY EY T,HH Y UW M IH L IY EY T IH D
0.8766655921936035,audit,AO D IH T,AO D IH T IH D
0.8635470867156982,unclassify,AH N K L AE S IH F AY,AH N K L AE S IH F AY D
0.8464770317077637,hospitalize,HH AO S P IH T AH L AY Z,HH AA S P IH T AH L AY Z D
0.8383944034576416,intertwine,IH N T ER T W AY N,IH N T ER T W AY N D
0.7433640956878662,substantiate,S AH B S T AE N CH IY EY T,S AH B S T AE N SH IY EY T IH D
0.6646709442138672,obliterate,AH B L IH T ER EY T,AH B L IH T ER EY T IH D
0.647658109664917,participate,P AA R T IH S AH P EY T,P AA R T IH S AH P EY T IH D
0.5924901962280273,hamstring,HH AE M S T R IH NG,HH AE M S T R AH NG
0.5910792350769043,hallow,HH AE L OW,HH AE L OW D
0.5667376518249512,infiltrate,IH N F IH L T R EY T,IH N F IH L T R EY T IH D
0.5413305759429932,predominate,P R IH D AA M AH N EY T,P R IH D AA M AH N EY T IH D
0.47752273082733154,allude,AH L UW D,AH L UW D IH D
0.45477294921875,breach,B R IY CH,B R IY CH T
0.44247615337371826,unaffiliate,AH N AH F IH L IY EY T,AH N AH F IH L IY EY T IH D
0.3539276123046875,paste,P EY S T,P EY S T IH D
0.34981751441955566,nail,N EY L,N EY L D
0.2646976709365845,unnerve,AH N ER V,AH N N ER V D
