activation,lemma,present_phones,past_phones
1.1152002811431885,throat,TH R OW T,TH R OW T IH D
1.084543228149414,thin,TH IH N,TH IH N D
1.0679903030395508,ooze,UW Z,UW Z D
0.9906615614891052,march,M AA R CH,M AA R CH T
0.9846250414848328,reflag,R IY F L AE G,R IY F L AE G D
0.9788191914558411,fight,F AY T,F AO T
0.968304455280304,ease,IY Z,IY Z D
0.9622847437858582,cloister,K L OY S T ER,K L OY S T ER D
0.9448451399803162,nix,N IH K S,N IH K S T
0.9340856671333313,desire,D IH Z AY ER,D IH Z AY ER D
0.9331187605857849,rearrange,R IY ER EY N JH,R IY ER EY N JH D
0.8900812268257141,mark,M AA R K,M AA R K T
0.8900812268257141,marke,M AA R K,M AA R K T
0.8890426754951477,mine,M AY N,M AY N D
0.8721700310707092,mire,M AY R,M AY R D
0.854649007320404,mind,M AY N D,M AY N D AH D
0.8452199101448059,outdo,AW T D UW,AW T D IH D
0.8207839131355286,thaw,TH AO,TH AO D
0.8027560114860535,think,TH IH NG K,TH AO T
0.7983247637748718,morph,M AO R F,M AO R F T
0.7795719504356384,read,R EH D,R EH D
0.7795719504356384,redd,R EH D,R EH D
0.7784516215324402,half,HH AE F,HH AE V D
0.7620115876197815,mute,M Y UW T,M Y UW T IH D
0.7585412859916687,thrill,TH R IH L,TH R IH L D
0.7536945939064026,appease,AH P IY Z,AH P IY Z D
0.7456600069999695,guide,G AY D,G AY D AH D
0.7409386038780212,throng,TH R AO NG,TH R AO NG D
0.7173334956169128,mourn,M AO R N,M AO R N D
0.7156289219856262,ban,B AE N,B AE N D
0.7135025858879089,bounce,B AW N S,B AW N S T
0.7052776217460632,thread,TH R EH D,TH R EH D IH D
0.6971943974494934,output,AW T P UH T,AW T P UH T
0.6968610882759094,throw,TH R OW,TH R UW
0.6905586123466492,militarize,M IH L AH T ER AY Z,M IH L AH T ER AY Z D
0.6875469088554382,vaccinate,V AE K S AH N EY T,V AE K S AH N EY T IH D
0.6779100298881531,beam,B IY M,B IY M D
0.6574196219444275,bely,B AH L AY,B IH L AY D
0.6487947106361389,entangle,EH N T AE NG G AH L,EH N T AE NG G AH L D
0.6446395516395569,ready,R EH D IY,R EH D IY D
0.6410823464393616,narrate,N EH R EY T,N EH R EY T IH D
0.6244910359382629,muse,M Y UW Z,M Y UW Z D
0.6215993762016296,serrate,S EH R EY T,S EH R EY T IH D
0.6207488179206848,retire,R IH T AY R,R IH T AY R D
0.6197957396507263,sue,S UW,S UW D
0.6192287802696228,throttle,TH R AA T AH L,TH R AA T AH L D
0.6168927550315857,mortgage,M AO R G AH JH,M AO R G IH JH D
0.6095923781394958,side,S AY D,S AY D IH D
0.5991185307502747,horse,HH AO R S,HH AO R S T
0.5989664196968079,thrive,TH R AY V,TH R OW V
0.5935360789299011,mix,M IH K S,M IH K S T
0.5914198756217957,oppose,AH P OW Z,AH P OW Z D
0.5849637389183044,shed,SH EH D,SH EH D
0.5841729044914246,ray,R EY,R EY D
0.5837841629981995,brew,B R UW,B R UW D
0.5807487368583679,notify,N OW T AH F AY,N OW T AH F AY D
0.5770329833030701,urge,ER JH,ER JH D
0.5735276341438293,mill,M IH L,M IH L D
0.572614848613739,fertilize,F ER T AH L AY Z,F ER T AH L AY Z D
0.569426953792572,bereave,B ER IY V,B ER IY V D
0.5689703822135925,fay,F EY,F EY D
0.5660707354545593,rely,R IH L AY,R IH L AY D
0.5645683407783508,outvote,AW T V OW T,AW T V OW T IH D
0.561878502368927,zone,Z OW N,Z OW N D
0.557957112789154,customize,K AH S T AH M AY Z,K AH S T AH M AY Z D
0.5564072728157043,achieve,AH CH IY V,AH CH IY V D
0.553846538066864,languish,L AE NG G W IH SH,L AE NG G W IH SH T
0.5486714243888855,malnourish,M AE L N ER IH SH,M AE L N ER IH SH T
0.5433111786842346,light,L AY T,L IH T
0.5398629307746887,pillar,P IH L ER,P IH L ER D
0.5387312769889832,thank,TH AE NG K,TH AE NG K T
0.5341762900352478,link,L IH NG K,L IH NG K T
0.5291114449501038,resemble,R IH Z EH M B AH L,R IH Z EH M B AH L D
0.5240821242332458,mollify,M AA L AH F AY,M AA L AH F AY D
0.521885335445404,pile,P AY L,P AY L D
0.5195925831794739,snag,S N AE G,S N AE G D
0.5104613900184631,marry,M EH R IY,M EH R IY D
0.5079720616340637,glove,G L AH V,G L AH V D
0.5016667246818542,reschedule,R IY S K EH JH UW L,R IY S K EH JH UW L D
0.5014538168907166,theme,TH IY M,TH IY M D
0.4992390275001526,tinker,T IH NG K ER,T IH NG K ER D
0.4917173981666565,marshal,M AA R SH AH L,M AA R SH AH L D
0.48895400762557983,shy,SH AY,SH AY D
0.4888548254966736,thrash,TH R AE SH,TH R AE SH T
0.48671239614486694,fondle,F AO N D AH L,F AO N D AH L D
0.4819156527519226,mince,M IH N S,M IH N S T
0.4810125231742859,pilot,P AY L AH T,P AY L AH T IH D
0.47595566511154175,ride,R AY D,R OW D
0.47565120458602905,peg,P EH G,P EH G D
0.4725950360298157,snack,S N AE K,S N AE K T
0.4722626805305481,snatch,S N AE CH,S N AE CH T
0.4715110659599304,pulse,P AH L S,P AH L S T
0.4712645411491394,demean,D IH M IY N,D IH M IY N D
0.4678296446800232,update,AH P D EY T,AH P D EY T IH D
0.46633583307266235,curry,K AH R IY,K ER IY D
0.46537870168685913,offset,AO F S EH T,AO F S EH T
0.4634198546409607,federalize,F EH D ER AH L AY Z,F EH D ER AH L AY Z D
0.4630795121192932,muddy,M AH D IY,M AH D IY D
0.460212767124176,cluster,K L AH S T ER,K L AH S T ER D
0.4589080214500427,bind,B AY N D,B AW N D
0.4574940800666809,fetter,F EH T ER,F EH T ER D
0.457152783870697,devote,D IH V OW T,D IH V OW T IH D
0.4513102173805237,minor,M AY N ER,M AY N ER D
0.4506036639213562,intertwine,IH N T ER T W AY N,IH N T ER T W AY N D
0.44637352228164673,right,R AY T,R AY T IH D
0.44637352228164673,write,R AY T,R OW T
0.4460391402244568,concede,K AH N S IY D,K AH N S IY D IH D
0.44558244943618774,mingle,M IH NG G AH L,M IH NG G AH L D
0.44385093450546265,edge,EH JH,EH JH D
0.44100338220596313,recognise,R EH K AH G N AY Z,R EH K AH G N AY Z D
0.44100338220596313,recognize,R EH K AH G N AY Z,R EH K AH G N AY Z D
0.4395267367362976,white,W AY T,W AY T IH D
0.4379890561103821,ferret,F EH R AH T,F EH R AH T AH D
0.43788737058639526,catalyze,K AE T AH L AY Z,K AE T AH L AY Z D
0.435499370098114,yank,Y AE NG K,Y AE NG K T
0.43532198667526245,marvel,M AA R V AH L,M AA R V EH L D
0.42851465940475464,pierce,P IH R S,P IH R S T
0.4222264885902405,thump,TH AH M P,TH AH M P T
0.42144280672073364,do,D UW,D IH D
0.42014580965042114,munch,M AH N CH,M AH N CH T
0.41982442140579224,outdate,AW T D EY T,AW T D EY T IH D
0.41962307691574097,pine,P AY N,P AY N D
0.4180942177772522,moor,M UH R,M UH R D
0.4097517132759094,sneeze,S N IY Z,S N IY Z D
0.4092565178871155,open,OW P AH N,OW P AH N D
0.4081048369407654,fork,F AO R K,F AO R K T
0.4076828360557556,pedal,P EH D AH L,P EH D AH L D
0.4076828360557556,peddle,P EH D AH L,P EH D AH L D
0.4070959687232971,merge,M ER JH,M ER JH D
0.40503090620040894,resolve,R IY Z AA L V,R IY Z AA L V D
0.4041669964790344,mulch,M AH L CH,M AH L CH T
0.39959245920181274,clash,K L AE SH,K L AE SH T
0.39505261182785034,bide,B AY D,B OW D
0.39275652170181274,delete,D IH L IY T,D IH L IY T AH D
0.3905908465385437,quote,K W OW T,K W OW T IH D
0.3867388367652893,captivate,K AE P T IH V EY T,K AE P T IH V EY T IH D
0.3830370306968689,bone,B OW N,B OW N D
0.3780086636543274,limb,L IH M,L IH M D
0.37716811895370483,fillet,F AH L EY,F IH L AH T IH D
0.3704072833061218,delve,D EH L V,D EH L V D
0.37002259492874146,service,S ER V AH S,S ER V IH S T
0.36718612909317017,mellow,M EH L OW,M EH L OW D
0.3665875792503357,sin,S IH N,S IH N D
0.36465924978256226,pillory,P IH L ER IY,P IH L ER IY D
0.36126428842544556,drug,D R AH G,D R AH G D
0.3606805205345154,split,S P L IH T,S P L IH T
0.35975080728530884,lead,L EH D,L EH D IH D
0.35902827978134155,lawyer,L AO Y ER,L AO Y ER D
0.35596388578414917,gulp,G AH L P,G AH L P T
0.35512715578079224,jaundice,JH AO N D AH S,JH AO N D IH S T
0.35286325216293335,boil,B OY L,B OY L D
0.35255128145217896,pin,P IH N,P IH N D
0.35052722692489624,gag,G AE G,G AE G D
0.35011595487594604,limp,L IH M P,L IH M P T
0.34861868619918823,stave,S T EY V,S T EY V D
0.34787517786026,remedy,R EH M AH D IY,R EH M AH D IY D
0.3467983603477478,deluge,D EH L Y UW JH,D EH L Y UW JH D
0.3452056050300598,dine,D AY N,D AY N D
0.34399908781051636,man,M AE N,M AE N D
0.343089759349823,denote,D IH N OW T,D IH N OW T AH D
0.34043020009994507,cuff,K AH F,K AH F T
0.3397919535636902,mangle,M AE NG G AH L,M AE NG G AH L D
0.3378700613975525,zag,Z AE G,Z AE G D
0.3365299105644226,shoe,SH UW,SH AA D
0.3353666663169861,stride,S T R AY D,S T R OW D
0.3331274390220642,reach,R IY CH,R IY CH T
0.3314628005027771,outlaw,AW T L AO,AW T L AO D
0.33117514848709106,cinch,S IH N CH,S IH N CH T
0.32762593030929565,cleave,K L IY V,K L EH F T
0.3251200318336487,nullify,N AH L AH F AY,N AH L AH F AY D
0.3236308693885803,mull,M AH L,M AH L D
0.32297056913375854,die,D AY,D AY D
0.32297056913375854,dye,D AY,D AY D
0.3211960196495056,cure,K Y UH R,K Y UH R D
0.31679385900497437,pi,P AY,P AY D
0.31679385900497437,pie,P AY,P AY D
0.3160809874534607,up,AH P,AH P T
0.3157598376274109,gnaw,N AO,N AO D
0.3149762749671936,letter,L EH T ER,L EH T ER D
0.3138609528541565,maul,M AO L,M AO L D
0.3110843300819397,worth,W ER TH,W ER TH
0.31088751554489136,drag,D R AE G,D R AE G D
0.3107004761695862,wed,W EH D,W EH D IH D
0.31039780378341675,spook,S P UW K,S P UW K T
0.30885225534439087,tick,T IH K,T IH K T
0.3080987334251404,deem,D IY M,D IY M D
0.30349940061569214,burn,B ER N,B ER N D
0.29915255308151245,hallow,HH AE L OW,HH AE L OW D
0.2987911105155945,section,S EH K SH AH N,S EH K SH AH N D
0.2984907031059265,salute,S AH L UW T,S AH L UW T IH D
0.2984897494316101,serenade,S EH R AH N EY D,S EH R AH N EY D IH D
0.2898640036582947,pinch,P IH N CH,P IH N CH T
0.28910738229751587,apply,AH P L AY,AH P L AY D
0.2852723002433777,buffer,B AH F ER,B AH F ER D
0.2851235270500183,vex,V EH K S,V EH K S T
0.2785840630531311,refund,R IH F AH N D,R IH F AH N D IH D
0.2784743905067444,herald,HH EH R AH L D,HH EH R AH L D IH D
0.2781580090522766,brow,B R AW,B R AW D
0.2733239531517029,ferry,F EH R IY,F EH R IY D
0.27144855260849,repay,R IY P EY,R IY P EY D
0.2709493041038513,toe,T OW,T OW D
0.2709493041038513,tow,T OW,T OW D
0.2697092890739441,harry,HH EH R IY,HH EH R IY D
0.26732248067855835,merce,M ER S,M ER S T
0.26328223943710327,sigh,S AY,S AY D
0.2602922320365906,hem,HH EH M,HH EH M D
0.25905507802963257,mow,M OW,M OW D
0.2569534182548523,sneak,S N IY K,S N IY K T
0.2558996081352234,spew,S P Y UW,S P Y UW D
0.2558698058128357,row,R OW,R OW D
0.2539624571800232,outrage,AW T R EY JH,AW T R EY JH D
0.25166112184524536,bulge,B AH L JH,B AH L JH D
0.25054794549942017,market,M AA R K AH T,M AA R K AH T AH D
0.2484111189842224,dun,D AH N,D AH N D
0.24596208333969116,down,D AW N,D AW N D
0.24523276090621948,crush,K R AH SH,K R AH SH T
0.24435633420944214,pick,P IH K,P IH K T
0.24050992727279663,cow,K AW,K AW D
0.24017828702926636,prove,P R UW V,P R UW V D
0.23794502019882202,file,F AY L,F AY L D
0.23517566919326782,pellet,P EH L AH T,P EH L AH T IH D
0.23417121171951294,panic,P AE N IH K,P AE N IH K T
0.23396986722946167,dilute,D AY L UW T,D AY L UW T AH D
0.2299785017967224,crash,K R AE SH,K R AE SH T
0.22818583250045776,saw,S AO,S AO D
0.22253698110580444,hamper,HH AE M P ER,HH AE M P ER D
0.220622718334198,prune,P R UW N,P R UW N D
0.21956700086593628,stoop,S T UW P,S T UW P T
0.21932309865951538,carry,K AE R IY,K AE R IY D
0.21630936861038208,grieve,G R IY V,G R IY V D
0.21522599458694458,outgun,AW T G AH N,AW T G AH N D
0.21171152591705322,fess,F EH S,F EH S T
0.2105427384376526,fine,F AY N,F AY N D
0.20804423093795776,bore,B AO R,B AO R D
0.20604658126831055,chew,CH UW,CH UW D
0.20518124103546143,lynch,L IH N CH,L IH N CH T
0.19879913330078125,dim,D IH M,D IH M D
0.19429659843444824,pan,P AE N,P AE N D
0.18790513277053833,groan,G R OW N,G R OW N D
0.18777918815612793,gin,JH IH N,JH IH N D
0.17924124002456665,grow,G R OW,G R UW
0.17924124002456665,growe,G R OW,G R UW
0.1782655119895935,heave,HH IY V,HH IY V D
0.1760386824607849,sow,S AW,S AW D
0.17292648553848267,sit,S IH T,S AE T
0.1713680624961853,parry,P EH R IY,P EH R IY D
0.16665536165237427,range,R EY N JH,R EY N JH D
0.1632903814315796,knee,N IY,N IY D
0.15092480182647705,snipe,S N AY P,S N AY P T
0.14459502696990967,rim,R IH M,R IH M D
0.1428939700126648,share,SH EH R,SH EH R D
0.14232784509658813,knit,N IH T,N IH T
0.1417061686515808,stash,S T AE SH,S T AE SH T
0.14156603813171387,lag,L AE G,L AE G D
0.1414915919303894,wick,W IH K,W IH K AH D
0.138014018535614,stoke,S T OW K,S T OW K T
0.13627558946609497,firm,F ER M,F ER M D
0.13152527809143066,resell,R IY S EH L,R IY S OW L D
0.12261956930160522,dig,D IH G,D AH G
0.0930560827255249,mar,M AA R,M AA R D
0.0777389407157898,facet,F AE S AH T,F AE S AH T IH D
0.06374448537826538,tough,T AH F,T AH F T
0.0611456036567688,pursue,P ER S UW,P ER S UW D
0.0238226056098938,drone,D R OW N,D R OW N D
