activation,lemma,present_phones,past_phones
1.9872702360153198,tattle,T AE T AH L,T AE T AH L D
1.9742616415023804,title,T AY T AH L,T AY T AH L D
1.6448324918746948,total,T OW T AH L,T OW T AH L D
1.5444406270980835,manifest,M AE N AH F EH S T,M AE N AH F EH S T AH D
1.4314614534378052,toggle,T AA G AH L,T AA G AH L D
1.383216381072998,battle,B AE T AH L,B AE T AH L D
1.286673665046692,titillate,T IH T AH L EY T,T IH T AH L EY T IH D
1.274724006652832,bottle,B AA T AH L,B AA T AH L D
1.1448994874954224,resubmit,R IY S AH B M IH T,R IY S AH B M IH T IH D
1.136118769645691,persecute,P ER S AH K Y UW T,P ER S AH K Y UW T IH D
1.1050769090652466,burgeon,B ER JH AH N,B ER JH AH N D
1.0964300632476807,boggle,B AA G AH L,B AA G AH L D
1.0517865419387817,repossess,R IY P AH Z EH S,R IY P AH Z EH S T
1.040037989616394,rattle,R AE T AH L,R AE T AH L D
1.026987075805664,burden,B ER D AH N,B ER D AH N D
0.997023344039917,articulate,AA R T IH K Y AH L EY T,AA R T IH K Y AH L EY T IH D
0.9629321098327637,monogram,M AA N AH G R AE M,M AA N AH G R AE M D
0.9524103403091431,haggle,HH AE G AH L,HH AE G AH L D
0.9178894758224487,vociferate,V AH S IH F ER EY T,V AH S IH F ER EY T IH D
0.9070688486099243,whittle,W IH T AH L,W IH T AH L D
0.8436163663864136,button,B AH T AH N,B AH T AH N D
0.81964111328125,terminate,T ER M AH N EY T,T ER M AH N EY T IH D
0.8137720823287964,topple,T AA P AH L,T AA P AH L D
0.7916386127471924,regenerate,R IY JH EH N ER EY T,R IY JH EH N ER EY T IH D
0.7904119491577148,aspirate,AE S P ER EY T,AE S P ER EY T IH D
0.7851841449737549,burble,B ER B AH L,B ER B AH L D
0.7311612367630005,tussle,T AH S AH L,T AH S AH L D
0.6920846700668335,ration,R AE SH AH N,R AE SH AH N D
0.6808329820632935,generate,JH EH N ER EY T,JH EH N ER EY T AH D
0.6762139797210693,curtail,K ER T EY L,K ER T EY L D
0.6524463891983032,shuttle,SH AH T AH L,SH AH T AH L D
0.642105221748352,riddle,R IH D AH L,R IH D AH L D
0.6349576711654663,tackle,T AE K AH L,T AE K AH L D
0.5880192518234253,venerate,V EH N ER EY T,V EH N ER EY T IH D
0.5872859954833984,google,G UW G AH L,G UW G AH L D
0.5810738801956177,terrace,T EH R AH S,T EH R AH S T
0.578755259513855,giggle,G IH G AH L,G IH G AH L D
0.5752670764923096,massacre,M AE S AH K ER,M AE S AH K ER D
0.572569727897644,beguile,B IH G AY L,B IH G AY L D
0.5649276971817017,hijack,HH AY JH AE K,HH AY JH AE K T
0.5622323751449585,license,L AY S AH N S,L AY S AH N S T
0.5602855682373047,minimize,M IH N AH M AY Z,M IH N AH M AY Z D
0.560224175453186,babble,B AE B AH L,B AE B AH L D
0.5350453853607178,wattle,W AA T AH L,W AA T AH L D
0.5330201983451843,tickle,T IH K AH L,T IH K AH L D
0.5322937369346619,hassle,HH AE S AH L,HH AE S AH L D
0.5305383205413818,orphan,AO R F AH N,AO R F AH N D
0.5241678357124329,wiggle,W IH G AH L,W IH G AH L D
0.5203619003295898,misunderstand,M IH S AH N D ER S T AE N D,M IH S AH N D ER S T UH D
0.5118882656097412,baffle,B AE F AH L,B AE F AH L D
0.47206205129623413,retest,R IY T EH S T,R IY T EH S T IH D
0.46624284982681274,regale,R IH G EY L,R IH G EY L D
0.4420037865638733,table,T EY B AH L,T EY B AH L D
0.4261462688446045,ironize,AY ER N AY Z,AY ER N AY Z D
0.41354477405548096,rifle,R AY F AH L,R AY F AH L D
0.41098976135253906,buckle,B AH K AH L,B AH K AH L D
0.40451693534851074,monitor,M AA N AH T ER,M AA N AH T ER D
0.3969292640686035,reminisce,R EH M AH N IH S,R EH M AH N IH S T
0.3945937156677246,gauge,G EY JH,G EY JH D
0.38244539499282837,gate,G EY T,G EY T IH D
0.35967040061950684,address,AE D R EH S,AH D R EH S T
0.3588141202926636,vanish,V AE N IH SH,V AE N IH SH T
0.3490127921104431,sidle,S AY D AH L,S AY D AH L D
0.34062957763671875,betake,B IY T EY K,B EH T UH K
0.3388490676879883,hate,HH EY T,HH EY T AH D
0.33858275413513184,rivet,R IH V AH T,R IH V AH T IH D
0.33809375762939453,ruffle,R AH F AH L,R AH F AH L D
0.3360970616340637,leash,L IY SH,L IY SH T
0.32876408100128174,last,L AE S T,L AE S T AH D
0.3286723494529724,hurt,HH ER T,HH ER T
0.31465643644332886,outrun,AW T R AH N,AW T R AE N
0.3075127601623535,berate,B IH R EY T,B IH R EY T IH D
0.30520546436309814,recheck,R IY CH EH K,R IY CH EH K T
0.3050636053085327,goof,G UW F,G UW F T
0.3041316270828247,lawyer,L AO Y ER,L AO Y ER D
0.2886826992034912,rebuff,R IH B AH F,R IH B AH F T
0.28707820177078247,update,AH P D EY T,AH P D EY T IH D
0.278964638710022,engine,EH N JH AH N,EH N JH AH N D
0.27555274963378906,hustle,HH AH S AH L,HH AH S AH L D
0.27131277322769165,shackle,SH AE K AH L,SH AE K AH L D
0.2682276964187622,levy,L EH V IY,L EH V IY D
0.2654750943183899,oppress,AH P R EH S,AH P R EH S T
0.25657856464385986,pocket,P AA K AH T,P AA K AH T IH D
0.24834686517715454,raid,R EY D,R EY D IH D
0.24148857593536377,hobble,HH AA B AH L,HH AA B AH L D
0.2394343614578247,git,G IH T,G AA T AH N
0.23721492290496826,rocket,R AA K AH T,R AA K AH T IH D
0.227181077003479,put,P UH T,P UH T
0.21215873956680298,mock,M AA K,M AA K T
0.2077617049217224,gain,G EY N,G EY N D
0.1991109848022461,guard,G AA R D,G AA R D AH D
0.19316959381103516,hit,HH IH T,HH IH T
0.19280755519866943,pickle,P IH K AH L,P IH K AH L D
0.17972135543823242,hack,HH AE K,HH AE K T
0.17894327640533447,overshoot,OW V ER SH UW T,OW V ER SH AA T
0.17658352851867676,lock,L AA K,L AA K T
0.1464475393295288,vex,V EH K S,V EH K S T
0.13986480236053467,bypass,B AY P AE S,B AY P AE S T
0.1379389762878418,rotate,R OW T EY T,R OW T EY T IH D
0.1353864073753357,bate,B EY T,B EY T IH D
0.12804639339447021,tee,T IY,T IY D
0.12781769037246704,ratify,R AE T AH F AY,R AE T AH F AY D
0.12332117557525635,toy,T OY,T OY D
0.12106895446777344,heat,HH IY T,HH IY T AH D
0.1130327582359314,mate,M EY T,M EY T IH D
0.10737892985343933,gas,G AE S,G AE S T
0.09235993027687073,guess,G EH S,G EH S T
0.09024322032928467,resuscitate,R IH S AH S IH T EY T,R IH S AH S IH T EY T IH D
0.04959315061569214,finesse,F IH N EH S,F IH N EH S T
0.04580679535865784,merge,M ER JH,M ER JH D
