activation,lemma,present_phones,past_phones
5.283817768096924,intercept,IH N T ER S EH P T,IH N T ER S EH P T AH D
4.044577121734619,injure,IH N JH ER,IH N JH ER D
3.724510669708252,intersperse,IH N T ER S P ER S,IH N T ER S P ER S T
3.4024291038513184,intermix,IH N T ER M IH K S,IH N T ER M IH K S T
3.381300926208496,interlink,IH N T ER L IH NG K,IH N T ER L IH NG K T
3.145258903503418,intercede,IH N T ER S IY D,IH N T ER S IY D IH D
2.9558205604553223,intertwine,IH N T ER T W AY N,IH N T ER T W AY N D
2.929891347885132,exhibit,IH G Z IH B IH T,IH G Z IH B AH T AH D
2.894146203994751,interrupt,IH N T ER AH P T,IH N T ER AH P T IH D
2.864487409591675,exempt,IH G Z EH M P T,IH G Z EH M P T IH D
2.861035108566284,incur,IH N K ER,IH N K ER D
2.818131446838379,internationalize,IH N T ER N AE SH AH N AH L AY Z,IH N T ER N AE SH AH N AH L AY Z D
2.769528388977051,waterlog,W AO T ER L AA G,W AO T ER L AA G D
2.685518503189087,interfere,IH N T ER F IH R,IH N T ER F IH R D
2.637815237045288,intervene,IH N T ER V IY N,IH N T ER V IY N D
2.5435290336608887,interlace,IH N T ER L EY S,IH N T ER L EY S T
2.4427452087402344,exhilarate,IH G Z IH L ER EY T,IH G Z IH L ER EY T IH D
2.353633403778076,incinerate,IH N S IH N ER EY T,IH N S IH N ER EY T IH D
2.16686749458313,intermingle,IH N T ER M IH NG G AH L,IH N T ER M IH NG G AH L D
2.166827440261841,integrate,IH N T AH G R EY T,IH N T AH G R EY T AH D
2.0691139698028564,infatuate,IH N F AE CH UW EY T,IH N F AE CH UW EY T IH D
2.0471105575561523,answer,AE N S ER,AE N S ER D
2.0450382232666016,exemplify,IH G Z EH M P L AH F AY,IH G Z EH M P L AH F AY D
1.9932403564453125,interrelate,IH N T ER R IH L EY T,IH N T ER R IH L EY T IH D
1.930769443511963,enthuse,IH N TH UW Z,IH N TH UW Z D
1.8534955978393555,interlock,IH N T ER L AA K,IH N T ER L AA K T
1.788062572479248,undercapitalize,AH N D ER K AE P AH T AH L AY Z,AH N D ER K AE P AH T AH L AY Z D
1.766561508178711,examine,IH G Z AE M IH N,IH G Z AE M AH N D
1.7494902610778809,earn,ER N,ER N D
1.7343523502349854,exacerbate,IH G Z AE S ER B EY T,IH G Z AE S ER B EY T AH D
1.7337276935577393,zoom,Z UW M,Z UW M D
1.707162857055664,exonerate,IH G Z AA N ER EY T,IH G Z AA N ER EY T IH D
1.7049074172973633,intermarry,IH N T ER M AE R IY,IH N T ER M AE R IY D
1.6646950244903564,impersonate,IH M P ER S AH N EY T,IH M P ER S AH N EY T IH D
1.599961280822754,insert,IH N S ER T,IH N S ER T AH D
1.5974845886230469,inter,IH N T ER,IH N T ER D
1.596588134765625,interleave,IH N T ER L IY V,IH N T ER L IY V D
1.5894501209259033,intimidate,IH N T IH M IH D EY T,IH N T IH M IH D EY T IH D
1.5787959098815918,intimate,IH N T AH M AH T,IH N T AH M EY T IH D
1.558732032775879,coordinate,K OW AO R D AH N AH T,K OW AO R D AH N EY T IH D
1.552403450012207,syncopate,S IH NG K AH P EY T,S IH NG K AH P EY T IH D
1.54555082321167,interrogate,IH N T EH R AH G EY T,IH N T EH R AH G EY T IH D
1.5389881134033203,urge,ER JH,ER JH D
1.493598222732544,unbalance,AH N B AE L AH N S,AH N B AE L AH N S T
1.4831821918487549,antiquate,AE N T AH K W EY T,AE N T AH K W EY T IH D
1.462881088256836,exit,EH G Z IH T,EH G Z AH T IH D
1.4620635509490967,snag,S N AE G,S N AE G D
1.4280767440795898,encircle,EH N S ER K AH L,IH N S ER K AH L D
1.4099199771881104,interact,IH N T ER AE K T,IH N T ER AE K T AH D
1.406416893005371,exasperate,IH G Z AE S P ER EY T,IH G Z AE S P ER EY T IH D
1.3906316757202148,sting,S T IH NG,S T AH NG
1.383005142211914,undercount,AH N D ER K AW N T,AH N D ER K AW N T IH D
1.3602726459503174,reflag,R IY F L AE G,R IY F L AE G D
1.3537306785583496,nurture,N ER CH ER,N ER CH ER D
1.335714340209961,devastate,D EH V AH S T EY T,D EH V AH S T EY T IH D
1.316859483718872,edge,EH JH,EH JH D
1.2409722805023193,underinsure,AH N D ER IH N SH AO R,AH N D ER IH N SH AO R D
1.2100999355316162,flag,F L AE G,F L AE G D
1.191697120666504,encompass,EH N K AH M P AH S,EH N K AH M P AH S T
1.1729748249053955,unset,AH N S EH T,AH N S EH T
1.1609740257263184,infer,IH N F ER,IH N F ER D
1.1497306823730469,decaffeinate,D IY K AE F AH N EY T,D IY K AE F AH N EY T IH D
1.148289680480957,reauthorize,R IY AO TH ER AY Z,R IY AO TH ER AY Z D
1.1227657794952393,procure,P R OW K Y UH R,P R OW K Y UH R D
1.061985969543457,astonish,AH S T AA N IH SH,AH S T AA N IH SH T
1.0604701042175293,incapacitate,IH N K AH P AE S IH T EY T,IH N K AH P AE S IH T EY T IH D
1.0381505489349365,frustrate,F R AH S T R EY T,F R AH S T R EY T AH D
0.9638029932975769,spurt,S P ER T,S P ER T IH D
0.955690324306488,stilt,S T IH L T,S T IH L T IH D
0.9052143692970276,fling,F L IH NG,F L AH NG
0.9030773043632507,throng,TH R AO NG,TH R AO NG D
0.885664165019989,indulge,IH N D AH L JH,IH N D AH L JH D
0.8582236170768738,neutralize,N UW T R AH L AY Z,N UW T R AH L AY Z D
0.816076934337616,fly,F L AY,F L UW
0.8083316683769226,concatenate,K AH N K AE T AH N EY T,K AH N K AE T AH N EY T AH D
0.7930495142936707,rebound,R IY B AW N D,R IY B AW N D IH D
0.7490566372871399,underrate,AH N D ER R EY T,AH N D ER R EY T IH D
0.7411550879478455,intoxicate,IH N T AA K S AH K EY T,IH N T AA K S AH K EY T IH D
0.739027202129364,undercook,AH N D ER K UH K,AH N D ER K UH K T
0.7071239352226257,indemnify,IH N D EH M N AH F AY,IH N D EH M N AH F AY D
0.679690420627594,assassinate,AH S AE S AH N EY T,AH S AE S AH N EY T IH D
0.6703134179115295,thrill,TH R IH L,TH R IH L D
0.669584333896637,invigorate,IH N V IH G ER IH T,IH N V IH G ER EY T IH D
0.6515733599662781,polarize,P OW L ER AY Z,P OW L ER AY Z D
0.642572820186615,recur,R IH K ER,R IY K ER D
0.6409042477607727,outfox,AW T F AA K S,AW T F AA K S T
0.635006844997406,understate,AH N D ER S T EY T,AH N D ER S T EY T IH D
0.6327983736991882,flank,F L AE NG K,F L AE NG K T
0.6209272742271423,unsubscribe,AH N S AH B S K R AY B,AH N S AH B S K R AY B D
0.6170981526374817,unfold,AH N F OW L D,AH N F OW L D IH D
0.5567757487297058,envelope,EH N V AH L OW P,EH N V EH L AH P T
0.5528290867805481,sling,S L IH NG,S L AH NG
0.5469083189964294,crucify,K R UW S AH F AY,K R UW S AH F AY D
0.534062922000885,impregnate,IH M P R EH G N EY T,IH M P R EH G N EY T AH D
0.5162271857261658,stylize,S T AY L AY Z,S T AY L AY Z D
0.4689938426017761,swink,S W IH NG K,S W AE NG K
0.38548773527145386,lawyer,L AO Y ER,L AO Y ER D
0.3653452396392822,inset,IH N S EH T,IH N S EH T
0.2850126624107361,underline,AH N D ER L AY N,AH N D ER L AY N D
